{
  "timelineEvents": [
    {
      "id": 1450112244000,
      "date": "14/12/2015",
      "dateParsed": {
        "original": "14/12/2015",
        "date": "2015-12-14T11:57:24",
        "year": 2015,
        "month": 12,
        "day": 14,
        "format": "DD/MM/YYYY"
      },
      "type": "other",
      "title": "Nhớ em... 💓",
      "description": "Võ Tuấn Nguyên đã thêm 2 ảnh mới. Nhớ em... 💓",
      "location": "",
      "witnesses": "",
      "documents": "",
      "images": [
        {
          "id": 1450112244000,
          "name": "942139179156348.jpg",
          "path": "/Users/tuannguyen8888/Downloads/facebook-tuannguyen8888-30_11_2025-BPwDyk9R/your_facebook_activity/posts/media/Tailentudidong_471272692909668/942139179156348.jpg",
          "type": "image/jpeg"
        },
        {
          "id": 1450112244001,
          "name": "942139199156346.jpg",
          "path": "/Users/tuannguyen8888/Downloads/facebook-tuannguyen8888-30_11_2025-BPwDyk9R/your_facebook_activity/posts/media/Tailentudidong_471272692909668/942139199156346.jpg",
          "type": "image/jpeg"
        }
      ]
    },
    {
      "id": 1455246867000,
      "date": "11/02/2016",
      "dateParsed": {
        "original": "11/02/2016",
        "date": "2016-02-11T22:14:27",
        "year": 2016,
        "month": 2,
        "day": 11,
        "format": "DD/MM/YYYY"
      },
      "type": "other",
      "title": "Ghé Milano Sông Trà nghỉ chân, checkin phát 😄",
      "description": "Võ Tuấn Nguyên đã thêm 3 ảnh mới. Ghé Milano Sông Trà nghỉ chân, checkin phát 😄",
      "location": "",
      "witnesses": "",
      "documents": "",
      "images": [
        {
          "id": 1455246867000,
          "name": "969631346407131.jpg",
          "path": "/Users/tuannguyen8888/Downloads/facebook-tuannguyen8888-30_11_2025-BPwDyk9R/your_facebook_activity/posts/media/Tailentudidong_471272692909668/969631346407131.jpg",
          "type": "image/jpeg"
        },
        {
          "id": 1455246867001,
          "name": "969631359740463.jpg",
          "path": "/Users/tuannguyen8888/Downloads/facebook-tuannguyen8888-30_11_2025-BPwDyk9R/your_facebook_activity/posts/media/Tailentudidong_471272692909668/969631359740463.jpg",
          "type": "image/jpeg"
        },
        {
          "id": 1455246867002,
          "name": "969631416407124.jpg",
          "path": "/Users/tuannguyen8888/Downloads/facebook-tuannguyen8888-30_11_2025-BPwDyk9R/your_facebook_activity/posts/media/Tailentudidong_471272692909668/969631416407124.jpg",
          "type": "image/jpeg"
        }
      ]
    },
    {
      "id": 1455257315000,
      "date": "12/02/2016",
      "dateParsed": {
        "original": "12/02/2016",
        "date": "2016-02-12T01:08:35",
        "year": 2016,
        "month": 2,
        "day": 12,
        "format": "DD/MM/YYYY"
      },
      "type": "other",
      "title": "Sự kiện với vợ - 12/02/2016",
      "description": "Võ Tuấn Nguyên đã thêm 3 ảnh mới. Checkin",
      "location": "",
      "witnesses": "",
      "documents": "",
      "images": [
        {
          "id": 1455257315000,
          "name": "969676936402572.jpg",
          "path": "/Users/tuannguyen8888/Downloads/facebook-tuannguyen8888-30_11_2025-BPwDyk9R/your_facebook_activity/posts/media/Tailentudidong_471272692909668/969676936402572.jpg",
          "type": "image/jpeg"
        },
        {
          "id": 1455257315001,
          "name": "969676983069234.jpg",
          "path": "/Users/tuannguyen8888/Downloads/facebook-tuannguyen8888-30_11_2025-BPwDyk9R/your_facebook_activity/posts/media/Tailentudidong_471272692909668/969676983069234.jpg",
          "type": "image/jpeg"
        },
        {
          "id": 1455257315002,
          "name": "969677006402565.jpg",
          "path": "/Users/tuannguyen8888/Downloads/facebook-tuannguyen8888-30_11_2025-BPwDyk9R/your_facebook_activity/posts/media/Tailentudidong_471272692909668/969677006402565.jpg",
          "type": "image/jpeg"
        }
      ]
    },
    {
      "id": 1455282629000,
      "date": "12/02/2016",
      "dateParsed": {
        "original": "12/02/2016",
        "date": "2016-02-12T08:10:29",
        "year": 2016,
        "month": 2,
        "day": 12,
        "format": "DD/MM/YYYY"
      },
      "type": "other",
      "title": "Chờ mõi mòn mới đc ăn",
      "description": "Võ Tuấn Nguyên đã thêm 9 ảnh mới. Chờ mõi mòn mới đc ăn",
      "location": "",
      "witnesses": "",
      "documents": "",
      "images": [
        {
          "id": 1455282629000,
          "name": "969826743054258.jpg",
          "path": "/Users/tuannguyen8888/Downloads/facebook-tuannguyen8888-30_11_2025-BPwDyk9R/your_facebook_activity/posts/media/Tailentudidong_471272692909668/969826743054258.jpg",
          "type": "image/jpeg"
        },
        {
          "id": 1455282629001,
          "name": "969827113054221.jpg",
          "path": "/Users/tuannguyen8888/Downloads/facebook-tuannguyen8888-30_11_2025-BPwDyk9R/your_facebook_activity/posts/media/Tailentudidong_471272692909668/969827113054221.jpg",
          "type": "image/jpeg"
        },
        {
          "id": 1455282629002,
          "name": "969827149720884.jpg",
          "path": "/Users/tuannguyen8888/Downloads/facebook-tuannguyen8888-30_11_2025-BPwDyk9R/your_facebook_activity/posts/media/Tailentudidong_471272692909668/969827149720884.jpg",
          "type": "image/jpeg"
        },
        {
          "id": 1455282629003,
          "name": "969827706387495.jpg",
          "path": "/Users/tuannguyen8888/Downloads/facebook-tuannguyen8888-30_11_2025-BPwDyk9R/your_facebook_activity/posts/media/Tailentudidong_471272692909668/969827706387495.jpg",
          "type": "image/jpeg"
        },
        {
          "id": 1455282629004,
          "name": "969827733054159.jpg",
          "path": "/Users/tuannguyen8888/Downloads/facebook-tuannguyen8888-30_11_2025-BPwDyk9R/your_facebook_activity/posts/media/Tailentudidong_471272692909668/969827733054159.jpg",
          "type": "image/jpeg"
        },
        {
          "id": 1455282629005,
          "name": "969827763054156.jpg",
          "path": "/Users/tuannguyen8888/Downloads/facebook-tuannguyen8888-30_11_2025-BPwDyk9R/your_facebook_activity/posts/media/Tailentudidong_471272692909668/969827763054156.jpg",
          "type": "image/jpeg"
        },
        {
          "id": 1455282629006,
          "name": "969827809720818.jpg",
          "path": "/Users/tuannguyen8888/Downloads/facebook-tuannguyen8888-30_11_2025-BPwDyk9R/your_facebook_activity/posts/media/Tailentudidong_471272692909668/969827809720818.jpg",
          "type": "image/jpeg"
        },
        {
          "id": 1455282629007,
          "name": "969827859720813.jpg",
          "path": "/Users/tuannguyen8888/Downloads/facebook-tuannguyen8888-30_11_2025-BPwDyk9R/your_facebook_activity/posts/media/Tailentudidong_471272692909668/969827859720813.jpg",
          "type": "image/jpeg"
        },
        {
          "id": 1455282629008,
          "name": "969827886387477.jpg",
          "path": "/Users/tuannguyen8888/Downloads/facebook-tuannguyen8888-30_11_2025-BPwDyk9R/your_facebook_activity/posts/media/Tailentudidong_471272692909668/969827886387477.jpg",
          "type": "image/jpeg"
        }
      ]
    },
    {
      "id": 1455339298000,
      "date": "12/02/2016",
      "dateParsed": {
        "original": "12/02/2016",
        "date": "2016-02-12T23:54:58",
        "year": 2016,
        "month": 2,
        "day": 12,
        "format": "DD/MM/YYYY"
      },
      "type": "other",
      "title": "Sáng giờ chạy đc có 70km 😤, nhưng mà qua đc đèo Cả là ngon rồi, cảnh đẹp thiệt",
      "description": "Võ Tuấn Nguyên đã thêm 6 ảnh mới. Sáng giờ chạy đc có 70km 😤, nhưng mà qua đc đèo Cả là ngon rồi, cảnh đẹp thiệt",
      "location": "",
      "witnesses": "",
      "documents": "",
      "images": [
        {
          "id": 1455339298000,
          "name": "970105203026412.jpg",
          "path": "/Users/tuannguyen8888/Downloads/facebook-tuannguyen8888-30_11_2025-BPwDyk9R/your_facebook_activity/posts/media/Tailentudidong_471272692909668/970105203026412.jpg",
          "type": "image/jpeg"
        },
        {
          "id": 1455339298001,
          "name": "970105226359743.jpg",
          "path": "/Users/tuannguyen8888/Downloads/facebook-tuannguyen8888-30_11_2025-BPwDyk9R/your_facebook_activity/posts/media/Tailentudidong_471272692909668/970105226359743.jpg",
          "type": "image/jpeg"
        },
        {
          "id": 1455339298002,
          "name": "970105243026408.jpg",
          "path": "/Users/tuannguyen8888/Downloads/facebook-tuannguyen8888-30_11_2025-BPwDyk9R/your_facebook_activity/posts/media/Tailentudidong_471272692909668/970105243026408.jpg",
          "type": "image/jpeg"
        },
        {
          "id": 1455339298003,
          "name": "970105286359737.jpg",
          "path": "/Users/tuannguyen8888/Downloads/facebook-tuannguyen8888-30_11_2025-BPwDyk9R/your_facebook_activity/posts/media/Tailentudidong_471272692909668/970105286359737.jpg",
          "type": "image/jpeg"
        },
        {
          "id": 1455339298004,
          "name": "970105323026400.jpg",
          "path": "/Users/tuannguyen8888/Downloads/facebook-tuannguyen8888-30_11_2025-BPwDyk9R/your_facebook_activity/posts/media/Tailentudidong_471272692909668/970105323026400.jpg",
          "type": "image/jpeg"
        },
        {
          "id": 1455339298005,
          "name": "970105353026397.jpg",
          "path": "/Users/tuannguyen8888/Downloads/facebook-tuannguyen8888-30_11_2025-BPwDyk9R/your_facebook_activity/posts/media/Tailentudidong_471272692909668/970105353026397.jpg",
          "type": "image/jpeg"
        }
      ]
    },
    {
      "id": 1455366586000,
      "date": "13/02/2016",
      "dateParsed": {
        "original": "13/02/2016",
        "date": "2016-02-13T07:29:46",
        "year": 2016,
        "month": 2,
        "day": 13,
        "format": "DD/MM/YYYY"
      },
      "type": "other",
      "title": "Valentin dọc đường nhẹ nhẹ",
      "description": "Võ Tuấn Nguyên đã thêm 9 ảnh mới. Valentin dọc đường nhẹ nhẹ",
      "location": "",
      "witnesses": "",
      "documents": "",
      "images": [
        {
          "id": 1455366586000,
          "name": "970235723013360.jpg",
          "path": "/Users/tuannguyen8888/Downloads/facebook-tuannguyen8888-30_11_2025-BPwDyk9R/your_facebook_activity/posts/media/Tailentudidong_471272692909668/970235723013360.jpg",
          "type": "image/jpeg"
        },
        {
          "id": 1455366586001,
          "name": "970235803013352.jpg",
          "path": "/Users/tuannguyen8888/Downloads/facebook-tuannguyen8888-30_11_2025-BPwDyk9R/your_facebook_activity/posts/media/Tailentudidong_471272692909668/970235803013352.jpg",
          "type": "image/jpeg"
        },
        {
          "id": 1455366586002,
          "name": "970235923013340.jpg",
          "path": "/Users/tuannguyen8888/Downloads/facebook-tuannguyen8888-30_11_2025-BPwDyk9R/your_facebook_activity/posts/media/Tailentudidong_471272692909668/970235923013340.jpg",
          "type": "image/jpeg"
        },
        {
          "id": 1455366586003,
          "name": "970236033013329.jpg",
          "path": "/Users/tuannguyen8888/Downloads/facebook-tuannguyen8888-30_11_2025-BPwDyk9R/your_facebook_activity/posts/media/Tailentudidong_471272692909668/970236033013329.jpg",
          "type": "image/jpeg"
        },
        {
          "id": 1455366586004,
          "name": "970236076346658.jpg",
          "path": "/Users/tuannguyen8888/Downloads/facebook-tuannguyen8888-30_11_2025-BPwDyk9R/your_facebook_activity/posts/media/Tailentudidong_471272692909668/970236076346658.jpg",
          "type": "image/jpeg"
        },
        {
          "id": 1455366586005,
          "name": "970236139679985.jpg",
          "path": "/Users/tuannguyen8888/Downloads/facebook-tuannguyen8888-30_11_2025-BPwDyk9R/your_facebook_activity/posts/media/Tailentudidong_471272692909668/970236139679985.jpg",
          "type": "image/jpeg"
        },
        {
          "id": 1455366586006,
          "name": "970236189679980.jpg",
          "path": "/Users/tuannguyen8888/Downloads/facebook-tuannguyen8888-30_11_2025-BPwDyk9R/your_facebook_activity/posts/media/Tailentudidong_471272692909668/970236189679980.jpg",
          "type": "image/jpeg"
        },
        {
          "id": 1455366586007,
          "name": "970236243013308.jpg",
          "path": "/Users/tuannguyen8888/Downloads/facebook-tuannguyen8888-30_11_2025-BPwDyk9R/your_facebook_activity/posts/media/Tailentudidong_471272692909668/970236243013308.jpg",
          "type": "image/jpeg"
        },
        {
          "id": 1455366586008,
          "name": "970236339679965.jpg",
          "path": "/Users/tuannguyen8888/Downloads/facebook-tuannguyen8888-30_11_2025-BPwDyk9R/your_facebook_activity/posts/media/Tailentudidong_471272692909668/970236339679965.jpg",
          "type": "image/jpeg"
        }
      ]
    },
    {
      "id": 1466923777000,
      "date": "26/06/2016",
      "dateParsed": {
        "original": "26/06/2016",
        "date": "2016-06-26T02:49:37",
        "year": 2016,
        "month": 6,
        "day": 26,
        "format": "DD/MM/YYYY"
      },
      "type": "other",
      "title": "Cuối tuần được con vợ nóa tẩm bổ... 😍",
      "description": "Võ Tuấn Nguyên đã thêm 2 ảnh mới. Cuối tuần được con vợ nóa tẩm bổ... 😍",
      "location": "",
      "witnesses": "",
      "documents": "",
      "images": [
        {
          "id": 1466923777000,
          "name": "1044198788950386.jpg",
          "path": "/Users/tuannguyen8888/Downloads/facebook-tuannguyen8888-30_11_2025-BPwDyk9R/your_facebook_activity/posts/media/Tailentudidong_471272692909668/1044198788950386.jpg",
          "type": "image/jpeg"
        },
        {
          "id": 1466923777001,
          "name": "1044198815617050.jpg",
          "path": "/Users/tuannguyen8888/Downloads/facebook-tuannguyen8888-30_11_2025-BPwDyk9R/your_facebook_activity/posts/media/Tailentudidong_471272692909668/1044198815617050.jpg",
          "type": "image/jpeg"
        }
      ]
    },
    {
      "id": 1471410058000,
      "date": "17/08/2016",
      "dateParsed": {
        "original": "17/08/2016",
        "date": "2016-08-17T01:00:58",
        "year": 2016,
        "month": 8,
        "day": 17,
        "format": "DD/MM/YYYY"
      },
      "type": "birth",
      "title": "Chúc mừng sinh nhật honey iu, luôn cười tươi và vui vẽ nhé em 😍😍😍",
      "description": "Võ Tuấn Nguyên đã thêm 3 ảnh mới. Chúc mừng sinh nhật honey iu, luôn cười tươi và vui vẽ nhé em 😍😍😍",
      "location": "",
      "witnesses": "",
      "documents": "",
      "images": [
        {
          "id": 1471410058000,
          "name": "1081712798532318.jpg",
          "path": "/Users/tuannguyen8888/Downloads/facebook-tuannguyen8888-30_11_2025-BPwDyk9R/your_facebook_activity/posts/media/Tailentudidong_471272692909668/1081712798532318.jpg",
          "type": "image/jpeg"
        },
        {
          "id": 1471410058001,
          "name": "1081712801865651.jpg",
          "path": "/Users/tuannguyen8888/Downloads/facebook-tuannguyen8888-30_11_2025-BPwDyk9R/your_facebook_activity/posts/media/Tailentudidong_471272692909668/1081712801865651.jpg",
          "type": "image/jpeg"
        },
        {
          "id": 1471410058002,
          "name": "1081712845198980.jpg",
          "path": "/Users/tuannguyen8888/Downloads/facebook-tuannguyen8888-30_11_2025-BPwDyk9R/your_facebook_activity/posts/media/Tailentudidong_471272692909668/1081712845198980.jpg",
          "type": "image/jpeg"
        }
      ]
    },
    {
      "id": 1475990834000,
      "date": "09/10/2016",
      "dateParsed": {
        "original": "09/10/2016",
        "date": "2016-10-09T01:27:14",
        "year": 2016,
        "month": 10,
        "day": 9,
        "format": "DD/MM/YYYY"
      },
      "type": "other",
      "title": "Sự kiện với vợ - 09/10/2016",
      "description": "Võ Tuấn Nguyên đã thêm 3 ảnh mới.",
      "location": "",
      "witnesses": "",
      "documents": "",
      "images": [
        {
          "id": 1475990834000,
          "name": "1125502867486644.jpg",
          "path": "/Users/tuannguyen8888/Downloads/facebook-tuannguyen8888-30_11_2025-BPwDyk9R/your_facebook_activity/posts/media/Tailentudidong_471272692909668/1125502867486644.jpg",
          "type": "image/jpeg"
        },
        {
          "id": 1475990834001,
          "name": "1125502910819973.jpg",
          "path": "/Users/tuannguyen8888/Downloads/facebook-tuannguyen8888-30_11_2025-BPwDyk9R/your_facebook_activity/posts/media/Tailentudidong_471272692909668/1125502910819973.jpg",
          "type": "image/jpeg"
        },
        {
          "id": 1475990834002,
          "name": "1125502967486634.jpg",
          "path": "/Users/tuannguyen8888/Downloads/facebook-tuannguyen8888-30_11_2025-BPwDyk9R/your_facebook_activity/posts/media/Tailentudidong_471272692909668/1125502967486634.jpg",
          "type": "image/jpeg"
        }
      ]
    },
    {
      "id": 1487079542000,
      "date": "14/02/2017",
      "dateParsed": {
        "original": "14/02/2017",
        "date": "2017-02-14T08:39:02",
        "year": 2017,
        "month": 2,
        "day": 14,
        "format": "DD/MM/YYYY"
      },
      "type": "other",
      "title": "Valungtung xa HN-SG ❤",
      "description": "Võ Tuấn Nguyên đã thêm 3 ảnh mới. Valungtung xa HN-SG ❤",
      "location": "",
      "witnesses": "",
      "documents": "",
      "images": [
        {
          "id": 1487079542000,
          "name": "1241755562528040.jpg",
          "path": "/Users/tuannguyen8888/Downloads/facebook-tuannguyen8888-30_11_2025-BPwDyk9R/your_facebook_activity/posts/media/Tailentudidong_471272692909668/1241755562528040.jpg",
          "type": "image/jpeg"
        },
        {
          "id": 1487079542001,
          "name": "1241755569194706.jpg",
          "path": "/Users/tuannguyen8888/Downloads/facebook-tuannguyen8888-30_11_2025-BPwDyk9R/your_facebook_activity/posts/media/Tailentudidong_471272692909668/1241755569194706.jpg",
          "type": "image/jpeg"
        },
        {
          "id": 1487079542002,
          "name": "1241755572528039.jpg",
          "path": "/Users/tuannguyen8888/Downloads/facebook-tuannguyen8888-30_11_2025-BPwDyk9R/your_facebook_activity/posts/media/Tailentudidong_471272692909668/1241755572528039.jpg",
          "type": "image/jpeg"
        }
      ]
    },
    {
      "id": 1488623825000,
      "date": "04/03/2017",
      "dateParsed": {
        "original": "04/03/2017",
        "date": "2017-03-04T05:37:05",
        "year": 2017,
        "month": 3,
        "day": 4,
        "format": "DD/MM/YYYY"
      },
      "type": "other",
      "title": "Sự kiện với vợ - 04/03/2017",
      "description": "Võ Tuấn Nguyên đã thêm 4 ảnh mới.",
      "location": "",
      "witnesses": "",
      "documents": "",
      "images": [
        {
          "id": 1488623825000,
          "name": "1257597377610525.jpg",
          "path": "/Users/tuannguyen8888/Downloads/facebook-tuannguyen8888-30_11_2025-BPwDyk9R/your_facebook_activity/posts/media/Tailentudidong_471272692909668/1257597377610525.jpg",
          "type": "image/jpeg"
        },
        {
          "id": 1488623825001,
          "name": "1257597380943858.jpg",
          "path": "/Users/tuannguyen8888/Downloads/facebook-tuannguyen8888-30_11_2025-BPwDyk9R/your_facebook_activity/posts/media/Tailentudidong_471272692909668/1257597380943858.jpg",
          "type": "image/jpeg"
        },
        {
          "id": 1488623825002,
          "name": "1257597434277186.jpg",
          "path": "/Users/tuannguyen8888/Downloads/facebook-tuannguyen8888-30_11_2025-BPwDyk9R/your_facebook_activity/posts/media/Tailentudidong_471272692909668/1257597434277186.jpg",
          "type": "image/jpeg"
        },
        {
          "id": 1488623825003,
          "name": "1257597477610515.jpg",
          "path": "/Users/tuannguyen8888/Downloads/facebook-tuannguyen8888-30_11_2025-BPwDyk9R/your_facebook_activity/posts/media/Tailentudidong_471272692909668/1257597477610515.jpg",
          "type": "image/jpeg"
        }
      ]
    },
    {
      "id": 1491344899000,
      "date": "04/04/2017",
      "dateParsed": {
        "original": "04/04/2017",
        "date": "2017-04-04T18:28:19",
        "year": 2017,
        "month": 4,
        "day": 4,
        "format": "DD/MM/YYYY"
      },
      "type": "other",
      "title": "Phú Quốc thẳng tiến :D",
      "description": "Võ Tuấn Nguyên đã thêm 3 ảnh mới. Phú Quốc thẳng tiến :D",
      "location": "",
      "witnesses": "",
      "documents": "",
      "images": [
        {
          "id": 1491344899000,
          "name": "1287324351304494.jpg",
          "path": "/Users/tuannguyen8888/Downloads/facebook-tuannguyen8888-30_11_2025-BPwDyk9R/your_facebook_activity/posts/media/Tailentudidong_471272692909668/1287324351304494.jpg",
          "type": "image/jpeg"
        },
        {
          "id": 1491344899001,
          "name": "1287324354637827.jpg",
          "path": "/Users/tuannguyen8888/Downloads/facebook-tuannguyen8888-30_11_2025-BPwDyk9R/your_facebook_activity/posts/media/Tailentudidong_471272692909668/1287324354637827.jpg",
          "type": "image/jpeg"
        },
        {
          "id": 1491344899002,
          "name": "1287324357971160.jpg",
          "path": "/Users/tuannguyen8888/Downloads/facebook-tuannguyen8888-30_11_2025-BPwDyk9R/your_facebook_activity/posts/media/Tailentudidong_471272692909668/1287324357971160.jpg",
          "type": "image/jpeg"
        }
      ]
    },
    {
      "id": 1491402795000,
      "date": "05/04/2017",
      "dateParsed": {
        "original": "05/04/2017",
        "date": "2017-04-05T10:33:15",
        "year": 2017,
        "month": 4,
        "day": 5,
        "format": "DD/MM/YYYY"
      },
      "type": "other",
      "title": "Chợ đêm Phú Quốc",
      "description": "Võ Tuấn Nguyên đã thêm 11 ảnh mới. Chợ đêm Phú Quốc",
      "location": "",
      "witnesses": "",
      "documents": "",
      "images": [
        {
          "id": 1491402795000,
          "name": "1288334917870104.jpg",
          "path": "/Users/tuannguyen8888/Downloads/facebook-tuannguyen8888-30_11_2025-BPwDyk9R/your_facebook_activity/posts/media/Tailentudidong_471272692909668/1288334917870104.jpg",
          "type": "image/jpeg"
        },
        {
          "id": 1491402795001,
          "name": "1288334947870101.jpg",
          "path": "/Users/tuannguyen8888/Downloads/facebook-tuannguyen8888-30_11_2025-BPwDyk9R/your_facebook_activity/posts/media/Tailentudidong_471272692909668/1288334947870101.jpg",
          "type": "image/jpeg"
        },
        {
          "id": 1491402795002,
          "name": "1288334914536771.jpg",
          "path": "/Users/tuannguyen8888/Downloads/facebook-tuannguyen8888-30_11_2025-BPwDyk9R/your_facebook_activity/posts/media/Tailentudidong_471272692909668/1288334914536771.jpg",
          "type": "image/jpeg"
        },
        {
          "id": 1491402795003,
          "name": "1288334944536768.jpg",
          "path": "/Users/tuannguyen8888/Downloads/facebook-tuannguyen8888-30_11_2025-BPwDyk9R/your_facebook_activity/posts/media/Tailentudidong_471272692909668/1288334944536768.jpg",
          "type": "image/jpeg"
        },
        {
          "id": 1491402795004,
          "name": "1288334981203431.jpg",
          "path": "/Users/tuannguyen8888/Downloads/facebook-tuannguyen8888-30_11_2025-BPwDyk9R/your_facebook_activity/posts/media/Tailentudidong_471272692909668/1288334981203431.jpg",
          "type": "image/jpeg"
        },
        {
          "id": 1491402795005,
          "name": "1288335004536762.jpg",
          "path": "/Users/tuannguyen8888/Downloads/facebook-tuannguyen8888-30_11_2025-BPwDyk9R/your_facebook_activity/posts/media/Tailentudidong_471272692909668/1288335004536762.jpg",
          "type": "image/jpeg"
        },
        {
          "id": 1491402795006,
          "name": "1288335031203426.jpg",
          "path": "/Users/tuannguyen8888/Downloads/facebook-tuannguyen8888-30_11_2025-BPwDyk9R/your_facebook_activity/posts/media/Tailentudidong_471272692909668/1288335031203426.jpg",
          "type": "image/jpeg"
        },
        {
          "id": 1491402795007,
          "name": "1288335027870093.jpg",
          "path": "/Users/tuannguyen8888/Downloads/facebook-tuannguyen8888-30_11_2025-BPwDyk9R/your_facebook_activity/posts/media/Tailentudidong_471272692909668/1288335027870093.jpg",
          "type": "image/jpeg"
        },
        {
          "id": 1491402795008,
          "name": "1288335047870091.jpg",
          "path": "/Users/tuannguyen8888/Downloads/facebook-tuannguyen8888-30_11_2025-BPwDyk9R/your_facebook_activity/posts/media/Tailentudidong_471272692909668/1288335047870091.jpg",
          "type": "image/jpeg"
        },
        {
          "id": 1491402795009,
          "name": "1288335064536756.jpg",
          "path": "/Users/tuannguyen8888/Downloads/facebook-tuannguyen8888-30_11_2025-BPwDyk9R/your_facebook_activity/posts/media/Tailentudidong_471272692909668/1288335064536756.jpg",
          "type": "image/jpeg"
        }
      ]
    },
    {
      "id": 1491526496000,
      "date": "06/04/2017",
      "dateParsed": {
        "original": "06/04/2017",
        "date": "2017-04-06T20:54:56",
        "year": 2017,
        "month": 4,
        "day": 6,
        "format": "DD/MM/YYYY"
      },
      "type": "other",
      "title": "Buổi sáng thức dậy ở một nơi xa ...",
      "description": "Võ Tuấn Nguyên đã thêm 4 ảnh mới. Buổi sáng thức dậy ở một nơi xa ...",
      "location": "",
      "witnesses": "",
      "documents": "",
      "images": [
        {
          "id": 1491526496000,
          "name": "1289992411037688.jpg",
          "path": "/Users/tuannguyen8888/Downloads/facebook-tuannguyen8888-30_11_2025-BPwDyk9R/your_facebook_activity/posts/media/Tailentudidong_471272692909668/1289992411037688.jpg",
          "type": "image/jpeg"
        },
        {
          "id": 1491526496001,
          "name": "1289992434371019.jpg",
          "path": "/Users/tuannguyen8888/Downloads/facebook-tuannguyen8888-30_11_2025-BPwDyk9R/your_facebook_activity/posts/media/Tailentudidong_471272692909668/1289992434371019.jpg",
          "type": "image/jpeg"
        },
        {
          "id": 1491526496002,
          "name": "1289992437704352.jpg",
          "path": "/Users/tuannguyen8888/Downloads/facebook-tuannguyen8888-30_11_2025-BPwDyk9R/your_facebook_activity/posts/media/Tailentudidong_471272692909668/1289992437704352.jpg",
          "type": "image/jpeg"
        },
        {
          "id": 1491526496003,
          "name": "1289992444371018.jpg",
          "path": "/Users/tuannguyen8888/Downloads/facebook-tuannguyen8888-30_11_2025-BPwDyk9R/your_facebook_activity/posts/media/Tailentudidong_471272692909668/1289992444371018.jpg",
          "type": "image/jpeg"
        }
      ]
    },
    {
      "id": 1502892535000,
      "date": "16/08/2017",
      "dateParsed": {
        "original": "16/08/2017",
        "date": "2017-08-16T10:08:55",
        "year": 2017,
        "month": 8,
        "day": 16,
        "format": "DD/MM/YYYY"
      },
      "type": "birth",
      "title": "Mai anh họp về trễ rồi, nên hôm nay dẫn ENY đi sinh nhật sớm 😘",
      "description": "Võ Tuấn Nguyên đã thêm 7 ảnh mới. Mai anh họp về trễ rồi, nên hôm nay dẫn ENY đi sinh nhật sớm 😘",
      "location": "",
      "witnesses": "",
      "documents": "",
      "images": [
        {
          "id": 1502892535000,
          "name": "1416203305083264.jpg",
          "path": "/Users/tuannguyen8888/Downloads/facebook-tuannguyen8888-30_11_2025-BPwDyk9R/your_facebook_activity/posts/media/Tailentudidong_471272692909668/1416203305083264.jpg",
          "type": "image/jpeg"
        },
        {
          "id": 1502892535001,
          "name": "1416203318416596.jpg",
          "path": "/Users/tuannguyen8888/Downloads/facebook-tuannguyen8888-30_11_2025-BPwDyk9R/your_facebook_activity/posts/media/Tailentudidong_471272692909668/1416203318416596.jpg",
          "type": "image/jpeg"
        },
        {
          "id": 1502892535002,
          "name": "1416203311749930.jpg",
          "path": "/Users/tuannguyen8888/Downloads/facebook-tuannguyen8888-30_11_2025-BPwDyk9R/your_facebook_activity/posts/media/Tailentudidong_471272692909668/1416203311749930.jpg",
          "type": "image/jpeg"
        },
        {
          "id": 1502892535003,
          "name": "1416203321749929.jpg",
          "path": "/Users/tuannguyen8888/Downloads/facebook-tuannguyen8888-30_11_2025-BPwDyk9R/your_facebook_activity/posts/media/Tailentudidong_471272692909668/1416203321749929.jpg",
          "type": "image/jpeg"
        },
        {
          "id": 1502892535004,
          "name": "1416203361749925.jpg",
          "path": "/Users/tuannguyen8888/Downloads/facebook-tuannguyen8888-30_11_2025-BPwDyk9R/your_facebook_activity/posts/media/Tailentudidong_471272692909668/1416203361749925.jpg",
          "type": "image/jpeg"
        },
        {
          "id": 1502892535005,
          "name": "1416203381749923.jpg",
          "path": "/Users/tuannguyen8888/Downloads/facebook-tuannguyen8888-30_11_2025-BPwDyk9R/your_facebook_activity/posts/media/Tailentudidong_471272692909668/1416203381749923.jpg",
          "type": "image/jpeg"
        },
        {
          "id": 1502892535006,
          "name": "1416203401749921.jpg",
          "path": "/Users/tuannguyen8888/Downloads/facebook-tuannguyen8888-30_11_2025-BPwDyk9R/your_facebook_activity/posts/media/Tailentudidong_471272692909668/1416203401749921.jpg",
          "type": "image/jpeg"
        }
      ]
    },
    {
      "id": 1510901422000,
      "date": "17/11/2017",
      "dateParsed": {
        "original": "17/11/2017",
        "date": "2017-11-17T01:50:22",
        "year": 2017,
        "month": 11,
        "day": 17,
        "format": "DD/MM/YYYY"
      },
      "type": "other",
      "title": "Sự kiện với vợ - 17/11/2017",
      "description": "Võ Tuấn Nguyên đã thêm một video mới.",
      "location": "",
      "witnesses": "",
      "documents": "",
      "images": [
        {
          "id": 1510901422000,
          "name": "1493717983998462.mp4",
          "path": "/Users/tuannguyen8888/Downloads/facebook-tuannguyen8888-30_11_2025-BPwDyk9R/your_facebook_activity/posts/media/videos/1493717983998462.mp4",
          "type": "image/jpeg"
        }
      ]
    },
    {
      "id": 1510928706000,
      "date": "17/11/2017",
      "dateParsed": {
        "original": "17/11/2017",
        "date": "2017-11-17T09:25:06",
        "year": 2017,
        "month": 11,
        "day": 17,
        "format": "DD/MM/YYYY"
      },
      "type": "other",
      "title": "Nương lạc trôi 😂😂",
      "description": "Võ Tuấn Nguyên đã thêm 6 ảnh và một video. Nương lạc trôi 😂😂",
      "location": "",
      "witnesses": "",
      "documents": "",
      "images": [
        {
          "id": 1510928706000,
          "name": "1494005560636371.jpg",
          "path": "/Users/tuannguyen8888/Downloads/facebook-tuannguyen8888-30_11_2025-BPwDyk9R/your_facebook_activity/posts/media/Tailentudidong_471272692909668/1494005560636371.jpg",
          "type": "image/jpeg"
        },
        {
          "id": 1510928706001,
          "name": "1494005563969704.jpg",
          "path": "/Users/tuannguyen8888/Downloads/facebook-tuannguyen8888-30_11_2025-BPwDyk9R/your_facebook_activity/posts/media/Tailentudidong_471272692909668/1494005563969704.jpg",
          "type": "image/jpeg"
        },
        {
          "id": 1510928706002,
          "name": "1494005607303033.jpg",
          "path": "/Users/tuannguyen8888/Downloads/facebook-tuannguyen8888-30_11_2025-BPwDyk9R/your_facebook_activity/posts/media/Tailentudidong_471272692909668/1494005607303033.jpg",
          "type": "image/jpeg"
        },
        {
          "id": 1510928706003,
          "name": "1494005680636359.jpg",
          "path": "/Users/tuannguyen8888/Downloads/facebook-tuannguyen8888-30_11_2025-BPwDyk9R/your_facebook_activity/posts/media/Tailentudidong_471272692909668/1494005680636359.jpg",
          "type": "image/jpeg"
        },
        {
          "id": 1510928706004,
          "name": "1494005310636396.jpg",
          "path": "/Users/tuannguyen8888/Downloads/facebook-tuannguyen8888-30_11_2025-BPwDyk9R/your_facebook_activity/posts/media/Tailentudidong_471272692909668/1494005310636396.jpg",
          "type": "image/jpeg"
        },
        {
          "id": 1510928706005,
          "name": "1494005320636395.jpg",
          "path": "/Users/tuannguyen8888/Downloads/facebook-tuannguyen8888-30_11_2025-BPwDyk9R/your_facebook_activity/posts/media/Tailentudidong_471272692909668/1494005320636395.jpg",
          "type": "image/jpeg"
        },
        {
          "id": 1510928706006,
          "name": "1493987193971541.mp4",
          "path": "/Users/tuannguyen8888/Downloads/facebook-tuannguyen8888-30_11_2025-BPwDyk9R/your_facebook_activity/posts/media/videos/1493987193971541.mp4",
          "type": "image/jpeg"
        }
      ]
    },
    {
      "id": 1514635991000,
      "date": "30/12/2017",
      "dateParsed": {
        "original": "30/12/2017",
        "date": "2017-12-30T07:13:11",
        "year": 2017,
        "month": 12,
        "day": 30,
        "format": "DD/MM/YYYY"
      },
      "type": "other",
      "title": "Sự kiện với vợ - 30/12/2017",
      "description": "Võ Tuấn Nguyên đã thêm một ảnh mới.",
      "location": "",
      "witnesses": "",
      "documents": "",
      "images": [
        {
          "id": 1514635991000,
          "name": "1533383436698583.jpg",
          "path": "/Users/tuannguyen8888/Downloads/facebook-tuannguyen8888-30_11_2025-BPwDyk9R/your_facebook_activity/posts/media/Tailentudidong_471272692909668/1533383436698583.jpg",
          "type": "image/jpeg"
        }
      ]
    },
    {
      "id": 1515052859000,
      "date": "04/01/2018",
      "dateParsed": {
        "original": "04/01/2018",
        "date": "2018-01-04T03:00:59",
        "year": 2018,
        "month": 1,
        "day": 4,
        "format": "DD/MM/YYYY"
      },
      "type": "other",
      "title": "🤩🤗😉Lịch trình đây Nương Nương Táo Xanh 🤩🤗😉Lịch trình đây @[100006489412839:2048:Nương Nương] @[10...",
      "description": "Võ Tuấn Nguyên đã thêm một ảnh mới. 🤩🤗😉Lịch trình đây Nương Nương Táo Xanh 🤩🤗😉Lịch trình đây @[100006489412839:2048:Nương Nương] @[100005995920533:2048:Táo Xanh]",
      "location": "",
      "witnesses": "",
      "documents": "",
      "images": [
        {
          "id": 1515052859000,
          "name": "1538144719555788.jpg",
          "path": "/Users/tuannguyen8888/Downloads/facebook-tuannguyen8888-30_11_2025-BPwDyk9R/your_facebook_activity/posts/media/Anhtrendongthoigian_267243079979298/1538144719555788.jpg",
          "type": "image/jpeg"
        }
      ]
    },
    {
      "id": 1515206071000,
      "date": "05/01/2018",
      "dateParsed": {
        "original": "05/01/2018",
        "date": "2018-01-05T21:34:31",
        "year": 2018,
        "month": 1,
        "day": 5,
        "format": "DD/MM/YYYY"
      },
      "type": "other",
      "title": "Cừ híp mắt lun 😊 Cừ híp mắt lun 😊",
      "description": "Võ Tuấn Nguyên đã thêm một ảnh mới. Cừ híp mắt lun 😊 Cừ híp mắt lun 😊",
      "location": "",
      "witnesses": "",
      "documents": "",
      "images": [
        {
          "id": 1515206071000,
          "name": "1540021946034732.jpg",
          "path": "/Users/tuannguyen8888/Downloads/facebook-tuannguyen8888-30_11_2025-BPwDyk9R/your_facebook_activity/posts/media/Tailentudidong_471272692909668/1540021946034732.jpg",
          "type": "image/jpeg"
        }
      ]
    },
    {
      "id": 1523464908000,
      "date": "11/04/2018",
      "dateParsed": {
        "original": "11/04/2018",
        "date": "2018-04-11T12:41:48",
        "year": 2018,
        "month": 4,
        "day": 11,
        "format": "DD/MM/YYYY"
      },
      "type": "other",
      "title": "Sự kiện với vợ - 11/04/2018",
      "description": "Võ Tuấn Nguyên đã thêm 3 ảnh mới. ❤️❤️❤️",
      "location": "",
      "witnesses": "",
      "documents": "",
      "images": [
        {
          "id": 1523464908000,
          "name": "1632290446807881.jpg",
          "path": "/Users/tuannguyen8888/Downloads/facebook-tuannguyen8888-30_11_2025-BPwDyk9R/your_facebook_activity/posts/media/Tailentudidong_471272692909668/1632290446807881.jpg",
          "type": "image/jpeg"
        },
        {
          "id": 1523464908001,
          "name": "1632290423474550.jpg",
          "path": "/Users/tuannguyen8888/Downloads/facebook-tuannguyen8888-30_11_2025-BPwDyk9R/your_facebook_activity/posts/media/Tailentudidong_471272692909668/1632290423474550.jpg",
          "type": "image/jpeg"
        },
        {
          "id": 1523464908002,
          "name": "1632290540141205.jpg",
          "path": "/Users/tuannguyen8888/Downloads/facebook-tuannguyen8888-30_11_2025-BPwDyk9R/your_facebook_activity/posts/media/Tailentudidong_471272692909668/1632290540141205.jpg",
          "type": "image/jpeg"
        }
      ]
    },
    {
      "id": 1525542051000,
      "date": "05/05/2018",
      "dateParsed": {
        "original": "05/05/2018",
        "date": "2018-05-05T13:40:51",
        "year": 2018,
        "month": 5,
        "day": 5,
        "format": "DD/MM/YYYY"
      },
      "type": "other",
      "title": "Cuối tuần với em ❤️",
      "description": "Võ Tuấn Nguyên đã thêm 2 ảnh mới. Cuối tuần với em ❤️",
      "location": "",
      "witnesses": "",
      "documents": "",
      "images": [
        {
          "id": 1525542051000,
          "name": "1655274434509482.jpg",
          "path": "/Users/tuannguyen8888/Downloads/facebook-tuannguyen8888-30_11_2025-BPwDyk9R/your_facebook_activity/posts/media/Tailentudidong_471272692909668/1655274434509482.jpg",
          "type": "image/jpeg"
        },
        {
          "id": 1525542051001,
          "name": "1655274421176150.jpg",
          "path": "/Users/tuannguyen8888/Downloads/facebook-tuannguyen8888-30_11_2025-BPwDyk9R/your_facebook_activity/posts/media/Tailentudidong_471272692909668/1655274421176150.jpg",
          "type": "image/jpeg"
        }
      ]
    },
    {
      "id": 1527920167000,
      "date": "02/06/2018",
      "dateParsed": {
        "original": "02/06/2018",
        "date": "2018-06-02T02:16:07",
        "year": 2018,
        "month": 6,
        "day": 2,
        "format": "DD/MM/YYYY"
      },
      "type": "wedding",
      "title": "Đám cưới Khuong Duc Nguyen",
      "description": "Võ Tuấn Nguyên đã thêm 3 ảnh mới. Đám cưới Khuong Duc Nguyen",
      "location": "",
      "witnesses": "",
      "documents": "",
      "images": [
        {
          "id": 1527920167000,
          "name": "1680261405344118.jpg",
          "path": "/Users/tuannguyen8888/Downloads/facebook-tuannguyen8888-30_11_2025-BPwDyk9R/your_facebook_activity/posts/media/Tailentudidong_471272692909668/1680261405344118.jpg",
          "type": "image/jpeg"
        },
        {
          "id": 1527920167001,
          "name": "1680261458677446.jpg",
          "path": "/Users/tuannguyen8888/Downloads/facebook-tuannguyen8888-30_11_2025-BPwDyk9R/your_facebook_activity/posts/media/Tailentudidong_471272692909668/1680261458677446.jpg",
          "type": "image/jpeg"
        },
        {
          "id": 1527920167002,
          "name": "1680261395344119.jpg",
          "path": "/Users/tuannguyen8888/Downloads/facebook-tuannguyen8888-30_11_2025-BPwDyk9R/your_facebook_activity/posts/media/Tailentudidong_471272692909668/1680261395344119.jpg",
          "type": "image/jpeg"
        }
      ]
    },
    {
      "id": 1528610965000,
      "date": "10/06/2018",
      "dateParsed": {
        "original": "10/06/2018",
        "date": "2018-06-10T02:09:25",
        "year": 2018,
        "month": 6,
        "day": 10,
        "format": "DD/MM/YYYY"
      },
      "type": "other",
      "title": "So cute ❤️",
      "description": "Võ Tuấn Nguyên đã thêm 4 ảnh mới. So cute ❤️",
      "location": "",
      "witnesses": "",
      "documents": "",
      "images": [
        {
          "id": 1528610965000,
          "name": "1688063074563951.jpg",
          "path": "/Users/tuannguyen8888/Downloads/facebook-tuannguyen8888-30_11_2025-BPwDyk9R/your_facebook_activity/posts/media/Tailentudidong_471272692909668/1688063074563951.jpg",
          "type": "image/jpeg"
        },
        {
          "id": 1528610965001,
          "name": "1688063084563950.jpg",
          "path": "/Users/tuannguyen8888/Downloads/facebook-tuannguyen8888-30_11_2025-BPwDyk9R/your_facebook_activity/posts/media/Tailentudidong_471272692909668/1688063084563950.jpg",
          "type": "image/jpeg"
        },
        {
          "id": 1528610965002,
          "name": "1688063161230609.jpg",
          "path": "/Users/tuannguyen8888/Downloads/facebook-tuannguyen8888-30_11_2025-BPwDyk9R/your_facebook_activity/posts/media/Tailentudidong_471272692909668/1688063161230609.jpg",
          "type": "image/jpeg"
        },
        {
          "id": 1528610965003,
          "name": "1688063164563942.jpg",
          "path": "/Users/tuannguyen8888/Downloads/facebook-tuannguyen8888-30_11_2025-BPwDyk9R/your_facebook_activity/posts/media/Tailentudidong_471272692909668/1688063164563942.jpg",
          "type": "image/jpeg"
        }
      ]
    },
    {
      "id": 1531030632000,
      "date": "08/07/2018",
      "dateParsed": {
        "original": "08/07/2018",
        "date": "2018-07-08T02:17:12",
        "year": 2018,
        "month": 7,
        "day": 8,
        "format": "DD/MM/YYYY"
      },
      "type": "other",
      "title": "Sự kiện với vợ - 08/07/2018",
      "description": "Võ Tuấn Nguyên đã thêm 5 ảnh mới. Vui chơi",
      "location": "",
      "witnesses": "",
      "documents": "",
      "images": [
        {
          "id": 1531030632000,
          "name": "1727260963977495.jpg",
          "path": "/Users/tuannguyen8888/Downloads/facebook-tuannguyen8888-30_11_2025-BPwDyk9R/your_facebook_activity/posts/media/Tailentudidong_471272692909668/1727260963977495.jpg",
          "type": "image/jpeg"
        },
        {
          "id": 1531030632001,
          "name": "1727261030644155.jpg",
          "path": "/Users/tuannguyen8888/Downloads/facebook-tuannguyen8888-30_11_2025-BPwDyk9R/your_facebook_activity/posts/media/Tailentudidong_471272692909668/1727261030644155.jpg",
          "type": "image/jpeg"
        },
        {
          "id": 1531030632002,
          "name": "1727261040644154.jpg",
          "path": "/Users/tuannguyen8888/Downloads/facebook-tuannguyen8888-30_11_2025-BPwDyk9R/your_facebook_activity/posts/media/Tailentudidong_471272692909668/1727261040644154.jpg",
          "type": "image/jpeg"
        },
        {
          "id": 1531030632003,
          "name": "1727260997310825.jpg",
          "path": "/Users/tuannguyen8888/Downloads/facebook-tuannguyen8888-30_11_2025-BPwDyk9R/your_facebook_activity/posts/media/Tailentudidong_471272692909668/1727260997310825.jpg",
          "type": "image/jpeg"
        },
        {
          "id": 1531030632004,
          "name": "1727261107310814.jpg",
          "path": "/Users/tuannguyen8888/Downloads/facebook-tuannguyen8888-30_11_2025-BPwDyk9R/your_facebook_activity/posts/media/Tailentudidong_471272692909668/1727261107310814.jpg",
          "type": "image/jpeg"
        }
      ]
    },
    {
      "id": 1533133607000,
      "date": "01/08/2018",
      "dateParsed": {
        "original": "01/08/2018",
        "date": "2018-08-01T10:26:47",
        "year": 2018,
        "month": 8,
        "day": 1,
        "format": "DD/MM/YYYY"
      },
      "type": "wedding",
      "title": "Võ Tuấn Nguyên  Cảm ơn rất nhiều những người thân của con. Thật vui vì mọi người đã có mặt trong ...",
      "description": "Võ Tuấn Nguyên đang ở cùng Nương Nương. Cảm ơn rất nhiều những người thân của con. Thật vui vì mọi người đã có mặt trong đám cưới của chúng con. Chúng con hạnh phúc khi nhìn thấy các ông bà nội ngoại cô dì cậu chú bác anh chị em của con trong ngày vui. Gửi cảm ơn và lời chúc tốt đẹp, ấm áp nhất đến mọi người.\nVà đặt biệt cảm ơn dì 5 Ngoc Trish Nguyen, dì út Kim Nguyen, bà ngoại Hưng và các dì ở xa không về được vẫn gởi quà mừng cho chúng con. \nMột lần nữa cảm ơn mọi người rất nhiều!",
      "location": "",
      "witnesses": "",
      "documents": "",
      "images": []
    },
    {
      "id": 1533133872000,
      "date": "01/08/2018",
      "dateParsed": {
        "original": "01/08/2018",
        "date": "2018-08-01T10:31:12",
        "year": 2018,
        "month": 8,
        "day": 1,
        "format": "DD/MM/YYYY"
      },
      "type": "wedding",
      "title": "Võ Tuấn Nguyên  Ngày cưới của mình quá tuyệt vời vì có những nụ cười, cái ôm và lời chúc phúc của...",
      "description": "Võ Tuấn Nguyên đang ở cùng Nương Nương. Ngày cưới của mình quá tuyệt vời vì có những nụ cười, cái ôm và lời chúc phúc của các bạn. Thật vui vì thấy các bạn có mặt ngày hôm đó. Cảm ơn những người bạn thân thiết đã trở thành điều đặc biệt trong đám cưới của chúng mình.\nCảm ơn các bạn lớp 9/3 & 12/10",
      "location": "",
      "witnesses": "",
      "documents": "",
      "images": []
    },
    {
      "id": 1533175755000,
      "date": "01/08/2018",
      "dateParsed": {
        "original": "01/08/2018",
        "date": "2018-08-01T22:09:15",
        "year": 2018,
        "month": 8,
        "day": 1,
        "format": "DD/MM/YYYY"
      },
      "type": "other",
      "title": "Mấy bà ngoại đẹp ngang ngữa cô dâu 😘😘😘",
      "description": "Võ Tuấn Nguyên đã thêm 3 ảnh mới. Mấy bà ngoại đẹp ngang ngữa cô dâu 😘😘😘",
      "location": "",
      "witnesses": "",
      "documents": "",
      "images": [
        {
          "id": 1533175755000,
          "name": "1764693853567539.jpg",
          "path": "/Users/tuannguyen8888/Downloads/facebook-tuannguyen8888-30_11_2025-BPwDyk9R/your_facebook_activity/posts/media/Tailentudidong_471272692909668/1764693853567539.jpg",
          "type": "image/jpeg"
        },
        {
          "id": 1533175755001,
          "name": "1764693843567540.jpg",
          "path": "/Users/tuannguyen8888/Downloads/facebook-tuannguyen8888-30_11_2025-BPwDyk9R/your_facebook_activity/posts/media/Tailentudidong_471272692909668/1764693843567540.jpg",
          "type": "image/jpeg"
        },
        {
          "id": 1533175755002,
          "name": "1764693873567537.jpg",
          "path": "/Users/tuannguyen8888/Downloads/facebook-tuannguyen8888-30_11_2025-BPwDyk9R/your_facebook_activity/posts/media/Tailentudidong_471272692909668/1764693873567537.jpg",
          "type": "image/jpeg"
        }
      ]
    },
    {
      "id": 1533176679000,
      "date": "01/08/2018",
      "dateParsed": {
        "original": "01/08/2018",
        "date": "2018-08-01T22:24:39",
        "year": 2018,
        "month": 8,
        "day": 1,
        "format": "DD/MM/YYYY"
      },
      "type": "other",
      "title": "Ngoại với cháu dâu show deep 😊😊😋 Ngoại với cháu dâu show deep 😊😊😋",
      "description": "Võ Tuấn Nguyên đã thêm một ảnh mới. Ngoại với cháu dâu show deep 😊😊😋 Ngoại với cháu dâu show deep 😊😊😋",
      "location": "",
      "witnesses": "",
      "documents": "",
      "images": [
        {
          "id": 1533176679000,
          "name": "1764710463565878.jpg",
          "path": "/Users/tuannguyen8888/Downloads/facebook-tuannguyen8888-30_11_2025-BPwDyk9R/your_facebook_activity/posts/media/Tailentudidong_471272692909668/1764710463565878.jpg",
          "type": "image/jpeg"
        }
      ]
    },
    {
      "id": 1533176849000,
      "date": "01/08/2018",
      "dateParsed": {
        "original": "01/08/2018",
        "date": "2018-08-01T22:27:29",
        "year": 2018,
        "month": 8,
        "day": 1,
        "format": "DD/MM/YYYY"
      },
      "type": "other",
      "title": "Út đẹp trai quá 😍",
      "description": "Võ Tuấn Nguyên đã thêm 3 ảnh mới. Út đẹp trai quá 😍",
      "location": "",
      "witnesses": "",
      "documents": "",
      "images": [
        {
          "id": 1533176849000,
          "name": "1764715063565418.jpg",
          "path": "/Users/tuannguyen8888/Downloads/facebook-tuannguyen8888-30_11_2025-BPwDyk9R/your_facebook_activity/posts/media/Tailentudidong_471272692909668/1764715063565418.jpg",
          "type": "image/jpeg"
        },
        {
          "id": 1533176849001,
          "name": "1764715073565417.jpg",
          "path": "/Users/tuannguyen8888/Downloads/facebook-tuannguyen8888-30_11_2025-BPwDyk9R/your_facebook_activity/posts/media/Tailentudidong_471272692909668/1764715073565417.jpg",
          "type": "image/jpeg"
        },
        {
          "id": 1533176849002,
          "name": "1764715140232077.jpg",
          "path": "/Users/tuannguyen8888/Downloads/facebook-tuannguyen8888-30_11_2025-BPwDyk9R/your_facebook_activity/posts/media/Tailentudidong_471272692909668/1764715140232077.jpg",
          "type": "image/jpeg"
        }
      ]
    },
    {
      "id": 1533474522000,
      "date": "05/08/2018",
      "dateParsed": {
        "original": "05/08/2018",
        "date": "2018-08-05T09:08:42",
        "year": 2018,
        "month": 8,
        "day": 5,
        "format": "DD/MM/YYYY"
      },
      "type": "other",
      "title": "Troai đã coá dzợ 😂 Troai đã coá dzợ 😂",
      "description": "Võ Tuấn Nguyên đã thêm một ảnh mới. Troai đã coá dzợ 😂 Troai đã coá dzợ 😂",
      "location": "",
      "witnesses": "",
      "documents": "",
      "images": [
        {
          "id": 1533474522000,
          "name": "1770074646362793.jpg",
          "path": "/Users/tuannguyen8888/Downloads/facebook-tuannguyen8888-30_11_2025-BPwDyk9R/your_facebook_activity/posts/media/Tailentudidong_471272692909668/1770074646362793.jpg",
          "type": "image/jpeg"
        }
      ]
    },
    {
      "id": 1533600294000,
      "date": "06/08/2018",
      "dateParsed": {
        "original": "06/08/2018",
        "date": "2018-08-06T20:04:54",
        "year": 2018,
        "month": 8,
        "day": 6,
        "format": "DD/MM/YYYY"
      },
      "type": "wedding",
      "title": "Võ Tuấn Nguyên đã thêm một sự kiện trong đời từ 31 tháng 7, 2018: Kết hôn với Nư",
      "description": "Võ Tuấn Nguyên đã thêm một sự kiện trong đời từ 31 tháng 7, 2018: Kết hôn với Nương Nương.",
      "location": "",
      "witnesses": "",
      "documents": "",
      "images": []
    },
    {
      "id": 1534468894000,
      "date": "16/08/2018",
      "dateParsed": {
        "original": "16/08/2018",
        "date": "2018-08-16T21:21:34",
        "year": 2018,
        "month": 8,
        "day": 16,
        "format": "DD/MM/YYYY"
      },
      "type": "dating",
      "title": "Yêu vợ Nương Nương Yêu vợ @[100006489412839:2048:Nương Nương]",
      "description": "Võ Tuấn Nguyên đã thêm một video mới vào dòng thời gian của Nương Nương. Yêu vợ Nương Nương Yêu vợ @[100006489412839:2048:Nương Nương]",
      "location": "",
      "witnesses": "",
      "documents": "",
      "images": [
        {
          "id": 1534468894000,
          "name": "307745689986228.mp4",
          "path": "/Users/tuannguyen8888/Downloads/facebook-tuannguyen8888-30_11_2025-BPwDyk9R/your_facebook_activity/posts/media/videos/307745689986228.mp4",
          "type": "image/jpeg"
        }
      ]
    },
    {
      "id": 1535212398000,
      "date": "25/08/2018",
      "dateParsed": {
        "original": "25/08/2018",
        "date": "2018-08-25T11:53:18",
        "year": 2018,
        "month": 8,
        "day": 25,
        "format": "DD/MM/YYYY"
      },
      "type": "other",
      "title": "Video lễ thành hôn Video lễ thành hôn",
      "description": "Võ Tuấn Nguyên đã thêm một video mới. Video lễ thành hôn Video lễ thành hôn",
      "location": "",
      "witnesses": "",
      "documents": "",
      "images": [
        {
          "id": 1535212398000,
          "name": "1803449853025272.mp4",
          "path": "/Users/tuannguyen8888/Downloads/facebook-tuannguyen8888-30_11_2025-BPwDyk9R/your_facebook_activity/posts/media/videos/1803449853025272.mp4",
          "type": "image/jpeg"
        }
      ]
    },
    {
      "id": 1535289647000,
      "date": "26/08/2018",
      "dateParsed": {
        "original": "26/08/2018",
        "date": "2018-08-26T09:20:47",
        "year": 2018,
        "month": 8,
        "day": 26,
        "format": "DD/MM/YYYY"
      },
      "type": "other",
      "title": "Trả hình muộn",
      "description": "Võ Tuấn Nguyên đã thêm 14 ảnh mới. Trả hình muộn",
      "location": "",
      "witnesses": "",
      "documents": "",
      "images": [
        {
          "id": 1535289647000,
          "name": "1804553379581586.jpg",
          "path": "/Users/tuannguyen8888/Downloads/facebook-tuannguyen8888-30_11_2025-BPwDyk9R/your_facebook_activity/posts/media/Tailentudidong_471272692909668/1804553379581586.jpg",
          "type": "image/jpeg"
        },
        {
          "id": 1535289647001,
          "name": "1804557442914513.jpg",
          "path": "/Users/tuannguyen8888/Downloads/facebook-tuannguyen8888-30_11_2025-BPwDyk9R/your_facebook_activity/posts/media/Tailentudidong_471272692909668/1804557442914513.jpg",
          "type": "image/jpeg"
        },
        {
          "id": 1535289647002,
          "name": "1804557566247834.jpg",
          "path": "/Users/tuannguyen8888/Downloads/facebook-tuannguyen8888-30_11_2025-BPwDyk9R/your_facebook_activity/posts/media/Tailentudidong_471272692909668/1804557566247834.jpg",
          "type": "image/jpeg"
        },
        {
          "id": 1535289647003,
          "name": "1804557599581164.jpg",
          "path": "/Users/tuannguyen8888/Downloads/facebook-tuannguyen8888-30_11_2025-BPwDyk9R/your_facebook_activity/posts/media/Tailentudidong_471272692909668/1804557599581164.jpg",
          "type": "image/jpeg"
        },
        {
          "id": 1535289647004,
          "name": "1804557702914487.jpg",
          "path": "/Users/tuannguyen8888/Downloads/facebook-tuannguyen8888-30_11_2025-BPwDyk9R/your_facebook_activity/posts/media/Tailentudidong_471272692909668/1804557702914487.jpg",
          "type": "image/jpeg"
        },
        {
          "id": 1535289647005,
          "name": "1804557739581150.jpg",
          "path": "/Users/tuannguyen8888/Downloads/facebook-tuannguyen8888-30_11_2025-BPwDyk9R/your_facebook_activity/posts/media/Tailentudidong_471272692909668/1804557739581150.jpg",
          "type": "image/jpeg"
        },
        {
          "id": 1535289647006,
          "name": "1804557829581141.jpg",
          "path": "/Users/tuannguyen8888/Downloads/facebook-tuannguyen8888-30_11_2025-BPwDyk9R/your_facebook_activity/posts/media/Tailentudidong_471272692909668/1804557829581141.jpg",
          "type": "image/jpeg"
        },
        {
          "id": 1535289647007,
          "name": "1804557879581136.jpg",
          "path": "/Users/tuannguyen8888/Downloads/facebook-tuannguyen8888-30_11_2025-BPwDyk9R/your_facebook_activity/posts/media/Tailentudidong_471272692909668/1804557879581136.jpg",
          "type": "image/jpeg"
        },
        {
          "id": 1535289647008,
          "name": "1804557962914461.jpg",
          "path": "/Users/tuannguyen8888/Downloads/facebook-tuannguyen8888-30_11_2025-BPwDyk9R/your_facebook_activity/posts/media/Tailentudidong_471272692909668/1804557962914461.jpg",
          "type": "image/jpeg"
        },
        {
          "id": 1535289647009,
          "name": "1804558062914451.jpg",
          "path": "/Users/tuannguyen8888/Downloads/facebook-tuannguyen8888-30_11_2025-BPwDyk9R/your_facebook_activity/posts/media/Tailentudidong_471272692909668/1804558062914451.jpg",
          "type": "image/jpeg"
        }
      ]
    },
    {
      "id": 1538060164000,
      "date": "27/09/2018",
      "dateParsed": {
        "original": "27/09/2018",
        "date": "2018-09-27T10:56:04",
        "year": 2018,
        "month": 9,
        "day": 27,
        "format": "DD/MM/YYYY"
      },
      "type": "other",
      "title": "1 tháng 1 lần \nThành heo trong phút chốc 😋😋😋 1 tháng 1 lần \nThành heo trong phút chốc 😋😋😋",
      "description": "Võ Tuấn Nguyên đã thêm một ảnh mới. 1 tháng 1 lần \nThành heo trong phút chốc 😋😋😋 1 tháng 1 lần \nThành heo trong phút chốc 😋😋😋",
      "location": "",
      "witnesses": "",
      "documents": "",
      "images": [
        {
          "id": 1538060164000,
          "name": "1840062276030696.jpg",
          "path": "/Users/tuannguyen8888/Downloads/facebook-tuannguyen8888-30_11_2025-BPwDyk9R/your_facebook_activity/posts/media/Tailentudidong_471272692909668/1840062276030696.jpg",
          "type": "image/jpeg"
        }
      ]
    },
    {
      "id": 1549981821000,
      "date": "12/02/2019",
      "dateParsed": {
        "original": "12/02/2019",
        "date": "2019-02-12T09:30:21",
        "year": 2019,
        "month": 2,
        "day": 12,
        "format": "DD/MM/YYYY"
      },
      "type": "other",
      "title": "4 năm 😊❤️❤️❤️ 4 năm 😊❤️❤️❤️",
      "description": "Võ Tuấn Nguyên đã thêm một video mới. 4 năm 😊❤️❤️❤️ 4 năm 😊❤️❤️❤️",
      "location": "",
      "witnesses": "",
      "documents": "",
      "images": [
        {
          "id": 1549981821000,
          "name": "2072213462856934.mp4",
          "path": "/Users/tuannguyen8888/Downloads/facebook-tuannguyen8888-30_11_2025-BPwDyk9R/your_facebook_activity/posts/media/videos/2072213462856934.mp4",
          "type": "image/jpeg"
        }
      ]
    },
    {
      "id": 1553182862000,
      "date": "21/03/2019",
      "dateParsed": {
        "original": "21/03/2019",
        "date": "2019-03-21T11:41:02",
        "year": 2019,
        "month": 3,
        "day": 21,
        "format": "DD/MM/YYYY"
      },
      "type": "other",
      "title": "Rủ nhau lên núi 😂",
      "description": "Võ Tuấn Nguyên đã thêm 4 ảnh mới. Rủ nhau lên núi 😂",
      "location": "",
      "witnesses": "",
      "documents": "",
      "images": [
        {
          "id": 1553182862000,
          "name": "2079886742048247.jpg",
          "path": "/Users/tuannguyen8888/Downloads/facebook-tuannguyen8888-30_11_2025-BPwDyk9R/your_facebook_activity/posts/media/Tailentudidong_471272692909668/2079886742048247.jpg",
          "type": "image/jpeg"
        },
        {
          "id": 1553182862001,
          "name": "2079886745381580.jpg",
          "path": "/Users/tuannguyen8888/Downloads/facebook-tuannguyen8888-30_11_2025-BPwDyk9R/your_facebook_activity/posts/media/Tailentudidong_471272692909668/2079886745381580.jpg",
          "type": "image/jpeg"
        },
        {
          "id": 1553182862002,
          "name": "2079886842048237.jpg",
          "path": "/Users/tuannguyen8888/Downloads/facebook-tuannguyen8888-30_11_2025-BPwDyk9R/your_facebook_activity/posts/media/Tailentudidong_471272692909668/2079886842048237.jpg",
          "type": "image/jpeg"
        },
        {
          "id": 1553182862003,
          "name": "2079886822048239.jpg",
          "path": "/Users/tuannguyen8888/Downloads/facebook-tuannguyen8888-30_11_2025-BPwDyk9R/your_facebook_activity/posts/media/Tailentudidong_471272692909668/2079886822048239.jpg",
          "type": "image/jpeg"
        }
      ]
    },
    {
      "id": 1553228312000,
      "date": "22/03/2019",
      "dateParsed": {
        "original": "22/03/2019",
        "date": "2019-03-22T00:18:32",
        "year": 2019,
        "month": 3,
        "day": 22,
        "format": "DD/MM/YYYY"
      },
      "type": "other",
      "title": "Trên nóc nhà Đông Dương",
      "description": "Võ Tuấn Nguyên đã thêm 5 ảnh mới. Trên nóc nhà Đông Dương",
      "location": "",
      "witnesses": "",
      "documents": "",
      "images": [
        {
          "id": 1553228312000,
          "name": "2080599215310333.jpg",
          "path": "/Users/tuannguyen8888/Downloads/facebook-tuannguyen8888-30_11_2025-BPwDyk9R/your_facebook_activity/posts/media/Tailentudidong_471272692909668/2080599215310333.jpg",
          "type": "image/jpeg"
        },
        {
          "id": 1553228312001,
          "name": "2080599175310337.jpg",
          "path": "/Users/tuannguyen8888/Downloads/facebook-tuannguyen8888-30_11_2025-BPwDyk9R/your_facebook_activity/posts/media/Tailentudidong_471272692909668/2080599175310337.jpg",
          "type": "image/jpeg"
        },
        {
          "id": 1553228312002,
          "name": "2080599188643669.jpg",
          "path": "/Users/tuannguyen8888/Downloads/facebook-tuannguyen8888-30_11_2025-BPwDyk9R/your_facebook_activity/posts/media/Tailentudidong_471272692909668/2080599188643669.jpg",
          "type": "image/jpeg"
        },
        {
          "id": 1553228312003,
          "name": "2080599221976999.jpg",
          "path": "/Users/tuannguyen8888/Downloads/facebook-tuannguyen8888-30_11_2025-BPwDyk9R/your_facebook_activity/posts/media/Tailentudidong_471272692909668/2080599221976999.jpg",
          "type": "image/jpeg"
        },
        {
          "id": 1553228312004,
          "name": "2080599291976992.jpg",
          "path": "/Users/tuannguyen8888/Downloads/facebook-tuannguyen8888-30_11_2025-BPwDyk9R/your_facebook_activity/posts/media/Tailentudidong_471272692909668/2080599291976992.jpg",
          "type": "image/jpeg"
        }
      ]
    },
    {
      "id": 1553916456000,
      "date": "29/03/2019",
      "dateParsed": {
        "original": "29/03/2019",
        "date": "2019-03-29T23:27:36",
        "year": 2019,
        "month": 3,
        "day": 29,
        "format": "DD/MM/YYYY"
      },
      "type": "other",
      "title": "My Darling ❤️ My Darling ❤️",
      "description": "Võ Tuấn Nguyên đã thêm một ảnh mới. My Darling ❤️ My Darling ❤️",
      "location": "",
      "witnesses": "",
      "documents": "",
      "images": [
        {
          "id": 1553916456000,
          "name": "2092276160809305.jpg",
          "path": "/Users/tuannguyen8888/Downloads/facebook-tuannguyen8888-30_11_2025-BPwDyk9R/your_facebook_activity/posts/media/Tailentudidong_471272692909668/2092276160809305.jpg",
          "type": "image/jpeg"
        }
      ]
    },
    {
      "id": 1555507500000,
      "date": "17/04/2019",
      "dateParsed": {
        "original": "17/04/2019",
        "date": "2019-04-17T09:25:00",
        "year": 2019,
        "month": 4,
        "day": 17,
        "format": "DD/MM/YYYY"
      },
      "type": "other",
      "title": "Dẫn ẻm đi ăn, kỹ niệm 5 năm 😘",
      "description": "Võ Tuấn Nguyên đã thêm 10 ảnh mới. Dẫn ẻm đi ăn, kỹ niệm 5 năm 😘",
      "location": "",
      "witnesses": "",
      "documents": "",
      "images": [
        {
          "id": 1555507500000,
          "name": "2119029178134003.jpg",
          "path": "/Users/tuannguyen8888/Downloads/facebook-tuannguyen8888-30_11_2025-BPwDyk9R/your_facebook_activity/posts/media/Tailentudidong_471272692909668/2119029178134003.jpg",
          "type": "image/jpeg"
        },
        {
          "id": 1555507500001,
          "name": "2119028914800696.jpg",
          "path": "/Users/tuannguyen8888/Downloads/facebook-tuannguyen8888-30_11_2025-BPwDyk9R/your_facebook_activity/posts/media/Tailentudidong_471272692909668/2119028914800696.jpg",
          "type": "image/jpeg"
        },
        {
          "id": 1555507500002,
          "name": "2119029141467340.jpg",
          "path": "/Users/tuannguyen8888/Downloads/facebook-tuannguyen8888-30_11_2025-BPwDyk9R/your_facebook_activity/posts/media/Tailentudidong_471272692909668/2119029141467340.jpg",
          "type": "image/jpeg"
        },
        {
          "id": 1555507500003,
          "name": "2119029101467344.jpg",
          "path": "/Users/tuannguyen8888/Downloads/facebook-tuannguyen8888-30_11_2025-BPwDyk9R/your_facebook_activity/posts/media/Tailentudidong_471272692909668/2119029101467344.jpg",
          "type": "image/jpeg"
        },
        {
          "id": 1555507500004,
          "name": "2119029224800665.jpg",
          "path": "/Users/tuannguyen8888/Downloads/facebook-tuannguyen8888-30_11_2025-BPwDyk9R/your_facebook_activity/posts/media/Tailentudidong_471272692909668/2119029224800665.jpg",
          "type": "image/jpeg"
        },
        {
          "id": 1555507500005,
          "name": "2119029264800661.jpg",
          "path": "/Users/tuannguyen8888/Downloads/facebook-tuannguyen8888-30_11_2025-BPwDyk9R/your_facebook_activity/posts/media/Tailentudidong_471272692909668/2119029264800661.jpg",
          "type": "image/jpeg"
        },
        {
          "id": 1555507500006,
          "name": "2119029371467317.jpg",
          "path": "/Users/tuannguyen8888/Downloads/facebook-tuannguyen8888-30_11_2025-BPwDyk9R/your_facebook_activity/posts/media/Tailentudidong_471272692909668/2119029371467317.jpg",
          "type": "image/jpeg"
        },
        {
          "id": 1555507500007,
          "name": "2119029418133979.jpg",
          "path": "/Users/tuannguyen8888/Downloads/facebook-tuannguyen8888-30_11_2025-BPwDyk9R/your_facebook_activity/posts/media/Tailentudidong_471272692909668/2119029418133979.jpg",
          "type": "image/jpeg"
        },
        {
          "id": 1555507500008,
          "name": "2119029498133971.jpg",
          "path": "/Users/tuannguyen8888/Downloads/facebook-tuannguyen8888-30_11_2025-BPwDyk9R/your_facebook_activity/posts/media/Tailentudidong_471272692909668/2119029498133971.jpg",
          "type": "image/jpeg"
        },
        {
          "id": 1555507500009,
          "name": "2119029481467306.jpg",
          "path": "/Users/tuannguyen8888/Downloads/facebook-tuannguyen8888-30_11_2025-BPwDyk9R/your_facebook_activity/posts/media/Tailentudidong_471272692909668/2119029481467306.jpg",
          "type": "image/jpeg"
        }
      ]
    },
    {
      "id": 1563169218000,
      "date": "15/07/2019",
      "dateParsed": {
        "original": "15/07/2019",
        "date": "2019-07-15T01:40:18",
        "year": 2019,
        "month": 7,
        "day": 15,
        "format": "DD/MM/YYYY"
      },
      "type": "anniversary",
      "title": "Nhìn cưng quá he 😘 @[100006489412839:2048:Nương Nương]",
      "description": "Võ Tuấn Nguyên đã chia sẻ một kỷ niệm. Nhìn cưng quá he 😘 @[100006489412839:2048:Nương Nương]",
      "location": "",
      "witnesses": "",
      "documents": "",
      "images": []
    },
    {
      "id": 1565094041000,
      "date": "06/08/2019",
      "dateParsed": {
        "original": "06/08/2019",
        "date": "2019-08-06T08:20:41",
        "year": 2019,
        "month": 8,
        "day": 6,
        "format": "DD/MM/YYYY"
      },
      "type": "other",
      "title": "Coming soon ...",
      "description": "Võ Tuấn Nguyên đã thêm 3 ảnh mới. Coming soon ...",
      "location": "",
      "witnesses": "",
      "documents": "",
      "images": [
        {
          "id": 1565094041000,
          "name": "2307234859313433.jpg",
          "path": "/Users/tuannguyen8888/Downloads/facebook-tuannguyen8888-30_11_2025-BPwDyk9R/your_facebook_activity/posts/media/Tailentudidong_471272692909668/2307234859313433.jpg",
          "type": "image/jpeg"
        },
        {
          "id": 1565094041001,
          "name": "2307234889313430.jpg",
          "path": "/Users/tuannguyen8888/Downloads/facebook-tuannguyen8888-30_11_2025-BPwDyk9R/your_facebook_activity/posts/media/Tailentudidong_471272692909668/2307234889313430.jpg",
          "type": "image/jpeg"
        },
        {
          "id": 1565094041002,
          "name": "2307234955980090.jpg",
          "path": "/Users/tuannguyen8888/Downloads/facebook-tuannguyen8888-30_11_2025-BPwDyk9R/your_facebook_activity/posts/media/Tailentudidong_471272692909668/2307234955980090.jpg",
          "type": "image/jpeg"
        }
      ]
    },
    {
      "id": 1566034521000,
      "date": "17/08/2019",
      "dateParsed": {
        "original": "17/08/2019",
        "date": "2019-08-17T05:35:21",
        "year": 2019,
        "month": 8,
        "day": 17,
        "format": "DD/MM/YYYY"
      },
      "type": "other",
      "title": "Võ Tuấn Nguyên đã thêm một video mới vào dòng thời gian của Nương Nương",
      "description": "Võ Tuấn Nguyên đã thêm một video mới vào dòng thời gian của Nương Nương.",
      "location": "",
      "witnesses": "",
      "documents": "",
      "images": [
        {
          "id": 1566034521000,
          "name": "367962040543971.mp4",
          "path": "/Users/tuannguyen8888/Downloads/facebook-tuannguyen8888-30_11_2025-BPwDyk9R/your_facebook_activity/posts/media/videos/367962040543971.mp4",
          "type": "image/jpeg"
        }
      ]
    },
    {
      "id": 1573301248000,
      "date": "09/11/2019",
      "dateParsed": {
        "original": "09/11/2019",
        "date": "2019-11-09T07:07:28",
        "year": 2019,
        "month": 11,
        "day": 9,
        "format": "DD/MM/YYYY"
      },
      "type": "other",
      "title": "Sự kiện với vợ - 09/11/2019",
      "description": "Võ Tuấn Nguyên đã thêm một ảnh mới.",
      "location": "",
      "witnesses": "",
      "documents": "",
      "images": [
        {
          "id": 1573301248000,
          "name": "2490680944302156.jpg",
          "path": "/Users/tuannguyen8888/Downloads/facebook-tuannguyen8888-30_11_2025-BPwDyk9R/your_facebook_activity/posts/media/Tailentudidong_471272692909668/2490680944302156.jpg",
          "type": "image/jpeg"
        }
      ]
    },
    {
      "id": 1575200416000,
      "date": "01/12/2019",
      "dateParsed": {
        "original": "01/12/2019",
        "date": "2019-12-01T06:40:16",
        "year": 2019,
        "month": 12,
        "day": 1,
        "format": "DD/MM/YYYY"
      },
      "type": "other",
      "title": "Bé áo vàng chơi đồ hàng 😊😊😊",
      "description": "Võ Tuấn Nguyên đã thêm 2 ảnh mới. Bé áo vàng chơi đồ hàng 😊😊😊",
      "location": "",
      "witnesses": "",
      "documents": "",
      "images": [
        {
          "id": 1575200416000,
          "name": "2538029122900671.jpg",
          "path": "/Users/tuannguyen8888/Downloads/facebook-tuannguyen8888-30_11_2025-BPwDyk9R/your_facebook_activity/posts/media/Tailentudidong_471272692909668/2538029122900671.jpg",
          "type": "image/jpeg"
        },
        {
          "id": 1575200416001,
          "name": "2538029089567341.jpg",
          "path": "/Users/tuannguyen8888/Downloads/facebook-tuannguyen8888-30_11_2025-BPwDyk9R/your_facebook_activity/posts/media/Tailentudidong_471272692909668/2538029089567341.jpg",
          "type": "image/jpeg"
        }
      ]
    },
    {
      "id": 1579236835000,
      "date": "16/01/2020",
      "dateParsed": {
        "original": "16/01/2020",
        "date": "2020-01-16T23:53:55",
        "year": 2020,
        "month": 1,
        "day": 16,
        "format": "DD/MM/YYYY"
      },
      "type": "other",
      "title": "Dạo china town",
      "description": "Võ Tuấn Nguyên đã thêm 9 ảnh mới. Dạo china town",
      "location": "",
      "witnesses": "",
      "documents": "",
      "images": [
        {
          "id": 1579236835000,
          "name": "2636768979693351.jpg",
          "path": "/Users/tuannguyen8888/Downloads/facebook-tuannguyen8888-30_11_2025-BPwDyk9R/your_facebook_activity/posts/media/TetdiThai_2636770386359877/2636768979693351.jpg",
          "type": "image/jpeg"
        },
        {
          "id": 1579236835001,
          "name": "2636769189693330.jpg",
          "path": "/Users/tuannguyen8888/Downloads/facebook-tuannguyen8888-30_11_2025-BPwDyk9R/your_facebook_activity/posts/media/TetdiThai_2636770386359877/2636769189693330.jpg",
          "type": "image/jpeg"
        },
        {
          "id": 1579236835002,
          "name": "2636769326359983.jpg",
          "path": "/Users/tuannguyen8888/Downloads/facebook-tuannguyen8888-30_11_2025-BPwDyk9R/your_facebook_activity/posts/media/TetdiThai_2636770386359877/2636769326359983.jpg",
          "type": "image/jpeg"
        },
        {
          "id": 1579236835003,
          "name": "2636769523026630.jpg",
          "path": "/Users/tuannguyen8888/Downloads/facebook-tuannguyen8888-30_11_2025-BPwDyk9R/your_facebook_activity/posts/media/TetdiThai_2636770386359877/2636769523026630.jpg",
          "type": "image/jpeg"
        },
        {
          "id": 1579236835004,
          "name": "2636769556359960.jpg",
          "path": "/Users/tuannguyen8888/Downloads/facebook-tuannguyen8888-30_11_2025-BPwDyk9R/your_facebook_activity/posts/media/TetdiThai_2636770386359877/2636769556359960.jpg",
          "type": "image/jpeg"
        },
        {
          "id": 1579236835005,
          "name": "2636769979693251.jpg",
          "path": "/Users/tuannguyen8888/Downloads/facebook-tuannguyen8888-30_11_2025-BPwDyk9R/your_facebook_activity/posts/media/TetdiThai_2636770386359877/2636769979693251.jpg",
          "type": "image/jpeg"
        },
        {
          "id": 1579236835006,
          "name": "2636770013026581.jpg",
          "path": "/Users/tuannguyen8888/Downloads/facebook-tuannguyen8888-30_11_2025-BPwDyk9R/your_facebook_activity/posts/media/TetdiThai_2636770386359877/2636770013026581.jpg",
          "type": "image/jpeg"
        },
        {
          "id": 1579236835007,
          "name": "2636770153026567.jpg",
          "path": "/Users/tuannguyen8888/Downloads/facebook-tuannguyen8888-30_11_2025-BPwDyk9R/your_facebook_activity/posts/media/TetdiThai_2636770386359877/2636770153026567.jpg",
          "type": "image/jpeg"
        },
        {
          "id": 1579236835008,
          "name": "2636770203026562.jpg",
          "path": "/Users/tuannguyen8888/Downloads/facebook-tuannguyen8888-30_11_2025-BPwDyk9R/your_facebook_activity/posts/media/TetdiThai_2636770386359877/2636770203026562.jpg",
          "type": "image/jpeg"
        }
      ]
    },
    {
      "id": 1579244582000,
      "date": "17/01/2020",
      "dateParsed": {
        "original": "17/01/2020",
        "date": "2020-01-17T02:03:02",
        "year": 2020,
        "month": 1,
        "day": 17,
        "format": "DD/MM/YYYY"
      },
      "type": "other",
      "title": "Sự kiện với vợ - 17/01/2020",
      "description": "Võ Tuấn Nguyên đã thêm 3 ảnh mới.",
      "location": "",
      "witnesses": "",
      "documents": "",
      "images": [
        {
          "id": 1579244582000,
          "name": "2636919193011663.jpg",
          "path": "/Users/tuannguyen8888/Downloads/facebook-tuannguyen8888-30_11_2025-BPwDyk9R/your_facebook_activity/posts/media/TetdiThai_2636770386359877/2636919193011663.jpg",
          "type": "image/jpeg"
        },
        {
          "id": 1579244582001,
          "name": "2636919236344992.jpg",
          "path": "/Users/tuannguyen8888/Downloads/facebook-tuannguyen8888-30_11_2025-BPwDyk9R/your_facebook_activity/posts/media/TetdiThai_2636770386359877/2636919236344992.jpg",
          "type": "image/jpeg"
        },
        {
          "id": 1579244582002,
          "name": "2636919246344991.jpg",
          "path": "/Users/tuannguyen8888/Downloads/facebook-tuannguyen8888-30_11_2025-BPwDyk9R/your_facebook_activity/posts/media/TetdiThai_2636770386359877/2636919246344991.jpg",
          "type": "image/jpeg"
        }
      ]
    },
    {
      "id": 1579245790000,
      "date": "17/01/2020",
      "dateParsed": {
        "original": "17/01/2020",
        "date": "2020-01-17T02:23:10",
        "year": 2020,
        "month": 1,
        "day": 17,
        "format": "DD/MM/YYYY"
      },
      "type": "other",
      "title": "Ăn trưa, chuẩn bị xuống thuỷ cung chơi",
      "description": "Võ Tuấn Nguyên đã thêm 10 ảnh mới. Ăn trưa, chuẩn bị xuống thuỷ cung chơi",
      "location": "",
      "witnesses": "",
      "documents": "",
      "images": [
        {
          "id": 1579245790000,
          "name": "2636940959676153.jpg",
          "path": "/Users/tuannguyen8888/Downloads/facebook-tuannguyen8888-30_11_2025-BPwDyk9R/your_facebook_activity/posts/media/TetdiThai_2636770386359877/2636940959676153.jpg",
          "type": "image/jpeg"
        },
        {
          "id": 1579245790001,
          "name": "2636941119676137.jpg",
          "path": "/Users/tuannguyen8888/Downloads/facebook-tuannguyen8888-30_11_2025-BPwDyk9R/your_facebook_activity/posts/media/TetdiThai_2636770386359877/2636941119676137.jpg",
          "type": "image/jpeg"
        },
        {
          "id": 1579245790002,
          "name": "2636941136342802.jpg",
          "path": "/Users/tuannguyen8888/Downloads/facebook-tuannguyen8888-30_11_2025-BPwDyk9R/your_facebook_activity/posts/media/TetdiThai_2636770386359877/2636941136342802.jpg",
          "type": "image/jpeg"
        },
        {
          "id": 1579245790003,
          "name": "2636941276342788.jpg",
          "path": "/Users/tuannguyen8888/Downloads/facebook-tuannguyen8888-30_11_2025-BPwDyk9R/your_facebook_activity/posts/media/TetdiThai_2636770386359877/2636941276342788.jpg",
          "type": "image/jpeg"
        },
        {
          "id": 1579245790004,
          "name": "2636941339676115.jpg",
          "path": "/Users/tuannguyen8888/Downloads/facebook-tuannguyen8888-30_11_2025-BPwDyk9R/your_facebook_activity/posts/media/TetdiThai_2636770386359877/2636941339676115.jpg",
          "type": "image/jpeg"
        },
        {
          "id": 1579245790005,
          "name": "2636941383009444.jpg",
          "path": "/Users/tuannguyen8888/Downloads/facebook-tuannguyen8888-30_11_2025-BPwDyk9R/your_facebook_activity/posts/media/TetdiThai_2636770386359877/2636941383009444.jpg",
          "type": "image/jpeg"
        },
        {
          "id": 1579245790006,
          "name": "2636941503009432.jpg",
          "path": "/Users/tuannguyen8888/Downloads/facebook-tuannguyen8888-30_11_2025-BPwDyk9R/your_facebook_activity/posts/media/TetdiThai_2636770386359877/2636941503009432.jpg",
          "type": "image/jpeg"
        },
        {
          "id": 1579245790007,
          "name": "2636941609676088.jpg",
          "path": "/Users/tuannguyen8888/Downloads/facebook-tuannguyen8888-30_11_2025-BPwDyk9R/your_facebook_activity/posts/media/TetdiThai_2636770386359877/2636941609676088.jpg",
          "type": "image/jpeg"
        },
        {
          "id": 1579245790008,
          "name": "2636941669676082.jpg",
          "path": "/Users/tuannguyen8888/Downloads/facebook-tuannguyen8888-30_11_2025-BPwDyk9R/your_facebook_activity/posts/media/TetdiThai_2636770386359877/2636941669676082.jpg",
          "type": "image/jpeg"
        },
        {
          "id": 1579245790009,
          "name": "2636941736342742.jpg",
          "path": "/Users/tuannguyen8888/Downloads/facebook-tuannguyen8888-30_11_2025-BPwDyk9R/your_facebook_activity/posts/media/TetdiThai_2636770386359877/2636941736342742.jpg",
          "type": "image/jpeg"
        }
      ]
    },
    {
      "id": 1579369307000,
      "date": "18/01/2020",
      "dateParsed": {
        "original": "18/01/2020",
        "date": "2020-01-18T12:41:47",
        "year": 2020,
        "month": 1,
        "day": 18,
        "format": "DD/MM/YYYY"
      },
      "type": "other",
      "title": "Sự kiện với vợ - 18/01/2020",
      "description": "Võ Tuấn Nguyên đã thêm 7 ảnh mới. 😋😋😋",
      "location": "",
      "witnesses": "",
      "documents": "",
      "images": [
        {
          "id": 1579369307000,
          "name": "2639728692730713.jpg",
          "path": "/Users/tuannguyen8888/Downloads/facebook-tuannguyen8888-30_11_2025-BPwDyk9R/your_facebook_activity/posts/media/Tailentudidong_471272692909668/2639728692730713.jpg",
          "type": "image/jpeg"
        },
        {
          "id": 1579369307001,
          "name": "2639728742730708.jpg",
          "path": "/Users/tuannguyen8888/Downloads/facebook-tuannguyen8888-30_11_2025-BPwDyk9R/your_facebook_activity/posts/media/Tailentudidong_471272692909668/2639728742730708.jpg",
          "type": "image/jpeg"
        },
        {
          "id": 1579369307002,
          "name": "2639728852730697.jpg",
          "path": "/Users/tuannguyen8888/Downloads/facebook-tuannguyen8888-30_11_2025-BPwDyk9R/your_facebook_activity/posts/media/Tailentudidong_471272692909668/2639728852730697.jpg",
          "type": "image/jpeg"
        },
        {
          "id": 1579369307003,
          "name": "2639728922730690.jpg",
          "path": "/Users/tuannguyen8888/Downloads/facebook-tuannguyen8888-30_11_2025-BPwDyk9R/your_facebook_activity/posts/media/Tailentudidong_471272692909668/2639728922730690.jpg",
          "type": "image/jpeg"
        },
        {
          "id": 1579369307004,
          "name": "2639729029397346.jpg",
          "path": "/Users/tuannguyen8888/Downloads/facebook-tuannguyen8888-30_11_2025-BPwDyk9R/your_facebook_activity/posts/media/Tailentudidong_471272692909668/2639729029397346.jpg",
          "type": "image/jpeg"
        },
        {
          "id": 1579369307005,
          "name": "2639729092730673.jpg",
          "path": "/Users/tuannguyen8888/Downloads/facebook-tuannguyen8888-30_11_2025-BPwDyk9R/your_facebook_activity/posts/media/Tailentudidong_471272692909668/2639729092730673.jpg",
          "type": "image/jpeg"
        },
        {
          "id": 1579369307006,
          "name": "2639729219397327.jpg",
          "path": "/Users/tuannguyen8888/Downloads/facebook-tuannguyen8888-30_11_2025-BPwDyk9R/your_facebook_activity/posts/media/Tailentudidong_471272692909668/2639729219397327.jpg",
          "type": "image/jpeg"
        }
      ]
    },
    {
      "id": 1579406427000,
      "date": "18/01/2020",
      "dateParsed": {
        "original": "18/01/2020",
        "date": "2020-01-18T23:00:27",
        "year": 2020,
        "month": 1,
        "day": 18,
        "format": "DD/MM/YYYY"
      },
      "type": "other",
      "title": "Sự kiện với vợ - 18/01/2020",
      "description": "Võ Tuấn Nguyên đã thêm 3 ảnh mới. 😂😂",
      "location": "",
      "witnesses": "",
      "documents": "",
      "images": [
        {
          "id": 1579406427000,
          "name": "2640517172651865.jpg",
          "path": "/Users/tuannguyen8888/Downloads/facebook-tuannguyen8888-30_11_2025-BPwDyk9R/your_facebook_activity/posts/media/Tailentudidong_471272692909668/2640517172651865.jpg",
          "type": "image/jpeg"
        },
        {
          "id": 1579406427001,
          "name": "2640517215985194.jpg",
          "path": "/Users/tuannguyen8888/Downloads/facebook-tuannguyen8888-30_11_2025-BPwDyk9R/your_facebook_activity/posts/media/Tailentudidong_471272692909668/2640517215985194.jpg",
          "type": "image/jpeg"
        },
        {
          "id": 1579406427002,
          "name": "2640517275985188.jpg",
          "path": "/Users/tuannguyen8888/Downloads/facebook-tuannguyen8888-30_11_2025-BPwDyk9R/your_facebook_activity/posts/media/Tailentudidong_471272692909668/2640517275985188.jpg",
          "type": "image/jpeg"
        }
      ]
    },
    {
      "id": 1579501604000,
      "date": "20/01/2020",
      "dateParsed": {
        "original": "20/01/2020",
        "date": "2020-01-20T01:26:44",
        "year": 2020,
        "month": 1,
        "day": 20,
        "format": "DD/MM/YYYY"
      },
      "type": "other",
      "title": "vk nấu mì Thái ,ăn rồi đi về Việt Nam vk nấu mì Thái ,ăn rồi đi về Việt Nam",
      "description": "Võ Tuấn Nguyên đã thêm một ảnh mới. vk nấu mì Thái ,ăn rồi đi về Việt Nam vk nấu mì Thái ,ăn rồi đi về Việt Nam",
      "location": "",
      "witnesses": "",
      "documents": "",
      "images": [
        {
          "id": 1579501604000,
          "name": "2642559429114306.jpg",
          "path": "/Users/tuannguyen8888/Downloads/facebook-tuannguyen8888-30_11_2025-BPwDyk9R/your_facebook_activity/posts/media/Tailentudidong_471272692909668/2642559429114306.jpg",
          "type": "image/jpeg"
        }
      ]
    },
    {
      "id": 1579572122000,
      "date": "20/01/2020",
      "dateParsed": {
        "original": "20/01/2020",
        "date": "2020-01-20T21:02:02",
        "year": 2020,
        "month": 1,
        "day": 20,
        "format": "DD/MM/YYYY"
      },
      "type": "other",
      "title": "Checkin nhẹ nhẹ ĐN với 2 đứa em rồi về Quảng Nôm Checkin nhẹ nhẹ ĐN với 2 đứa em rồi về Quảng Nôm...",
      "description": "Võ Tuấn Nguyên đã thêm 16 ảnh mới. Checkin nhẹ nhẹ ĐN với 2 đứa em rồi về Quảng Nôm Checkin nhẹ nhẹ ĐN với 2 đứa em rồi về Quảng Nôm Checkin nhẹ nhẹ ĐN với 2 đứa em rồi về Quảng Nôm Checkin nhẹ nhẹ ĐN với 2 đứa em rồi về Quảng Nôm Checkin nhẹ nhẹ ĐN với 2 đứa em rồi về Quảng Nôm Checkin nhẹ nhẹ ĐN với 2 đứa em rồi về Quảng Nôm Checkin nhẹ nhẹ ĐN với 2 đứa em rồi về Quảng Nôm",
      "location": "",
      "witnesses": "",
      "documents": "",
      "images": [
        {
          "id": 1579572122000,
          "name": "2644103775626538.jpg",
          "path": "/Users/tuannguyen8888/Downloads/facebook-tuannguyen8888-30_11_2025-BPwDyk9R/your_facebook_activity/posts/media/Tailentudidong_471272692909668/2644103775626538.jpg",
          "type": "image/jpeg"
        },
        {
          "id": 1579572122001,
          "name": "2644103832293199.jpg",
          "path": "/Users/tuannguyen8888/Downloads/facebook-tuannguyen8888-30_11_2025-BPwDyk9R/your_facebook_activity/posts/media/Tailentudidong_471272692909668/2644103832293199.jpg",
          "type": "image/jpeg"
        },
        {
          "id": 1579572122002,
          "name": "2644103898959859.jpg",
          "path": "/Users/tuannguyen8888/Downloads/facebook-tuannguyen8888-30_11_2025-BPwDyk9R/your_facebook_activity/posts/media/Tailentudidong_471272692909668/2644103898959859.jpg",
          "type": "image/jpeg"
        },
        {
          "id": 1579572122003,
          "name": "2644103985626517.jpg",
          "path": "/Users/tuannguyen8888/Downloads/facebook-tuannguyen8888-30_11_2025-BPwDyk9R/your_facebook_activity/posts/media/Tailentudidong_471272692909668/2644103985626517.jpg",
          "type": "image/jpeg"
        },
        {
          "id": 1579572122004,
          "name": "2644104068959842.jpg",
          "path": "/Users/tuannguyen8888/Downloads/facebook-tuannguyen8888-30_11_2025-BPwDyk9R/your_facebook_activity/posts/media/Tailentudidong_471272692909668/2644104068959842.jpg",
          "type": "image/jpeg"
        },
        {
          "id": 1579572122005,
          "name": "2644104138959835.jpg",
          "path": "/Users/tuannguyen8888/Downloads/facebook-tuannguyen8888-30_11_2025-BPwDyk9R/your_facebook_activity/posts/media/Tailentudidong_471272692909668/2644104138959835.jpg",
          "type": "image/jpeg"
        },
        {
          "id": 1579572122006,
          "name": "2644104252293157.jpg",
          "path": "/Users/tuannguyen8888/Downloads/facebook-tuannguyen8888-30_11_2025-BPwDyk9R/your_facebook_activity/posts/media/Tailentudidong_471272692909668/2644104252293157.jpg",
          "type": "image/jpeg"
        },
        {
          "id": 1579572122007,
          "name": "2644104375626478.jpg",
          "path": "/Users/tuannguyen8888/Downloads/facebook-tuannguyen8888-30_11_2025-BPwDyk9R/your_facebook_activity/posts/media/Tailentudidong_471272692909668/2644104375626478.jpg",
          "type": "image/jpeg"
        },
        {
          "id": 1579572122008,
          "name": "2644104438959805.jpg",
          "path": "/Users/tuannguyen8888/Downloads/facebook-tuannguyen8888-30_11_2025-BPwDyk9R/your_facebook_activity/posts/media/Tailentudidong_471272692909668/2644104438959805.jpg",
          "type": "image/jpeg"
        },
        {
          "id": 1579572122009,
          "name": "2644104552293127.jpg",
          "path": "/Users/tuannguyen8888/Downloads/facebook-tuannguyen8888-30_11_2025-BPwDyk9R/your_facebook_activity/posts/media/Tailentudidong_471272692909668/2644104552293127.jpg",
          "type": "image/jpeg"
        }
      ]
    },
    {
      "id": 1590385376000,
      "date": "25/05/2020",
      "dateParsed": {
        "original": "25/05/2020",
        "date": "2020-05-25T01:42:56",
        "year": 2020,
        "month": 5,
        "day": 25,
        "format": "DD/MM/YYYY"
      },
      "type": "other",
      "title": "Sự kiện với vợ - 25/05/2020",
      "description": "Võ Tuấn Nguyên đã thêm 5 ảnh mới.",
      "location": "",
      "witnesses": "",
      "documents": "",
      "images": [
        {
          "id": 1590385376000,
          "name": "2921516127885300.jpg",
          "path": "/Users/tuannguyen8888/Downloads/facebook-tuannguyen8888-30_11_2025-BPwDyk9R/your_facebook_activity/posts/media/Tailentudidong_471272692909668/2921516127885300.jpg",
          "type": "image/jpeg"
        },
        {
          "id": 1590385376001,
          "name": "2921516174551962.jpg",
          "path": "/Users/tuannguyen8888/Downloads/facebook-tuannguyen8888-30_11_2025-BPwDyk9R/your_facebook_activity/posts/media/Tailentudidong_471272692909668/2921516174551962.jpg",
          "type": "image/jpeg"
        },
        {
          "id": 1590385376002,
          "name": "2921516281218618.jpg",
          "path": "/Users/tuannguyen8888/Downloads/facebook-tuannguyen8888-30_11_2025-BPwDyk9R/your_facebook_activity/posts/media/Tailentudidong_471272692909668/2921516281218618.jpg",
          "type": "image/jpeg"
        },
        {
          "id": 1590385376003,
          "name": "2921518401218406.jpg",
          "path": "/Users/tuannguyen8888/Downloads/facebook-tuannguyen8888-30_11_2025-BPwDyk9R/your_facebook_activity/posts/media/Tailentudidong_471272692909668/2921518401218406.jpg",
          "type": "image/jpeg"
        },
        {
          "id": 1590385376004,
          "name": "2921521854551394.jpg",
          "path": "/Users/tuannguyen8888/Downloads/facebook-tuannguyen8888-30_11_2025-BPwDyk9R/your_facebook_activity/posts/media/Tailentudidong_471272692909668/2921521854551394.jpg",
          "type": "image/jpeg"
        }
      ]
    },
    {
      "id": 1592105707000,
      "date": "13/06/2020",
      "dateParsed": {
        "original": "13/06/2020",
        "date": "2020-06-13T23:35:07",
        "year": 2020,
        "month": 6,
        "day": 13,
        "format": "DD/MM/YYYY"
      },
      "type": "other",
      "title": "Cafe với bé bầu Cafe với bé bầu",
      "description": "Võ Tuấn Nguyên đã thêm một ảnh mới. Cafe với bé bầu Cafe với bé bầu",
      "location": "",
      "witnesses": "",
      "documents": "",
      "images": [
        {
          "id": 1592105707000,
          "name": "2971766776193568.jpg",
          "path": "/Users/tuannguyen8888/Downloads/facebook-tuannguyen8888-30_11_2025-BPwDyk9R/your_facebook_activity/posts/media/Tailentudidong_471272692909668/2971766776193568.jpg",
          "type": "image/jpeg"
        }
      ]
    },
    {
      "id": 1592959541000,
      "date": "23/06/2020",
      "dateParsed": {
        "original": "23/06/2020",
        "date": "2020-06-23T20:45:41",
        "year": 2020,
        "month": 6,
        "day": 23,
        "format": "DD/MM/YYYY"
      },
      "type": "other",
      "title": "Sự kiện với vợ - 23/06/2020",
      "description": "Võ Tuấn Nguyên đã thêm một ảnh mới. ❤️ ❤️",
      "location": "",
      "witnesses": "",
      "documents": "",
      "images": [
        {
          "id": 1592959541000,
          "name": "2998209690215943.jpg",
          "path": "/Users/tuannguyen8888/Downloads/facebook-tuannguyen8888-30_11_2025-BPwDyk9R/your_facebook_activity/posts/media/Tailentudidong_471272692909668/2998209690215943.jpg",
          "type": "image/jpeg"
        }
      ]
    },
    {
      "id": 1593181687000,
      "date": "26/06/2020",
      "dateParsed": {
        "original": "26/06/2020",
        "date": "2020-06-26T10:28:07",
        "year": 2020,
        "month": 6,
        "day": 26,
        "format": "DD/MM/YYYY"
      },
      "type": "other",
      "title": "Võ Tuấn Nguyên cùng với Nương Nương tại Soya Garden. Dẫn bầu đi uống sữa đậu nành nóng cho dễ ngủ 😘",
      "description": "Võ Tuấn Nguyên cùng với Nương Nương tại Soya Garden. Dẫn bầu đi uống sữa đậu nành nóng cho dễ ngủ 😘",
      "location": "",
      "witnesses": "",
      "documents": "",
      "images": [
        {
          "id": 1593181687000,
          "name": "3005147542855491.jpg",
          "path": "/Users/tuannguyen8888/Downloads/facebook-tuannguyen8888-30_11_2025-BPwDyk9R/your_facebook_activity/posts/media/your_posts/3005147542855491.jpg",
          "type": "image/jpeg"
        }
      ]
    },
    {
      "id": 1595996191000,
      "date": "29/07/2020",
      "dateParsed": {
        "original": "29/07/2020",
        "date": "2020-07-29T00:16:31",
        "year": 2020,
        "month": 7,
        "day": 29,
        "format": "DD/MM/YYYY"
      },
      "type": "wedding",
      "title": "Quà vk tặng đám cưới  “Bông “❤️",
      "description": "Võ Tuấn Nguyên đã thêm 3 ảnh mới. Quà vk tặng đám cưới  “Bông “❤️",
      "location": "",
      "witnesses": "",
      "documents": "",
      "images": [
        {
          "id": 1595996191000,
          "name": "3092883807415197.jpg",
          "path": "/Users/tuannguyen8888/Downloads/facebook-tuannguyen8888-30_11_2025-BPwDyk9R/your_facebook_activity/posts/media/Tailentudidong_471272692909668/3092883807415197.jpg",
          "type": "image/jpeg"
        },
        {
          "id": 1595996191001,
          "name": "3092883934081851.jpg",
          "path": "/Users/tuannguyen8888/Downloads/facebook-tuannguyen8888-30_11_2025-BPwDyk9R/your_facebook_activity/posts/media/Tailentudidong_471272692909668/3092883934081851.jpg",
          "type": "image/jpeg"
        },
        {
          "id": 1595996191002,
          "name": "3092883840748527.jpg",
          "path": "/Users/tuannguyen8888/Downloads/facebook-tuannguyen8888-30_11_2025-BPwDyk9R/your_facebook_activity/posts/media/Tailentudidong_471272692909668/3092883840748527.jpg",
          "type": "image/jpeg"
        }
      ]
    },
    {
      "id": 1596209973000,
      "date": "31/07/2020",
      "dateParsed": {
        "original": "31/07/2020",
        "date": "2020-07-31T11:39:33",
        "year": 2020,
        "month": 7,
        "day": 31,
        "format": "DD/MM/YYYY"
      },
      "type": "wedding",
      "title": "Đám cưới bông \nThương 2 mẹ con ❤️",
      "description": "Võ Tuấn Nguyên đã thêm 10 ảnh mới. Đám cưới bông \nThương 2 mẹ con ❤️",
      "location": "",
      "witnesses": "",
      "documents": "",
      "images": [
        {
          "id": 1596209973000,
          "name": "3100030336700544.jpg",
          "path": "/Users/tuannguyen8888/Downloads/facebook-tuannguyen8888-30_11_2025-BPwDyk9R/your_facebook_activity/posts/media/Tailentudidong_471272692909668/3100030336700544.jpg",
          "type": "image/jpeg"
        },
        {
          "id": 1596209973001,
          "name": "3100030490033862.jpg",
          "path": "/Users/tuannguyen8888/Downloads/facebook-tuannguyen8888-30_11_2025-BPwDyk9R/your_facebook_activity/posts/media/Tailentudidong_471272692909668/3100030490033862.jpg",
          "type": "image/jpeg"
        },
        {
          "id": 1596209973002,
          "name": "3100031070033804.jpg",
          "path": "/Users/tuannguyen8888/Downloads/facebook-tuannguyen8888-30_11_2025-BPwDyk9R/your_facebook_activity/posts/media/Tailentudidong_471272692909668/3100031070033804.jpg",
          "type": "image/jpeg"
        },
        {
          "id": 1596209973003,
          "name": "3100031656700412.jpg",
          "path": "/Users/tuannguyen8888/Downloads/facebook-tuannguyen8888-30_11_2025-BPwDyk9R/your_facebook_activity/posts/media/Tailentudidong_471272692909668/3100031656700412.jpg",
          "type": "image/jpeg"
        },
        {
          "id": 1596209973004,
          "name": "3100030383367206.jpg",
          "path": "/Users/tuannguyen8888/Downloads/facebook-tuannguyen8888-30_11_2025-BPwDyk9R/your_facebook_activity/posts/media/Tailentudidong_471272692909668/3100030383367206.jpg",
          "type": "image/jpeg"
        },
        {
          "id": 1596209973005,
          "name": "3100031613367083.jpg",
          "path": "/Users/tuannguyen8888/Downloads/facebook-tuannguyen8888-30_11_2025-BPwDyk9R/your_facebook_activity/posts/media/Tailentudidong_471272692909668/3100031613367083.jpg",
          "type": "image/jpeg"
        },
        {
          "id": 1596209973006,
          "name": "3100031396700438.jpg",
          "path": "/Users/tuannguyen8888/Downloads/facebook-tuannguyen8888-30_11_2025-BPwDyk9R/your_facebook_activity/posts/media/Tailentudidong_471272692909668/3100031396700438.jpg",
          "type": "image/jpeg"
        },
        {
          "id": 1596209973007,
          "name": "3100031116700466.jpg",
          "path": "/Users/tuannguyen8888/Downloads/facebook-tuannguyen8888-30_11_2025-BPwDyk9R/your_facebook_activity/posts/media/Tailentudidong_471272692909668/3100031116700466.jpg",
          "type": "image/jpeg"
        },
        {
          "id": 1596209973008,
          "name": "3100030933367151.jpg",
          "path": "/Users/tuannguyen8888/Downloads/facebook-tuannguyen8888-30_11_2025-BPwDyk9R/your_facebook_activity/posts/media/Tailentudidong_471272692909668/3100030933367151.jpg",
          "type": "image/jpeg"
        },
        {
          "id": 1596209973009,
          "name": "3100032840033627.jpg",
          "path": "/Users/tuannguyen8888/Downloads/facebook-tuannguyen8888-30_11_2025-BPwDyk9R/your_facebook_activity/posts/media/Tailentudidong_471272692909668/3100032840033627.jpg",
          "type": "image/jpeg"
        }
      ]
    },
    {
      "id": 1597674735000,
      "date": "17/08/2020",
      "dateParsed": {
        "original": "17/08/2020",
        "date": "2020-08-17T10:32:15",
        "year": 2020,
        "month": 8,
        "day": 17,
        "format": "DD/MM/YYYY"
      },
      "type": "birth",
      "title": "Chúc mừng sinh nhật vợ yêu ❤️\nCố gắng 2 tháng nữa gặp Sam baby nha\nThương em và con 😘😘😘",
      "description": "Võ Tuấn Nguyên đã thêm 3 ảnh mới. Chúc mừng sinh nhật vợ yêu ❤️\nCố gắng 2 tháng nữa gặp Sam baby nha\nThương em và con 😘😘😘",
      "location": "",
      "witnesses": "",
      "documents": "",
      "images": [
        {
          "id": 1597674735000,
          "name": "3148171145219796.jpg",
          "path": "/Users/tuannguyen8888/Downloads/facebook-tuannguyen8888-30_11_2025-BPwDyk9R/your_facebook_activity/posts/media/Tailentudidong_471272692909668/3148171145219796.jpg",
          "type": "image/jpeg"
        },
        {
          "id": 1597674735001,
          "name": "3148171311886446.jpg",
          "path": "/Users/tuannguyen8888/Downloads/facebook-tuannguyen8888-30_11_2025-BPwDyk9R/your_facebook_activity/posts/media/Tailentudidong_471272692909668/3148171311886446.jpg",
          "type": "image/jpeg"
        },
        {
          "id": 1597674735002,
          "name": "3148171191886458.jpg",
          "path": "/Users/tuannguyen8888/Downloads/facebook-tuannguyen8888-30_11_2025-BPwDyk9R/your_facebook_activity/posts/media/Tailentudidong_471272692909668/3148171191886458.jpg",
          "type": "image/jpeg"
        }
      ]
    },
    {
      "id": 1603946508000,
      "date": "29/10/2020",
      "dateParsed": {
        "original": "29/10/2020",
        "date": "2020-10-29T00:41:48",
        "year": 2020,
        "month": 10,
        "day": 29,
        "format": "DD/MM/YYYY"
      },
      "type": "other",
      "title": "Chào mừng con gái đến với gia đình.\nMong con lớn lên khoẻ mạnh vui vẽ và hạnh phúc bên ba mẹ.\nChu...",
      "description": "Võ Tuấn Nguyên đã thêm 2 ảnh và một video. Chào mừng con gái đến với gia đình.\nMong con lớn lên khoẻ mạnh vui vẽ và hạnh phúc bên ba mẹ.\nChuột gái tên Sam (Võ Ngọc Linh Đan) chào đời lúc 11:50 28/10/2020 nặng 3.5kg ❤️",
      "location": "",
      "witnesses": "",
      "documents": "",
      "images": [
        {
          "id": 1603946508000,
          "name": "3362670320436543.jpg",
          "path": "/Users/tuannguyen8888/Downloads/facebook-tuannguyen8888-30_11_2025-BPwDyk9R/your_facebook_activity/posts/media/Sam_3362678057102436/3362670320436543.jpg",
          "type": "image/jpeg"
        },
        {
          "id": 1603946508001,
          "name": "3362670447103197.jpg",
          "path": "/Users/tuannguyen8888/Downloads/facebook-tuannguyen8888-30_11_2025-BPwDyk9R/your_facebook_activity/posts/media/Sam_3362678057102436/3362670447103197.jpg",
          "type": "image/jpeg"
        },
        {
          "id": 1603946508002,
          "name": "3362670767103165.mp4",
          "path": "/Users/tuannguyen8888/Downloads/facebook-tuannguyen8888-30_11_2025-BPwDyk9R/your_facebook_activity/posts/media/Sam_3362678057102436/3362670767103165.mp4",
          "type": "image/jpeg"
        }
      ]
    },
    {
      "id": 1604153731000,
      "date": "31/10/2020",
      "dateParsed": {
        "original": "31/10/2020",
        "date": "2020-10-31T10:15:31",
        "year": 2020,
        "month": 10,
        "day": 31,
        "format": "DD/MM/YYYY"
      },
      "type": "other",
      "title": "Bệnh viện phát cho mỗi người 1 cái lắc, đeo khỏi tháo luôn 😊",
      "description": "Võ Tuấn Nguyên đã thêm 2 ảnh mới. Bệnh viện phát cho mỗi người 1 cái lắc, đeo khỏi tháo luôn 😊",
      "location": "",
      "witnesses": "",
      "documents": "",
      "images": [
        {
          "id": 1604153731000,
          "name": "3369288196441422.jpg",
          "path": "/Users/tuannguyen8888/Downloads/facebook-tuannguyen8888-30_11_2025-BPwDyk9R/your_facebook_activity/posts/media/Tailentudidong_471272692909668/3369288196441422.jpg",
          "type": "image/jpeg"
        },
        {
          "id": 1604153731001,
          "name": "3369291683107740.jpg",
          "path": "/Users/tuannguyen8888/Downloads/facebook-tuannguyen8888-30_11_2025-BPwDyk9R/your_facebook_activity/posts/media/Tailentudidong_471272692909668/3369291683107740.jpg",
          "type": "image/jpeg"
        }
      ]
    },
    {
      "id": 1606208085000,
      "date": "24/11/2020",
      "dateParsed": {
        "original": "24/11/2020",
        "date": "2020-11-24T03:54:45",
        "year": 2020,
        "month": 11,
        "day": 24,
        "format": "DD/MM/YYYY"
      },
      "type": "other",
      "title": "Chúc mừng con gái của ba đầy tháng. Khoẻ mạnh, bình an lớn lên bên ba mẹ nha con 😘😘😘",
      "description": "Võ Tuấn Nguyên đã thêm 9 ảnh mới. Chúc mừng con gái của ba đầy tháng. Khoẻ mạnh, bình an lớn lên bên ba mẹ nha con 😘😘😘",
      "location": "",
      "witnesses": "",
      "documents": "",
      "images": [
        {
          "id": 1606208085000,
          "name": "3433610900009151.jpg",
          "path": "/Users/tuannguyen8888/Downloads/facebook-tuannguyen8888-30_11_2025-BPwDyk9R/your_facebook_activity/posts/media/Tailentudidong_471272692909668/3433610900009151.jpg",
          "type": "image/jpeg"
        },
        {
          "id": 1606208085001,
          "name": "3433610993342475.jpg",
          "path": "/Users/tuannguyen8888/Downloads/facebook-tuannguyen8888-30_11_2025-BPwDyk9R/your_facebook_activity/posts/media/Tailentudidong_471272692909668/3433610993342475.jpg",
          "type": "image/jpeg"
        },
        {
          "id": 1606208085002,
          "name": "3433611903342384.jpg",
          "path": "/Users/tuannguyen8888/Downloads/facebook-tuannguyen8888-30_11_2025-BPwDyk9R/your_facebook_activity/posts/media/Tailentudidong_471272692909668/3433611903342384.jpg",
          "type": "image/jpeg"
        },
        {
          "id": 1606208085003,
          "name": "3433611850009056.jpg",
          "path": "/Users/tuannguyen8888/Downloads/facebook-tuannguyen8888-30_11_2025-BPwDyk9R/your_facebook_activity/posts/media/Tailentudidong_471272692909668/3433611850009056.jpg",
          "type": "image/jpeg"
        },
        {
          "id": 1606208085004,
          "name": "3433611050009136.jpg",
          "path": "/Users/tuannguyen8888/Downloads/facebook-tuannguyen8888-30_11_2025-BPwDyk9R/your_facebook_activity/posts/media/Tailentudidong_471272692909668/3433611050009136.jpg",
          "type": "image/jpeg"
        },
        {
          "id": 1606208085005,
          "name": "3433610933342481.jpg",
          "path": "/Users/tuannguyen8888/Downloads/facebook-tuannguyen8888-30_11_2025-BPwDyk9R/your_facebook_activity/posts/media/Tailentudidong_471272692909668/3433610933342481.jpg",
          "type": "image/jpeg"
        },
        {
          "id": 1606208085006,
          "name": "3433611306675777.jpg",
          "path": "/Users/tuannguyen8888/Downloads/facebook-tuannguyen8888-30_11_2025-BPwDyk9R/your_facebook_activity/posts/media/Tailentudidong_471272692909668/3433611306675777.jpg",
          "type": "image/jpeg"
        },
        {
          "id": 1606208085007,
          "name": "3433611090009132.jpg",
          "path": "/Users/tuannguyen8888/Downloads/facebook-tuannguyen8888-30_11_2025-BPwDyk9R/your_facebook_activity/posts/media/Tailentudidong_471272692909668/3433611090009132.jpg",
          "type": "image/jpeg"
        },
        {
          "id": 1606208085008,
          "name": "3433611233342451.jpg",
          "path": "/Users/tuannguyen8888/Downloads/facebook-tuannguyen8888-30_11_2025-BPwDyk9R/your_facebook_activity/posts/media/Tailentudidong_471272692909668/3433611233342451.jpg",
          "type": "image/jpeg"
        }
      ]
    },
    {
      "id": 1608824305000,
      "date": "24/12/2020",
      "dateParsed": {
        "original": "24/12/2020",
        "date": "2020-12-24T10:38:25",
        "year": 2020,
        "month": 12,
        "day": 24,
        "format": "DD/MM/YYYY"
      },
      "type": "birth",
      "title": "Mùa noel đầu tiên của gái rượu 🥰\nChúc cả nhà giáng sinh an lành",
      "description": "Võ Tuấn Nguyên đã thêm 3 ảnh mới. Mùa noel đầu tiên của gái rượu 🥰\nChúc cả nhà giáng sinh an lành",
      "location": "",
      "witnesses": "",
      "documents": "",
      "images": [
        {
          "id": 1608824305000,
          "name": "3512526568784250.jpg",
          "path": "/Users/tuannguyen8888/Downloads/facebook-tuannguyen8888-30_11_2025-BPwDyk9R/your_facebook_activity/posts/media/Tailentudidong_471272692909668/3512526568784250.jpg",
          "type": "image/jpeg"
        },
        {
          "id": 1608824305001,
          "name": "3512526608784246.jpg",
          "path": "/Users/tuannguyen8888/Downloads/facebook-tuannguyen8888-30_11_2025-BPwDyk9R/your_facebook_activity/posts/media/Tailentudidong_471272692909668/3512526608784246.jpg",
          "type": "image/jpeg"
        },
        {
          "id": 1608824305002,
          "name": "3512526668784240.jpg",
          "path": "/Users/tuannguyen8888/Downloads/facebook-tuannguyen8888-30_11_2025-BPwDyk9R/your_facebook_activity/posts/media/Tailentudidong_471272692909668/3512526668784240.jpg",
          "type": "image/jpeg"
        }
      ]
    },
    {
      "id": 1608995863000,
      "date": "26/12/2020",
      "dateParsed": {
        "original": "26/12/2020",
        "date": "2020-12-26T10:17:43",
        "year": 2020,
        "month": 12,
        "day": 26,
        "format": "DD/MM/YYYY"
      },
      "type": "other",
      "title": "Vk tặng cho cái nồi, lên cty nấu cơm ăn 😁",
      "description": "Võ Tuấn Nguyên đã thêm 4 ảnh mới. Vk tặng cho cái nồi, lên cty nấu cơm ăn 😁",
      "location": "",
      "witnesses": "",
      "documents": "",
      "images": [
        {
          "id": 1608995863000,
          "name": "3517270454976528.jpg",
          "path": "/Users/tuannguyen8888/Downloads/facebook-tuannguyen8888-30_11_2025-BPwDyk9R/your_facebook_activity/posts/media/Tailentudidong_471272692909668/3517270454976528.jpg",
          "type": "image/jpeg"
        },
        {
          "id": 1608995863001,
          "name": "3517270494976524.jpg",
          "path": "/Users/tuannguyen8888/Downloads/facebook-tuannguyen8888-30_11_2025-BPwDyk9R/your_facebook_activity/posts/media/Tailentudidong_471272692909668/3517270494976524.jpg",
          "type": "image/jpeg"
        },
        {
          "id": 1608995863002,
          "name": "3517270561643184.jpg",
          "path": "/Users/tuannguyen8888/Downloads/facebook-tuannguyen8888-30_11_2025-BPwDyk9R/your_facebook_activity/posts/media/Tailentudidong_471272692909668/3517270561643184.jpg",
          "type": "image/jpeg"
        },
        {
          "id": 1608995863003,
          "name": "3517270618309845.jpg",
          "path": "/Users/tuannguyen8888/Downloads/facebook-tuannguyen8888-30_11_2025-BPwDyk9R/your_facebook_activity/posts/media/Tailentudidong_471272692909668/3517270618309845.jpg",
          "type": "image/jpeg"
        }
      ]
    },
    {
      "id": 1609334993000,
      "date": "30/12/2020",
      "dateParsed": {
        "original": "30/12/2020",
        "date": "2020-12-30T08:29:53",
        "year": 2020,
        "month": 12,
        "day": 30,
        "format": "DD/MM/YYYY"
      },
      "type": "birth",
      "title": "Sam chúc ông nội sinh nhật vui vẽ, giữ gìn sức khoẻ và sớm về chơi với Sam 😘😘😘 Sam chúc ông nội s...",
      "description": "Võ Tuấn Nguyên đã thêm một video mới. Sam chúc ông nội sinh nhật vui vẽ, giữ gìn sức khoẻ và sớm về chơi với Sam 😘😘😘 Sam chúc ông nội sinh nhật vui vẽ, giữ gìn sức khoẻ và sớm về chơi với Sam 😘😘😘",
      "location": "",
      "witnesses": "",
      "documents": "",
      "images": [
        {
          "id": 1609334993000,
          "name": "3526722130698027.mp4",
          "path": "/Users/tuannguyen8888/Downloads/facebook-tuannguyen8888-30_11_2025-BPwDyk9R/your_facebook_activity/posts/media/videos/3526722130698027.mp4",
          "type": "image/jpeg"
        }
      ]
    },
    {
      "id": 1609475190000,
      "date": "31/12/2020",
      "dateParsed": {
        "original": "31/12/2020",
        "date": "2020-12-31T23:26:30",
        "year": 2020,
        "month": 12,
        "day": 31,
        "format": "DD/MM/YYYY"
      },
      "type": "other",
      "title": "Sam chích ngừa xong mặt tỉnh queo 😊😊😊 Sam chích ngừa xong mặt tỉnh queo 😊😊😊",
      "description": "Võ Tuấn Nguyên đã thêm một ảnh mới. Sam chích ngừa xong mặt tỉnh queo 😊😊😊 Sam chích ngừa xong mặt tỉnh queo 😊😊😊",
      "location": "",
      "witnesses": "",
      "documents": "",
      "images": [
        {
          "id": 1609475190000,
          "name": "3530861716950735.jpg",
          "path": "/Users/tuannguyen8888/Downloads/facebook-tuannguyen8888-30_11_2025-BPwDyk9R/your_facebook_activity/posts/media/Tailentudidong_471272692909668/3530861716950735.jpg",
          "type": "image/jpeg"
        }
      ]
    },
    {
      "id": 1609949494000,
      "date": "06/01/2021",
      "dateParsed": {
        "original": "06/01/2021",
        "date": "2021-01-06T11:11:34",
        "year": 2021,
        "month": 1,
        "day": 6,
        "format": "DD/MM/YYYY"
      },
      "type": "other",
      "title": "Cừ cái coi 🤗",
      "description": "Võ Tuấn Nguyên đã thêm 3 ảnh mới. Cừ cái coi 🤗",
      "location": "",
      "witnesses": "",
      "documents": "",
      "images": [
        {
          "id": 1609949494000,
          "name": "3544041112299462.jpg",
          "path": "/Users/tuannguyen8888/Downloads/facebook-tuannguyen8888-30_11_2025-BPwDyk9R/your_facebook_activity/posts/media/Tailentudidong_471272692909668/3544041112299462.jpg",
          "type": "image/jpeg"
        },
        {
          "id": 1609949494001,
          "name": "3544041218966118.jpg",
          "path": "/Users/tuannguyen8888/Downloads/facebook-tuannguyen8888-30_11_2025-BPwDyk9R/your_facebook_activity/posts/media/Tailentudidong_471272692909668/3544041218966118.jpg",
          "type": "image/jpeg"
        },
        {
          "id": 1609949494002,
          "name": "3544041135632793.jpg",
          "path": "/Users/tuannguyen8888/Downloads/facebook-tuannguyen8888-30_11_2025-BPwDyk9R/your_facebook_activity/posts/media/Tailentudidong_471272692909668/3544041135632793.jpg",
          "type": "image/jpeg"
        }
      ]
    },
    {
      "id": 1610692018000,
      "date": "15/01/2021",
      "dateParsed": {
        "original": "15/01/2021",
        "date": "2021-01-15T01:26:58",
        "year": 2021,
        "month": 1,
        "day": 15,
        "format": "DD/MM/YYYY"
      },
      "type": "other",
      "title": "Mẹ chọc Sam nè 😅 Mẹ chọc Sam nè 😅",
      "description": "Võ Tuấn Nguyên đã thêm một ảnh mới. Mẹ chọc Sam nè 😅 Mẹ chọc Sam nè 😅",
      "location": "",
      "witnesses": "",
      "documents": "",
      "images": [
        {
          "id": 1610692018000,
          "name": "3565995016770738.jpg",
          "path": "/Users/tuannguyen8888/Downloads/facebook-tuannguyen8888-30_11_2025-BPwDyk9R/your_facebook_activity/posts/media/Tailentudidong_471272692909668/3565995016770738.jpg",
          "type": "image/jpeg"
        }
      ]
    },
    {
      "id": 1613313945000,
      "date": "14/02/2021",
      "dateParsed": {
        "original": "14/02/2021",
        "date": "2021-02-14T09:45:45",
        "year": 2021,
        "month": 2,
        "day": 14,
        "format": "DD/MM/YYYY"
      },
      "type": "other",
      "title": "Tết của đại gia đình, xa nhưng ấm áp \n❤️❤️❤️",
      "description": "Võ Tuấn Nguyên đã thêm 3 ảnh mới. Tết của đại gia đình, xa nhưng ấm áp \n❤️❤️❤️",
      "location": "",
      "witnesses": "",
      "documents": "",
      "images": [
        {
          "id": 1613313945000,
          "name": "3644130488957190.jpg",
          "path": "/Users/tuannguyen8888/Downloads/facebook-tuannguyen8888-30_11_2025-BPwDyk9R/your_facebook_activity/posts/media/Tailentudidong_471272692909668/3644130488957190.jpg",
          "type": "image/jpeg"
        },
        {
          "id": 1613313945001,
          "name": "3644130618957177.jpg",
          "path": "/Users/tuannguyen8888/Downloads/facebook-tuannguyen8888-30_11_2025-BPwDyk9R/your_facebook_activity/posts/media/Tailentudidong_471272692909668/3644130618957177.jpg",
          "type": "image/jpeg"
        },
        {
          "id": 1613313945002,
          "name": "3644130545623851.jpg",
          "path": "/Users/tuannguyen8888/Downloads/facebook-tuannguyen8888-30_11_2025-BPwDyk9R/your_facebook_activity/posts/media/Tailentudidong_471272692909668/3644130545623851.jpg",
          "type": "image/jpeg"
        }
      ]
    },
    {
      "id": 1615033780000,
      "date": "06/03/2021",
      "dateParsed": {
        "original": "06/03/2021",
        "date": "2021-03-06T07:29:40",
        "year": 2021,
        "month": 3,
        "day": 6,
        "format": "DD/MM/YYYY"
      },
      "type": "other",
      "title": "Ba hớt tóc xong Sam đẹp trai quá 😂😂😂 Ba hớt tóc xong Sam đẹp trai quá 😂😂😂",
      "description": "Võ Tuấn Nguyên đã thêm một ảnh mới. Ba hớt tóc xong Sam đẹp trai quá 😂😂😂 Ba hớt tóc xong Sam đẹp trai quá 😂😂😂",
      "location": "",
      "witnesses": "",
      "documents": "",
      "images": [
        {
          "id": 1615033780000,
          "name": "3700790343291204.jpg",
          "path": "/Users/tuannguyen8888/Downloads/facebook-tuannguyen8888-30_11_2025-BPwDyk9R/your_facebook_activity/posts/media/Tailentudidong_471272692909668/3700790343291204.jpg",
          "type": "image/jpeg"
        }
      ]
    },
    {
      "id": 1618119663000,
      "date": "11/04/2021",
      "dateParsed": {
        "original": "11/04/2021",
        "date": "2021-04-11T01:41:03",
        "year": 2021,
        "month": 4,
        "day": 11,
        "format": "DD/MM/YYYY"
      },
      "type": "other",
      "title": "Con gái ba 5 tháng 14 ngày 😘😘😘 Con gái ba 5 tháng 14 ngày 😘😘😘",
      "description": "Võ Tuấn Nguyên đã thêm một video mới. Con gái ba 5 tháng 14 ngày 😘😘😘 Con gái ba 5 tháng 14 ngày 😘😘😘",
      "location": "",
      "witnesses": "",
      "documents": "",
      "images": [
        {
          "id": 1618119663000,
          "name": "3802499919786912.mp4",
          "path": "/Users/tuannguyen8888/Downloads/facebook-tuannguyen8888-30_11_2025-BPwDyk9R/your_facebook_activity/posts/media/videos/3802499919786912.mp4",
          "type": "image/jpeg"
        }
      ]
    },
    {
      "id": 1618562319000,
      "date": "16/04/2021",
      "dateParsed": {
        "original": "16/04/2021",
        "date": "2021-04-16T04:38:39",
        "year": 2021,
        "month": 4,
        "day": 16,
        "format": "DD/MM/YYYY"
      },
      "type": "anniversary",
      "title": "Ưng đi nữa ko @[100006489412839:2048:Nương Nương] 😁",
      "description": "Võ Tuấn Nguyên đã chia sẻ một kỷ niệm. Ưng đi nữa ko @[100006489412839:2048:Nương Nương] 😁",
      "location": "",
      "witnesses": "",
      "documents": "",
      "images": []
    },
    {
      "id": 1618987940000,
      "date": "21/04/2021",
      "dateParsed": {
        "original": "21/04/2021",
        "date": "2021-04-21T02:52:20",
        "year": 2021,
        "month": 4,
        "day": 21,
        "format": "DD/MM/YYYY"
      },
      "type": "other",
      "title": "Cô 3 giỡn cười thôi rồi luôn 😁 Cô 3 giỡn cười thôi rồi luôn 😁",
      "description": "Võ Tuấn Nguyên đã thêm một video mới. Cô 3 giỡn cười thôi rồi luôn 😁 Cô 3 giỡn cười thôi rồi luôn 😁",
      "location": "",
      "witnesses": "",
      "documents": "",
      "images": [
        {
          "id": 1618987940000,
          "name": "3830388733664697.mp4",
          "path": "/Users/tuannguyen8888/Downloads/facebook-tuannguyen8888-30_11_2025-BPwDyk9R/your_facebook_activity/posts/media/videos/3830388733664697.mp4",
          "type": "image/jpeg"
        }
      ]
    },
    {
      "id": 1623206339000,
      "date": "08/06/2021",
      "dateParsed": {
        "original": "08/06/2021",
        "date": "2021-06-08T22:38:59",
        "year": 2021,
        "month": 6,
        "day": 8,
        "format": "DD/MM/YYYY"
      },
      "type": "other",
      "title": "Thanks bà vợ Nương Nương Thanks bà vợ @[100006489412839:2048:Nương Nương]",
      "description": "Võ Tuấn Nguyên đã thêm một ảnh mới. Thanks bà vợ Nương Nương Thanks bà vợ @[100006489412839:2048:Nương Nương]",
      "location": "",
      "witnesses": "",
      "documents": "",
      "images": [
        {
          "id": 1623206339000,
          "name": "3971671692869733.jpg",
          "path": "/Users/tuannguyen8888/Downloads/facebook-tuannguyen8888-30_11_2025-BPwDyk9R/your_facebook_activity/posts/media/Tailentudidong_471272692909668/3971671692869733.jpg",
          "type": "image/jpeg"
        }
      ]
    },
    {
      "id": 1627037684000,
      "date": "23/07/2021",
      "dateParsed": {
        "original": "23/07/2021",
        "date": "2021-07-23T06:54:44",
        "year": 2021,
        "month": 7,
        "day": 23,
        "format": "DD/MM/YYYY"
      },
      "type": "other",
      "title": "Nương Nương đổi nghề rồi nha quý dị 😂\nHớt tóc ,ráy tai 😂",
      "description": "Võ Tuấn Nguyên đã thêm 2 ảnh mới. Nương Nương đổi nghề rồi nha quý dị 😂\nHớt tóc ,ráy tai 😂",
      "location": "",
      "witnesses": "",
      "documents": "",
      "images": [
        {
          "id": 1627037684000,
          "name": "4093224127381155.jpg",
          "path": "/Users/tuannguyen8888/Downloads/facebook-tuannguyen8888-30_11_2025-BPwDyk9R/your_facebook_activity/posts/media/Tailentudidong_471272692909668/4093224127381155.jpg",
          "type": "image/jpeg"
        },
        {
          "id": 1627037684001,
          "name": "4093224147381153.jpg",
          "path": "/Users/tuannguyen8888/Downloads/facebook-tuannguyen8888-30_11_2025-BPwDyk9R/your_facebook_activity/posts/media/Tailentudidong_471272692909668/4093224147381153.jpg",
          "type": "image/jpeg"
        }
      ]
    },
    {
      "id": 1627279516000,
      "date": "26/07/2021",
      "dateParsed": {
        "original": "26/07/2021",
        "date": "2021-07-26T02:05:16",
        "year": 2021,
        "month": 7,
        "day": 26,
        "format": "DD/MM/YYYY"
      },
      "type": "other",
      "title": "Hương vị quê hương trong mùa dịch giữa lòng Sài Gòn 🤗",
      "description": "Võ Tuấn Nguyên đã thêm 5 ảnh mới. Hương vị quê hương trong mùa dịch giữa lòng Sài Gòn 🤗",
      "location": "",
      "witnesses": "",
      "documents": "",
      "images": [
        {
          "id": 1627279516000,
          "name": "4101488033221431.jpg",
          "path": "/Users/tuannguyen8888/Downloads/facebook-tuannguyen8888-30_11_2025-BPwDyk9R/your_facebook_activity/posts/media/Tailentudidong_471272692909668/4101488033221431.jpg",
          "type": "image/jpeg"
        },
        {
          "id": 1627279516001,
          "name": "4101487513221483.jpg",
          "path": "/Users/tuannguyen8888/Downloads/facebook-tuannguyen8888-30_11_2025-BPwDyk9R/your_facebook_activity/posts/media/Tailentudidong_471272692909668/4101487513221483.jpg",
          "type": "image/jpeg"
        },
        {
          "id": 1627279516002,
          "name": "4101487689888132.jpg",
          "path": "/Users/tuannguyen8888/Downloads/facebook-tuannguyen8888-30_11_2025-BPwDyk9R/your_facebook_activity/posts/media/Tailentudidong_471272692909668/4101487689888132.jpg",
          "type": "image/jpeg"
        },
        {
          "id": 1627279516003,
          "name": "4101487383221496.jpg",
          "path": "/Users/tuannguyen8888/Downloads/facebook-tuannguyen8888-30_11_2025-BPwDyk9R/your_facebook_activity/posts/media/Tailentudidong_471272692909668/4101487383221496.jpg",
          "type": "image/jpeg"
        },
        {
          "id": 1627279516004,
          "name": "4101487559888145.jpg",
          "path": "/Users/tuannguyen8888/Downloads/facebook-tuannguyen8888-30_11_2025-BPwDyk9R/your_facebook_activity/posts/media/Tailentudidong_471272692909668/4101487559888145.jpg",
          "type": "image/jpeg"
        }
      ]
    },
    {
      "id": 1627475479000,
      "date": "28/07/2021",
      "dateParsed": {
        "original": "28/07/2021",
        "date": "2021-07-28T08:31:19",
        "year": 2021,
        "month": 7,
        "day": 28,
        "format": "DD/MM/YYYY"
      },
      "type": "anniversary",
      "title": "Làm chuyến nữa hông 😊😊😊",
      "description": "Võ Tuấn Nguyên đã chia sẻ một kỷ niệm. Làm chuyến nữa hông 😊😊😊",
      "location": "",
      "witnesses": "",
      "documents": "",
      "images": []
    },
    {
      "id": 1628401140000,
      "date": "08/08/2021",
      "dateParsed": {
        "original": "08/08/2021",
        "date": "2021-08-08T01:39:00",
        "year": 2021,
        "month": 8,
        "day": 8,
        "format": "DD/MM/YYYY"
      },
      "type": "birth",
      "title": "Happy birthday to me 🥰",
      "description": "Võ Tuấn Nguyên đã thêm 6 ảnh mới. Happy birthday to me 🥰",
      "location": "",
      "witnesses": "",
      "documents": "",
      "images": [
        {
          "id": 1628401140000,
          "name": "4138670372836530.jpg",
          "path": "/Users/tuannguyen8888/Downloads/facebook-tuannguyen8888-30_11_2025-BPwDyk9R/your_facebook_activity/posts/media/Tailentudidong_471272692909668/4138670372836530.jpg",
          "type": "image/jpeg"
        },
        {
          "id": 1628401140001,
          "name": "4138670606169840.jpg",
          "path": "/Users/tuannguyen8888/Downloads/facebook-tuannguyen8888-30_11_2025-BPwDyk9R/your_facebook_activity/posts/media/Tailentudidong_471272692909668/4138670606169840.jpg",
          "type": "image/jpeg"
        },
        {
          "id": 1628401140002,
          "name": "4138670442836523.jpg",
          "path": "/Users/tuannguyen8888/Downloads/facebook-tuannguyen8888-30_11_2025-BPwDyk9R/your_facebook_activity/posts/media/Tailentudidong_471272692909668/4138670442836523.jpg",
          "type": "image/jpeg"
        },
        {
          "id": 1628401140003,
          "name": "4138670232836544.jpg",
          "path": "/Users/tuannguyen8888/Downloads/facebook-tuannguyen8888-30_11_2025-BPwDyk9R/your_facebook_activity/posts/media/Tailentudidong_471272692909668/4138670232836544.jpg",
          "type": "image/jpeg"
        },
        {
          "id": 1628401140004,
          "name": "4138670532836514.jpg",
          "path": "/Users/tuannguyen8888/Downloads/facebook-tuannguyen8888-30_11_2025-BPwDyk9R/your_facebook_activity/posts/media/Tailentudidong_471272692909668/4138670532836514.jpg",
          "type": "image/jpeg"
        },
        {
          "id": 1628401140005,
          "name": "4138670189503215.jpg",
          "path": "/Users/tuannguyen8888/Downloads/facebook-tuannguyen8888-30_11_2025-BPwDyk9R/your_facebook_activity/posts/media/Tailentudidong_471272692909668/4138670189503215.jpg",
          "type": "image/jpeg"
        }
      ]
    },
    {
      "id": 1628508503000,
      "date": "09/08/2021",
      "dateParsed": {
        "original": "09/08/2021",
        "date": "2021-08-09T07:28:23",
        "year": 2021,
        "month": 8,
        "day": 9,
        "format": "DD/MM/YYYY"
      },
      "type": "other",
      "title": "Dzầy có được gọi là sống chậm ko? 😂😂😂",
      "description": "Võ Tuấn Nguyên đã thêm 5 ảnh mới. Dzầy có được gọi là sống chậm ko? 😂😂😂",
      "location": "",
      "witnesses": "",
      "documents": "",
      "images": [
        {
          "id": 1628508503000,
          "name": "4142411079129126.jpg",
          "path": "/Users/tuannguyen8888/Downloads/facebook-tuannguyen8888-30_11_2025-BPwDyk9R/your_facebook_activity/posts/media/Tailentudidong_471272692909668/4142411079129126.jpg",
          "type": "image/jpeg"
        },
        {
          "id": 1628508503001,
          "name": "4142411295795771.jpg",
          "path": "/Users/tuannguyen8888/Downloads/facebook-tuannguyen8888-30_11_2025-BPwDyk9R/your_facebook_activity/posts/media/Tailentudidong_471272692909668/4142411295795771.jpg",
          "type": "image/jpeg"
        },
        {
          "id": 1628508503002,
          "name": "4142411509129083.jpg",
          "path": "/Users/tuannguyen8888/Downloads/facebook-tuannguyen8888-30_11_2025-BPwDyk9R/your_facebook_activity/posts/media/Tailentudidong_471272692909668/4142411509129083.jpg",
          "type": "image/jpeg"
        },
        {
          "id": 1628508503003,
          "name": "4142411342462433.jpg",
          "path": "/Users/tuannguyen8888/Downloads/facebook-tuannguyen8888-30_11_2025-BPwDyk9R/your_facebook_activity/posts/media/Tailentudidong_471272692909668/4142411342462433.jpg",
          "type": "image/jpeg"
        },
        {
          "id": 1628508503004,
          "name": "4142411139129120.jpg",
          "path": "/Users/tuannguyen8888/Downloads/facebook-tuannguyen8888-30_11_2025-BPwDyk9R/your_facebook_activity/posts/media/Tailentudidong_471272692909668/4142411139129120.jpg",
          "type": "image/jpeg"
        }
      ]
    },
    {
      "id": 1629207085000,
      "date": "17/08/2021",
      "dateParsed": {
        "original": "17/08/2021",
        "date": "2021-08-17T09:31:25",
        "year": 2021,
        "month": 8,
        "day": 17,
        "format": "DD/MM/YYYY"
      },
      "type": "birth",
      "title": "Chúc mừng sinh nhật vợ yêu, gia đình mình mãi hạnh phúc như thế này nhé ❤️❤️❤️\nChúc em luôn xinh ...",
      "description": "Võ Tuấn Nguyên đã thêm 3 ảnh mới. Chúc mừng sinh nhật vợ yêu, gia đình mình mãi hạnh phúc như thế này nhé ❤️❤️❤️\nChúc em luôn xinh đẹp, yêu con và yêu anh 😘😘😘",
      "location": "",
      "witnesses": "",
      "documents": "",
      "images": [
        {
          "id": 1629207085000,
          "name": "4166424173394483.jpg",
          "path": "/Users/tuannguyen8888/Downloads/facebook-tuannguyen8888-30_11_2025-BPwDyk9R/your_facebook_activity/posts/media/Tailentudidong_471272692909668/4166424173394483.jpg",
          "type": "image/jpeg"
        },
        {
          "id": 1629207085001,
          "name": "4166424353394465.jpg",
          "path": "/Users/tuannguyen8888/Downloads/facebook-tuannguyen8888-30_11_2025-BPwDyk9R/your_facebook_activity/posts/media/Tailentudidong_471272692909668/4166424353394465.jpg",
          "type": "image/jpeg"
        },
        {
          "id": 1629207085002,
          "name": "4166424213394479.jpg",
          "path": "/Users/tuannguyen8888/Downloads/facebook-tuannguyen8888-30_11_2025-BPwDyk9R/your_facebook_activity/posts/media/Tailentudidong_471272692909668/4166424213394479.jpg",
          "type": "image/jpeg"
        }
      ]
    },
    {
      "id": 1629891447000,
      "date": "25/08/2021",
      "dateParsed": {
        "original": "25/08/2021",
        "date": "2021-08-25T07:37:27",
        "year": 2021,
        "month": 8,
        "day": 25,
        "format": "DD/MM/YYYY"
      },
      "type": "other",
      "title": "Mới test xong, vẫn an toàn 😊😊😊 Mới test xong, vẫn an toàn 😊😊😊",
      "description": "Võ Tuấn Nguyên đã thêm một ảnh mới. Mới test xong, vẫn an toàn 😊😊😊 Mới test xong, vẫn an toàn 😊😊😊",
      "location": "",
      "witnesses": "",
      "documents": "",
      "images": [
        {
          "id": 1629891447000,
          "name": "4189988557704711.jpg",
          "path": "/Users/tuannguyen8888/Downloads/facebook-tuannguyen8888-30_11_2025-BPwDyk9R/your_facebook_activity/posts/media/Tailentudidong_471272692909668/4189988557704711.jpg",
          "type": "image/jpeg"
        }
      ]
    },
    {
      "id": 1630562252000,
      "date": "02/09/2021",
      "dateParsed": {
        "original": "02/09/2021",
        "date": "2021-09-02T01:57:32",
        "year": 2021,
        "month": 9,
        "day": 2,
        "format": "DD/MM/YYYY"
      },
      "type": "other",
      "title": "Lễ 2/9 ăn bò kho 😋",
      "description": "Võ Tuấn Nguyên đã thêm 3 ảnh mới. Lễ 2/9 ăn bò kho 😋",
      "location": "",
      "witnesses": "",
      "documents": "",
      "images": [
        {
          "id": 1630562252000,
          "name": "4213414612028772.jpg",
          "path": "/Users/tuannguyen8888/Downloads/facebook-tuannguyen8888-30_11_2025-BPwDyk9R/your_facebook_activity/posts/media/Tailentudidong_471272692909668/4213414612028772.jpg",
          "type": "image/jpeg"
        },
        {
          "id": 1630562252001,
          "name": "4213414785362088.jpg",
          "path": "/Users/tuannguyen8888/Downloads/facebook-tuannguyen8888-30_11_2025-BPwDyk9R/your_facebook_activity/posts/media/Tailentudidong_471272692909668/4213414785362088.jpg",
          "type": "image/jpeg"
        },
        {
          "id": 1630562252002,
          "name": "4213423545361212.jpg",
          "path": "/Users/tuannguyen8888/Downloads/facebook-tuannguyen8888-30_11_2025-BPwDyk9R/your_facebook_activity/posts/media/Tailentudidong_471272692909668/4213423545361212.jpg",
          "type": "image/jpeg"
        }
      ]
    },
    {
      "id": 1634992782000,
      "date": "23/10/2021",
      "dateParsed": {
        "original": "23/10/2021",
        "date": "2021-10-23T08:39:42",
        "year": 2021,
        "month": 10,
        "day": 23,
        "format": "DD/MM/YYYY"
      },
      "type": "other",
      "title": "Mưa to như thế này thì ăn bánh xèo là hết xảy con bà bảy 😋😋😋",
      "description": "Võ Tuấn Nguyên đã thêm 3 ảnh và một video. Mưa to như thế này thì ăn bánh xèo là hết xảy con bà bảy 😋😋😋",
      "location": "",
      "witnesses": "",
      "documents": "",
      "images": [
        {
          "id": 1634992782000,
          "name": "4372658542771044.jpg",
          "path": "/Users/tuannguyen8888/Downloads/facebook-tuannguyen8888-30_11_2025-BPwDyk9R/your_facebook_activity/posts/media/Tailentudidong_471272692909668/4372658542771044.jpg",
          "type": "image/jpeg"
        },
        {
          "id": 1634992782001,
          "name": "4372658629437702.jpg",
          "path": "/Users/tuannguyen8888/Downloads/facebook-tuannguyen8888-30_11_2025-BPwDyk9R/your_facebook_activity/posts/media/Tailentudidong_471272692909668/4372658629437702.jpg",
          "type": "image/jpeg"
        },
        {
          "id": 1634992782002,
          "name": "4372659646104267.jpg",
          "path": "/Users/tuannguyen8888/Downloads/facebook-tuannguyen8888-30_11_2025-BPwDyk9R/your_facebook_activity/posts/media/Tailentudidong_471272692909668/4372659646104267.jpg",
          "type": "image/jpeg"
        },
        {
          "id": 1634992782003,
          "name": "603703537740810.mp4",
          "path": "/Users/tuannguyen8888/Downloads/facebook-tuannguyen8888-30_11_2025-BPwDyk9R/your_facebook_activity/posts/media/videos/603703537740810.mp4",
          "type": "image/jpeg"
        }
      ]
    },
    {
      "id": 1637508043000,
      "date": "21/11/2021",
      "dateParsed": {
        "original": "21/11/2021",
        "date": "2021-11-21T10:20:43",
        "year": 2021,
        "month": 11,
        "day": 21,
        "format": "DD/MM/YYYY"
      },
      "type": "other",
      "title": "Lâu lắm mới được ….😋😋😋",
      "description": "Võ Tuấn Nguyên đã thêm 7 ảnh và một video. Lâu lắm mới được ….😋😋😋",
      "location": "",
      "witnesses": "",
      "documents": "",
      "images": [
        {
          "id": 1637508043000,
          "name": "4464061326964098.jpg",
          "path": "/Users/tuannguyen8888/Downloads/facebook-tuannguyen8888-30_11_2025-BPwDyk9R/your_facebook_activity/posts/media/Tailentudidong_471272692909668/4464061326964098.jpg",
          "type": "image/jpeg"
        },
        {
          "id": 1637508043001,
          "name": "4464061020297462.jpg",
          "path": "/Users/tuannguyen8888/Downloads/facebook-tuannguyen8888-30_11_2025-BPwDyk9R/your_facebook_activity/posts/media/Tailentudidong_471272692909668/4464061020297462.jpg",
          "type": "image/jpeg"
        },
        {
          "id": 1637508043002,
          "name": "4464061973630700.jpg",
          "path": "/Users/tuannguyen8888/Downloads/facebook-tuannguyen8888-30_11_2025-BPwDyk9R/your_facebook_activity/posts/media/Tailentudidong_471272692909668/4464061973630700.jpg",
          "type": "image/jpeg"
        },
        {
          "id": 1637508043003,
          "name": "4464061573630740.jpg",
          "path": "/Users/tuannguyen8888/Downloads/facebook-tuannguyen8888-30_11_2025-BPwDyk9R/your_facebook_activity/posts/media/Tailentudidong_471272692909668/4464061573630740.jpg",
          "type": "image/jpeg"
        },
        {
          "id": 1637508043004,
          "name": "4464061156964115.jpg",
          "path": "/Users/tuannguyen8888/Downloads/facebook-tuannguyen8888-30_11_2025-BPwDyk9R/your_facebook_activity/posts/media/Tailentudidong_471272692909668/4464061156964115.jpg",
          "type": "image/jpeg"
        },
        {
          "id": 1637508043005,
          "name": "4464061453630752.jpg",
          "path": "/Users/tuannguyen8888/Downloads/facebook-tuannguyen8888-30_11_2025-BPwDyk9R/your_facebook_activity/posts/media/Tailentudidong_471272692909668/4464061453630752.jpg",
          "type": "image/jpeg"
        },
        {
          "id": 1637508043006,
          "name": "4464060886964142.jpg",
          "path": "/Users/tuannguyen8888/Downloads/facebook-tuannguyen8888-30_11_2025-BPwDyk9R/your_facebook_activity/posts/media/Tailentudidong_471272692909668/4464060886964142.jpg",
          "type": "image/jpeg"
        },
        {
          "id": 1637508043007,
          "name": "331677501622022.mp4",
          "path": "/Users/tuannguyen8888/Downloads/facebook-tuannguyen8888-30_11_2025-BPwDyk9R/your_facebook_activity/posts/media/videos/331677501622022.mp4",
          "type": "image/jpeg"
        }
      ]
    },
    {
      "id": 1637946653000,
      "date": "26/11/2021",
      "dateParsed": {
        "original": "26/11/2021",
        "date": "2021-11-26T12:10:53",
        "year": 2021,
        "month": 11,
        "day": 26,
        "format": "DD/MM/YYYY"
      },
      "type": "other",
      "title": "Nhá hàng xíu, Yeon sẽ khai trương vào 28/11/2021. Hẹn mọi người ở 314 Âu Cơ, P10, Tân Bình",
      "description": "Võ Tuấn Nguyên đã thêm 3 ảnh mới. Nhá hàng xíu, Yeon sẽ khai trương vào 28/11/2021. Hẹn mọi người ở 314 Âu Cơ, P10, Tân Bình",
      "location": "",
      "witnesses": "",
      "documents": "",
      "images": [
        {
          "id": 1637946653000,
          "name": "4480501881986709.jpg",
          "path": "/Users/tuannguyen8888/Downloads/facebook-tuannguyen8888-30_11_2025-BPwDyk9R/your_facebook_activity/posts/media/Tailentudidong_471272692909668/4480501881986709.jpg",
          "type": "image/jpeg"
        },
        {
          "id": 1637946653001,
          "name": "4480501898653374.jpg",
          "path": "/Users/tuannguyen8888/Downloads/facebook-tuannguyen8888-30_11_2025-BPwDyk9R/your_facebook_activity/posts/media/Tailentudidong_471272692909668/4480501898653374.jpg",
          "type": "image/jpeg"
        },
        {
          "id": 1637946653002,
          "name": "4480502321986665.jpg",
          "path": "/Users/tuannguyen8888/Downloads/facebook-tuannguyen8888-30_11_2025-BPwDyk9R/your_facebook_activity/posts/media/Tailentudidong_471272692909668/4480502321986665.jpg",
          "type": "image/jpeg"
        }
      ]
    },
    {
      "id": 1645020676000,
      "date": "16/02/2022",
      "dateParsed": {
        "original": "16/02/2022",
        "date": "2022-02-16T09:11:16",
        "year": 2022,
        "month": 2,
        "day": 16,
        "format": "DD/MM/YYYY"
      },
      "type": "other",
      "title": "Mẹ Đầu tư cho cô công chúa cái máy chiếu coi baby shark 😘😘😘",
      "description": "Võ Tuấn Nguyên đã thêm một ảnh và 2 video. Mẹ Đầu tư cho cô công chúa cái máy chiếu coi baby shark 😘😘😘",
      "location": "",
      "witnesses": "",
      "documents": "",
      "images": [
        {
          "id": 1645020676000,
          "name": "4774530872583807.jpg",
          "path": "/Users/tuannguyen8888/Downloads/facebook-tuannguyen8888-30_11_2025-BPwDyk9R/your_facebook_activity/posts/media/Tailentudidong_471272692909668/4774530872583807.jpg",
          "type": "image/jpeg"
        },
        {
          "id": 1645020676001,
          "name": "322325226576692.mp4",
          "path": "/Users/tuannguyen8888/Downloads/facebook-tuannguyen8888-30_11_2025-BPwDyk9R/your_facebook_activity/posts/media/videos/322325226576692.mp4",
          "type": "image/jpeg"
        },
        {
          "id": 1645020676002,
          "name": "286148013617360.mp4",
          "path": "/Users/tuannguyen8888/Downloads/facebook-tuannguyen8888-30_11_2025-BPwDyk9R/your_facebook_activity/posts/media/videos/286148013617360.mp4",
          "type": "image/jpeg"
        }
      ]
    },
    {
      "id": 1646980342000,
      "date": "11/03/2022",
      "dateParsed": {
        "original": "11/03/2022",
        "date": "2022-03-11T01:32:22",
        "year": 2022,
        "month": 3,
        "day": 11,
        "format": "DD/MM/YYYY"
      },
      "type": "wedding",
      "title": "Đám cưới Hoang Cong Che & Lê Như Ý",
      "description": "Võ Tuấn Nguyên đã thêm 5 ảnh và một video. Đám cưới Hoang Cong Che & Lê Như Ý",
      "location": "",
      "witnesses": "",
      "documents": "",
      "images": [
        {
          "id": 1646980342000,
          "name": "4839093682794192.jpg",
          "path": "/Users/tuannguyen8888/Downloads/facebook-tuannguyen8888-30_11_2025-BPwDyk9R/your_facebook_activity/posts/media/Tailentudidong_471272692909668/4839093682794192.jpg",
          "type": "image/jpeg"
        },
        {
          "id": 1646980342001,
          "name": "4839093709460856.jpg",
          "path": "/Users/tuannguyen8888/Downloads/facebook-tuannguyen8888-30_11_2025-BPwDyk9R/your_facebook_activity/posts/media/Tailentudidong_471272692909668/4839093709460856.jpg",
          "type": "image/jpeg"
        },
        {
          "id": 1646980342002,
          "name": "4839094256127468.jpg",
          "path": "/Users/tuannguyen8888/Downloads/facebook-tuannguyen8888-30_11_2025-BPwDyk9R/your_facebook_activity/posts/media/Tailentudidong_471272692909668/4839094256127468.jpg",
          "type": "image/jpeg"
        },
        {
          "id": 1646980342003,
          "name": "4839094329460794.jpg",
          "path": "/Users/tuannguyen8888/Downloads/facebook-tuannguyen8888-30_11_2025-BPwDyk9R/your_facebook_activity/posts/media/Tailentudidong_471272692909668/4839094329460794.jpg",
          "type": "image/jpeg"
        },
        {
          "id": 1646980342004,
          "name": "4839094429460784.jpg",
          "path": "/Users/tuannguyen8888/Downloads/facebook-tuannguyen8888-30_11_2025-BPwDyk9R/your_facebook_activity/posts/media/Tailentudidong_471272692909668/4839094429460784.jpg",
          "type": "image/jpeg"
        },
        {
          "id": 1646980342005,
          "name": "918936402130695.mp4",
          "path": "/Users/tuannguyen8888/Downloads/facebook-tuannguyen8888-30_11_2025-BPwDyk9R/your_facebook_activity/posts/media/videos/918936402130695.mp4",
          "type": "image/jpeg"
        }
      ]
    },
    {
      "id": 1649655610000,
      "date": "11/04/2022",
      "dateParsed": {
        "original": "11/04/2022",
        "date": "2022-04-11T01:40:10",
        "year": 2022,
        "month": 4,
        "day": 11,
        "format": "DD/MM/YYYY"
      },
      "type": "other",
      "title": "Chơi hết hôm nay mai gái rượu đi học rồi ❤️",
      "description": "Võ Tuấn Nguyên đã thêm 8 ảnh mới. Chơi hết hôm nay mai gái rượu đi học rồi ❤️",
      "location": "",
      "witnesses": "",
      "documents": "",
      "images": [
        {
          "id": 1649655610000,
          "name": "4919899711380255.jpg",
          "path": "/Users/tuannguyen8888/Downloads/facebook-tuannguyen8888-30_11_2025-BPwDyk9R/your_facebook_activity/posts/media/Tailentudidong_471272692909668/4919899711380255.jpg",
          "type": "image/jpeg"
        },
        {
          "id": 1649655610001,
          "name": "4919899828046910.jpg",
          "path": "/Users/tuannguyen8888/Downloads/facebook-tuannguyen8888-30_11_2025-BPwDyk9R/your_facebook_activity/posts/media/Tailentudidong_471272692909668/4919899828046910.jpg",
          "type": "image/jpeg"
        },
        {
          "id": 1649655610002,
          "name": "4919899921380234.jpg",
          "path": "/Users/tuannguyen8888/Downloads/facebook-tuannguyen8888-30_11_2025-BPwDyk9R/your_facebook_activity/posts/media/Tailentudidong_471272692909668/4919899921380234.jpg",
          "type": "image/jpeg"
        },
        {
          "id": 1649655610003,
          "name": "4919899808046912.jpg",
          "path": "/Users/tuannguyen8888/Downloads/facebook-tuannguyen8888-30_11_2025-BPwDyk9R/your_facebook_activity/posts/media/Tailentudidong_471272692909668/4919899808046912.jpg",
          "type": "image/jpeg"
        },
        {
          "id": 1649655610004,
          "name": "4919900011380225.jpg",
          "path": "/Users/tuannguyen8888/Downloads/facebook-tuannguyen8888-30_11_2025-BPwDyk9R/your_facebook_activity/posts/media/Tailentudidong_471272692909668/4919900011380225.jpg",
          "type": "image/jpeg"
        },
        {
          "id": 1649655610005,
          "name": "4919899731380253.jpg",
          "path": "/Users/tuannguyen8888/Downloads/facebook-tuannguyen8888-30_11_2025-BPwDyk9R/your_facebook_activity/posts/media/Tailentudidong_471272692909668/4919899731380253.jpg",
          "type": "image/jpeg"
        },
        {
          "id": 1649655610006,
          "name": "4919900041380222.jpg",
          "path": "/Users/tuannguyen8888/Downloads/facebook-tuannguyen8888-30_11_2025-BPwDyk9R/your_facebook_activity/posts/media/Tailentudidong_471272692909668/4919900041380222.jpg",
          "type": "image/jpeg"
        },
        {
          "id": 1649655610007,
          "name": "4919899904713569.jpg",
          "path": "/Users/tuannguyen8888/Downloads/facebook-tuannguyen8888-30_11_2025-BPwDyk9R/your_facebook_activity/posts/media/Tailentudidong_471272692909668/4919899904713569.jpg",
          "type": "image/jpeg"
        }
      ]
    },
    {
      "id": 1651890640000,
      "date": "06/05/2022",
      "dateParsed": {
        "original": "06/05/2022",
        "date": "2022-05-06T22:30:40",
        "year": 2022,
        "month": 5,
        "day": 6,
        "format": "DD/MM/YYYY"
      },
      "type": "dating",
      "title": "Người yêu cũ Nương Nương",
      "description": "Võ Tuấn Nguyên đã thêm 2 ảnh mới. Người yêu cũ Nương Nương",
      "location": "",
      "witnesses": "",
      "documents": "",
      "images": [
        {
          "id": 1651890640000,
          "name": "4987679851268907.jpg",
          "path": "/Users/tuannguyen8888/Downloads/facebook-tuannguyen8888-30_11_2025-BPwDyk9R/your_facebook_activity/posts/media/Tailentudidong_471272692909668/4987679851268907.jpg",
          "type": "image/jpeg"
        },
        {
          "id": 1651890640001,
          "name": "4987679871268905.jpg",
          "path": "/Users/tuannguyen8888/Downloads/facebook-tuannguyen8888-30_11_2025-BPwDyk9R/your_facebook_activity/posts/media/Tailentudidong_471272692909668/4987679871268905.jpg",
          "type": "image/jpeg"
        }
      ]
    },
    {
      "id": 1651925687000,
      "date": "07/05/2022",
      "dateParsed": {
        "original": "07/05/2022",
        "date": "2022-05-07T08:14:47",
        "year": 2022,
        "month": 5,
        "day": 7,
        "format": "DD/MM/YYYY"
      },
      "type": "dating",
      "title": "Sáng úp ảnh người yêu cũ \nTối úp ảnh vợ có được không ?😘",
      "description": "Võ Tuấn Nguyên đã thêm 3 ảnh mới. Sáng úp ảnh người yêu cũ \nTối úp ảnh vợ có được không ?😘",
      "location": "",
      "witnesses": "",
      "documents": "",
      "images": [
        {
          "id": 1651925687000,
          "name": "4988756254494600.jpg",
          "path": "/Users/tuannguyen8888/Downloads/facebook-tuannguyen8888-30_11_2025-BPwDyk9R/your_facebook_activity/posts/media/Tailentudidong_471272692909668/4988756254494600.jpg",
          "type": "image/jpeg"
        },
        {
          "id": 1651925687001,
          "name": "4988756417827917.jpg",
          "path": "/Users/tuannguyen8888/Downloads/facebook-tuannguyen8888-30_11_2025-BPwDyk9R/your_facebook_activity/posts/media/Tailentudidong_471272692909668/4988756417827917.jpg",
          "type": "image/jpeg"
        },
        {
          "id": 1651925687002,
          "name": "4988756491161243.jpg",
          "path": "/Users/tuannguyen8888/Downloads/facebook-tuannguyen8888-30_11_2025-BPwDyk9R/your_facebook_activity/posts/media/Tailentudidong_471272692909668/4988756491161243.jpg",
          "type": "image/jpeg"
        }
      ]
    },
    {
      "id": 1652708717000,
      "date": "16/05/2022",
      "dateParsed": {
        "original": "16/05/2022",
        "date": "2022-05-16T09:45:17",
        "year": 2022,
        "month": 5,
        "day": 16,
        "format": "DD/MM/YYYY"
      },
      "type": "other",
      "title": "em nói chán quá anh\nthì ra là em muốn đi ăn 🤣",
      "description": "Võ Tuấn Nguyên đã thêm 11 ảnh mới. em nói chán quá anh\nthì ra là em muốn đi ăn 🤣",
      "location": "",
      "witnesses": "",
      "documents": "",
      "images": [
        {
          "id": 1652708717000,
          "name": "5014395248597367.jpg",
          "path": "/Users/tuannguyen8888/Downloads/facebook-tuannguyen8888-30_11_2025-BPwDyk9R/your_facebook_activity/posts/media/Tailentudidong_471272692909668/5014395248597367.jpg",
          "type": "image/jpeg"
        },
        {
          "id": 1652708717001,
          "name": "5014395115264047.jpg",
          "path": "/Users/tuannguyen8888/Downloads/facebook-tuannguyen8888-30_11_2025-BPwDyk9R/your_facebook_activity/posts/media/Tailentudidong_471272692909668/5014395115264047.jpg",
          "type": "image/jpeg"
        },
        {
          "id": 1652708717002,
          "name": "5014395345264024.jpg",
          "path": "/Users/tuannguyen8888/Downloads/facebook-tuannguyen8888-30_11_2025-BPwDyk9R/your_facebook_activity/posts/media/Tailentudidong_471272692909668/5014395345264024.jpg",
          "type": "image/jpeg"
        },
        {
          "id": 1652708717003,
          "name": "5014395498597342.jpg",
          "path": "/Users/tuannguyen8888/Downloads/facebook-tuannguyen8888-30_11_2025-BPwDyk9R/your_facebook_activity/posts/media/Tailentudidong_471272692909668/5014395498597342.jpg",
          "type": "image/jpeg"
        },
        {
          "id": 1652708717004,
          "name": "5014395595263999.jpg",
          "path": "/Users/tuannguyen8888/Downloads/facebook-tuannguyen8888-30_11_2025-BPwDyk9R/your_facebook_activity/posts/media/Tailentudidong_471272692909668/5014395595263999.jpg",
          "type": "image/jpeg"
        },
        {
          "id": 1652708717005,
          "name": "5014395625263996.jpg",
          "path": "/Users/tuannguyen8888/Downloads/facebook-tuannguyen8888-30_11_2025-BPwDyk9R/your_facebook_activity/posts/media/Tailentudidong_471272692909668/5014395625263996.jpg",
          "type": "image/jpeg"
        },
        {
          "id": 1652708717006,
          "name": "5014394971930728.jpg",
          "path": "/Users/tuannguyen8888/Downloads/facebook-tuannguyen8888-30_11_2025-BPwDyk9R/your_facebook_activity/posts/media/Tailentudidong_471272692909668/5014394971930728.jpg",
          "type": "image/jpeg"
        },
        {
          "id": 1652708717007,
          "name": "5014395371930688.jpg",
          "path": "/Users/tuannguyen8888/Downloads/facebook-tuannguyen8888-30_11_2025-BPwDyk9R/your_facebook_activity/posts/media/Tailentudidong_471272692909668/5014395371930688.jpg",
          "type": "image/jpeg"
        },
        {
          "id": 1652708717008,
          "name": "5014395098597382.jpg",
          "path": "/Users/tuannguyen8888/Downloads/facebook-tuannguyen8888-30_11_2025-BPwDyk9R/your_facebook_activity/posts/media/Tailentudidong_471272692909668/5014395098597382.jpg",
          "type": "image/jpeg"
        },
        {
          "id": 1652708717009,
          "name": "5014395241930701.jpg",
          "path": "/Users/tuannguyen8888/Downloads/facebook-tuannguyen8888-30_11_2025-BPwDyk9R/your_facebook_activity/posts/media/Tailentudidong_471272692909668/5014395241930701.jpg",
          "type": "image/jpeg"
        }
      ]
    },
    {
      "id": 1658479375000,
      "date": "22/07/2022",
      "dateParsed": {
        "original": "22/07/2022",
        "date": "2022-07-22T04:42:55",
        "year": 2022,
        "month": 7,
        "day": 22,
        "format": "DD/MM/YYYY"
      },
      "type": "first-meet",
      "title": "Lần đầu tiên diễn văn nghệ của Sam & Kiwi ❤️\nLễ bế giảng năm học 2021-2022 Lần đầu tiên diễn văn ...",
      "description": "Võ Tuấn Nguyên đã thêm một video mới. Lần đầu tiên diễn văn nghệ của Sam & Kiwi ❤️\nLễ bế giảng năm học 2021-2022 Lần đầu tiên diễn văn nghệ của Sam & Kiwi ❤️\nLễ bế giảng năm học 2021-2022",
      "location": "",
      "witnesses": "",
      "documents": "",
      "images": [
        {
          "id": 1658479375000,
          "name": "1500077310444443.mp4",
          "path": "/Users/tuannguyen8888/Downloads/facebook-tuannguyen8888-30_11_2025-BPwDyk9R/your_facebook_activity/posts/media/videos/1500077310444443.mp4",
          "type": "image/jpeg"
        }
      ]
    },
    {
      "id": 1659280581000,
      "date": "31/07/2022",
      "dateParsed": {
        "original": "31/07/2022",
        "date": "2022-07-31T11:16:21",
        "year": 2022,
        "month": 7,
        "day": 31,
        "format": "DD/MM/YYYY"
      },
      "type": "wedding",
      "title": "4 năm ngày cưới ❤️",
      "description": "Võ Tuấn Nguyên đã thêm 11 ảnh mới. 4 năm ngày cưới ❤️",
      "location": "",
      "witnesses": "",
      "documents": "",
      "images": [
        {
          "id": 1659280581000,
          "name": "5228088700561353.jpg",
          "path": "/Users/tuannguyen8888/Downloads/facebook-tuannguyen8888-30_11_2025-BPwDyk9R/your_facebook_activity/posts/media/Tailentudidong_471272692909668/5228088700561353.jpg",
          "type": "image/jpeg"
        },
        {
          "id": 1659280581001,
          "name": "5228089103894646.jpg",
          "path": "/Users/tuannguyen8888/Downloads/facebook-tuannguyen8888-30_11_2025-BPwDyk9R/your_facebook_activity/posts/media/Tailentudidong_471272692909668/5228089103894646.jpg",
          "type": "image/jpeg"
        },
        {
          "id": 1659280581002,
          "name": "5228089253894631.jpg",
          "path": "/Users/tuannguyen8888/Downloads/facebook-tuannguyen8888-30_11_2025-BPwDyk9R/your_facebook_activity/posts/media/Tailentudidong_471272692909668/5228089253894631.jpg",
          "type": "image/jpeg"
        },
        {
          "id": 1659280581003,
          "name": "5228088877228002.jpg",
          "path": "/Users/tuannguyen8888/Downloads/facebook-tuannguyen8888-30_11_2025-BPwDyk9R/your_facebook_activity/posts/media/Tailentudidong_471272692909668/5228088877228002.jpg",
          "type": "image/jpeg"
        },
        {
          "id": 1659280581004,
          "name": "5228089377227952.jpg",
          "path": "/Users/tuannguyen8888/Downloads/facebook-tuannguyen8888-30_11_2025-BPwDyk9R/your_facebook_activity/posts/media/Tailentudidong_471272692909668/5228089377227952.jpg",
          "type": "image/jpeg"
        },
        {
          "id": 1659280581005,
          "name": "5228089140561309.jpg",
          "path": "/Users/tuannguyen8888/Downloads/facebook-tuannguyen8888-30_11_2025-BPwDyk9R/your_facebook_activity/posts/media/Tailentudidong_471272692909668/5228089140561309.jpg",
          "type": "image/jpeg"
        },
        {
          "id": 1659280581006,
          "name": "5228089020561321.jpg",
          "path": "/Users/tuannguyen8888/Downloads/facebook-tuannguyen8888-30_11_2025-BPwDyk9R/your_facebook_activity/posts/media/Tailentudidong_471272692909668/5228089020561321.jpg",
          "type": "image/jpeg"
        },
        {
          "id": 1659280581007,
          "name": "5228089290561294.jpg",
          "path": "/Users/tuannguyen8888/Downloads/facebook-tuannguyen8888-30_11_2025-BPwDyk9R/your_facebook_activity/posts/media/Tailentudidong_471272692909668/5228089290561294.jpg",
          "type": "image/jpeg"
        },
        {
          "id": 1659280581008,
          "name": "5228088853894671.jpg",
          "path": "/Users/tuannguyen8888/Downloads/facebook-tuannguyen8888-30_11_2025-BPwDyk9R/your_facebook_activity/posts/media/Tailentudidong_471272692909668/5228088853894671.jpg",
          "type": "image/jpeg"
        },
        {
          "id": 1659280581009,
          "name": "5228088977227992.jpg",
          "path": "/Users/tuannguyen8888/Downloads/facebook-tuannguyen8888-30_11_2025-BPwDyk9R/your_facebook_activity/posts/media/Tailentudidong_471272692909668/5228088977227992.jpg",
          "type": "image/jpeg"
        }
      ]
    },
    {
      "id": 1660723885000,
      "date": "17/08/2022",
      "dateParsed": {
        "original": "17/08/2022",
        "date": "2022-08-17T04:11:25",
        "year": 2022,
        "month": 8,
        "day": 17,
        "format": "DD/MM/YYYY"
      },
      "type": "birth",
      "title": "Happy birthday vợ iu Nương Nương\nChúc những điều tuyệt vời nhất sẽ đến với em \n😘😘😘 Happy birthday...",
      "description": "Võ Tuấn Nguyên đã thêm một video mới. Happy birthday vợ iu Nương Nương\nChúc những điều tuyệt vời nhất sẽ đến với em \n😘😘😘 Happy birthday vợ iu @[100006489412839:2048:Nương Nương]\nChúc những điều tuyệt vời nhất sẽ đến với em \n😘😘😘",
      "location": "",
      "witnesses": "",
      "documents": "",
      "images": [
        {
          "id": 1660723885000,
          "name": "600396074990014.mp4",
          "path": "/Users/tuannguyen8888/Downloads/facebook-tuannguyen8888-30_11_2025-BPwDyk9R/your_facebook_activity/posts/media/videos/600396074990014.mp4",
          "type": "image/jpeg"
        }
      ]
    },
    {
      "id": 1660953824000,
      "date": "19/08/2022",
      "dateParsed": {
        "original": "19/08/2022",
        "date": "2022-08-19T20:03:44",
        "year": 2022,
        "month": 8,
        "day": 19,
        "format": "DD/MM/YYYY"
      },
      "type": "other",
      "title": "Sự kiện với vợ - 19/08/2022",
      "description": "Võ Tuấn Nguyên đã thêm 3 ảnh mới.",
      "location": "",
      "witnesses": "",
      "documents": "",
      "images": [
        {
          "id": 1660953824000,
          "name": "5281927088510847.jpg",
          "path": "/Users/tuannguyen8888/Downloads/facebook-tuannguyen8888-30_11_2025-BPwDyk9R/your_facebook_activity/posts/media/Tailentudidong_471272692909668/5281927088510847.jpg",
          "type": "image/jpeg"
        },
        {
          "id": 1660953824001,
          "name": "5281927188510837.jpg",
          "path": "/Users/tuannguyen8888/Downloads/facebook-tuannguyen8888-30_11_2025-BPwDyk9R/your_facebook_activity/posts/media/Tailentudidong_471272692909668/5281927188510837.jpg",
          "type": "image/jpeg"
        },
        {
          "id": 1660953824002,
          "name": "5281927101844179.jpg",
          "path": "/Users/tuannguyen8888/Downloads/facebook-tuannguyen8888-30_11_2025-BPwDyk9R/your_facebook_activity/posts/media/Tailentudidong_471272692909668/5281927101844179.jpg",
          "type": "image/jpeg"
        }
      ]
    },
    {
      "id": 1666921798000,
      "date": "27/10/2022",
      "dateParsed": {
        "original": "27/10/2022",
        "date": "2022-10-27T21:49:58",
        "year": 2022,
        "month": 10,
        "day": 27,
        "format": "DD/MM/YYYY"
      },
      "type": "birth",
      "title": "Chúc mừng sinh nhật 🎂 con gái cưng Sam 🥳\nCả nhà yêu con ❤️",
      "description": "Võ Tuấn Nguyên đã thêm 8 ảnh và một video. Chúc mừng sinh nhật 🎂 con gái cưng Sam 🥳\nCả nhà yêu con ❤️",
      "location": "",
      "witnesses": "",
      "documents": "",
      "images": [
        {
          "id": 1666921798000,
          "name": "5480362582000629.jpg",
          "path": "/Users/tuannguyen8888/Downloads/facebook-tuannguyen8888-30_11_2025-BPwDyk9R/your_facebook_activity/posts/media/Tailentudidong_471272692909668/5480362582000629.jpg",
          "type": "image/jpeg"
        },
        {
          "id": 1666921798001,
          "name": "5480349102001977.jpg",
          "path": "/Users/tuannguyen8888/Downloads/facebook-tuannguyen8888-30_11_2025-BPwDyk9R/your_facebook_activity/posts/media/Tailentudidong_471272692909668/5480349102001977.jpg",
          "type": "image/jpeg"
        },
        {
          "id": 1666921798002,
          "name": "5480349012001986.jpg",
          "path": "/Users/tuannguyen8888/Downloads/facebook-tuannguyen8888-30_11_2025-BPwDyk9R/your_facebook_activity/posts/media/Tailentudidong_471272692909668/5480349012001986.jpg",
          "type": "image/jpeg"
        },
        {
          "id": 1666921798003,
          "name": "5480349038668650.jpg",
          "path": "/Users/tuannguyen8888/Downloads/facebook-tuannguyen8888-30_11_2025-BPwDyk9R/your_facebook_activity/posts/media/Tailentudidong_471272692909668/5480349038668650.jpg",
          "type": "image/jpeg"
        },
        {
          "id": 1666921798004,
          "name": "5480362602000627.jpg",
          "path": "/Users/tuannguyen8888/Downloads/facebook-tuannguyen8888-30_11_2025-BPwDyk9R/your_facebook_activity/posts/media/Tailentudidong_471272692909668/5480362602000627.jpg",
          "type": "image/jpeg"
        },
        {
          "id": 1666921798005,
          "name": "5480349268668627.jpg",
          "path": "/Users/tuannguyen8888/Downloads/facebook-tuannguyen8888-30_11_2025-BPwDyk9R/your_facebook_activity/posts/media/Tailentudidong_471272692909668/5480349268668627.jpg",
          "type": "image/jpeg"
        },
        {
          "id": 1666921798006,
          "name": "5480362795333941.jpg",
          "path": "/Users/tuannguyen8888/Downloads/facebook-tuannguyen8888-30_11_2025-BPwDyk9R/your_facebook_activity/posts/media/Tailentudidong_471272692909668/5480362795333941.jpg",
          "type": "image/jpeg"
        },
        {
          "id": 1666921798007,
          "name": "5480362745333946.jpg",
          "path": "/Users/tuannguyen8888/Downloads/facebook-tuannguyen8888-30_11_2025-BPwDyk9R/your_facebook_activity/posts/media/Tailentudidong_471272692909668/5480362745333946.jpg",
          "type": "image/jpeg"
        },
        {
          "id": 1666921798008,
          "name": "383841760543259.mp4",
          "path": "/Users/tuannguyen8888/Downloads/facebook-tuannguyen8888-30_11_2025-BPwDyk9R/your_facebook_activity/posts/media/videos/383841760543259.mp4",
          "type": "image/jpeg"
        }
      ]
    },
    {
      "id": 1669252323000,
      "date": "23/11/2022",
      "dateParsed": {
        "original": "23/11/2022",
        "date": "2022-11-23T20:12:03",
        "year": 2022,
        "month": 11,
        "day": 23,
        "format": "DD/MM/YYYY"
      },
      "type": "other",
      "title": "Sự kiện với vợ - 23/11/2022",
      "description": "Võ Tuấn Nguyên đã thêm một ảnh mới. 😘😘😘 😘😘😘",
      "location": "",
      "witnesses": "",
      "documents": "",
      "images": [
        {
          "id": 1669252323000,
          "name": "5555996904437196.jpg",
          "path": "/Users/tuannguyen8888/Downloads/facebook-tuannguyen8888-30_11_2025-BPwDyk9R/your_facebook_activity/posts/media/Tailentudidong_471272692909668/5555996904437196.jpg",
          "type": "image/jpeg"
        }
      ]
    },
    {
      "id": 1671972069000,
      "date": "25/12/2022",
      "dateParsed": {
        "original": "25/12/2022",
        "date": "2022-12-25T07:41:09",
        "year": 2022,
        "month": 12,
        "day": 25,
        "format": "DD/MM/YYYY"
      },
      "type": "other",
      "title": "Vẫn còn chơi chung nha …😊 Vẫn còn chơi chung nha …😊",
      "description": "Võ Tuấn Nguyên đã thêm một ảnh mới. Vẫn còn chơi chung nha …😊 Vẫn còn chơi chung nha …😊",
      "location": "",
      "witnesses": "",
      "documents": "",
      "images": [
        {
          "id": 1671972069000,
          "name": "5655970754439810.jpg",
          "path": "/Users/tuannguyen8888/Downloads/facebook-tuannguyen8888-30_11_2025-BPwDyk9R/your_facebook_activity/posts/media/Tailentudidong_471272692909668/5655970754439810.jpg",
          "type": "image/jpeg"
        }
      ]
    },
    {
      "id": 1672927943000,
      "date": "05/01/2023",
      "dateParsed": {
        "original": "05/01/2023",
        "date": "2023-01-05T09:12:23",
        "year": 2023,
        "month": 1,
        "day": 5,
        "format": "DD/MM/YYYY"
      },
      "type": "other",
      "title": "Cả nhà thương nhau 😘",
      "description": "Võ Tuấn Nguyên đã thêm 3 ảnh mới. Cả nhà thương nhau 😘",
      "location": "",
      "witnesses": "",
      "documents": "",
      "images": [
        {
          "id": 1672927943000,
          "name": "5686326248070927.jpg",
          "path": "/Users/tuannguyen8888/Downloads/facebook-tuannguyen8888-30_11_2025-BPwDyk9R/your_facebook_activity/posts/media/Tailentudidong_471272692909668/5686326248070927.jpg",
          "type": "image/jpeg"
        },
        {
          "id": 1672927943001,
          "name": "5686326274737591.jpg",
          "path": "/Users/tuannguyen8888/Downloads/facebook-tuannguyen8888-30_11_2025-BPwDyk9R/your_facebook_activity/posts/media/Tailentudidong_471272692909668/5686326274737591.jpg",
          "type": "image/jpeg"
        },
        {
          "id": 1672927943002,
          "name": "5686326368070915.jpg",
          "path": "/Users/tuannguyen8888/Downloads/facebook-tuannguyen8888-30_11_2025-BPwDyk9R/your_facebook_activity/posts/media/Tailentudidong_471272692909668/5686326368070915.jpg",
          "type": "image/jpeg"
        }
      ]
    },
    {
      "id": 1673154737000,
      "date": "08/01/2023",
      "dateParsed": {
        "original": "08/01/2023",
        "date": "2023-01-08T00:12:17",
        "year": 2023,
        "month": 1,
        "day": 8,
        "format": "DD/MM/YYYY"
      },
      "type": "other",
      "title": "Cuối tuần 😊",
      "description": "Võ Tuấn Nguyên đã thêm 4 ảnh mới. Cuối tuần 😊",
      "location": "",
      "witnesses": "",
      "documents": "",
      "images": [
        {
          "id": 1673154737000,
          "name": "5693477934022425.jpg",
          "path": "/Users/tuannguyen8888/Downloads/facebook-tuannguyen8888-30_11_2025-BPwDyk9R/your_facebook_activity/posts/media/Tailentudidong_471272692909668/5693477934022425.jpg",
          "type": "image/jpeg"
        },
        {
          "id": 1673154737001,
          "name": "5693478054022413.jpg",
          "path": "/Users/tuannguyen8888/Downloads/facebook-tuannguyen8888-30_11_2025-BPwDyk9R/your_facebook_activity/posts/media/Tailentudidong_471272692909668/5693478054022413.jpg",
          "type": "image/jpeg"
        },
        {
          "id": 1673154737002,
          "name": "5693477977355754.jpg",
          "path": "/Users/tuannguyen8888/Downloads/facebook-tuannguyen8888-30_11_2025-BPwDyk9R/your_facebook_activity/posts/media/Tailentudidong_471272692909668/5693477977355754.jpg",
          "type": "image/jpeg"
        },
        {
          "id": 1673154737003,
          "name": "5693478084022410.jpg",
          "path": "/Users/tuannguyen8888/Downloads/facebook-tuannguyen8888-30_11_2025-BPwDyk9R/your_facebook_activity/posts/media/Tailentudidong_471272692909668/5693478084022410.jpg",
          "type": "image/jpeg"
        }
      ]
    },
    {
      "id": 1675230971000,
      "date": "01/02/2023",
      "dateParsed": {
        "original": "01/02/2023",
        "date": "2023-02-01T00:56:11",
        "year": 2023,
        "month": 2,
        "day": 1,
        "format": "DD/MM/YYYY"
      },
      "type": "other",
      "title": "chính thức hết tết, vào lại SG đi mần thôi 😊 chính thức hết tết, vào lại SG đi mần thôi 😊",
      "description": "Võ Tuấn Nguyên đã thêm một ảnh mới. chính thức hết tết, vào lại SG đi mần thôi 😊 chính thức hết tết, vào lại SG đi mần thôi 😊",
      "location": "",
      "witnesses": "",
      "documents": "",
      "images": [
        {
          "id": 1675230971000,
          "name": "5766555650047986.jpg",
          "path": "/Users/tuannguyen8888/Downloads/facebook-tuannguyen8888-30_11_2025-BPwDyk9R/your_facebook_activity/posts/media/Tailentudidong_471272692909668/5766555650047986.jpg",
          "type": "image/jpeg"
        }
      ]
    },
    {
      "id": 1683460449000,
      "date": "07/05/2023",
      "dateParsed": {
        "original": "07/05/2023",
        "date": "2023-05-07T07:54:09",
        "year": 2023,
        "month": 5,
        "day": 7,
        "format": "DD/MM/YYYY"
      },
      "type": "other",
      "title": "Sam thích chơi tiktok 😂 Sam thích chơi tiktok 😂",
      "description": "Võ Tuấn Nguyên đã thêm một video mới. Sam thích chơi tiktok 😂 Sam thích chơi tiktok 😂",
      "location": "",
      "witnesses": "",
      "documents": "",
      "images": [
        {
          "id": 1683460449000,
          "name": "240932438530833.mp4",
          "path": "/Users/tuannguyen8888/Downloads/facebook-tuannguyen8888-30_11_2025-BPwDyk9R/your_facebook_activity/posts/media/videos/240932438530833.mp4",
          "type": "image/jpeg"
        }
      ]
    },
    {
      "id": 1685587574000,
      "date": "31/05/2023",
      "dateParsed": {
        "original": "31/05/2023",
        "date": "2023-05-31T22:46:14",
        "year": 2023,
        "month": 5,
        "day": 31,
        "format": "DD/MM/YYYY"
      },
      "type": "other",
      "title": "trại hè 2023, ngày đầu tiên 😁 trại hè 2023, ngày đầu tiên 😁",
      "description": "Võ Tuấn Nguyên đã thêm một ảnh mới. trại hè 2023, ngày đầu tiên 😁 trại hè 2023, ngày đầu tiên 😁",
      "location": "",
      "witnesses": "",
      "documents": "",
      "images": [
        {
          "id": 1685587574000,
          "name": "6148435348526679.jpg",
          "path": "/Users/tuannguyen8888/Downloads/facebook-tuannguyen8888-30_11_2025-BPwDyk9R/your_facebook_activity/posts/media/Tailentudidong_471272692909668/6148435348526679.jpg",
          "type": "image/jpeg"
        }
      ]
    },
    {
      "id": 1686420117000,
      "date": "10/06/2023",
      "dateParsed": {
        "original": "10/06/2023",
        "date": "2023-06-10T14:01:57",
        "year": 2023,
        "month": 6,
        "day": 10,
        "format": "DD/MM/YYYY"
      },
      "type": "birth",
      "title": "chúc mừng sinh nhật bà nội Sam 🎂\nchúc má luôn vui tươi và khoẻ mạnh ❤️",
      "description": "Võ Tuấn Nguyên đã thêm 5 ảnh mới vào dòng thời gian của Trinh Nguyen. chúc mừng sinh nhật bà nội Sam 🎂\nchúc má luôn vui tươi và khoẻ mạnh ❤️",
      "location": "",
      "witnesses": "",
      "documents": "",
      "images": [
        {
          "id": 1686420117000,
          "name": "6181185178585029.jpg",
          "path": "/Users/tuannguyen8888/Downloads/facebook-tuannguyen8888-30_11_2025-BPwDyk9R/your_facebook_activity/posts/media/your_posts/6181185178585029.jpg",
          "type": "image/jpeg"
        },
        {
          "id": 1686420117001,
          "name": "6181185325251681.jpg",
          "path": "/Users/tuannguyen8888/Downloads/facebook-tuannguyen8888-30_11_2025-BPwDyk9R/your_facebook_activity/posts/media/your_posts/6181185325251681.jpg",
          "type": "image/jpeg"
        },
        {
          "id": 1686420117002,
          "name": "6181185208585026.jpg",
          "path": "/Users/tuannguyen8888/Downloads/facebook-tuannguyen8888-30_11_2025-BPwDyk9R/your_facebook_activity/posts/media/your_posts/6181185208585026.jpg",
          "type": "image/jpeg"
        },
        {
          "id": 1686420117003,
          "name": "6181185315251682.jpg",
          "path": "/Users/tuannguyen8888/Downloads/facebook-tuannguyen8888-30_11_2025-BPwDyk9R/your_facebook_activity/posts/media/your_posts/6181185315251682.jpg",
          "type": "image/jpeg"
        },
        {
          "id": 1686420117004,
          "name": "6181185435251670.jpg",
          "path": "/Users/tuannguyen8888/Downloads/facebook-tuannguyen8888-30_11_2025-BPwDyk9R/your_facebook_activity/posts/media/your_posts/6181185435251670.jpg",
          "type": "image/jpeg"
        }
      ]
    },
    {
      "id": 1687701176000,
      "date": "25/06/2023",
      "dateParsed": {
        "original": "25/06/2023",
        "date": "2023-06-25T09:52:56",
        "year": 2023,
        "month": 6,
        "day": 25,
        "format": "DD/MM/YYYY"
      },
      "type": "other",
      "title": "Cuối tuần của gia đình nhỏ 🥰",
      "description": "Võ Tuấn Nguyên đã thêm 3 ảnh mới. Cuối tuần của gia đình nhỏ 🥰",
      "location": "",
      "witnesses": "",
      "documents": "",
      "images": [
        {
          "id": 1687701176000,
          "name": "6233947086642171.jpg",
          "path": "/Users/tuannguyen8888/Downloads/facebook-tuannguyen8888-30_11_2025-BPwDyk9R/your_facebook_activity/posts/media/Tailentudidong_471272692909668/6233947086642171.jpg",
          "type": "image/jpeg"
        },
        {
          "id": 1687701176001,
          "name": "6233946943308852.jpg",
          "path": "/Users/tuannguyen8888/Downloads/facebook-tuannguyen8888-30_11_2025-BPwDyk9R/your_facebook_activity/posts/media/Tailentudidong_471272692909668/6233946943308852.jpg",
          "type": "image/jpeg"
        },
        {
          "id": 1687701176002,
          "name": "6233948006642079.jpg",
          "path": "/Users/tuannguyen8888/Downloads/facebook-tuannguyen8888-30_11_2025-BPwDyk9R/your_facebook_activity/posts/media/Tailentudidong_471272692909668/6233948006642079.jpg",
          "type": "image/jpeg"
        }
      ]
    },
    {
      "id": 1688893826000,
      "date": "09/07/2023",
      "dateParsed": {
        "original": "09/07/2023",
        "date": "2023-07-09T05:10:26",
        "year": 2023,
        "month": 7,
        "day": 9,
        "format": "DD/MM/YYYY"
      },
      "type": "other",
      "title": "Ráng chịu vài tháng nữa bé bầu Nương Nương 😘😘😘 Ráng chịu vài tháng nữa bé bầu @[100006489412839:2...",
      "description": "Võ Tuấn Nguyên đã thêm một ảnh mới. Ráng chịu vài tháng nữa bé bầu Nương Nương 😘😘😘 Ráng chịu vài tháng nữa bé bầu @[100006489412839:2048:Nương Nương] 😘😘😘",
      "location": "",
      "witnesses": "",
      "documents": "",
      "images": [
        {
          "id": 1688893826000,
          "name": "6280157148687831.jpg",
          "path": "/Users/tuannguyen8888/Downloads/facebook-tuannguyen8888-30_11_2025-BPwDyk9R/your_facebook_activity/posts/media/Tailentudidong_471272692909668/6280157148687831.jpg",
          "type": "image/jpeg"
        }
      ]
    },
    {
      "id": 1690091827000,
      "date": "23/07/2023",
      "dateParsed": {
        "original": "23/07/2023",
        "date": "2023-07-23T01:57:07",
        "year": 2023,
        "month": 7,
        "day": 23,
        "format": "DD/MM/YYYY"
      },
      "type": "other",
      "title": "sáng CN đi ăn sáng",
      "description": "Võ Tuấn Nguyên đã thêm 4 ảnh mới. sáng CN đi ăn sáng",
      "location": "",
      "witnesses": "",
      "documents": "",
      "images": [
        {
          "id": 1690091827000,
          "name": "6326803177356561.jpg",
          "path": "/Users/tuannguyen8888/Downloads/facebook-tuannguyen8888-30_11_2025-BPwDyk9R/your_facebook_activity/posts/media/Tailentudidong_471272692909668/6326803177356561.jpg",
          "type": "image/jpeg"
        },
        {
          "id": 1690091827001,
          "name": "6326803197356559.jpg",
          "path": "/Users/tuannguyen8888/Downloads/facebook-tuannguyen8888-30_11_2025-BPwDyk9R/your_facebook_activity/posts/media/Tailentudidong_471272692909668/6326803197356559.jpg",
          "type": "image/jpeg"
        },
        {
          "id": 1690091827002,
          "name": "6326803264023219.jpg",
          "path": "/Users/tuannguyen8888/Downloads/facebook-tuannguyen8888-30_11_2025-BPwDyk9R/your_facebook_activity/posts/media/Tailentudidong_471272692909668/6326803264023219.jpg",
          "type": "image/jpeg"
        },
        {
          "id": 1690091827003,
          "name": "6326803290689883.jpg",
          "path": "/Users/tuannguyen8888/Downloads/facebook-tuannguyen8888-30_11_2025-BPwDyk9R/your_facebook_activity/posts/media/Tailentudidong_471272692909668/6326803290689883.jpg",
          "type": "image/jpeg"
        }
      ]
    },
    {
      "id": 1690820158000,
      "date": "31/07/2023",
      "dateParsed": {
        "original": "31/07/2023",
        "date": "2023-07-31T12:15:58",
        "year": 2023,
        "month": 7,
        "day": 31,
        "format": "DD/MM/YYYY"
      },
      "type": "wedding",
      "title": "Ủa, 5 năm rồi hả vợ 😘😘\nKỷ niệm ngày cưới 31/7",
      "description": "Võ Tuấn Nguyên đã thêm 13 ảnh mới. Ủa, 5 năm rồi hả vợ 😘😘\nKỷ niệm ngày cưới 31/7",
      "location": "",
      "witnesses": "",
      "documents": "",
      "images": [
        {
          "id": 1690820158000,
          "name": "6353991491304396.jpg",
          "path": "/Users/tuannguyen8888/Downloads/facebook-tuannguyen8888-30_11_2025-BPwDyk9R/your_facebook_activity/posts/media/Tailentudidong_471272692909668/6353991491304396.jpg",
          "type": "image/jpeg"
        },
        {
          "id": 1690820158001,
          "name": "6353992051304340.jpg",
          "path": "/Users/tuannguyen8888/Downloads/facebook-tuannguyen8888-30_11_2025-BPwDyk9R/your_facebook_activity/posts/media/Tailentudidong_471272692909668/6353992051304340.jpg",
          "type": "image/jpeg"
        },
        {
          "id": 1690820158002,
          "name": "6353992007971011.jpg",
          "path": "/Users/tuannguyen8888/Downloads/facebook-tuannguyen8888-30_11_2025-BPwDyk9R/your_facebook_activity/posts/media/Tailentudidong_471272692909668/6353992007971011.jpg",
          "type": "image/jpeg"
        },
        {
          "id": 1690820158003,
          "name": "6353991824637696.jpg",
          "path": "/Users/tuannguyen8888/Downloads/facebook-tuannguyen8888-30_11_2025-BPwDyk9R/your_facebook_activity/posts/media/Tailentudidong_471272692909668/6353991824637696.jpg",
          "type": "image/jpeg"
        },
        {
          "id": 1690820158004,
          "name": "6353991611304384.jpg",
          "path": "/Users/tuannguyen8888/Downloads/facebook-tuannguyen8888-30_11_2025-BPwDyk9R/your_facebook_activity/posts/media/Tailentudidong_471272692909668/6353991611304384.jpg",
          "type": "image/jpeg"
        },
        {
          "id": 1690820158005,
          "name": "6353991827971029.jpg",
          "path": "/Users/tuannguyen8888/Downloads/facebook-tuannguyen8888-30_11_2025-BPwDyk9R/your_facebook_activity/posts/media/Tailentudidong_471272692909668/6353991827971029.jpg",
          "type": "image/jpeg"
        },
        {
          "id": 1690820158006,
          "name": "6353991607971051.jpg",
          "path": "/Users/tuannguyen8888/Downloads/facebook-tuannguyen8888-30_11_2025-BPwDyk9R/your_facebook_activity/posts/media/Tailentudidong_471272692909668/6353991607971051.jpg",
          "type": "image/jpeg"
        },
        {
          "id": 1690820158007,
          "name": "6353991904637688.jpg",
          "path": "/Users/tuannguyen8888/Downloads/facebook-tuannguyen8888-30_11_2025-BPwDyk9R/your_facebook_activity/posts/media/Tailentudidong_471272692909668/6353991904637688.jpg",
          "type": "image/jpeg"
        },
        {
          "id": 1690820158008,
          "name": "6353992094637669.jpg",
          "path": "/Users/tuannguyen8888/Downloads/facebook-tuannguyen8888-30_11_2025-BPwDyk9R/your_facebook_activity/posts/media/Tailentudidong_471272692909668/6353992094637669.jpg",
          "type": "image/jpeg"
        },
        {
          "id": 1690820158009,
          "name": "6353991907971021.jpg",
          "path": "/Users/tuannguyen8888/Downloads/facebook-tuannguyen8888-30_11_2025-BPwDyk9R/your_facebook_activity/posts/media/Tailentudidong_471272692909668/6353991907971021.jpg",
          "type": "image/jpeg"
        }
      ]
    },
    {
      "id": 1691204821000,
      "date": "04/08/2023",
      "dateParsed": {
        "original": "04/08/2023",
        "date": "2023-08-04T23:07:01",
        "year": 2023,
        "month": 8,
        "day": 4,
        "format": "DD/MM/YYYY"
      },
      "type": "other",
      "title": "Sự kiện với vợ - 04/08/2023",
      "description": "Võ Tuấn Nguyên đã thêm 6 ảnh mới. zìa quơ 😅",
      "location": "",
      "witnesses": "",
      "documents": "",
      "images": [
        {
          "id": 1691204821000,
          "name": "6368686893168189.jpg",
          "path": "/Users/tuannguyen8888/Downloads/facebook-tuannguyen8888-30_11_2025-BPwDyk9R/your_facebook_activity/posts/media/Tailentudidong_471272692909668/6368686893168189.jpg",
          "type": "image/jpeg"
        },
        {
          "id": 1691204821001,
          "name": "6368687029834842.jpg",
          "path": "/Users/tuannguyen8888/Downloads/facebook-tuannguyen8888-30_11_2025-BPwDyk9R/your_facebook_activity/posts/media/Tailentudidong_471272692909668/6368687029834842.jpg",
          "type": "image/jpeg"
        },
        {
          "id": 1691204821002,
          "name": "6368687103168168.jpg",
          "path": "/Users/tuannguyen8888/Downloads/facebook-tuannguyen8888-30_11_2025-BPwDyk9R/your_facebook_activity/posts/media/Tailentudidong_471272692909668/6368687103168168.jpg",
          "type": "image/jpeg"
        },
        {
          "id": 1691204821003,
          "name": "6368686996501512.jpg",
          "path": "/Users/tuannguyen8888/Downloads/facebook-tuannguyen8888-30_11_2025-BPwDyk9R/your_facebook_activity/posts/media/Tailentudidong_471272692909668/6368686996501512.jpg",
          "type": "image/jpeg"
        },
        {
          "id": 1691204821004,
          "name": "6368687133168165.jpg",
          "path": "/Users/tuannguyen8888/Downloads/facebook-tuannguyen8888-30_11_2025-BPwDyk9R/your_facebook_activity/posts/media/Tailentudidong_471272692909668/6368687133168165.jpg",
          "type": "image/jpeg"
        },
        {
          "id": 1691204821005,
          "name": "6368686899834855.jpg",
          "path": "/Users/tuannguyen8888/Downloads/facebook-tuannguyen8888-30_11_2025-BPwDyk9R/your_facebook_activity/posts/media/Tailentudidong_471272692909668/6368686899834855.jpg",
          "type": "image/jpeg"
        }
      ]
    },
    {
      "id": 1692280142000,
      "date": "17/08/2023",
      "dateParsed": {
        "original": "17/08/2023",
        "date": "2023-08-17T09:49:02",
        "year": 2023,
        "month": 8,
        "day": 17,
        "format": "DD/MM/YYYY"
      },
      "type": "birth",
      "title": "Chúc vợ yêu sinh nhật vui vẽ\nBên anh bình yên và hạnh phúc em nhé\nYêu em ❤️❤️❤️",
      "description": "Võ Tuấn Nguyên đã thêm 7 ảnh mới vào dòng thời gian của Nương Nương. Chúc vợ yêu sinh nhật vui vẽ\nBên anh bình yên và hạnh phúc em nhé\nYêu em ❤️❤️❤️",
      "location": "",
      "witnesses": "",
      "documents": "",
      "images": [
        {
          "id": 1692280142000,
          "name": "6409326239104254.jpg",
          "path": "/Users/tuannguyen8888/Downloads/facebook-tuannguyen8888-30_11_2025-BPwDyk9R/your_facebook_activity/posts/media/your_posts/6409326239104254.jpg",
          "type": "image/jpeg"
        },
        {
          "id": 1692280142001,
          "name": "6409326269104251.jpg",
          "path": "/Users/tuannguyen8888/Downloads/facebook-tuannguyen8888-30_11_2025-BPwDyk9R/your_facebook_activity/posts/media/your_posts/6409326269104251.jpg",
          "type": "image/jpeg"
        },
        {
          "id": 1692280142002,
          "name": "6409326502437561.jpg",
          "path": "/Users/tuannguyen8888/Downloads/facebook-tuannguyen8888-30_11_2025-BPwDyk9R/your_facebook_activity/posts/media/your_posts/6409326502437561.jpg",
          "type": "image/jpeg"
        },
        {
          "id": 1692280142003,
          "name": "6409326425770902.jpg",
          "path": "/Users/tuannguyen8888/Downloads/facebook-tuannguyen8888-30_11_2025-BPwDyk9R/your_facebook_activity/posts/media/your_posts/6409326425770902.jpg",
          "type": "image/jpeg"
        },
        {
          "id": 1692280142004,
          "name": "6409326379104240.jpg",
          "path": "/Users/tuannguyen8888/Downloads/facebook-tuannguyen8888-30_11_2025-BPwDyk9R/your_facebook_activity/posts/media/your_posts/6409326379104240.jpg",
          "type": "image/jpeg"
        },
        {
          "id": 1692280142005,
          "name": "6409326469104231.jpg",
          "path": "/Users/tuannguyen8888/Downloads/facebook-tuannguyen8888-30_11_2025-BPwDyk9R/your_facebook_activity/posts/media/your_posts/6409326469104231.jpg",
          "type": "image/jpeg"
        },
        {
          "id": 1692280142006,
          "name": "6409326325770912.jpg",
          "path": "/Users/tuannguyen8888/Downloads/facebook-tuannguyen8888-30_11_2025-BPwDyk9R/your_facebook_activity/posts/media/your_posts/6409326325770912.jpg",
          "type": "image/jpeg"
        }
      ]
    },
    {
      "id": 1693798210000,
      "date": "03/09/2023",
      "dateParsed": {
        "original": "03/09/2023",
        "date": "2023-09-03T23:30:10",
        "year": 2023,
        "month": 9,
        "day": 3,
        "format": "DD/MM/YYYY"
      },
      "type": "travel",
      "title": "Dẫn bé Lớn đi chơi 😅",
      "description": "Võ Tuấn Nguyên đã thêm 3 ảnh mới. Dẫn bé Lớn đi chơi 😅",
      "location": "",
      "witnesses": "",
      "documents": "",
      "images": [
        {
          "id": 1693798210000,
          "name": "6467744929929051.jpg",
          "path": "/Users/tuannguyen8888/Downloads/facebook-tuannguyen8888-30_11_2025-BPwDyk9R/your_facebook_activity/posts/media/Tailentudidong_471272692909668/6467744929929051.jpg",
          "type": "image/jpeg"
        },
        {
          "id": 1693798210001,
          "name": "6467745019929042.jpg",
          "path": "/Users/tuannguyen8888/Downloads/facebook-tuannguyen8888-30_11_2025-BPwDyk9R/your_facebook_activity/posts/media/Tailentudidong_471272692909668/6467745019929042.jpg",
          "type": "image/jpeg"
        },
        {
          "id": 1693798210002,
          "name": "6467746489928895.jpg",
          "path": "/Users/tuannguyen8888/Downloads/facebook-tuannguyen8888-30_11_2025-BPwDyk9R/your_facebook_activity/posts/media/Tailentudidong_471272692909668/6467746489928895.jpg",
          "type": "image/jpeg"
        }
      ]
    },
    {
      "id": 1696587766000,
      "date": "06/10/2023",
      "dateParsed": {
        "original": "06/10/2023",
        "date": "2023-10-06T06:22:46",
        "year": 2023,
        "month": 10,
        "day": 6,
        "format": "DD/MM/YYYY"
      },
      "type": "other",
      "title": "chừng nào có nhà sẽ làm cái giường ngủ như thế này cho con gái, Sam thích máy bay lắm 😘 chừng nào...",
      "description": "Võ Tuấn Nguyên đã thêm một ảnh mới. chừng nào có nhà sẽ làm cái giường ngủ như thế này cho con gái, Sam thích máy bay lắm 😘 chừng nào có nhà sẽ làm cái giường ngủ như thế này cho con gái, Sam thích máy bay lắm 😘",
      "location": "",
      "witnesses": "",
      "documents": "",
      "images": [
        {
          "id": 1696587766000,
          "name": "6589276624442547.jpg",
          "path": "/Users/tuannguyen8888/Downloads/facebook-tuannguyen8888-30_11_2025-BPwDyk9R/your_facebook_activity/posts/media/Anhtrendongthoigian_267243079979298/6589276624442547.jpg",
          "type": "image/jpeg"
        }
      ]
    },
    {
      "id": 1699668304000,
      "date": "10/11/2023",
      "dateParsed": {
        "original": "10/11/2023",
        "date": "2023-11-10T21:05:04",
        "year": 2023,
        "month": 11,
        "day": 10,
        "format": "DD/MM/YYYY"
      },
      "type": "dating",
      "title": "Chào mừng con trai đã đến với gia đình\nMong con hạnh phúc suốt đời, giỏi giang và mạnh mẽ\nCả nhà ...",
      "description": "Võ Tuấn Nguyên đã thêm một ảnh mới. Chào mừng con trai đã đến với gia đình\nMong con hạnh phúc suốt đời, giỏi giang và mạnh mẽ\nCả nhà yêu con ❤️❤️❤️ Chào mừng con trai đã đến với gia đình\nMong con hạnh phúc suốt đời, giỏi giang và mạnh mẽ\nCả nhà yêu con ❤️❤️❤️",
      "location": "",
      "witnesses": "",
      "documents": "",
      "images": [
        {
          "id": 1699668304000,
          "name": "6721399351230273.jpg",
          "path": "/Users/tuannguyen8888/Downloads/facebook-tuannguyen8888-30_11_2025-BPwDyk9R/your_facebook_activity/posts/media/Tailentudidong_471272692909668/6721399351230273.jpg",
          "type": "image/jpeg"
        }
      ]
    },
    {
      "id": 1702001616000,
      "date": "07/12/2023",
      "dateParsed": {
        "original": "07/12/2023",
        "date": "2023-12-07T21:13:36",
        "year": 2023,
        "month": 12,
        "day": 7,
        "format": "DD/MM/YYYY"
      },
      "type": "other",
      "title": "Nằm trên người ba ngủ mới chịu 😘\nku Bee, tròn 1 tháng Nằm trên người ba ngủ mới chịu 😘\nku Bee, tr...",
      "description": "Võ Tuấn Nguyên đã thêm một ảnh mới. Nằm trên người ba ngủ mới chịu 😘\nku Bee, tròn 1 tháng Nằm trên người ba ngủ mới chịu 😘\nku Bee, tròn 1 tháng",
      "location": "",
      "witnesses": "",
      "documents": "",
      "images": [
        {
          "id": 1702001616000,
          "name": "6818954838141390.jpg",
          "path": "/Users/tuannguyen8888/Downloads/facebook-tuannguyen8888-30_11_2025-BPwDyk9R/your_facebook_activity/posts/media/Tailentudidong_471272692909668/6818954838141390.jpg",
          "type": "image/jpeg"
        }
      ]
    },
    {
      "id": 1705496155000,
      "date": "17/01/2024",
      "dateParsed": {
        "original": "17/01/2024",
        "date": "2024-01-17T07:55:55",
        "year": 2024,
        "month": 1,
        "day": 17,
        "format": "DD/MM/YYYY"
      },
      "type": "other",
      "title": "Sự kiện với vợ - 17/01/2024",
      "description": "Võ Tuấn Nguyên đã thêm một ảnh mới.",
      "location": "",
      "witnesses": "",
      "documents": "",
      "images": [
        {
          "id": 1705496155000,
          "name": "6964945516875654.jpg",
          "path": "/Users/tuannguyen8888/Downloads/facebook-tuannguyen8888-30_11_2025-BPwDyk9R/your_facebook_activity/posts/media/Tailentudidong_471272692909668/6964945516875654.jpg",
          "type": "image/jpeg"
        }
      ]
    },
    {
      "id": 1709048284000,
      "date": "27/02/2024",
      "dateParsed": {
        "original": "27/02/2024",
        "date": "2024-02-27T10:38:04",
        "year": 2024,
        "month": 2,
        "day": 27,
        "format": "DD/MM/YYYY"
      },
      "type": "other",
      "title": "Nhà có 2 cục kim cương ❤️",
      "description": "Võ Tuấn Nguyên đã thêm 9 ảnh mới. Nhà có 2 cục kim cương ❤️",
      "location": "",
      "witnesses": "",
      "documents": "",
      "images": [
        {
          "id": 1709048284000,
          "name": "7127035210666683.jpg",
          "path": "/Users/tuannguyen8888/Downloads/facebook-tuannguyen8888-30_11_2025-BPwDyk9R/your_facebook_activity/posts/media/SamBee_7127039327332938/7127035210666683.jpg",
          "type": "image/jpeg"
        },
        {
          "id": 1709048284001,
          "name": "7127035440666660.jpg",
          "path": "/Users/tuannguyen8888/Downloads/facebook-tuannguyen8888-30_11_2025-BPwDyk9R/your_facebook_activity/posts/media/SamBee_7127039327332938/7127035440666660.jpg",
          "type": "image/jpeg"
        },
        {
          "id": 1709048284002,
          "name": "7127035244000013.jpg",
          "path": "/Users/tuannguyen8888/Downloads/facebook-tuannguyen8888-30_11_2025-BPwDyk9R/your_facebook_activity/posts/media/SamBee_7127039327332938/7127035244000013.jpg",
          "type": "image/jpeg"
        },
        {
          "id": 1709048284003,
          "name": "7127035730666631.jpg",
          "path": "/Users/tuannguyen8888/Downloads/facebook-tuannguyen8888-30_11_2025-BPwDyk9R/your_facebook_activity/posts/media/SamBee_7127039327332938/7127035730666631.jpg",
          "type": "image/jpeg"
        },
        {
          "id": 1709048284004,
          "name": "7127035367333334.jpg",
          "path": "/Users/tuannguyen8888/Downloads/facebook-tuannguyen8888-30_11_2025-BPwDyk9R/your_facebook_activity/posts/media/SamBee_7127039327332938/7127035367333334.jpg",
          "type": "image/jpeg"
        },
        {
          "id": 1709048284005,
          "name": "7127035327333338.jpg",
          "path": "/Users/tuannguyen8888/Downloads/facebook-tuannguyen8888-30_11_2025-BPwDyk9R/your_facebook_activity/posts/media/SamBee_7127039327332938/7127035327333338.jpg",
          "type": "image/jpeg"
        },
        {
          "id": 1709048284006,
          "name": "7127035483999989.jpg",
          "path": "/Users/tuannguyen8888/Downloads/facebook-tuannguyen8888-30_11_2025-BPwDyk9R/your_facebook_activity/posts/media/SamBee_7127039327332938/7127035483999989.jpg",
          "type": "image/jpeg"
        },
        {
          "id": 1709048284007,
          "name": "7127035587333312.jpg",
          "path": "/Users/tuannguyen8888/Downloads/facebook-tuannguyen8888-30_11_2025-BPwDyk9R/your_facebook_activity/posts/media/SamBee_7127039327332938/7127035587333312.jpg",
          "type": "image/jpeg"
        },
        {
          "id": 1709048284008,
          "name": "7127035627333308.jpg",
          "path": "/Users/tuannguyen8888/Downloads/facebook-tuannguyen8888-30_11_2025-BPwDyk9R/your_facebook_activity/posts/media/SamBee_7127039327332938/7127035627333308.jpg",
          "type": "image/jpeg"
        }
      ]
    },
    {
      "id": 1710657059000,
      "date": "17/03/2024",
      "dateParsed": {
        "original": "17/03/2024",
        "date": "2024-03-17T02:30:59",
        "year": 2024,
        "month": 3,
        "day": 17,
        "format": "DD/MM/YYYY"
      },
      "type": "other",
      "title": "Dancer Sam 😊 Dancer Sam 😊",
      "description": "Võ Tuấn Nguyên đã thêm một video mới. Dancer Sam 😊 Dancer Sam 😊",
      "location": "",
      "witnesses": "",
      "documents": "",
      "images": [
        {
          "id": 1710657059000,
          "name": "389644980365839.mp4",
          "path": "/Users/tuannguyen8888/Downloads/facebook-tuannguyen8888-30_11_2025-BPwDyk9R/your_facebook_activity/posts/media/Sam_3362678057102436/389644980365839.mp4",
          "type": "image/jpeg"
        }
      ]
    },
    {
      "id": 1713001724000,
      "date": "13/04/2024",
      "dateParsed": {
        "original": "13/04/2024",
        "date": "2024-04-13T05:48:44",
        "year": 2024,
        "month": 4,
        "day": 13,
        "format": "DD/MM/YYYY"
      },
      "type": "other",
      "title": "Gọi vợ một phát là rùm ben cái nhà luôn 😅 Gọi vợ một phát là rùm ben cái nhà luôn 😅",
      "description": "Võ Tuấn Nguyên đã thêm một ảnh mới. Gọi vợ một phát là rùm ben cái nhà luôn 😅 Gọi vợ một phát là rùm ben cái nhà luôn 😅",
      "location": "",
      "witnesses": "",
      "documents": "",
      "images": [
        {
          "id": 1713001724000,
          "name": "7309978005705735.jpg",
          "path": "/Users/tuannguyen8888/Downloads/facebook-tuannguyen8888-30_11_2025-BPwDyk9R/your_facebook_activity/posts/media/Tailentudidong_471272692909668/7309978005705735.jpg",
          "type": "image/jpeg"
        }
      ]
    },
    {
      "id": 1714910173000,
      "date": "05/05/2024",
      "dateParsed": {
        "original": "05/05/2024",
        "date": "2024-05-05T07:56:13",
        "year": 2024,
        "month": 5,
        "day": 5,
        "format": "DD/MM/YYYY"
      },
      "type": "other",
      "title": "con gái dịu dàng 😘",
      "description": "Võ Tuấn Nguyên đã thêm 6 ảnh mới. con gái dịu dàng 😘",
      "location": "",
      "witnesses": "",
      "documents": "",
      "images": [
        {
          "id": 1714910173000,
          "name": "7405977036105831.jpg",
          "path": "/Users/tuannguyen8888/Downloads/facebook-tuannguyen8888-30_11_2025-BPwDyk9R/your_facebook_activity/posts/media/Sam_3362678057102436/7405977036105831.jpg",
          "type": "image/jpeg"
        },
        {
          "id": 1714910173001,
          "name": "7405977159439152.jpg",
          "path": "/Users/tuannguyen8888/Downloads/facebook-tuannguyen8888-30_11_2025-BPwDyk9R/your_facebook_activity/posts/media/Sam_3362678057102436/7405977159439152.jpg",
          "type": "image/jpeg"
        },
        {
          "id": 1714910173002,
          "name": "7405977296105805.jpg",
          "path": "/Users/tuannguyen8888/Downloads/facebook-tuannguyen8888-30_11_2025-BPwDyk9R/your_facebook_activity/posts/media/Sam_3362678057102436/7405977296105805.jpg",
          "type": "image/jpeg"
        },
        {
          "id": 1714910173003,
          "name": "7405977062772495.jpg",
          "path": "/Users/tuannguyen8888/Downloads/facebook-tuannguyen8888-30_11_2025-BPwDyk9R/your_facebook_activity/posts/media/Sam_3362678057102436/7405977062772495.jpg",
          "type": "image/jpeg"
        },
        {
          "id": 1714910173004,
          "name": "7405977216105813.jpg",
          "path": "/Users/tuannguyen8888/Downloads/facebook-tuannguyen8888-30_11_2025-BPwDyk9R/your_facebook_activity/posts/media/Sam_3362678057102436/7405977216105813.jpg",
          "type": "image/jpeg"
        },
        {
          "id": 1714910173005,
          "name": "7405977356105799.jpg",
          "path": "/Users/tuannguyen8888/Downloads/facebook-tuannguyen8888-30_11_2025-BPwDyk9R/your_facebook_activity/posts/media/Sam_3362678057102436/7405977356105799.jpg",
          "type": "image/jpeg"
        }
      ]
    },
    {
      "id": 1716555028000,
      "date": "24/05/2024",
      "dateParsed": {
        "original": "24/05/2024",
        "date": "2024-05-24T08:50:28",
        "year": 2024,
        "month": 5,
        "day": 24,
        "format": "DD/MM/YYYY"
      },
      "type": "dating",
      "title": "Võ Tuấn Nguyên",
      "description": "Võ Tuấn Nguyên đang ăn tối cùng với Nương Nương và Khoi Vo tại Sushi Masa.",
      "location": "",
      "witnesses": "",
      "documents": "",
      "images": []
    },
    {
      "id": 1723911616000,
      "date": "17/08/2024",
      "dateParsed": {
        "original": "17/08/2024",
        "date": "2024-08-17T12:20:16",
        "year": 2024,
        "month": 8,
        "day": 17,
        "format": "DD/MM/YYYY"
      },
      "type": "birth",
      "title": "Chúc mừng sinh nhật vợ yêu 🥳\nChúc em những điều tuyệt vời nhất😊\nBình yên bên anh và các con em nh...",
      "description": "Võ Tuấn Nguyên đã thêm 4 ảnh mới. Chúc mừng sinh nhật vợ yêu 🥳\nChúc em những điều tuyệt vời nhất😊\nBình yên bên anh và các con em nhé😍\nYêu em rất nhiều 😘❤️",
      "location": "",
      "witnesses": "",
      "documents": "",
      "images": [
        {
          "id": 1723911616000,
          "name": "7952104574826405.jpg",
          "path": "/Users/tuannguyen8888/Downloads/facebook-tuannguyen8888-30_11_2025-BPwDyk9R/your_facebook_activity/posts/media/Tailentudidong_471272692909668/7952104574826405.jpg",
          "type": "image/jpeg"
        },
        {
          "id": 1723911616001,
          "name": "7952104754826387.jpg",
          "path": "/Users/tuannguyen8888/Downloads/facebook-tuannguyen8888-30_11_2025-BPwDyk9R/your_facebook_activity/posts/media/Tailentudidong_471272692909668/7952104754826387.jpg",
          "type": "image/jpeg"
        },
        {
          "id": 1723911616002,
          "name": "7952104634826399.jpg",
          "path": "/Users/tuannguyen8888/Downloads/facebook-tuannguyen8888-30_11_2025-BPwDyk9R/your_facebook_activity/posts/media/Tailentudidong_471272692909668/7952104634826399.jpg",
          "type": "image/jpeg"
        },
        {
          "id": 1723911616003,
          "name": "7952104704826392.jpg",
          "path": "/Users/tuannguyen8888/Downloads/facebook-tuannguyen8888-30_11_2025-BPwDyk9R/your_facebook_activity/posts/media/Tailentudidong_471272692909668/7952104704826392.jpg",
          "type": "image/jpeg"
        }
      ]
    },
    {
      "id": 1724498717000,
      "date": "24/08/2024",
      "dateParsed": {
        "original": "24/08/2024",
        "date": "2024-08-24T07:25:17",
        "year": 2024,
        "month": 8,
        "day": 24,
        "format": "DD/MM/YYYY"
      },
      "type": "other",
      "title": "Vừa tới nơi, checkin nhẹ quán nướng hot trên Tiktok Vừa tới nơi, checkin nhẹ quán nướng hot trên ...",
      "description": "Võ Tuấn Nguyên đã thêm một video mới. Vừa tới nơi, checkin nhẹ quán nướng hot trên Tiktok Vừa tới nơi, checkin nhẹ quán nướng hot trên Tiktok",
      "location": "",
      "witnesses": "",
      "documents": "",
      "images": [
        {
          "id": 1724498717000,
          "name": "1020971232848594.mp4",
          "path": "/Users/tuannguyen8888/Downloads/facebook-tuannguyen8888-30_11_2025-BPwDyk9R/your_facebook_activity/posts/media/videos/1020971232848594.mp4",
          "type": "image/jpeg"
        }
      ]
    },
    {
      "id": 1725234273000,
      "date": "01/09/2024",
      "dateParsed": {
        "original": "01/09/2024",
        "date": "2024-09-01T19:44:33",
        "year": 2024,
        "month": 9,
        "day": 1,
        "format": "DD/MM/YYYY"
      },
      "type": "other",
      "title": "Nắng lên rồi Nắng lên rồi",
      "description": "Võ Tuấn Nguyên đã thêm một video mới. Nắng lên rồi Nắng lên rồi",
      "location": "",
      "witnesses": "",
      "documents": "",
      "images": [
        {
          "id": 1725234273000,
          "name": "1183155789417872.mp4",
          "path": "/Users/tuannguyen8888/Downloads/facebook-tuannguyen8888-30_11_2025-BPwDyk9R/your_facebook_activity/posts/media/videos/1183155789417872.mp4",
          "type": "image/jpeg"
        }
      ]
    },
    {
      "id": 1726279412000,
      "date": "13/09/2024",
      "dateParsed": {
        "original": "13/09/2024",
        "date": "2024-09-13T22:03:32",
        "year": 2024,
        "month": 9,
        "day": 13,
        "format": "DD/MM/YYYY"
      },
      "type": "other",
      "title": "chị em nó lấy điện thoại tự chụp 😁\nthương nhau ghê hông 😘",
      "description": "Võ Tuấn Nguyên đã thêm 4 ảnh mới. chị em nó lấy điện thoại tự chụp 😁\nthương nhau ghê hông 😘",
      "location": "",
      "witnesses": "",
      "documents": "",
      "images": [
        {
          "id": 1726279412000,
          "name": "8118081028228758.jpg",
          "path": "/Users/tuannguyen8888/Downloads/facebook-tuannguyen8888-30_11_2025-BPwDyk9R/your_facebook_activity/posts/media/Tailentudidong_471272692909668/8118081028228758.jpg",
          "type": "image/jpeg"
        },
        {
          "id": 1726279412001,
          "name": "8118080794895448.jpg",
          "path": "/Users/tuannguyen8888/Downloads/facebook-tuannguyen8888-30_11_2025-BPwDyk9R/your_facebook_activity/posts/media/Tailentudidong_471272692909668/8118080794895448.jpg",
          "type": "image/jpeg"
        },
        {
          "id": 1726279412002,
          "name": "8118081061562088.jpg",
          "path": "/Users/tuannguyen8888/Downloads/facebook-tuannguyen8888-30_11_2025-BPwDyk9R/your_facebook_activity/posts/media/Tailentudidong_471272692909668/8118081061562088.jpg",
          "type": "image/jpeg"
        },
        {
          "id": 1726279412003,
          "name": "8118080838228777.jpg",
          "path": "/Users/tuannguyen8888/Downloads/facebook-tuannguyen8888-30_11_2025-BPwDyk9R/your_facebook_activity/posts/media/Tailentudidong_471272692909668/8118080838228777.jpg",
          "type": "image/jpeg"
        }
      ]
    },
    {
      "id": 1734929815000,
      "date": "22/12/2024",
      "dateParsed": {
        "original": "22/12/2024",
        "date": "2024-12-22T23:56:55",
        "year": 2024,
        "month": 12,
        "day": 22,
        "format": "DD/MM/YYYY"
      },
      "type": "other",
      "title": "Chuyện ngày chủ nhật 😁",
      "description": "Võ Tuấn Nguyên đã thêm 4 ảnh và một video. Chuyện ngày chủ nhật 😁",
      "location": "",
      "witnesses": "",
      "documents": "",
      "images": [
        {
          "id": 1734929815000,
          "name": "8787514397952081.jpg",
          "path": "/Users/tuannguyen8888/Downloads/facebook-tuannguyen8888-30_11_2025-BPwDyk9R/your_facebook_activity/posts/media/Tailentudidong_471272692909668/8787514397952081.jpg",
          "type": "image/jpeg"
        },
        {
          "id": 1734929815001,
          "name": "8787517551285099.jpg",
          "path": "/Users/tuannguyen8888/Downloads/facebook-tuannguyen8888-30_11_2025-BPwDyk9R/your_facebook_activity/posts/media/Tailentudidong_471272692909668/8787517551285099.jpg",
          "type": "image/jpeg"
        },
        {
          "id": 1734929815002,
          "name": "8787514411285413.jpg",
          "path": "/Users/tuannguyen8888/Downloads/facebook-tuannguyen8888-30_11_2025-BPwDyk9R/your_facebook_activity/posts/media/Tailentudidong_471272692909668/8787514411285413.jpg",
          "type": "image/jpeg"
        },
        {
          "id": 1734929815003,
          "name": "8787514594618728.jpg",
          "path": "/Users/tuannguyen8888/Downloads/facebook-tuannguyen8888-30_11_2025-BPwDyk9R/your_facebook_activity/posts/media/Tailentudidong_471272692909668/8787514594618728.jpg",
          "type": "image/jpeg"
        },
        {
          "id": 1734929815004,
          "name": "1578112089489990.mp4",
          "path": "/Users/tuannguyen8888/Downloads/facebook-tuannguyen8888-30_11_2025-BPwDyk9R/your_facebook_activity/posts/media/videos/1578112089489990.mp4",
          "type": "image/jpeg"
        }
      ]
    },
    {
      "id": 1739322575000,
      "date": "11/02/2025",
      "dateParsed": {
        "original": "11/02/2025",
        "date": "2025-02-11T20:09:35",
        "year": 2025,
        "month": 2,
        "day": 11,
        "format": "DD/MM/YYYY"
      },
      "type": "other",
      "title": "Võ Tuấn Nguyên  😘 Cafe với bé bầu Cafe với bé bầu",
      "description": "Võ Tuấn Nguyên đang ở cùng Nương Nương. 😘 Cafe với bé bầu Cafe với bé bầu",
      "location": "",
      "witnesses": "",
      "documents": "",
      "images": [
        {
          "id": 1739322575000,
          "name": "3100030336700544.jpg",
          "path": "/Users/tuannguyen8888/Downloads/facebook-tuannguyen8888-30_11_2025-BPwDyk9R/your_facebook_activity/posts/media/Tailentudidong_471272692909668/3100030336700544.jpg",
          "type": "image/jpeg"
        },
        {
          "id": 1739322575001,
          "name": "1675024592534466.jpg",
          "path": "/Users/tuannguyen8888/Downloads/facebook-tuannguyen8888-30_11_2025-BPwDyk9R/your_facebook_activity/posts/media/Anhdaidien_144515588918715/1675024592534466.jpg",
          "type": "image/jpeg"
        },
        {
          "id": 1739322575002,
          "name": "2971766776193568.jpg",
          "path": "/Users/tuannguyen8888/Downloads/facebook-tuannguyen8888-30_11_2025-BPwDyk9R/your_facebook_activity/posts/media/Tailentudidong_471272692909668/2971766776193568.jpg",
          "type": "image/jpeg"
        },
        {
          "id": 1739322575003,
          "name": "3100030336700544.jpg",
          "path": "/Users/tuannguyen8888/Downloads/facebook-tuannguyen8888-30_11_2025-BPwDyk9R/your_facebook_activity/posts/media/Tailentudidong_471272692909668/3100030336700544.jpg",
          "type": "image/jpeg"
        },
        {
          "id": 1739322575004,
          "name": "1675024592534466.jpg",
          "path": "/Users/tuannguyen8888/Downloads/facebook-tuannguyen8888-30_11_2025-BPwDyk9R/your_facebook_activity/posts/media/Anhdaidien_144515588918715/1675024592534466.jpg",
          "type": "image/jpeg"
        },
        {
          "id": 1739322575005,
          "name": "2971766776193568.jpg",
          "path": "/Users/tuannguyen8888/Downloads/facebook-tuannguyen8888-30_11_2025-BPwDyk9R/your_facebook_activity/posts/media/Tailentudidong_471272692909668/2971766776193568.jpg",
          "type": "image/jpeg"
        }
      ]
    },
    {
      "id": 1740146571000,
      "date": "21/02/2025",
      "dateParsed": {
        "original": "21/02/2025",
        "date": "2025-02-21T09:02:51",
        "year": 2025,
        "month": 2,
        "day": 21,
        "format": "DD/MM/YYYY"
      },
      "type": "other",
      "title": "My son My son",
      "description": "Võ Tuấn Nguyên đã thêm một ảnh mới. My son My son",
      "location": "",
      "witnesses": "",
      "documents": "",
      "images": [
        {
          "id": 1740146571000,
          "name": "9118278068209044.jpg",
          "path": "/Users/tuannguyen8888/Downloads/facebook-tuannguyen8888-30_11_2025-BPwDyk9R/your_facebook_activity/posts/media/Tailentudidong_471272692909668/9118278068209044.jpg",
          "type": "image/jpeg"
        }
      ]
    },
    {
      "id": 1742614805000,
      "date": "21/03/2025",
      "dateParsed": {
        "original": "21/03/2025",
        "date": "2025-03-21T23:40:05",
        "year": 2025,
        "month": 3,
        "day": 21,
        "format": "DD/MM/YYYY"
      },
      "type": "other",
      "title": "Sắp lướt được rồi 😋",
      "description": "Võ Tuấn Nguyên đã thêm 3 ảnh và 2 video. Sắp lướt được rồi 😋",
      "location": "",
      "witnesses": "",
      "documents": "",
      "images": [
        {
          "id": 1742614805000,
          "name": "9289882597715256.jpg",
          "path": "/Users/tuannguyen8888/Downloads/facebook-tuannguyen8888-30_11_2025-BPwDyk9R/your_facebook_activity/posts/media/Tailentudidong_471272692909668/9289882597715256.jpg",
          "type": "image/jpeg"
        },
        {
          "id": 1742614805001,
          "name": "9289882604381922.jpg",
          "path": "/Users/tuannguyen8888/Downloads/facebook-tuannguyen8888-30_11_2025-BPwDyk9R/your_facebook_activity/posts/media/Tailentudidong_471272692909668/9289882604381922.jpg",
          "type": "image/jpeg"
        },
        {
          "id": 1742614805002,
          "name": "9289882847715231.jpg",
          "path": "/Users/tuannguyen8888/Downloads/facebook-tuannguyen8888-30_11_2025-BPwDyk9R/your_facebook_activity/posts/media/Tailentudidong_471272692909668/9289882847715231.jpg",
          "type": "image/jpeg"
        },
        {
          "id": 1742614805003,
          "name": "1541131656556460.mp4",
          "path": "/Users/tuannguyen8888/Downloads/facebook-tuannguyen8888-30_11_2025-BPwDyk9R/your_facebook_activity/posts/media/videos/1541131656556460.mp4",
          "type": "image/jpeg"
        },
        {
          "id": 1742614805004,
          "name": "1317552325965194.mp4",
          "path": "/Users/tuannguyen8888/Downloads/facebook-tuannguyen8888-30_11_2025-BPwDyk9R/your_facebook_activity/posts/media/videos/1317552325965194.mp4",
          "type": "image/jpeg"
        }
      ]
    },
    {
      "id": 1743689104000,
      "date": "03/04/2025",
      "dateParsed": {
        "original": "03/04/2025",
        "date": "2025-04-03T10:05:04",
        "year": 2025,
        "month": 4,
        "day": 3,
        "format": "DD/MM/YYYY"
      },
      "type": "other",
      "title": "Sự kiện với vợ - 03/04/2025",
      "description": "Võ Tuấn Nguyên đã thêm một video mới.",
      "location": "",
      "witnesses": "",
      "documents": "",
      "images": [
        {
          "id": 1743689104000,
          "name": "1654523108808223.mp4",
          "path": "/Users/tuannguyen8888/Downloads/facebook-tuannguyen8888-30_11_2025-BPwDyk9R/your_facebook_activity/posts/media/videos/1654523108808223.mp4",
          "type": "image/jpeg"
        }
      ]
    },
    {
      "id": 1755380365000,
      "date": "16/08/2025",
      "dateParsed": {
        "original": "16/08/2025",
        "date": "2025-08-16T17:39:25",
        "year": 2025,
        "month": 8,
        "day": 16,
        "format": "DD/MM/YYYY"
      },
      "type": "birth",
      "title": "Chúc mừng sinh nhật Honey, yêu em ❤️😍😘\nNhớ em và các con rất nhiều.",
      "description": "Võ Tuấn Nguyên đã thêm 3 ảnh mới. Chúc mừng sinh nhật Honey, yêu em ❤️😍😘\nNhớ em và các con rất nhiều.",
      "location": "",
      "witnesses": "",
      "documents": "",
      "images": [
        {
          "id": 1755380365000,
          "name": "24145551898388415.jpg",
          "path": "/Users/tuannguyen8888/Downloads/facebook-tuannguyen8888-30_11_2025-BPwDyk9R/your_facebook_activity/posts/media/Anhtrendongthoigian_267243079979298/24145551898388415.jpg",
          "type": "image/jpeg"
        },
        {
          "id": 1755380365001,
          "name": "24145551925055079.jpg",
          "path": "/Users/tuannguyen8888/Downloads/facebook-tuannguyen8888-30_11_2025-BPwDyk9R/your_facebook_activity/posts/media/Anhtrendongthoigian_267243079979298/24145551925055079.jpg",
          "type": "image/jpeg"
        },
        {
          "id": 1755380365002,
          "name": "24145551995055072.jpg",
          "path": "/Users/tuannguyen8888/Downloads/facebook-tuannguyen8888-30_11_2025-BPwDyk9R/your_facebook_activity/posts/media/Anhtrendongthoigian_267243079979298/24145551995055072.jpg",
          "type": "image/jpeg"
        }
      ]
    },
    {
      "id": 1756262736000,
      "date": "26/08/2025",
      "dateParsed": {
        "original": "26/08/2025",
        "date": "2025-08-26T22:45:36",
        "year": 2025,
        "month": 8,
        "day": 26,
        "format": "DD/MM/YYYY"
      },
      "type": "other",
      "title": "Cưng quá đi 😘😘😘 Cưng quá đi 😘😘😘",
      "description": "Võ Tuấn Nguyên đã thêm một ảnh mới. Cưng quá đi 😘😘😘 Cưng quá đi 😘😘😘",
      "location": "",
      "witnesses": "",
      "documents": "",
      "images": [
        {
          "id": 1756262736000,
          "name": "24231261653150772.jpg",
          "path": "/Users/tuannguyen8888/Downloads/facebook-tuannguyen8888-30_11_2025-BPwDyk9R/your_facebook_activity/posts/media/Tailentudidong_471272692909668/24231261653150772.jpg",
          "type": "image/jpeg"
        }
      ]
    },
    {
      "id": 1758474232000,
      "date": "21/09/2025",
      "dateParsed": {
        "original": "21/09/2025",
        "date": "2025-09-21T13:03:52",
        "year": 2025,
        "month": 9,
        "day": 21,
        "format": "DD/MM/YYYY"
      },
      "type": "first-meet",
      "title": "Về VN thôi 😊, sắp được gặp rồi Nương Nương @Sam @Bee Về VN thôi 😊, sắp được gặp rồi @[10000648941...",
      "description": "Võ Tuấn Nguyên đã thêm một ảnh mới. Về VN thôi 😊, sắp được gặp rồi Nương Nương @Sam @Bee Về VN thôi 😊, sắp được gặp rồi @[100006489412839:2048:Nương Nương] @Sam @Bee",
      "location": "",
      "witnesses": "",
      "documents": "",
      "images": [
        {
          "id": 1758474232000,
          "name": "24437334649210137.jpg",
          "path": "/Users/tuannguyen8888/Downloads/facebook-tuannguyen8888-30_11_2025-BPwDyk9R/your_facebook_activity/posts/media/Tailentudidong_471272692909668/24437334649210137.jpg",
          "type": "image/jpeg"
        }
      ]
    },
    {
      "id": 1758566405000,
      "date": "22/09/2025",
      "dateParsed": {
        "original": "22/09/2025",
        "date": "2025-09-22T14:40:05",
        "year": 2025,
        "month": 9,
        "day": 22,
        "format": "DD/MM/YYYY"
      },
      "type": "other",
      "title": "Đã về tới VN",
      "description": "Võ Tuấn Nguyên đã thêm 4 ảnh mới. Đã về tới VN",
      "location": "",
      "witnesses": "",
      "documents": "",
      "images": [
        {
          "id": 1758566405000,
          "name": "24445835825026686.jpg",
          "path": "/Users/tuannguyen8888/Downloads/facebook-tuannguyen8888-30_11_2025-BPwDyk9R/your_facebook_activity/posts/media/Tailentudidong_471272692909668/24445835825026686.jpg",
          "type": "image/jpeg"
        },
        {
          "id": 1758566405001,
          "name": "24445835865026682.jpg",
          "path": "/Users/tuannguyen8888/Downloads/facebook-tuannguyen8888-30_11_2025-BPwDyk9R/your_facebook_activity/posts/media/Tailentudidong_471272692909668/24445835865026682.jpg",
          "type": "image/jpeg"
        },
        {
          "id": 1758566405002,
          "name": "24445836125026656.jpg",
          "path": "/Users/tuannguyen8888/Downloads/facebook-tuannguyen8888-30_11_2025-BPwDyk9R/your_facebook_activity/posts/media/Tailentudidong_471272692909668/24445836125026656.jpg",
          "type": "image/jpeg"
        },
        {
          "id": 1758566405003,
          "name": "24445836091693326.jpg",
          "path": "/Users/tuannguyen8888/Downloads/facebook-tuannguyen8888-30_11_2025-BPwDyk9R/your_facebook_activity/posts/media/Tailentudidong_471272692909668/24445836091693326.jpg",
          "type": "image/jpeg"
        }
      ]
    },
    {
      "id": 1759033631000,
      "date": "28/09/2025",
      "dateParsed": {
        "original": "28/09/2025",
        "date": "2025-09-28T00:27:11",
        "year": 2025,
        "month": 9,
        "day": 28,
        "format": "DD/MM/YYYY"
      },
      "type": "other",
      "title": "Cho @Sam @Bee bay về quê thăm bà cố 😊",
      "description": "Võ Tuấn Nguyên đã thêm 6 ảnh mới. Cho @Sam @Bee bay về quê thăm bà cố 😊",
      "location": "",
      "witnesses": "",
      "documents": "",
      "images": [
        {
          "id": 1759033631000,
          "name": "24492091580401110.jpg",
          "path": "/Users/tuannguyen8888/Downloads/facebook-tuannguyen8888-30_11_2025-BPwDyk9R/your_facebook_activity/posts/media/Tailentudidong_471272692909668/24492091580401110.jpg",
          "type": "image/jpeg"
        },
        {
          "id": 1759033631001,
          "name": "24492091783734423.jpg",
          "path": "/Users/tuannguyen8888/Downloads/facebook-tuannguyen8888-30_11_2025-BPwDyk9R/your_facebook_activity/posts/media/Tailentudidong_471272692909668/24492091783734423.jpg",
          "type": "image/jpeg"
        },
        {
          "id": 1759033631002,
          "name": "24492091613734440.jpg",
          "path": "/Users/tuannguyen8888/Downloads/facebook-tuannguyen8888-30_11_2025-BPwDyk9R/your_facebook_activity/posts/media/Tailentudidong_471272692909668/24492091613734440.jpg",
          "type": "image/jpeg"
        },
        {
          "id": 1759033631003,
          "name": "24492091967067738.jpg",
          "path": "/Users/tuannguyen8888/Downloads/facebook-tuannguyen8888-30_11_2025-BPwDyk9R/your_facebook_activity/posts/media/Tailentudidong_471272692909668/24492091967067738.jpg",
          "type": "image/jpeg"
        },
        {
          "id": 1759033631004,
          "name": "24492092033734398.jpg",
          "path": "/Users/tuannguyen8888/Downloads/facebook-tuannguyen8888-30_11_2025-BPwDyk9R/your_facebook_activity/posts/media/Tailentudidong_471272692909668/24492092033734398.jpg",
          "type": "image/jpeg"
        },
        {
          "id": 1759033631005,
          "name": "24492091810401087.jpg",
          "path": "/Users/tuannguyen8888/Downloads/facebook-tuannguyen8888-30_11_2025-BPwDyk9R/your_facebook_activity/posts/media/Tailentudidong_471272692909668/24492091810401087.jpg",
          "type": "image/jpeg"
        }
      ]
    },
    {
      "id": 1759197698000,
      "date": "29/09/2025",
      "dateParsed": {
        "original": "29/09/2025",
        "date": "2025-09-29T22:01:38",
        "year": 2025,
        "month": 9,
        "day": 29,
        "format": "DD/MM/YYYY"
      },
      "type": "other",
      "title": "Sự kiện với vợ - 29/09/2025",
      "description": "Võ Tuấn Nguyên đã thêm 5 ảnh mới. Cafe sáng",
      "location": "",
      "witnesses": "",
      "documents": "",
      "images": [
        {
          "id": 1759197698000,
          "name": "24508529225424012.jpg",
          "path": "/Users/tuannguyen8888/Downloads/facebook-tuannguyen8888-30_11_2025-BPwDyk9R/your_facebook_activity/posts/media/Tailentudidong_471272692909668/24508529225424012.jpg",
          "type": "image/jpeg"
        },
        {
          "id": 1759197698001,
          "name": "24508529312090670.jpg",
          "path": "/Users/tuannguyen8888/Downloads/facebook-tuannguyen8888-30_11_2025-BPwDyk9R/your_facebook_activity/posts/media/Tailentudidong_471272692909668/24508529312090670.jpg",
          "type": "image/jpeg"
        },
        {
          "id": 1759197698002,
          "name": "24508529548757313.jpg",
          "path": "/Users/tuannguyen8888/Downloads/facebook-tuannguyen8888-30_11_2025-BPwDyk9R/your_facebook_activity/posts/media/Tailentudidong_471272692909668/24508529548757313.jpg",
          "type": "image/jpeg"
        },
        {
          "id": 1759197698003,
          "name": "24508529628757305.jpg",
          "path": "/Users/tuannguyen8888/Downloads/facebook-tuannguyen8888-30_11_2025-BPwDyk9R/your_facebook_activity/posts/media/Tailentudidong_471272692909668/24508529628757305.jpg",
          "type": "image/jpeg"
        },
        {
          "id": 1759197698004,
          "name": "24508530092090592.jpg",
          "path": "/Users/tuannguyen8888/Downloads/facebook-tuannguyen8888-30_11_2025-BPwDyk9R/your_facebook_activity/posts/media/Tailentudidong_471272692909668/24508530092090592.jpg",
          "type": "image/jpeg"
        }
      ]
    },
    {
      "id": 1759494918000,
      "date": "03/10/2025",
      "dateParsed": {
        "original": "03/10/2025",
        "date": "2025-10-03T08:35:18",
        "year": 2025,
        "month": 10,
        "day": 3,
        "format": "DD/MM/YYYY"
      },
      "type": "other",
      "title": "Sự kiện với vợ - 03/10/2025",
      "description": "Võ Tuấn Nguyên đã thêm 3 ảnh và một video. Bá cháy",
      "location": "",
      "witnesses": "",
      "documents": "",
      "images": [
        {
          "id": 1759494918000,
          "name": "24544294115180856.jpg",
          "path": "/Users/tuannguyen8888/Downloads/facebook-tuannguyen8888-30_11_2025-BPwDyk9R/your_facebook_activity/posts/media/Tailentudidong_471272692909668/24544294115180856.jpg",
          "type": "image/jpeg"
        },
        {
          "id": 1759494918001,
          "name": "24544294211847513.jpg",
          "path": "/Users/tuannguyen8888/Downloads/facebook-tuannguyen8888-30_11_2025-BPwDyk9R/your_facebook_activity/posts/media/Tailentudidong_471272692909668/24544294211847513.jpg",
          "type": "image/jpeg"
        },
        {
          "id": 1759494918002,
          "name": "24544294488514152.jpg",
          "path": "/Users/tuannguyen8888/Downloads/facebook-tuannguyen8888-30_11_2025-BPwDyk9R/your_facebook_activity/posts/media/Tailentudidong_471272692909668/24544294488514152.jpg",
          "type": "image/jpeg"
        }
      ]
    },
    {
      "id": 1759668481000,
      "date": "05/10/2025",
      "dateParsed": {
        "original": "05/10/2025",
        "date": "2025-10-05T08:48:01",
        "year": 2025,
        "month": 10,
        "day": 5,
        "format": "DD/MM/YYYY"
      },
      "type": "other",
      "title": "Lân vào nhà nội Lân vào nhà nội",
      "description": "Võ Tuấn Nguyên đã thêm một video mới. Lân vào nhà nội Lân vào nhà nội",
      "location": "",
      "witnesses": "",
      "documents": "",
      "images": [
        {
          "id": 1759668481000,
          "name": "821367810757430.mp4",
          "path": "/Users/tuannguyen8888/Downloads/facebook-tuannguyen8888-30_11_2025-BPwDyk9R/your_facebook_activity/posts/media/videos/821367810757430.mp4",
          "type": "image/jpeg"
        }
      ]
    },
    {
      "id": 1759739506000,
      "date": "06/10/2025",
      "dateParsed": {
        "original": "06/10/2025",
        "date": "2025-10-06T04:31:46",
        "year": 2025,
        "month": 10,
        "day": 6,
        "format": "DD/MM/YYYY"
      },
      "type": "other",
      "title": "Tạm biệt bà cố, Sam và Bee vào lại SG đi học",
      "description": "Võ Tuấn Nguyên đã thêm 7 ảnh mới. Tạm biệt bà cố, Sam và Bee vào lại SG đi học",
      "location": "",
      "witnesses": "",
      "documents": "",
      "images": [
        {
          "id": 1759739506000,
          "name": "24572486392361628.jpg",
          "path": "/Users/tuannguyen8888/Downloads/facebook-tuannguyen8888-30_11_2025-BPwDyk9R/your_facebook_activity/posts/media/Tailentudidong_471272692909668/24572486392361628.jpg",
          "type": "image/jpeg"
        },
        {
          "id": 1759739506001,
          "name": "24572486659028268.jpg",
          "path": "/Users/tuannguyen8888/Downloads/facebook-tuannguyen8888-30_11_2025-BPwDyk9R/your_facebook_activity/posts/media/Tailentudidong_471272692909668/24572486659028268.jpg",
          "type": "image/jpeg"
        },
        {
          "id": 1759739506002,
          "name": "24572486405694960.jpg",
          "path": "/Users/tuannguyen8888/Downloads/facebook-tuannguyen8888-30_11_2025-BPwDyk9R/your_facebook_activity/posts/media/Tailentudidong_471272692909668/24572486405694960.jpg",
          "type": "image/jpeg"
        },
        {
          "id": 1759739506003,
          "name": "24572486845694916.jpg",
          "path": "/Users/tuannguyen8888/Downloads/facebook-tuannguyen8888-30_11_2025-BPwDyk9R/your_facebook_activity/posts/media/Tailentudidong_471272692909668/24572486845694916.jpg",
          "type": "image/jpeg"
        },
        {
          "id": 1759739506004,
          "name": "24572486639028270.jpg",
          "path": "/Users/tuannguyen8888/Downloads/facebook-tuannguyen8888-30_11_2025-BPwDyk9R/your_facebook_activity/posts/media/Tailentudidong_471272692909668/24572486639028270.jpg",
          "type": "image/jpeg"
        },
        {
          "id": 1759739506005,
          "name": "24572487055694895.jpg",
          "path": "/Users/tuannguyen8888/Downloads/facebook-tuannguyen8888-30_11_2025-BPwDyk9R/your_facebook_activity/posts/media/Tailentudidong_471272692909668/24572487055694895.jpg",
          "type": "image/jpeg"
        },
        {
          "id": 1759739506006,
          "name": "24572486825694918.jpg",
          "path": "/Users/tuannguyen8888/Downloads/facebook-tuannguyen8888-30_11_2025-BPwDyk9R/your_facebook_activity/posts/media/Tailentudidong_471272692909668/24572486825694918.jpg",
          "type": "image/jpeg"
        }
      ]
    },
    {
      "id": 1759802426000,
      "date": "06/10/2025",
      "dateParsed": {
        "original": "06/10/2025",
        "date": "2025-10-06T22:00:26",
        "year": 2025,
        "month": 10,
        "day": 6,
        "format": "DD/MM/YYYY"
      },
      "type": "other",
      "title": "Về quê trúng ngay trung thu Sam Bee chơi đã luôn 😊",
      "description": "Võ Tuấn Nguyên đã thêm 3 video mới. Về quê trúng ngay trung thu Sam Bee chơi đã luôn 😊",
      "location": "",
      "witnesses": "",
      "documents": "",
      "images": [
        {
          "id": 1759802426000,
          "name": "668979015841456.mp4",
          "path": "/Users/tuannguyen8888/Downloads/facebook-tuannguyen8888-30_11_2025-BPwDyk9R/your_facebook_activity/posts/media/videos/668979015841456.mp4",
          "type": "image/jpeg"
        },
        {
          "id": 1759802426001,
          "name": "809828294746843.mp4",
          "path": "/Users/tuannguyen8888/Downloads/facebook-tuannguyen8888-30_11_2025-BPwDyk9R/your_facebook_activity/posts/media/videos/809828294746843.mp4",
          "type": "image/jpeg"
        },
        {
          "id": 1759802426002,
          "name": "3086116071569377.mp4",
          "path": "/Users/tuannguyen8888/Downloads/facebook-tuannguyen8888-30_11_2025-BPwDyk9R/your_facebook_activity/posts/media/videos/3086116071569377.mp4",
          "type": "image/jpeg"
        }
      ]
    },
    {
      "id": 1762078127000,
      "date": "02/11/2025",
      "dateParsed": {
        "original": "02/11/2025",
        "date": "2025-11-02T05:08:47",
        "year": 2025,
        "month": 11,
        "day": 2,
        "format": "DD/MM/YYYY"
      },
      "type": "other",
      "title": "Tác phẩm mới của Sam, đố mọi người Sam vẽ con gì 😁 Tác phẩm mới của Sam, đố mọi người Sam vẽ con ...",
      "description": "Võ Tuấn Nguyên đã thêm một ảnh mới. Tác phẩm mới của Sam, đố mọi người Sam vẽ con gì 😁 Tác phẩm mới của Sam, đố mọi người Sam vẽ con gì 😁",
      "location": "",
      "witnesses": "",
      "documents": "",
      "images": [
        {
          "id": 1762078127000,
          "name": "24838091535801111.jpg",
          "path": "/Users/tuannguyen8888/Downloads/facebook-tuannguyen8888-30_11_2025-BPwDyk9R/your_facebook_activity/posts/media/Tailentudidong_471272692909668/24838091535801111.jpg",
          "type": "image/jpeg"
        }
      ]
    },
    {
      "id": 1762138918000,
      "date": "02/11/2025",
      "dateParsed": {
        "original": "02/11/2025",
        "date": "2025-11-02T22:01:58",
        "year": 2025,
        "month": 11,
        "day": 2,
        "format": "DD/MM/YYYY"
      },
      "type": "other",
      "title": "Bee hớt tóc cười tươi rói",
      "description": "Võ Tuấn Nguyên đã thêm 4 ảnh mới. Bee hớt tóc cười tươi rói",
      "location": "",
      "witnesses": "",
      "documents": "",
      "images": [
        {
          "id": 1762138918000,
          "name": "24844365151840416.jpg",
          "path": "/Users/tuannguyen8888/Downloads/facebook-tuannguyen8888-30_11_2025-BPwDyk9R/your_facebook_activity/posts/media/Anhtrendongthoigian_267243079979298/24844365151840416.jpg",
          "type": "image/jpeg"
        },
        {
          "id": 1762138918001,
          "name": "24844365221840409.jpg",
          "path": "/Users/tuannguyen8888/Downloads/facebook-tuannguyen8888-30_11_2025-BPwDyk9R/your_facebook_activity/posts/media/Anhtrendongthoigian_267243079979298/24844365221840409.jpg",
          "type": "image/jpeg"
        },
        {
          "id": 1762138918002,
          "name": "24844365245173740.jpg",
          "path": "/Users/tuannguyen8888/Downloads/facebook-tuannguyen8888-30_11_2025-BPwDyk9R/your_facebook_activity/posts/media/Anhtrendongthoigian_267243079979298/24844365245173740.jpg",
          "type": "image/jpeg"
        },
        {
          "id": 1762138918003,
          "name": "24844365175173747.jpg",
          "path": "/Users/tuannguyen8888/Downloads/facebook-tuannguyen8888-30_11_2025-BPwDyk9R/your_facebook_activity/posts/media/Anhtrendongthoigian_267243079979298/24844365175173747.jpg",
          "type": "image/jpeg"
        }
      ]
    },
    {
      "id": 1762688460000,
      "date": "09/11/2025",
      "dateParsed": {
        "original": "09/11/2025",
        "date": "2025-11-09T06:41:00",
        "year": 2025,
        "month": 11,
        "day": 9,
        "format": "DD/MM/YYYY"
      },
      "type": "other",
      "title": "Sam vẽ tặng cô giáo Sam vẽ tặng cô giáo",
      "description": "Võ Tuấn Nguyên đã thêm một ảnh mới. Sam vẽ tặng cô giáo Sam vẽ tặng cô giáo",
      "location": "",
      "witnesses": "",
      "documents": "",
      "images": [
        {
          "id": 1762688460000,
          "name": "24905268565750074.jpg",
          "path": "/Users/tuannguyen8888/Downloads/facebook-tuannguyen8888-30_11_2025-BPwDyk9R/your_facebook_activity/posts/media/Tailentudidong_471272692909668/24905268565750074.jpg",
          "type": "image/jpeg"
        }
      ]
    },
    {
      "id": 1762837049000,
      "date": "10/11/2025",
      "dateParsed": {
        "original": "10/11/2025",
        "date": "2025-11-10T23:57:29",
        "year": 2025,
        "month": 11,
        "day": 10,
        "format": "DD/MM/YYYY"
      },
      "type": "dating",
      "title": "Chúc mừng vợ yêu 🎉🎉🎉",
      "description": "Võ Tuấn Nguyên đã thêm 4 ảnh mới. Chúc mừng vợ yêu 🎉🎉🎉",
      "location": "",
      "witnesses": "",
      "documents": "",
      "images": [
        {
          "id": 1762837049000,
          "name": "24920931210850476.jpg",
          "path": "/Users/tuannguyen8888/Downloads/facebook-tuannguyen8888-30_11_2025-BPwDyk9R/your_facebook_activity/posts/media/Tailentudidong_471272692909668/24920931210850476.jpg",
          "type": "image/jpeg"
        },
        {
          "id": 1762837049001,
          "name": "24920931360850461.jpg",
          "path": "/Users/tuannguyen8888/Downloads/facebook-tuannguyen8888-30_11_2025-BPwDyk9R/your_facebook_activity/posts/media/Tailentudidong_471272692909668/24920931360850461.jpg",
          "type": "image/jpeg"
        },
        {
          "id": 1762837049002,
          "name": "24920931230850474.jpg",
          "path": "/Users/tuannguyen8888/Downloads/facebook-tuannguyen8888-30_11_2025-BPwDyk9R/your_facebook_activity/posts/media/Tailentudidong_471272692909668/24920931230850474.jpg",
          "type": "image/jpeg"
        },
        {
          "id": 1762837049003,
          "name": "24920937614183169.jpg",
          "path": "/Users/tuannguyen8888/Downloads/facebook-tuannguyen8888-30_11_2025-BPwDyk9R/your_facebook_activity/posts/media/Tailentudidong_471272692909668/24920937614183169.jpg",
          "type": "image/jpeg"
        }
      ]
    },
    {
      "id": 1763533290000,
      "date": "19/11/2025",
      "dateParsed": {
        "original": "19/11/2025",
        "date": "2025-11-19T01:21:30",
        "year": 2025,
        "month": 11,
        "day": 19,
        "format": "DD/MM/YYYY"
      },
      "type": "other",
      "title": "Cưng quá đi 😘😘😘 Cưng quá đi 😘😘😘",
      "description": "Võ Tuấn Nguyên đã thêm một video mới. Cưng quá đi 😘😘😘 Cưng quá đi 😘😘😘",
      "location": "",
      "witnesses": "",
      "documents": "",
      "images": [
        {
          "id": 1763533290000,
          "name": "1782950539060102.mp4",
          "path": "/Users/tuannguyen8888/Downloads/facebook-tuannguyen8888-30_11_2025-BPwDyk9R/your_facebook_activity/posts/media/videos/1782950539060102.mp4",
          "type": "image/jpeg"
        }
      ]
    },
    {
      "id": 1763652192000,
      "date": "20/11/2025",
      "dateParsed": {
        "original": "20/11/2025",
        "date": "2025-11-20T10:23:12",
        "year": 2025,
        "month": 11,
        "day": 20,
        "format": "DD/MM/YYYY"
      },
      "type": "dating",
      "title": "Chắc sẽ nhớ lắm đây\nTạm biệt vợ yêu Nương Nương, tạm biệt Sam, tạm biệt Bee.\nHẹn 6 tháng nữa ba l...",
      "description": "Võ Tuấn Nguyên đã thêm một ảnh mới. Chắc sẽ nhớ lắm đây\nTạm biệt vợ yêu Nương Nương, tạm biệt Sam, tạm biệt Bee.\nHẹn 6 tháng nữa ba lại về 😘😘😘 Chắc sẽ nhớ lắm đây\nTạm biệt vợ yêu @[100006489412839:2048:Nương Nương], tạm biệt Sam, tạm biệt Bee.\nHẹn 6 tháng nữa ba lại về 😘😘😘",
      "location": "",
      "witnesses": "",
      "documents": "",
      "images": [
        {
          "id": 1763652192000,
          "name": "25003701902573406.jpg",
          "path": "/Users/tuannguyen8888/Downloads/facebook-tuannguyen8888-30_11_2025-BPwDyk9R/your_facebook_activity/posts/media/Tailentudidong_471272692909668/25003701902573406.jpg",
          "type": "image/jpeg"
        }
      ]
    }
  ]
}