{
  "timelineEvents": [
    {
      "id": 1764508752140,
      "date": "16/02/2015",
      "dateParsed": {
        "original": "16/02/2015",
        "date": "2015-02-16T05:00:00.000Z",
        "year": 2015,
        "month": 2,
        "day": 16,
        "format": "DD/MM/YYYY"
      },
      "type": "first-meet",
      "title": "Lần đầu gặp mặt ở quê",
      "description": "Khi từ Sài Gòn về quê ăn tết âm lịch năm 2015, tôi dùng tính năng Quét quanh đây của ứng dụng chat Zalo và nhìn thấy Zalo của cô ấy với hình ảnh đại diện rất dễ thương, tôi muốn làm quen nên đã nhắn tin. Rất may cô ấy đã đồng ý kết bạn và trả lời tin nhắn. Sau đó chúng tôi gặp nhau tại một quán cafe ở thị trấn Núi Thành. Hôm sau chúng tôi lại hẹn gặp và từ đó giữ liên lạc nói chuyện với nhau.",
      "location": "Núi Thành, Quảng Nam",
      "witnesses": "Em gái và 2 người bạn của cô ấy",
      "documents": "Ảnh đại diện của cô ấy gây ấn tượng với tôi",
      "images": [
        {
          "id": 1764514247233.658,
          "name": "IMG_20150218_080125.jpg",
          "path": "/images/2015-02-16-first-meet/1764514247233-IMG_20150218_080125.jpg",
          "type": "image/jpeg",
          "size": 27905
        }
      ]
    },
    {
      "id": 1764509532747,
      "date": "19/02/2015",
      "dateParsed": {
        "original": "19/02/2015",
        "date": "2015-02-19T05:00:00.000Z",
        "year": 2015,
        "month": 2,
        "day": 19,
        "format": "DD/MM/YYYY"
      },
      "endDate": "22/02/2015",
      "endDateParsed": {
        "original": "22/02/2015",
        "date": "2015-02-22T05:00:00.000Z",
        "year": 2015,
        "month": 2,
        "day": 22,
        "format": "DD/MM/YYYY"
      },
      "type": "dating",
      "title": "Đi chơi tết cùng nhau",
      "description": "Những ngày tết âm lịch 2015, chúng tôi đi chơi cùng nhau. Tôi cũng qua nhà cô ấy nhiều lần và có chở cô ấy về nhà tôi.",
      "location": "Núi Thành, Quảng Nam",
      "witnesses": "Gia đinh và bạn bè 2 bên",
      "documents": "ảnh chụp chung",
      "images": [
        {
          "id": 1764509532741.0796,
          "name": "20150216_2.jpg",
          "path": "/images/2015-02-19-dating/1764509532741-20150216_2.jpg",
          "type": "image/jpeg",
          "size": 28424
        },
        {
          "id": 1764509532743.5496,
          "name": "20150216_3.jpg",
          "path": "/images/2015-02-19-dating/1764509532743-20150216_3.jpg",
          "type": "image/jpeg",
          "size": 30158
        }
      ]
    },
    {
      "id": 1764526568729,
      "date": "07/03/2015",
      "dateParsed": {
        "original": "07/03/2015",
        "date": "2015-03-07T05:00:00.000Z",
        "year": 2015,
        "month": 3,
        "day": 7,
        "format": "DD/MM/YYYY"
      },
      "type": "anniversary",
      "title": "Món quà đầu tiên",
      "description": "Tôi tặng cô ấy 1 chiếc đồng hồ",
      "location": "TP. Hồ Chí Minh",
      "witnesses": "",
      "documents": "Hình ảnh món quà đầu tiền",
      "images": [
        {
          "id": 1764526568727.4854,
          "name": "IMG_20150307_070420.jpg",
          "path": "/images/2015-03-07-anniversary/1764526568727-IMG_20150307_070420.jpg",
          "type": "image/jpeg",
          "size": 62788
        }
      ]
    },
    {
      "id": 1764525556706,
      "date": "17/04/2015",
      "dateParsed": {
        "original": "17/04/2015",
        "date": "2015-04-17T04:00:00.000Z",
        "year": 2015,
        "month": 4,
        "day": 17,
        "format": "DD/MM/YYYY"
      },
      "type": "confess-love",
      "title": "Cô ấy đồng ý yêu nhau",
      "description": "Sau một thời gian tìm hiểu, cô ấy chính thức đồng ý làm người yêu của tôi. Tuyệt vời, tôi rất hạnh phúc",
      "location": "TP. Hồ Chí Minh",
      "witnesses": "",
      "documents": "Ảnh chụp chung",
      "images": [
        {
          "id": 1764525556702.0342,
          "name": "C360_2015-05-02-14-44-16-270.jpg",
          "path": "/images/2015-04-17-confess-love/1764525556702-C360_2015-05-02-14-44-16-270.jpg",
          "type": "image/jpeg",
          "size": 38934
        },
        {
          "id": 1764525556702.4688,
          "name": "C360_2015-05-02-14-51-23-433.jpg",
          "path": "/images/2015-04-17-confess-love/1764525556702-C360_2015-05-02-14-51-23-433.jpg",
          "type": "image/jpeg",
          "size": 37682
        },
        {
          "id": 1764525556703.4119,
          "name": "C360_2015-05-02-14-54-36-732.jpg",
          "path": "/images/2015-04-17-confess-love/1764525556703-C360_2015-05-02-14-54-36-732.jpg",
          "type": "image/jpeg",
          "size": 35497
        }
      ]
    },
    {
      "id": 1764526404620,
      "date": "02/05/2015",
      "dateParsed": {
        "original": "02/05/2015",
        "date": "2015-05-02T04:00:00.000Z",
        "year": 2015,
        "month": 5,
        "day": 2,
        "format": "DD/MM/YYYY"
      },
      "endDate": "30/06/2015",
      "endDateParsed": {
        "original": "30/06/2015",
        "date": "2015-06-30T04:00:00.000Z",
        "year": 2015,
        "month": 6,
        "day": 30,
        "format": "DD/MM/YYYY"
      },
      "type": "anniversary",
      "title": "Nhiều lần hẹn hò",
      "description": "Đây là hình ảnh nhiều lần hẹn hò, gặp nhau, đị dạo, cafe",
      "location": "TP. Hồ Chí Minh",
      "witnesses": "",
      "documents": "Ảnh chụp chung",
      "images": [
        {
          "id": 1764526404615.0737,
          "name": "IMG_20150606_231411.jpg",
          "path": "/images/2015-05-02-other/1764526404615-IMG_20150606_231411.jpg",
          "type": "image/jpeg",
          "size": 57894
        },
        {
          "id": 1764526404615.268,
          "name": "C360_2015-05-06-22-34-30-589.jpg",
          "path": "/images/2015-05-02-other/1764526404615-C360_2015-05-06-22-34-30-589.jpg",
          "type": "image/jpeg",
          "size": 326610
        },
        {
          "id": 1764526404616.3325,
          "name": "C360_2015-05-06-22-33-40-029.jpg",
          "path": "/images/2015-05-02-other/1764526404616-C360_2015-05-06-22-33-40-029.jpg",
          "type": "image/jpeg",
          "size": 397714
        },
        {
          "id": 1764526404616.7954,
          "name": "IMG_20150503_132149.jpg",
          "path": "/images/2015-05-02-other/1764526404616-IMG_20150503_132149.jpg",
          "type": "image/jpeg",
          "size": 254215
        },
        {
          "id": 1764526404617.8206,
          "name": "C360_2015-06-28-13-38-24-555.jpg",
          "path": "/images/2015-05-02-other/1764526404617-C360_2015-06-28-13-38-24-555.jpg",
          "type": "image/jpeg",
          "size": 70035
        },
        {
          "id": 1764526404618.177,
          "name": "IMG_20150606_125350.jpg",
          "path": "/images/2015-05-02-other/1764526404618-IMG_20150606_125350.jpg",
          "type": "image/jpeg",
          "size": 68577
        }
      ]
    },
    {
      "id": 1764526759840,
      "date": "08/08/2015",
      "dateParsed": {
        "original": "08/08/2015",
        "date": "2015-08-08T04:00:00.000Z",
        "year": 2015,
        "month": 8,
        "day": 8,
        "format": "DD/MM/YYYY"
      },
      "type": "anniversary",
      "title": "Sinh nhật tôi",
      "description": "Cùng nhau đi chơi và chúc mừng sinh nhật",
      "location": "TP. Hồ Chí Minh",
      "witnesses": "Em gái tôi",
      "documents": "Ảnh chụp chung",
      "images": [
        {
          "id": 1764526759837.3528,
          "name": "C360_2015-08-08-13-03-30-710.jpg",
          "path": "/images/2015-08-08-anniversary/1764526759837-C360_2015-08-08-13-03-30-710.jpg",
          "type": "image/jpeg",
          "size": 70646
        },
        {
          "id": 1764526759837.4033,
          "name": "C360_2015-08-08-13-05-40-286.jpg",
          "path": "/images/2015-08-08-anniversary/1764526759837-C360_2015-08-08-13-05-40-286.jpg",
          "type": "image/jpeg",
          "size": 82853
        },
        {
          "id": 1764526759837.2454,
          "name": "C360_2015-08-09-20-21-37-197.jpg",
          "path": "/images/2015-08-08-anniversary/1764526759837-C360_2015-08-09-20-21-37-197.jpg",
          "type": "image/jpeg",
          "size": 309296
        }
      ]
    },
    {
      "id": 1764527086410,
      "date": "17/08/2015",
      "dateParsed": {
        "original": "17/08/2015",
        "date": "2015-08-17T04:00:00.000Z",
        "year": 2015,
        "month": 8,
        "day": 17,
        "format": "DD/MM/YYYY"
      },
      "type": "anniversary",
      "title": "Sinh nhật cô ấy",
      "description": "Tôi mua bánh kem tổ chức chúc mừng sinh nhật thứ 23 của cô ấy",
      "location": "TP. Hồ Chí Minh",
      "witnesses": "Bạn bè của cô ấy",
      "documents": "Ảnh chụp chung",
      "images": [
        {
          "id": 1764527086405.3357,
          "name": "IMG_20150816_202342.jpg",
          "path": "/images/2015-08-17-anniversary/1764527086405-IMG_20150816_202342.jpg",
          "type": "image/jpeg",
          "size": 783875
        },
        {
          "id": 1764527086406.4873,
          "name": "C360_2015-09-10-21-57-30-669.jpg",
          "path": "/images/2015-08-17-anniversary/1764527086406-C360_2015-09-10-21-57-30-669.jpg",
          "type": "image/jpeg",
          "size": 129311
        },
        {
          "id": 1764527086406.6096,
          "name": "C360_2015-09-10-21-57-13-437.jpg",
          "path": "/images/2015-08-17-anniversary/1764527086406-C360_2015-09-10-21-57-13-437.jpg",
          "type": "image/jpeg",
          "size": 114530
        },
        {
          "id": 1764527086407.0808,
          "name": "IMG_20150816_202348.jpg",
          "path": "/images/2015-08-17-anniversary/1764527086407-IMG_20150816_202348.jpg",
          "type": "image/jpeg",
          "size": 786767
        }
      ]
    },
    {
      "id": 1764527354038,
      "date": "20/09/2015",
      "dateParsed": {
        "original": "20/09/2015",
        "date": "2015-09-20T04:00:00.000Z",
        "year": 2015,
        "month": 9,
        "day": 20,
        "format": "DD/MM/YYYY"
      },
      "type": "anniversary",
      "title": "Dẫn em trai tôi đi chơi trước ngày Ba, Mẹ và em trai đi mỹ định cư",
      "description": "tôi và cô ấy cùng dẫn em trai tôi đi xem phim, ăn kem, chơi game",
      "location": "TP. Hồ Chí Minh",
      "witnesses": "Em trai tôi",
      "documents": "Ảnh chụp chung",
      "images": [
        {
          "id": 1764527354034.9922,
          "name": "C360_2015-09-20-19-56-32-032.jpg",
          "path": "/images/2015-09-20-anniversary/1764527354034-C360_2015-09-20-19-56-32-032.jpg",
          "type": "image/jpeg",
          "size": 423341
        },
        {
          "id": 1764527354035.8413,
          "name": "C360_2015-09-20-19-56-21-588.jpg",
          "path": "/images/2015-09-20-anniversary/1764527354035-C360_2015-09-20-19-56-21-588.jpg",
          "type": "image/jpeg",
          "size": 516243
        }
      ]
    },
    {
      "id": 1764527600329,
      "date": "21/09/2015",
      "dateParsed": {
        "original": "21/09/2015",
        "date": "2015-09-21T04:00:00.000Z",
        "year": 2015,
        "month": 9,
        "day": 21,
        "format": "DD/MM/YYYY"
      },
      "type": "family-event",
      "title": "Ba, Mẹ và em trai đi Mỹ định cư",
      "description": "Cô ấy cùng tôi, em gái và nhiều người thân đưa tiễn ba, mẹ và em trai đi Mỹ định cư",
      "location": "Sân bay quốc tế Tân Sơn Nhất",
      "witnesses": "Gia đình tôi",
      "documents": "Ảnh chụp chung",
      "images": [
        {
          "id": 1764527600326.0745,
          "name": "C360_2015-09-21-22-43-41-615.jpg",
          "path": "/images/2015-09-21-family-event/1764527600326-C360_2015-09-21-22-43-41-615.jpg",
          "type": "image/jpeg",
          "size": 164613
        },
        {
          "id": 1764527600326.6487,
          "name": "C360_2015-09-21-22-41-29-644.jpg",
          "path": "/images/2015-09-21-family-event/1764527600326-C360_2015-09-21-22-41-29-644.jpg",
          "type": "image/jpeg",
          "size": 115507
        },
        {
          "id": 1764527600327.8792,
          "name": "C360_2015-09-21-22-40-57-310.jpg",
          "path": "/images/2015-09-21-family-event/1764527600327-C360_2015-09-21-22-40-57-310.jpg",
          "type": "image/jpeg",
          "size": 414463
        }
      ]
    },
    {
      "id": 1764527766252,
      "date": "10/10/2015",
      "dateParsed": {
        "original": "10/10/2015",
        "date": "2015-10-10T04:00:00.000Z",
        "year": 2015,
        "month": 10,
        "day": 10,
        "format": "DD/MM/YYYY"
      },
      "type": "anniversary",
      "title": "Mặc áo cặp",
      "description": "Mặc áo cặp thế hiện tình yêu, rất vui vẽ",
      "location": "TP. Hồ Chí Minh",
      "witnesses": "",
      "documents": "Ảnh chụp chung",
      "images": [
        {
          "id": 1764527766249.8577,
          "name": "C360_2015-10-10-22-07-57-087.jpg",
          "path": "/images/2015-10-10-anniversary/1764527766249-C360_2015-10-10-22-07-57-087.jpg",
          "type": "image/jpeg",
          "size": 120741
        },
        {
          "id": 1764527766250.04,
          "name": "C360_2015-10-10-22-08-53-575.jpg",
          "path": "/images/2015-10-10-anniversary/1764527766250-C360_2015-10-10-22-08-53-575.jpg",
          "type": "image/jpeg",
          "size": 343545
        }
      ]
    },
    {
      "id": 1450112244000,
      "date": "14/12/2015",
      "dateParsed": {
        "original": "14/12/2015",
        "date": "2015-12-14T05:00:00.000Z",
        "year": 2015,
        "month": 12,
        "day": 14,
        "format": "DD/MM/YYYY"
      },
      "type": "other",
      "title": "Nhớ em... 💓",
      "description": "Tôi nhớ cô ấy, nên đăng ảnh lên facebook",
      "location": "TP. Hồ Chí Minh",
      "witnesses": "",
      "documents": "",
      "images": [
        {
          "id": 1450112244000,
          "name": "942139179156348.jpg",
          "path": "/images/2015-12-14-other/1764512300120-942139179156348.jpg",
          "type": "image/jpeg"
        },
        {
          "id": 1450112244001,
          "name": "942139199156346.jpg",
          "path": "/images/2015-12-14-other/1764512300121-942139199156346.jpg",
          "type": "image/jpeg"
        }
      ]
    },
    {
      "id": 1764528407879,
      "date": "14/02/2016",
      "dateParsed": {
        "original": "14/02/2016",
        "date": "2016-02-14T05:00:00.000Z",
        "year": 2016,
        "month": 2,
        "day": 14,
        "format": "DD/MM/YYYY"
      },
      "type": "anniversary",
      "title": "Valentin 2016",
      "description": "Tôi và cô ấy mặc áo cặp, mua tặng nhau nhẫn cặp thể hiện tình yêu. Rất ngọt ngào",
      "location": "TP. Hồ Chí Minh",
      "witnesses": "",
      "documents": "Ảnh chụp chung",
      "images": [
        {
          "id": 1764528407874.5957,
          "name": "IMG_20160214_121915.jpg",
          "path": "/images/2016-02-14-anniversary/1764528407874-IMG_20160214_121915.jpg",
          "type": "image/jpeg",
          "size": 38312
        },
        {
          "id": 1764528407874.6003,
          "name": "C360_2016-02-14-21-36-14-968.jpg",
          "path": "/images/2016-02-14-anniversary/1764528407874-C360_2016-02-14-21-36-14-968.jpg",
          "type": "image/jpeg",
          "size": 120405
        },
        {
          "id": 1764528407875.9165,
          "name": "C360_2016-02-14-21-36-49-943.jpg",
          "path": "/images/2016-02-14-anniversary/1764528407875-C360_2016-02-14-21-36-49-943.jpg",
          "type": "image/jpeg",
          "size": 111892
        },
        {
          "id": 1764528407875.2961,
          "name": "C360_2016-02-14-21-37-32-032.jpg",
          "path": "/images/2016-02-14-anniversary/1764528407875-C360_2016-02-14-21-37-32-032.jpg",
          "type": "image/jpeg",
          "size": 90664
        },
        {
          "id": 1764528407876.4578,
          "name": "C360_2016-02-14-21-31-00-933.jpg",
          "path": "/images/2016-02-14-anniversary/1764528407876-C360_2016-02-14-21-31-00-933.jpg",
          "type": "image/jpeg",
          "size": 446265
        }
      ]
    },
    {
      "id": 1764528765674,
      "date": "01/05/2016",
      "dateParsed": {
        "original": "01/05/2016",
        "date": "2016-05-01T04:00:00.000Z",
        "year": 2016,
        "month": 5,
        "day": 1,
        "format": "DD/MM/YYYY"
      },
      "type": "anniversary",
      "title": "Cô ấy nấu ăn ở phòng trọ của tôi",
      "description": "Cô ấy trổ tài nấu ăn, thức ăn rất ngon",
      "location": "TP. Hồ Chí Minh",
      "witnesses": "Em gái tôi, cậu tôi",
      "documents": "Ảnh chụp chung",
      "images": [
        {
          "id": 1764528765672.4365,
          "name": "IMG_0018.JPG",
          "path": "/images/2016-05-01-anniversary/1764528765672-IMG_0018.JPG",
          "type": "image/jpeg",
          "size": 448820
        }
      ]
    },
    {
      "id": 1764528920935,
      "date": "23/05/2016",
      "dateParsed": {
        "original": "23/05/2016",
        "date": "2016-05-23T04:00:00.000Z",
        "year": 2016,
        "month": 5,
        "day": 23,
        "format": "DD/MM/YYYY"
      },
      "type": "anniversary",
      "title": "Đi xem phim cùng nhau",
      "description": "Tôi đưa cô ấy đi xem phim, rất vui vẽ",
      "location": "TP. Hồ Chí Minh",
      "witnesses": "",
      "documents": "Ảnh chụp chung",
      "images": [
        {
          "id": 1764528920931.7488,
          "name": "IMG_0579.JPG",
          "path": "/images/2016-05-23-anniversary/1764528920931-IMG_0579.JPG",
          "type": "image/jpeg",
          "size": 122752
        },
        {
          "id": 1764528920933.1548,
          "name": "IMG_0581.JPG",
          "path": "/images/2016-05-23-anniversary/1764528920933-IMG_0581.JPG",
          "type": "image/jpeg",
          "size": 163843
        }
      ]
    },
    {
      "id": 1764531755558,
      "date": "09/07/2016",
      "dateParsed": {
        "original": "09/07/2016",
        "date": "2016-07-09T04:00:00.000Z",
        "year": 2016,
        "month": 7,
        "day": 9,
        "format": "DD/MM/YYYY"
      },
      "endDate": "10/07/2016",
      "endDateParsed": {
        "original": "10/07/2016",
        "date": "2016-07-10T04:00:00.000Z",
        "year": 2016,
        "month": 7,
        "day": 10,
        "format": "DD/MM/YYYY"
      },
      "type": "anniversary",
      "title": "Cuối tuần vui vẽ",
      "description": "Thường thì cuối tuấn chúng tôi gặp nhau và có những thời gian bên nhau rất vui vẻ",
      "location": "TP. Hồ Chí Minh",
      "witnesses": "",
      "documents": "Ảnh chụp chung",
      "images": [
        {
          "id": 1764531755549.529,
          "name": "IMG_0771.JPG",
          "path": "/images/2016-07-09-anniversary/1764531755549-IMG_0771.JPG",
          "type": "image/jpeg",
          "size": 142879
        },
        {
          "id": 1764531755550.043,
          "name": "IMG_0785.JPG",
          "path": "/images/2016-07-09-anniversary/1764531755550-IMG_0785.JPG",
          "type": "image/jpeg",
          "size": 133754
        },
        {
          "id": 1764531755550.1682,
          "name": "IMG_0784.JPG",
          "path": "/images/2016-07-09-anniversary/1764531755550-IMG_0784.JPG",
          "type": "image/jpeg",
          "size": 138044
        },
        {
          "id": 1764531755550.7207,
          "name": "IMG_0781.JPG",
          "path": "/images/2016-07-09-anniversary/1764531755550-IMG_0781.JPG",
          "type": "image/jpeg",
          "size": 113127
        },
        {
          "id": 1764531755550.3428,
          "name": "IMG_0780.JPG",
          "path": "/images/2016-07-09-anniversary/1764531755550-IMG_0780.JPG",
          "type": "image/jpeg",
          "size": 119984
        },
        {
          "id": 1764531755551.4583,
          "name": "IMG_0777.JPG",
          "path": "/images/2016-07-09-anniversary/1764531755551-IMG_0777.JPG",
          "type": "image/jpeg",
          "size": 461798
        },
        {
          "id": 1764531755552.0166,
          "name": "IMG_0776.JPG",
          "path": "/images/2016-07-09-anniversary/1764531755552-IMG_0776.JPG",
          "type": "image/jpeg",
          "size": 145827
        },
        {
          "id": 1764531755552.9082,
          "name": "IMG_0775.JPG",
          "path": "/images/2016-07-09-anniversary/1764531755552-IMG_0775.JPG",
          "type": "image/jpeg",
          "size": 152088
        }
      ]
    },
    {
      "id": 1764531505145,
      "date": "07/08/2016",
      "dateParsed": {
        "original": "07/08/2016",
        "date": "2016-08-07T04:00:00.000Z",
        "year": 2016,
        "month": 8,
        "day": 7,
        "format": "DD/MM/YYYY"
      },
      "type": "anniversary",
      "title": "Video call",
      "description": "Tôi đi công tác ở xa và video call với cô ấy ",
      "location": "Đà Nẵng",
      "witnesses": "",
      "documents": "Hình chụp màn hình",
      "images": [
        {
          "id": 1764531505139.5537,
          "name": "IMG_0618.PNG",
          "path": "/images/2016-08-07-anniversary/1764531505139-IMG_0618.PNG",
          "type": "image/png",
          "size": 1927289
        },
        {
          "id": 1764531505141.9014,
          "name": "IMG_0619.PNG",
          "path": "/images/2016-08-07-anniversary/1764531505141-IMG_0619.PNG",
          "type": "image/png",
          "size": 1903834
        }
      ]
    },
    {
      "id": 1471410058000,
      "date": "17/08/2016",
      "dateParsed": {
        "original": "17/08/2016",
        "date": "2016-08-17T04:00:00.000Z",
        "year": 2016,
        "month": 8,
        "day": 17,
        "format": "DD/MM/YYYY"
      },
      "type": "anniversary",
      "title": "Sinh nhật cô ấy lần thứ 24",
      "description": "Tôi đưa cô ấy đi nhà hàng, đón sinh nhật 24 tuổi với 1 bữa tối lãng mạn",
      "location": "TP. Hồ Chí Minh",
      "witnesses": "",
      "documents": "hình chụp chung",
      "images": [
        {
          "id": 1471410058000,
          "name": "1081712798532318.jpg",
          "path": "/images/2016-08-17-anniversary/1764512300100-1081712798532318.jpg",
          "type": "image/jpeg"
        },
        {
          "id": 1471410058001,
          "name": "1081712801865651.jpg",
          "path": "/images/2016-08-17-anniversary/1764512300101-1081712801865651.jpg",
          "type": "image/jpeg"
        },
        {
          "id": 1471410058002,
          "name": "1081712845198980.jpg",
          "path": "/images/2016-08-17-anniversary/1764512300102-1081712845198980.jpg",
          "type": "image/jpeg"
        },
        {
          "id": 1764532220473.2395,
          "name": "IMG_1245.JPG",
          "path": "/images/2016-08-17-anniversary/1764532220473-IMG_1245.JPG",
          "type": "image/jpeg",
          "size": 335091
        },
        {
          "id": 1764532220475.199,
          "name": "IMG_1248.JPG",
          "path": "/images/2016-08-17-anniversary/1764532220475-IMG_1248.JPG",
          "type": "image/jpeg",
          "size": 334936
        }
      ]
    },
    {
      "id": 1475990834000,
      "date": "09/10/2016",
      "dateParsed": {
        "original": "09/10/2016",
        "date": "2016-10-09T04:00:00.000Z",
        "year": 2016,
        "month": 10,
        "day": 9,
        "format": "DD/MM/YYYY"
      },
      "type": "other",
      "title": "Hẹn hò",
      "description": "",
      "location": "TP. Hồ Chí Minh",
      "witnesses": "",
      "documents": "Ảnh chụp chung",
      "images": [
        {
          "id": 1475990834000,
          "name": "1125502867486644.jpg",
          "path": "/images/2016-10-09-other/1764512300099-1125502867486644.jpg",
          "type": "image/jpeg"
        },
        {
          "id": 1475990834001,
          "name": "1125502910819973.jpg",
          "path": "/images/2016-10-09-other/1764512300100-1125502910819973.jpg",
          "type": "image/jpeg"
        },
        {
          "id": 1475990834002,
          "name": "1125502967486634.jpg",
          "path": "/images/2016-10-09-other/1764512300100-1125502967486634.jpg",
          "type": "image/jpeg"
        }
      ]
    },
    {
      "id": 1764533666052,
      "date": "31/01/2017",
      "dateParsed": {
        "original": "31/01/2017",
        "date": "2017-01-31T05:00:00.000Z",
        "year": 2017,
        "month": 1,
        "day": 31,
        "format": "DD/MM/YYYY"
      },
      "type": "family-event",
      "title": "Thăm nhà",
      "description": "Gia đình tôi (bà nội, bàn ngoại, các cô, các chú, dì, dượng) qua thăm nhà cô ấy (Mẹ, ông bà nội, các bác, các cô của cô ấy) và bàn luận về vấn đề đính hôn, kết hôn của tôi và cô ấy",
      "location": "Núi Thành, Quảng Nam",
      "witnesses": "Gia đình",
      "documents": "Ảnh chụp chung",
      "images": [
        {
          "id": 1764533666038.7375,
          "name": "IMG_2061.JPG",
          "path": "/images/2017-01-31-family-event/1764533666038-IMG_2061.JPG",
          "type": "image/jpeg",
          "size": 915769
        },
        {
          "id": 1764533666040.5374,
          "name": "IMG_2075.JPG",
          "path": "/images/2017-01-31-family-event/1764533666040-IMG_2075.JPG",
          "type": "image/jpeg",
          "size": 328799
        },
        {
          "id": 1764533666040.8362,
          "name": "IMG_2074.JPG",
          "path": "/images/2017-01-31-family-event/1764533666040-IMG_2074.JPG",
          "type": "image/jpeg",
          "size": 331193
        },
        {
          "id": 1764533666041.4646,
          "name": "IMG_2067.JPG",
          "path": "/images/2017-01-31-family-event/1764533666041-IMG_2067.JPG",
          "type": "image/jpeg",
          "size": 963182
        },
        {
          "id": 1764533666041.8823,
          "name": "IMG_2064.JPG",
          "path": "/images/2017-01-31-family-event/1764533666041-IMG_2064.JPG",
          "type": "image/jpeg",
          "size": 1080002
        },
        {
          "id": 1764533666043.3794,
          "name": "IMG_2063.JPG",
          "path": "/images/2017-01-31-family-event/1764533666043-IMG_2063.JPG",
          "type": "image/jpeg",
          "size": 956124
        }
      ]
    },
    {
      "id": 1487079542000,
      "date": "14/02/2017",
      "dateParsed": {
        "original": "14/02/2017",
        "date": "2017-02-14T08:39:02",
        "year": 2017,
        "month": 2,
        "day": 14,
        "format": "DD/MM/YYYY"
      },
      "type": "other",
      "title": "Valungtung xa HN-SG ❤",
      "description": "Võ Tuấn Nguyên đã thêm 3 ảnh mới. Valungtung xa HN-SG ❤",
      "location": "",
      "witnesses": "",
      "documents": "",
      "images": [
        {
          "id": 1487079542000,
          "name": "1241755562528040.jpg",
          "path": "/images/2017-02-14-other/1764512300097-1241755562528040.jpg",
          "type": "image/jpeg"
        },
        {
          "id": 1487079542001,
          "name": "1241755569194706.jpg",
          "path": "/images/2017-02-14-other/1764512300098-1241755569194706.jpg",
          "type": "image/jpeg"
        },
        {
          "id": 1487079542002,
          "name": "1241755572528039.jpg",
          "path": "/images/2017-02-14-other/1764512300098-1241755572528039.jpg",
          "type": "image/jpeg"
        }
      ]
    },
    {
      "id": 1488623825000,
      "date": "04/03/2017",
      "dateParsed": {
        "original": "04/03/2017",
        "date": "2017-03-04T05:00:00.000Z",
        "year": 2017,
        "month": 3,
        "day": 4,
        "format": "DD/MM/YYYY"
      },
      "endDate": "07/03/2017",
      "endDateParsed": {
        "original": "07/03/2017",
        "date": "2017-03-07T05:00:00.000Z",
        "year": 2017,
        "month": 3,
        "day": 7,
        "format": "DD/MM/YYYY"
      },
      "type": "travel",
      "title": "Đi chơi ở TP. Đà Nẵng, 3 ngày",
      "description": "Tôi và cô ấy đi chơi ở Đà Nẵng, ngắm biển, ăn hải sản",
      "location": "TP. Đà Nẵng",
      "witnesses": "",
      "documents": "Ảnh chụp chung",
      "images": [
        {
          "id": 1488623825000,
          "name": "1257597377610525.jpg",
          "path": "/images/2017-03-04-travel/1764512300095-1257597377610525.jpg",
          "type": "image/jpeg"
        },
        {
          "id": 1488623825001,
          "name": "1257597380943858.jpg",
          "path": "/images/2017-03-04-travel/1764512300095-1257597380943858.jpg",
          "type": "image/jpeg"
        },
        {
          "id": 1488623825002,
          "name": "1257597434277186.jpg",
          "path": "/images/2017-03-04-travel/1764512300096-1257597434277186.jpg",
          "type": "image/jpeg"
        },
        {
          "id": 1488623825003,
          "name": "1257597477610515.jpg",
          "path": "/images/2017-03-04-travel/1764512300096-1257597477610515.jpg",
          "type": "image/jpeg"
        }
      ]
    },
    {
      "id": 1491344899000,
      "date": "04/04/2017",
      "dateParsed": {
        "original": "04/04/2017",
        "date": "2017-04-04T04:00:00.000Z",
        "year": 2017,
        "month": 4,
        "day": 4,
        "format": "DD/MM/YYYY"
      },
      "endDate": "06/04/2017",
      "endDateParsed": {
        "original": "06/04/2017",
        "date": "2017-04-06T04:00:00.000Z",
        "year": 2017,
        "month": 4,
        "day": 6,
        "format": "DD/MM/YYYY"
      },
      "type": "travel",
      "title": "Phú Quốc thẳng tiến :D, 3 ngày",
      "description": "Tôi và cô ấy cùng đi du lịch ở Phú Quốc, đi chơi riêng trước khi hội họp và đi chơi chung với đồng nghiệp",
      "location": "Phú Quốc, Kiên Giang",
      "witnesses": "",
      "documents": "Ảnh chụp chung",
      "images": [
        {
          "id": 1491344899001,
          "name": "1287324354637827.jpg",
          "path": "/images/2017-04-04-travel/1764630511157-1287324354637827.jpg",
          "type": "image/jpeg"
        },
        {
          "id": 1491344899002,
          "name": "1287324357971160.jpg",
          "path": "/images/2017-04-04-travel/1764630511159-1287324357971160.jpg",
          "type": "image/jpeg"
        }
      ]
    },
    {
      "id": 1491526496000,
      "date": "06/04/2017",
      "dateParsed": {
        "original": "06/04/2017",
        "date": "2017-04-06T04:00:00.000Z",
        "year": 2017,
        "month": 4,
        "day": 6,
        "format": "DD/MM/YYYY"
      },
      "endDate": "08/04/2017",
      "endDateParsed": {
        "original": "08/04/2017",
        "date": "2017-04-08T04:00:00.000Z",
        "year": 2017,
        "month": 4,
        "day": 8,
        "format": "DD/MM/YYYY"
      },
      "type": "travel",
      "title": "Cắm trại và đi chơi ở Phú Quốc, 2 ngày",
      "description": "Tôi và cô ấy hội họp với đồng nghiệp của tôi ở Phú Quốc. Sau đó chúng tôi cùng cắm trại và đi chơi các địa điểm ở Phú Quốc",
      "location": "Phú Quốc, Kiên Giang",
      "witnesses": "Bạn và đồng nghiệp của tôi",
      "documents": "Ảnh chụp chung",
      "images": [
        {
          "id": 1764534589283.323,
          "name": "IMG_2403.JPG",
          "path": "/images/2017-04-06-travel/1764534589283-IMG_2403.JPG",
          "type": "image/jpeg",
          "size": 204992
        },
        {
          "id": 1764534589283.0488,
          "name": "IMG_2494.JPG",
          "path": "/images/2017-04-06-travel/1764534589283-IMG_2494.JPG",
          "type": "image/jpeg",
          "size": 161777
        },
        {
          "id": 1764534589284.0505,
          "name": "IMG_2489.JPG",
          "path": "/images/2017-04-06-travel/1764534589284-IMG_2489.JPG",
          "type": "image/jpeg",
          "size": 143246
        },
        {
          "id": 1764534589284.9656,
          "name": "IMG_2482.JPG",
          "path": "/images/2017-04-06-travel/1764534589284-IMG_2482.JPG",
          "type": "image/jpeg",
          "size": 437198
        },
        {
          "id": 1764534589285.124,
          "name": "IMG_2477.JPG",
          "path": "/images/2017-04-06-travel/1764534589285-IMG_2477.JPG",
          "type": "image/jpeg",
          "size": 136441
        },
        {
          "id": 1764534589287.743,
          "name": "IMG_2437.JPG",
          "path": "/images/2017-04-06-travel/1764534589287-IMG_2437.JPG",
          "type": "image/jpeg",
          "size": 194865
        },
        {
          "id": 1764534589289.9941,
          "name": "IMG_2428.JPG",
          "path": "/images/2017-04-06-travel/1764534589289-IMG_2428.JPG",
          "type": "image/jpeg",
          "size": 193562
        },
        {
          "id": 1764534589289.5278,
          "name": "IMG_2427.JPG",
          "path": "/images/2017-04-06-travel/1764534589289-IMG_2427.JPG",
          "type": "image/jpeg",
          "size": 210782
        },
        {
          "id": 1764534589292.112,
          "name": "IMG_2415.JPG",
          "path": "/images/2017-04-06-travel/1764534589292-IMG_2415.JPG",
          "type": "image/jpeg",
          "size": 215529
        },
        {
          "id": 1764534589292.547,
          "name": "IMG_2405.JPG",
          "path": "/images/2017-04-06-travel/1764534589292-IMG_2405.JPG",
          "type": "image/jpeg",
          "size": 213908
        }
      ]
    },
    {
      "id": 1764535014266,
      "date": "07/05/2017",
      "dateParsed": {
        "original": "07/05/2017",
        "date": "2017-05-07T04:00:00.000Z",
        "year": 2017,
        "month": 5,
        "day": 7,
        "format": "DD/MM/YYYY"
      },
      "type": "anniversary",
      "title": "Tham dự đám cưới của cậu (họ hàng) của tôi tại Vũng Tàu",
      "description": "Tôi và cô ấy chạy xe máy từ Sài Gòn đến Vũng Tàu để tham dự đám cưới của cậu tôi, có cả em gái và bạn trai của em gái (hiện tại là chồng) đi chung",
      "location": "TP. Vũng Tàu",
      "witnesses": "Em gái, bạn trai của em gái (hiện tại là chồng)",
      "documents": "Ảnh chụp chung",
      "images": [
        {
          "id": 1764535014261.28,
          "name": "IMG_5834.JPG",
          "path": "/images/2017-05-07-anniversary/1764535014261-IMG_5834.JPG",
          "type": "image/jpeg",
          "size": 161280
        },
        {
          "id": 1764535014262.984,
          "name": "IMG_2573.JPG",
          "path": "/images/2017-05-07-anniversary/1764535014262-IMG_2573.JPG",
          "type": "image/jpeg",
          "size": 287812
        },
        {
          "id": 1764535014263.7227,
          "name": "IMG_2565.JPG",
          "path": "/images/2017-05-07-anniversary/1764535014263-IMG_2565.JPG",
          "type": "image/jpeg",
          "size": 159490
        },
        {
          "id": 1764535014264.1008,
          "name": "IMG_2562.JPG",
          "path": "/images/2017-05-07-anniversary/1764535014264-IMG_2562.JPG",
          "type": "image/jpeg",
          "size": 119500
        }
      ]
    },
    {
      "id": 1764535169111,
      "date": "08/05/2017",
      "dateParsed": {
        "original": "08/05/2017",
        "date": "2017-05-08T04:00:00.000Z",
        "year": 2017,
        "month": 5,
        "day": 8,
        "format": "DD/MM/YYYY"
      },
      "type": "anniversary",
      "title": "Tham dự một bữa tiệt cùng với em gái của cô ấy ",
      "description": "",
      "location": "TP. Hồ Chí Minh",
      "witnesses": "Em gái cô ấy",
      "documents": "Ảnh chụp chung",
      "images": [
        {
          "id": 1764535169108.181,
          "name": "IMG_5881.JPG",
          "path": "/images/2017-05-08-anniversary/1764535169108-IMG_5881.JPG",
          "type": "image/jpeg",
          "size": 150743
        }
      ]
    },
    {
      "id": 1764535502343,
      "date": "07/08/2017",
      "dateParsed": {
        "original": "07/08/2017",
        "date": "2017-08-07T04:00:00.000Z",
        "year": 2017,
        "month": 8,
        "day": 7,
        "format": "DD/MM/YYYY"
      },
      "type": "anniversary",
      "title": "Party sinh nhật tôi",
      "description": "Cô ấy cùng với em gái tôi, em gái cô ấy, và những người bạn chung tổ chức party chúc mừng sinh nhật tôi. Rất vui vẻ",
      "location": "TP. Hồ Chí Minh",
      "witnesses": "Gia đinh và bạn bè 2 bên",
      "documents": "Ảnh chụp chung",
      "images": [
        {
          "id": 1764535502322.8071,
          "name": "IMG_9019.JPG",
          "path": "/images/2017-08-07-anniversary/1764535502322-IMG_9019.JPG",
          "type": "image/jpeg",
          "size": 239336
        }
      ]
    },
    {
      "id": 1502892535000,
      "date": "16/08/2017",
      "dateParsed": {
        "original": "16/08/2017",
        "date": "2017-08-16T04:00:00.000Z",
        "year": 2017,
        "month": 8,
        "day": 16,
        "format": "DD/MM/YYYY"
      },
      "type": "anniversary",
      "title": "Sinh nhật cô ấy",
      "description": "Tôi tổ chức sinh nhật sớm cho cô ấy",
      "location": "TP. Hồ Chí Minh",
      "witnesses": "",
      "documents": "Ảnh chụp chung",
      "images": [
        {
          "id": 1502892535000,
          "name": "1416203305083264.jpg",
          "path": "/images/2017-08-16-anniversary/1764512300078-1416203305083264.jpg",
          "type": "image/jpeg"
        },
        {
          "id": 1502892535001,
          "name": "1416203318416596.jpg",
          "path": "/images/2017-08-16-anniversary/1764512300078-1416203318416596.jpg",
          "type": "image/jpeg"
        },
        {
          "id": 1502892535002,
          "name": "1416203311749930.jpg",
          "path": "/images/2017-08-16-anniversary/1764512300079-1416203311749930.jpg",
          "type": "image/jpeg"
        },
        {
          "id": 1502892535003,
          "name": "1416203321749929.jpg",
          "path": "/images/2017-08-16-anniversary/1764512300079-1416203321749929.jpg",
          "type": "image/jpeg"
        },
        {
          "id": 1502892535004,
          "name": "1416203361749925.jpg",
          "path": "/images/2017-08-16-anniversary/1764512300081-1416203361749925.jpg",
          "type": "image/jpeg"
        },
        {
          "id": 1502892535005,
          "name": "1416203381749923.jpg",
          "path": "/images/2017-08-16-anniversary/1764512300081-1416203381749923.jpg",
          "type": "image/jpeg"
        },
        {
          "id": 1502892535006,
          "name": "1416203401749921.jpg",
          "path": "/images/2017-08-16-anniversary/1764512300082-1416203401749921.jpg",
          "type": "image/jpeg"
        }
      ]
    },
    {
      "id": 1510901422000,
      "date": "01/10/2017",
      "dateParsed": {
        "original": "01/10/2017",
        "date": "2017-10-01T04:00:00.000Z",
        "year": 2017,
        "month": 10,
        "day": 1,
        "format": "DD/MM/YYYY"
      },
      "type": "anniversary",
      "title": "Tham dự đám cưới một người bạn của tôi",
      "description": "Tôi và cô ấy cùng nhau đi đám cưới bạn tôi",
      "location": "TP. Hồ Chí Minh",
      "witnesses": "",
      "documents": "Ảnh chụp chung",
      "images": [
        {
          "id": 1764535836633.4788,
          "name": "IMG_0311.JPG",
          "path": "/images/2017-10-01-anniversary/1764535836633-IMG_0311.JPG",
          "type": "image/jpeg",
          "size": 258090
        },
        {
          "id": 1764535836635.8376,
          "name": "IMG_0303.JPG",
          "path": "/images/2017-10-01-anniversary/1764535836635-IMG_0303.JPG",
          "type": "image/jpeg",
          "size": 233136
        }
      ]
    },
    {
      "id": 1764542806271,
      "date": "20/10/2017",
      "dateParsed": {
        "original": "20/10/2017",
        "date": "2017-10-20T04:00:00.000Z",
        "year": 2017,
        "month": 10,
        "day": 20,
        "format": "DD/MM/YYYY"
      },
      "endDate": "21/10/2017",
      "endDateParsed": {
        "original": "21/10/2017",
        "date": "2017-10-21T04:00:00.000Z",
        "year": 2017,
        "month": 10,
        "day": 21,
        "format": "DD/MM/YYYY"
      },
      "type": "anniversary",
      "title": "Tham dự đám cưới một đồng nghiệp cũ",
      "description": "Tôi và cô ấy cùng nhau đi Buôn Ma Thuộc để tham dự đám cưới của một đồng nghiệp cũ",
      "location": "TP. Buôn Ma Thuộc",
      "witnesses": "Đồng nghiệp của tôi",
      "documents": "Ảnh chụp chung, vé máy bay",
      "images": [
        {
          "id": 1764542806260.9167,
          "name": "IMG_2951.JPG",
          "path": "/images/2017-10-20-anniversary/1764542806260-IMG_2951.JPG",
          "type": "image/jpeg",
          "size": 624359
        },
        {
          "id": 1764542806261.4507,
          "name": "IMG_0582.JPG",
          "path": "/images/2017-10-20-anniversary/1764542806261-IMG_0582.JPG",
          "type": "image/jpeg",
          "size": 186302
        },
        {
          "id": 1764542806262.9844,
          "name": "IMG_0568.JPG",
          "path": "/images/2017-10-20-anniversary/1764542806262-IMG_0568.JPG",
          "type": "image/jpeg",
          "size": 320627
        },
        {
          "id": 1764542806264.583,
          "name": "IMG_2966.JPG",
          "path": "/images/2017-10-20-anniversary/1764542806264-IMG_2966.JPG",
          "type": "image/jpeg",
          "size": 914309
        },
        {
          "id": 1764542806267.78,
          "name": "IMG_2962.JPG",
          "path": "/images/2017-10-20-anniversary/1764542806267-IMG_2962.JPG",
          "type": "image/jpeg",
          "size": 822598
        },
        {
          "id": 1764542819518.3137,
          "name": "Screenshot 2025-11-30 at 5.42.47 PM.png",
          "path": "/images/2017-10-20-anniversary/1764542819518-Screenshot_2025-11-30_at_5.42.47_PM.png",
          "type": "image/png",
          "size": 878123
        }
      ]
    },
    {
      "id": 1764543111406,
      "date": "26/10/2017",
      "dateParsed": {
        "original": "26/10/2017",
        "date": "2017-10-26T04:00:00.000Z",
        "year": 2017,
        "month": 10,
        "day": 26,
        "format": "DD/MM/YYYY"
      },
      "type": "anniversary",
      "title": "Đi xem phim",
      "description": "Tôi đưa cô ấy đi xem phim ",
      "location": "TP. Hồ Chí Minh",
      "witnesses": "",
      "documents": "Ảnh chụp chung, vé xem phim",
      "images": [
        {
          "id": 1764543111402.7947,
          "name": "IMG_2974.PNG",
          "path": "/images/2017-10-26-anniversary/1764543111402-IMG_2974.PNG",
          "type": "image/png",
          "size": 129471
        },
        {
          "id": 1764543111403.4182,
          "name": "IMG_0701.JPG",
          "path": "/images/2017-10-26-anniversary/1764543111403-IMG_0701.JPG",
          "type": "image/jpeg",
          "size": 279971
        },
        {
          "id": 1764543111403.6443,
          "name": "IMG_0698.JPG",
          "path": "/images/2017-10-26-anniversary/1764543111403-IMG_0698.JPG",
          "type": "image/jpeg",
          "size": 272448
        },
        {
          "id": 1764543111404.6511,
          "name": "IMG_0697.JPG",
          "path": "/images/2017-10-26-anniversary/1764543111404-IMG_0697.JPG",
          "type": "image/jpeg",
          "size": 192750
        }
      ]
    },
    {
      "id": 1510928706000,
      "date": "17/11/2017",
      "dateParsed": {
        "original": "17/11/2017",
        "date": "2017-11-17T05:00:00.000Z",
        "year": 2017,
        "month": 11,
        "day": 17,
        "format": "DD/MM/YYYY"
      },
      "endDate": "19/11/2017",
      "endDateParsed": {
        "original": "19/11/2017",
        "date": "2017-11-19T05:00:00.000Z",
        "year": 2017,
        "month": 11,
        "day": 19,
        "format": "DD/MM/YYYY"
      },
      "type": "other",
      "title": "Du lịch Đà Lạt, 3 ngày",
      "description": "Tôi, cô ấy, em gái tôi và bạn trai của em gái (hiện tại đã là chồng) cùng nhau đi du lịch ở Đà Lạt",
      "location": "Đà Lạt, Lâm Đồng",
      "witnesses": "Em gái tôi, bạn trai của em gái (hiện tại đã là chồng)",
      "documents": "",
      "images": [
        {
          "id": 1764636860488.613,
          "name": "IMG_3100.JPG",
          "path": "/images/2017-11-17-other/1764636860488-IMG_3100.JPG",
          "type": "image/jpeg",
          "size": 134381
        },
        {
          "id": 1764636860490.7268,
          "name": "IMG_3147.JPG",
          "path": "/images/2017-11-17-other/1764636860490-IMG_3147.JPG",
          "type": "image/jpeg",
          "size": 126911
        },
        {
          "id": 1764636860497.8674,
          "name": "IMG_0932.JPG",
          "path": "/images/2017-11-17-other/1764636860497-IMG_0932.JPG",
          "type": "image/jpeg",
          "size": 215355
        },
        {
          "id": 1764636860499.4436,
          "name": "IMG_3121.JPG",
          "path": "/images/2017-11-17-other/1764636860499-IMG_3121.JPG",
          "type": "image/jpeg",
          "size": 184307
        },
        {
          "id": 1764636860503.6929,
          "name": "IMG_3116.JPG",
          "path": "/images/2017-11-17-other/1764636860503-IMG_3116.JPG",
          "type": "image/jpeg",
          "size": 600738
        },
        {
          "id": 1764636860511.1594,
          "name": "IMG_3098.JPG",
          "path": "/images/2017-11-17-other/1764636860511-IMG_3098.JPG",
          "type": "image/jpeg",
          "size": 144166
        }
      ]
    },
    {
      "id": 1764637090335,
      "date": "11/12/2017",
      "dateParsed": {
        "original": "11/12/2017",
        "date": "2017-12-11T05:00:00.000Z",
        "year": 2017,
        "month": 12,
        "day": 11,
        "format": "DD/MM/YYYY"
      },
      "type": "travel",
      "title": "Đi chơi ở Vũng Tàu, 1 ngày",
      "description": "Một chuyến đi chơi lãng mạn của tôi cùng cô ấy ",
      "location": "TP. Vũng Tàu",
      "witnesses": "",
      "documents": "Ảnh chụp chung",
      "images": [
        {
          "id": 1764637090325.674,
          "name": "IMG_3217.JPG",
          "path": "/images/2017-12-11-travel/1764637090325-IMG_3217.JPG",
          "type": "image/jpeg",
          "size": 150319
        },
        {
          "id": 1764637090326.9722,
          "name": "IMG_3211.JPG",
          "path": "/images/2017-12-11-travel/1764637090326-IMG_3211.JPG",
          "type": "image/jpeg",
          "size": 142152
        },
        {
          "id": 1764637090326.893,
          "name": "IMG_3222.JPG",
          "path": "/images/2017-12-11-travel/1764637090326-IMG_3222.JPG",
          "type": "image/jpeg",
          "size": 478590
        },
        {
          "id": 1764637090327.8218,
          "name": "IMG_3218.JPG",
          "path": "/images/2017-12-11-travel/1764637090327-IMG_3218.JPG",
          "type": "image/jpeg",
          "size": 119819
        }
      ]
    },
    {
      "id": 1764637236394,
      "date": "17/12/2017",
      "dateParsed": {
        "original": "17/12/2017",
        "date": "2017-12-17T05:00:00.000Z",
        "year": 2017,
        "month": 12,
        "day": 17,
        "format": "DD/MM/YYYY"
      },
      "type": "other",
      "title": "Thử lễ phục đính hôn",
      "description": "Chúng tôi đi tìm và thử trạng phục cho lễ đính hôn",
      "location": "TP. Hồ Chí Minh",
      "witnesses": "",
      "documents": "Ảnh chụp chung",
      "images": [
        {
          "id": 1764637236387.4146,
          "name": "IMG_3254.JPG",
          "path": "/images/2017-12-17-other/1764637236387-IMG_3254.JPG",
          "type": "image/jpeg",
          "size": 624432
        },
        {
          "id": 1764637236388.4634,
          "name": "IMG_3257.JPG",
          "path": "/images/2017-12-17-other/1764637236388-IMG_3257.JPG",
          "type": "image/jpeg",
          "size": 893639
        },
        {
          "id": 1764637236389.391,
          "name": "IMG_3256.JPG",
          "path": "/images/2017-12-17-other/1764637236389-IMG_3256.JPG",
          "type": "image/jpeg",
          "size": 831686
        }
      ]
    },
    {
      "id": 1764637707511,
      "date": "26/12/2017",
      "dateParsed": {
        "original": "26/12/2017",
        "date": "2017-12-26T05:00:00.000Z",
        "year": 2017,
        "month": 12,
        "day": 26,
        "format": "DD/MM/YYYY"
      },
      "type": "anniversary",
      "title": "Dự đám cưới đồng nghiệp",
      "description": "Tôi và cô ấy dự dám cưới một đồng nghiệp của tôi",
      "location": "TP. Hồ Chí Minh",
      "witnesses": "Đồng nghiệp của tôi",
      "documents": "Ảnh chụp chung",
      "images": [
        {
          "id": 1764637707506.6802,
          "name": "IMG_3284.JPG",
          "path": "/images/2017-12-26-anniversary/1764637707506-IMG_3284.JPG",
          "type": "image/jpeg",
          "size": 134649
        },
        {
          "id": 1764637707507.61,
          "name": "IMG_3289.JPG",
          "path": "/images/2017-12-26-anniversary/1764637707507-IMG_3289.JPG",
          "type": "image/jpeg",
          "size": 412697
        },
        {
          "id": 1764637707508.3484,
          "name": "IMG_3293.JPG",
          "path": "/images/2017-12-26-anniversary/1764637707508-IMG_3293.JPG",
          "type": "image/jpeg",
          "size": 413551
        }
      ]
    },
    {
      "id": 1514635991000,
      "date": "30/12/2017",
      "dateParsed": {
        "original": "30/12/2017",
        "date": "2017-12-30T05:00:00.000Z",
        "year": 2017,
        "month": 12,
        "day": 30,
        "format": "DD/MM/YYYY"
      },
      "type": "other",
      "title": "Mua nhẫn cưới",
      "description": "Chúng tôi quyết định mua nhẫn cưới để chuẩn bị đính hôn",
      "location": "TP. Hồ Chí Minh",
      "witnesses": "",
      "documents": "Hình ảnh nhẫn cưới",
      "images": [
        {
          "id": 1514635991000,
          "name": "1533383436698583.jpg",
          "path": "/images/2017-12-30-other/1764512300064-1533383436698583.jpg",
          "type": "image/jpeg"
        }
      ]
    },
    {
      "id": 1764638031597,
      "date": "05/01/2018",
      "dateParsed": {
        "original": "05/01/2018",
        "date": "2018-01-05T05:00:00.000Z",
        "year": 2018,
        "month": 1,
        "day": 5,
        "format": "DD/MM/YYYY"
      },
      "type": "other",
      "title": "Chuẩn bị lễ đính hôn",
      "description": "Chúng tôi đến studio chụp ảnh để show trong lễ đính hôn",
      "location": "TP. Hồ Chí Minh",
      "witnesses": "",
      "documents": "Ảnh chụp chung",
      "images": [
        {
          "id": 1764638031592.0386,
          "name": "IMG_3320.JPG",
          "path": "/images/2018-01-05-other/1764638031592-IMG_3320.JPG",
          "type": "image/jpeg",
          "size": 129995
        },
        {
          "id": 1764638031593.9583,
          "name": "IMG_1405.JPG",
          "path": "/images/2018-01-05-other/1764638031593-IMG_1405.JPG",
          "type": "image/jpeg",
          "size": 176070
        },
        {
          "id": 1764638031593.5095,
          "name": "IMG_3321.JPG",
          "path": "/images/2018-01-05-other/1764638031593-IMG_3321.JPG",
          "type": "image/jpeg",
          "size": 109491
        },
        {
          "id": 1764639769836.8132,
          "name": "IMG_1492.JPG",
          "path": "/images/2018-01-05-other/1764639769836-IMG_1492.JPG",
          "type": "image/jpeg",
          "size": 216615
        }
      ]
    },
    {
      "id": 1764639325968,
      "date": "08/02/2018",
      "dateParsed": {
        "original": "08/02/2018",
        "date": "2018-02-08T05:00:00.000Z",
        "year": 2018,
        "month": 2,
        "day": 8,
        "format": "DD/MM/YYYY"
      },
      "type": "engagement",
      "title": "Lễ đính hôn",
      "description": "Chúng tôi tổ chức lễ đính hôn với sự chứng kiến của gia đình họ hàng 2 bên",
      "location": "Núi Thành, Quảng Nam",
      "witnesses": "gia đình họ hàng 2 bên",
      "documents": "Ảnh chụp chung",
      "images": [
        {
          "id": 1764639325958.7698,
          "name": "465070800_8488106961226161_9028488224539944193_n.jpg",
          "path": "/images/2018-02-08-engagement/1764639325958-465070800_8488106961226161_9028488224539944193_n.jpg",
          "type": "image/jpeg",
          "size": 358535
        },
        {
          "id": 1764639325960.698,
          "name": "465224959_8488107124559478_4708922834652675315_n.jpg",
          "path": "/images/2018-02-08-engagement/1764639325960-465224959_8488107124559478_4708922834652675315_n.jpg",
          "type": "image/jpeg",
          "size": 492235
        },
        {
          "id": 1764639325962.259,
          "name": "465275513_8488107681226089_2922517739276783434_n.jpg",
          "path": "/images/2018-02-08-engagement/1764639325962-465275513_8488107681226089_2922517739276783434_n.jpg",
          "type": "image/jpeg",
          "size": 511293
        },
        {
          "id": 1764639325962.1604,
          "name": "465143061_8488107331226124_3894870954490656305_n.jpg",
          "path": "/images/2018-02-08-engagement/1764639325962-465143061_8488107331226124_3894870954490656305_n.jpg",
          "type": "image/jpeg",
          "size": 450434
        },
        {
          "id": 1764639516243.8948,
          "name": "465237534_8488106794559511_4884751036907948482_n.jpg",
          "path": "/images/2018-02-08-engagement/1764639516243-465237534_8488106794559511_4884751036907948482_n.jpg",
          "type": "image/jpeg",
          "size": 183253
        },
        {
          "id": 1764639516244.0435,
          "name": "465013470_8488107301226127_8365136123214572256_n.jpg",
          "path": "/images/2018-02-08-engagement/1764639516244-465013470_8488107301226127_8365136123214572256_n.jpg",
          "type": "image/jpeg",
          "size": 211525
        },
        {
          "id": 1764639516245.437,
          "name": "465023461_8488106984559492_2405208977791640291_n.jpg",
          "path": "/images/2018-02-08-engagement/1764639516245-465023461_8488106984559492_2405208977791640291_n.jpg",
          "type": "image/jpeg",
          "size": 251538
        },
        {
          "id": 1764639516246.4072,
          "name": "465267658_8488107147892809_444489656025059113_n.jpg",
          "path": "/images/2018-02-08-engagement/1764639516246-465267658_8488107147892809_444489656025059113_n.jpg",
          "type": "image/jpeg",
          "size": 230075
        },
        {
          "id": 1764639516246.435,
          "name": "465391683_8488107321226125_6163981216586237501_n.jpg",
          "path": "/images/2018-02-08-engagement/1764639516246-465391683_8488107321226125_6163981216586237501_n.jpg",
          "type": "image/jpeg",
          "size": 242465
        },
        {
          "id": 1764639516247.9944,
          "name": "465033212_8488107687892755_2901951199276823328_n.jpg",
          "path": "/images/2018-02-08-engagement/1764639516247-465033212_8488107687892755_2901951199276823328_n.jpg",
          "type": "image/jpeg",
          "size": 264302
        }
      ]
    },
    {
      "id": 1764639726002,
      "date": "16/02/2018",
      "dateParsed": {
        "original": "16/02/2018",
        "date": "2018-02-16T05:00:00.000Z",
        "year": 2018,
        "month": 2,
        "day": 16,
        "format": "DD/MM/YYYY"
      },
      "type": "family-event",
      "title": "Video call với ba tôi",
      "description": "Tôi, cô ấy, bà nội tôi, ba tôi (ở Mỹ) nói chuyện với nhau qua video call",
      "location": "Núi Thành, Quảng Nam",
      "witnesses": "Ba tôi, bà nội tôi",
      "documents": "Ảnh chụp màn hình",
      "images": [
        {
          "id": 1764639725998.5718,
          "name": "IMG_3424.PNG",
          "path": "/images/2018-02-16-family-event/1764639725998-IMG_3424.PNG",
          "type": "image/png",
          "size": 1994291
        }
      ]
    },
    {
      "id": 1764640009725,
      "date": "11/03/2018",
      "dateParsed": {
        "original": "11/03/2018",
        "date": "2018-03-11T05:00:00.000Z",
        "year": 2018,
        "month": 3,
        "day": 11,
        "format": "DD/MM/YYYY"
      },
      "type": "other",
      "title": "Đón tiếp đối tác từ Malaysia",
      "description": "Cô ấy cùng tôi và các đồng nghiệp của tôi đón tiếp các đối tác làm việc của tôi từ Malaysia sang Việt Nam",
      "location": "TP. Hồ Chí Minh",
      "witnesses": "Đồng nghiệp, đối tác",
      "documents": "Ảnh chụp chung",
      "images": [
        {
          "id": 1764640009722.5442,
          "name": "IMG_3574.JPG",
          "path": "/images/2018-03-11-other/1764640009722-IMG_3574.JPG",
          "type": "image/jpeg",
          "size": 577517
        }
      ]
    },
    {
      "id": 1764640131589,
      "date": "29/03/2018",
      "dateParsed": {
        "original": "29/03/2018",
        "date": "2018-03-29T04:00:00.000Z",
        "year": 2018,
        "month": 3,
        "day": 29,
        "format": "DD/MM/YYYY"
      },
      "type": "other",
      "title": "Họp mặt bạn đại học của tôi",
      "description": "Cô ấy cùng tôi họp mặt với các bạn cùng lớp đại học của tôi",
      "location": "TP. Hồ Chí Minh",
      "witnesses": "Bạn bè",
      "documents": "Ảnh chụp chung",
      "images": [
        {
          "id": 1764640131587.639,
          "name": "IMG_3596.JPG",
          "path": "/images/2018-03-29-other/1764640131587-IMG_3596.JPG",
          "type": "image/jpeg",
          "size": 912133
        },
        {
          "id": 1764640131587.4314,
          "name": "IMG_3599.JPG",
          "path": "/images/2018-03-29-other/1764640131587-IMG_3599.JPG",
          "type": "image/jpeg",
          "size": 45843
        }
      ]
    },
    {
      "id": 1523464908000,
      "date": "11/04/2018",
      "dateParsed": {
        "original": "11/04/2018",
        "date": "2018-04-11T12:41:48",
        "year": 2018,
        "month": 4,
        "day": 11,
        "format": "DD/MM/YYYY"
      },
      "type": "other",
      "title": "Sự kiện với vợ - 11/04/2018",
      "description": "Võ Tuấn Nguyên đã thêm 3 ảnh mới. ❤️❤️❤️",
      "location": "",
      "witnesses": "",
      "documents": "",
      "images": [
        {
          "id": 1523464908000,
          "name": "1632290446807881.jpg",
          "path": "/images/2018-04-11-other/1764512300061-1632290446807881.jpg",
          "type": "image/jpeg"
        },
        {
          "id": 1523464908001,
          "name": "1632290423474550.jpg",
          "path": "/images/2018-04-11-other/1764512300061-1632290423474550.jpg",
          "type": "image/jpeg"
        },
        {
          "id": 1523464908002,
          "name": "1632290540141205.jpg",
          "path": "/images/2018-04-11-other/1764512300062-1632290540141205.jpg",
          "type": "image/jpeg"
        }
      ]
    },
    {
      "id": 1525542051000,
      "date": "05/05/2018",
      "dateParsed": {
        "original": "05/05/2018",
        "date": "2018-05-05T13:40:51",
        "year": 2018,
        "month": 5,
        "day": 5,
        "format": "DD/MM/YYYY"
      },
      "type": "other",
      "title": "Cuối tuần với em ❤️",
      "description": "Võ Tuấn Nguyên đã thêm 2 ảnh mới. Cuối tuần với em ❤️",
      "location": "",
      "witnesses": "",
      "documents": "",
      "images": [
        {
          "id": 1525542051000,
          "name": "1655274434509482.jpg",
          "path": "/images/2018-05-05-other/1764512300059-1655274434509482.jpg",
          "type": "image/jpeg"
        },
        {
          "id": 1525542051001,
          "name": "1655274421176150.jpg",
          "path": "/images/2018-05-05-other/1764512300060-1655274421176150.jpg",
          "type": "image/jpeg"
        }
      ]
    },
    {
      "id": 1764640391374,
      "date": "26/05/2018",
      "dateParsed": {
        "original": "26/05/2018",
        "date": "2018-05-26T04:00:00.000Z",
        "year": 2018,
        "month": 5,
        "day": 26,
        "format": "DD/MM/YYYY"
      },
      "type": "anniversary",
      "title": "Chụp ảnh cưới",
      "description": "Tôi và cô ấy chụp ảnh cưới để chuẩn bị cho đám cưới",
      "location": "TP. Hồ Chí Minh",
      "witnesses": "",
      "documents": "Ảnh chụp chung",
      "images": [
        {
          "id": 1764640391366.1458,
          "name": "IMG_2183.JPG",
          "path": "/images/2018-05-26-anniversary/1764640391366-IMG_2183.JPG",
          "type": "image/jpeg",
          "size": 30958
        },
        {
          "id": 1764640391367.8025,
          "name": "thiepnhahang.JPG",
          "path": "/images/2018-05-26-anniversary/1764640391367-thiepnhahang.JPG",
          "type": "image/jpeg",
          "size": 1160863
        },
        {
          "id": 1764640391368.9124,
          "name": "IMG_3850.JPG",
          "path": "/images/2018-05-26-anniversary/1764640391368-IMG_3850.JPG",
          "type": "image/jpeg",
          "size": 538436
        },
        {
          "id": 1764640391368.2378,
          "name": "phongbi.JPG",
          "path": "/images/2018-05-26-anniversary/1764640391368-phongbi.JPG",
          "type": "image/jpeg",
          "size": 649169
        },
        {
          "id": 1764640391369.3223,
          "name": "thieple.JPG",
          "path": "/images/2018-05-26-anniversary/1764640391369-thieple.JPG",
          "type": "image/jpeg",
          "size": 689706
        },
        {
          "id": 1764640391371.004,
          "name": "IMG_2189.JPG",
          "path": "/images/2018-05-26-anniversary/1764640391371-IMG_2189.JPG",
          "type": "image/jpeg",
          "size": 1400105
        }
      ]
    },
    {
      "id": 1527920167000,
      "date": "02/06/2018",
      "dateParsed": {
        "original": "02/06/2018",
        "date": "2018-06-02T04:00:00.000Z",
        "year": 2018,
        "month": 6,
        "day": 2,
        "format": "DD/MM/YYYY"
      },
      "type": "anniversary",
      "title": "Dự đám cưới con của dì 2 tôi",
      "description": "Tôi và cô ấy cùng về quê dự đám cưới con của dì 2 tôi",
      "location": "Núi Thành, Quảng Nam",
      "witnesses": "",
      "documents": "Ảnh chụp chung",
      "images": [
        {
          "id": 1527920167000,
          "name": "1680261405344118.jpg",
          "path": "/images/2018-06-02-anniversary/1764512300057-1680261405344118.jpg",
          "type": "image/jpeg"
        },
        {
          "id": 1527920167001,
          "name": "1680261458677446.jpg",
          "path": "/images/2018-06-02-anniversary/1764512300058-1680261458677446.jpg",
          "type": "image/jpeg"
        },
        {
          "id": 1527920167002,
          "name": "1680261395344119.jpg",
          "path": "/images/2018-06-02-anniversary/1764512300058-1680261395344119.jpg",
          "type": "image/jpeg"
        }
      ]
    },
    {
      "id": 1531030632000,
      "date": "08/07/2018",
      "dateParsed": {
        "original": "08/07/2018",
        "date": "2018-07-08T04:00:00.000Z",
        "year": 2018,
        "month": 7,
        "day": 8,
        "format": "DD/MM/YYYY"
      },
      "type": "other",
      "title": "Mini trip cùng những người bạn và đồng nghiệp trong công ty tôi làm, 1 ngày",
      "description": "Cô ấy cùng tôi đi mini trip",
      "location": "TP. Hồ Chí Minh",
      "witnesses": "Bạn & đồng nghiệp của tôi",
      "documents": "Ảnh chụp chung",
      "images": [
        {
          "id": 1531030632000,
          "name": "1727260963977495.jpg",
          "path": "/images/2018-07-08-other/1764512300050-1727260963977495.jpg",
          "type": "image/jpeg"
        },
        {
          "id": 1531030632001,
          "name": "1727261030644155.jpg",
          "path": "/images/2018-07-08-other/1764512300051-1727261030644155.jpg",
          "type": "image/jpeg"
        },
        {
          "id": 1531030632002,
          "name": "1727261040644154.jpg",
          "path": "/images/2018-07-08-other/1764512300052-1727261040644154.jpg",
          "type": "image/jpeg"
        },
        {
          "id": 1531030632003,
          "name": "1727260997310825.jpg",
          "path": "/images/2018-07-08-other/1764512300053-1727260997310825.jpg",
          "type": "image/jpeg"
        },
        {
          "id": 1531030632004,
          "name": "1727261107310814.jpg",
          "path": "/images/2018-07-08-other/1764512300054-1727261107310814.jpg",
          "type": "image/jpeg"
        }
      ]
    },
    {
      "id": 1764640702532,
      "date": "11/07/2018",
      "dateParsed": {
        "original": "11/07/2018",
        "date": "2018-07-11T04:00:00.000Z",
        "year": 2018,
        "month": 7,
        "day": 11,
        "format": "DD/MM/YYYY"
      },
      "type": "other",
      "title": "Chuẩn bị cho lễ Thành hôn ",
      "description": "Chúng tôi đi thử lễ phục, chuẩn bị cho lễ Thành hôn",
      "location": "TP. Hồ Chí Minh",
      "witnesses": "",
      "documents": "Ảnh chụp chung",
      "images": [
        {
          "id": 1764640702521.4412,
          "name": "IMG_4014.JPG",
          "path": "/images/2018-07-11-other/1764640702521-IMG_4014.JPG",
          "type": "image/jpeg",
          "size": 559925
        },
        {
          "id": 1764640702524.177,
          "name": "IMG_4034.JPG",
          "path": "/images/2018-07-11-other/1764640702524-IMG_4034.JPG",
          "type": "image/jpeg",
          "size": 630354
        },
        {
          "id": 1764640702526.775,
          "name": "IMG_4020.JPG",
          "path": "/images/2018-07-11-other/1764640702526-IMG_4020.JPG",
          "type": "image/jpeg",
          "size": 737234
        }
      ]
    },
    {
      "id": 1533176849000,
      "date": "31/07/2018",
      "dateParsed": {
        "original": "31/07/2018",
        "date": "2018-07-31T04:00:00.000Z",
        "year": 2018,
        "month": 7,
        "day": 31,
        "format": "DD/MM/YYYY"
      },
      "type": "wedding",
      "title": "Đám cưới",
      "description": "Chúng tôi làm đám cưới ở quê. Ở thời điểm này, chúng tôi chỉ làm đám cưới chứ chưa đăng ký kết hôn để giữ diện bảo lãnh cho tôi.",
      "location": "TP. Hồ Chí Minh",
      "witnesses": "Gia đinh và bạn bè 2 bên",
      "documents": "Ảnh chụp chung",
      "images": [
        {
          "id": 1533176849000,
          "name": "1764715063565418.jpg",
          "path": "/images/2018-07-31-wedding/1764512300044-1764715063565418.jpg",
          "type": "image/jpeg"
        },
        {
          "id": 1533176849001,
          "name": "1764715073565417.jpg",
          "path": "/images/2018-07-31-wedding/1764512300044-1764715073565417.jpg",
          "type": "image/jpeg"
        },
        {
          "id": 1533176849002,
          "name": "1764715140232077.jpg",
          "path": "/images/2018-07-31-wedding/1764512300046-1764715140232077.jpg",
          "type": "image/jpeg"
        },
        {
          "id": 1764641380091.527,
          "name": "IMG_4201.JPG",
          "path": "/images/2018-07-31-wedding/1764641380091-IMG_4201.JPG",
          "type": "image/jpeg",
          "size": 213387
        },
        {
          "id": 1764641380098.8638,
          "name": "IMG_4275.JPG",
          "path": "/images/2018-07-31-wedding/1764641380098-IMG_4275.JPG",
          "type": "image/jpeg",
          "size": 445192
        },
        {
          "id": 1764641380099.604,
          "name": "IMG_4273.JPG",
          "path": "/images/2018-07-31-wedding/1764641380099-IMG_4273.JPG",
          "type": "image/jpeg",
          "size": 442175
        },
        {
          "id": 1764641380099.8174,
          "name": "IMG_4261.JPG",
          "path": "/images/2018-07-31-wedding/1764641380099-IMG_4261.JPG",
          "type": "image/jpeg",
          "size": 185856
        }
      ]
    },
    {
      "id": 1764640957886,
      "date": "31/07/2018",
      "dateParsed": {
        "original": "31/07/2018",
        "date": "2018-07-31T04:00:00.000Z",
        "year": 2018,
        "month": 7,
        "day": 31,
        "format": "DD/MM/YYYY"
      },
      "type": "wedding",
      "title": "Thiệp cưới",
      "description": "",
      "location": "",
      "witnesses": "",
      "documents": "",
      "images": [
        {
          "id": 1764640957879.8108,
          "name": "IMG_4108.JPG",
          "path": "/images/2018-07-31-wedding/1764640957879-IMG_4108.JPG",
          "type": "image/jpeg",
          "size": 430661
        },
        {
          "id": 1764640957881.049,
          "name": "IMG_4143.JPG",
          "path": "/images/2018-07-31-wedding/1764640957881-IMG_4143.JPG",
          "type": "image/jpeg",
          "size": 521042
        }
      ]
    },
    {
      "id": 1535289647000,
      "date": "05/08/2018",
      "dateParsed": {
        "original": "05/08/2018",
        "date": "2018-08-05T04:00:00.000Z",
        "year": 2018,
        "month": 8,
        "day": 5,
        "format": "DD/MM/YYYY"
      },
      "type": "family-event",
      "title": "Tham dự đám cưới của em gái tôi",
      "description": "",
      "location": "TP. Hồ Chí Minh",
      "witnesses": "Gia đinh và bạn bè",
      "documents": "Ảnh chụp chung",
      "images": [
        {
          "id": 1535289647000,
          "name": "1804553379581586.jpg",
          "path": "/images/2018-08-05-family-event/1764512297981-1804553379581586.jpg",
          "type": "image/jpeg"
        },
        {
          "id": 1535289647001,
          "name": "1804557442914513.jpg",
          "path": "/images/2018-08-05-family-event/1764512297981-1804557442914513.jpg",
          "type": "image/jpeg"
        },
        {
          "id": 1535289647002,
          "name": "1804557566247834.jpg",
          "path": "/images/2018-08-05-family-event/1764512297983-1804557566247834.jpg",
          "type": "image/jpeg"
        },
        {
          "id": 1535289647003,
          "name": "1804557599581164.jpg",
          "path": "/images/2018-08-05-family-event/1764512297984-1804557599581164.jpg",
          "type": "image/jpeg"
        },
        {
          "id": 1535289647004,
          "name": "1804557702914487.jpg",
          "path": "/images/2018-08-05-family-event/1764512297984-1804557702914487.jpg",
          "type": "image/jpeg"
        },
        {
          "id": 1535289647005,
          "name": "1804557739581150.jpg",
          "path": "/images/2018-08-05-family-event/1764512297985-1804557739581150.jpg",
          "type": "image/jpeg"
        },
        {
          "id": 1535289647006,
          "name": "1804557829581141.jpg",
          "path": "/images/2018-08-05-family-event/1764512297985-1804557829581141.jpg",
          "type": "image/jpeg"
        },
        {
          "id": 1535289647007,
          "name": "1804557879581136.jpg",
          "path": "/images/2018-08-05-family-event/1764512297987-1804557879581136.jpg",
          "type": "image/jpeg"
        },
        {
          "id": 1535289647008,
          "name": "1804557962914461.jpg",
          "path": "/images/2018-08-05-family-event/1764512297988-1804557962914461.jpg",
          "type": "image/jpeg"
        },
        {
          "id": 1535289647009,
          "name": "1804558062914451.jpg",
          "path": "/images/2018-08-05-family-event/1764512297989-1804558062914451.jpg",
          "type": "image/jpeg"
        }
      ]
    },
    {
      "id": 1764641508232,
      "date": "06/08/2018",
      "dateParsed": {
        "original": "06/08/2018",
        "date": "2018-08-06T04:00:00.000Z",
        "year": 2018,
        "month": 8,
        "day": 6,
        "format": "DD/MM/YYYY"
      },
      "type": "anniversary",
      "title": "Đi chơi ở khu du lịch Đại Nam, 1 ngày",
      "description": "",
      "location": "",
      "witnesses": "",
      "documents": "",
      "images": [
        {
          "id": 1764641508230.1538,
          "name": "IMG_4424.JPG",
          "path": "/images/2018-08-06-anniversary/1764641508230-IMG_4424.JPG",
          "type": "image/jpeg",
          "size": 486424
        }
      ]
    },
    {
      "id": 1764592467898,
      "date": "21/03/2019",
      "dateParsed": {
        "original": "21/03/2019",
        "date": "2019-03-21T04:00:00.000Z",
        "year": 2019,
        "month": 3,
        "day": 21,
        "format": "DD/MM/YYYY"
      },
      "endDate": "26/03/2019",
      "endDateParsed": {
        "original": "26/03/2019",
        "date": "2019-03-26T04:00:00.000Z",
        "year": 2019,
        "month": 3,
        "day": 26,
        "format": "DD/MM/YYYY"
      },
      "type": "travel",
      "title": "Đi du lịch ở Sapa, 5 ngày",
      "description": "Tôi, cô ấy, cùng những anh em bà con đồng trang lứa đi du lịch ở Sapa",
      "location": "Sapa, Lào Cai",
      "witnesses": "Họ hàng của tôi",
      "documents": "Ảnh chụp chung",
      "images": [
        {
          "id": 1553182862000,
          "name": "2079886742048247.jpg",
          "path": "/images/2019-03-21-travel/1764512297972-2079886742048247.jpg",
          "type": "image/jpeg"
        },
        {
          "id": 1553182862001,
          "name": "2079886745381580.jpg",
          "path": "/images/2019-03-21-travel/1764512297973-2079886745381580.jpg",
          "type": "image/jpeg"
        },
        {
          "id": 1553182862002,
          "name": "2079886842048237.jpg",
          "path": "/images/2019-03-21-travel/1764512297974-2079886842048237.jpg",
          "type": "image/jpeg"
        },
        {
          "id": 1553182862003,
          "name": "2079886822048239.jpg",
          "path": "/images/2019-03-21-travel/1764512297976-2079886822048239.jpg",
          "type": "image/jpeg"
        },
        {
          "id": 1553228312000,
          "name": "2080599215310333.jpg",
          "path": "/images/2019-03-21-travel/1764512297968-2080599215310333.jpg",
          "type": "image/jpeg"
        },
        {
          "id": 1553228312001,
          "name": "2080599175310337.jpg",
          "path": "/images/2019-03-21-travel/1764512297969-2080599175310337.jpg",
          "type": "image/jpeg"
        },
        {
          "id": 1553228312002,
          "name": "2080599188643669.jpg",
          "path": "/images/2019-03-21-travel/1764512297970-2080599188643669.jpg",
          "type": "image/jpeg"
        },
        {
          "id": 1553228312003,
          "name": "2080599221976999.jpg",
          "path": "/images/2019-03-21-travel/1764512297971-2080599221976999.jpg",
          "type": "image/jpeg"
        },
        {
          "id": 1553228312004,
          "name": "2080599291976992.jpg",
          "path": "/images/2019-03-21-travel/1764512297971-2080599291976992.jpg",
          "type": "image/jpeg"
        }
      ]
    },
    {
      "id": 1764592644088,
      "date": "16/01/2020",
      "dateParsed": {
        "original": "16/01/2020",
        "date": "2020-01-16T05:00:00.000Z",
        "year": 2020,
        "month": 1,
        "day": 16,
        "format": "DD/MM/YYYY"
      },
      "endDate": "22/01/2020",
      "endDateParsed": {
        "original": "22/01/2020",
        "date": "2020-01-22T05:00:00.000Z",
        "year": 2020,
        "month": 1,
        "day": 22,
        "format": "DD/MM/YYYY"
      },
      "type": "honeymoon",
      "title": "Du lịch ở Thái Lan, 7 ngày",
      "description": "Chúng tôi cùng nhau đi du lịch Thái Lan",
      "location": "Thái Lan",
      "witnesses": "",
      "documents": "Ảnh chụp chung",
      "images": [
        {
          "id": 1579236835000,
          "name": "2636768979693351.jpg",
          "path": "/images/2020-01-16-honeymoon/1764512297945-2636768979693351.jpg",
          "type": "image/jpeg"
        },
        {
          "id": 1579236835001,
          "name": "2636769189693330.jpg",
          "path": "/images/2020-01-16-honeymoon/1764512297945-2636769189693330.jpg",
          "type": "image/jpeg"
        },
        {
          "id": 1579236835002,
          "name": "2636769326359983.jpg",
          "path": "/images/2020-01-16-honeymoon/1764512297946-2636769326359983.jpg",
          "type": "image/jpeg"
        },
        {
          "id": 1579236835003,
          "name": "2636769523026630.jpg",
          "path": "/images/2020-01-16-honeymoon/1764512297947-2636769523026630.jpg",
          "type": "image/jpeg"
        },
        {
          "id": 1579236835004,
          "name": "2636769556359960.jpg",
          "path": "/images/2020-01-16-honeymoon/1764512297949-2636769556359960.jpg",
          "type": "image/jpeg"
        },
        {
          "id": 1579236835005,
          "name": "2636769979693251.jpg",
          "path": "/images/2020-01-16-honeymoon/1764512297949-2636769979693251.jpg",
          "type": "image/jpeg"
        },
        {
          "id": 1579236835006,
          "name": "2636770013026581.jpg",
          "path": "/images/2020-01-16-honeymoon/1764512297951-2636770013026581.jpg",
          "type": "image/jpeg"
        },
        {
          "id": 1579236835007,
          "name": "2636770153026567.jpg",
          "path": "/images/2020-01-16-honeymoon/1764512297952-2636770153026567.jpg",
          "type": "image/jpeg"
        },
        {
          "id": 1579236835008,
          "name": "2636770203026562.jpg",
          "path": "/images/2020-01-16-honeymoon/1764512297953-2636770203026562.jpg",
          "type": "image/jpeg"
        },
        {
          "id": 1579244582000,
          "name": "2636919193011663.jpg",
          "path": "/images/2020-01-16-honeymoon/1764512297942-2636919193011663.jpg",
          "type": "image/jpeg"
        },
        {
          "id": 1579244582001,
          "name": "2636919236344992.jpg",
          "path": "/images/2020-01-16-honeymoon/1764512297943-2636919236344992.jpg",
          "type": "image/jpeg"
        },
        {
          "id": 1579244582002,
          "name": "2636919246344991.jpg",
          "path": "/images/2020-01-16-honeymoon/1764512297944-2636919246344991.jpg",
          "type": "image/jpeg"
        },
        {
          "id": 1579245790000,
          "name": "2636940959676153.jpg",
          "path": "/images/2020-01-16-honeymoon/1764512297934-2636940959676153.jpg",
          "type": "image/jpeg"
        },
        {
          "id": 1579245790001,
          "name": "2636941119676137.jpg",
          "path": "/images/2020-01-16-honeymoon/1764512297935-2636941119676137.jpg",
          "type": "image/jpeg"
        },
        {
          "id": 1579245790002,
          "name": "2636941136342802.jpg",
          "path": "/images/2020-01-16-honeymoon/1764512297935-2636941136342802.jpg",
          "type": "image/jpeg"
        },
        {
          "id": 1579245790003,
          "name": "2636941276342788.jpg",
          "path": "/images/2020-01-16-honeymoon/1764512297936-2636941276342788.jpg",
          "type": "image/jpeg"
        },
        {
          "id": 1579245790004,
          "name": "2636941339676115.jpg",
          "path": "/images/2020-01-16-honeymoon/1764512297937-2636941339676115.jpg",
          "type": "image/jpeg"
        },
        {
          "id": 1579245790005,
          "name": "2636941383009444.jpg",
          "path": "/images/2020-01-16-honeymoon/1764512297938-2636941383009444.jpg",
          "type": "image/jpeg"
        },
        {
          "id": 1579245790006,
          "name": "2636941503009432.jpg",
          "path": "/images/2020-01-16-honeymoon/1764512297939-2636941503009432.jpg",
          "type": "image/jpeg"
        },
        {
          "id": 1579245790007,
          "name": "2636941609676088.jpg",
          "path": "/images/2020-01-16-honeymoon/1764512297940-2636941609676088.jpg",
          "type": "image/jpeg"
        },
        {
          "id": 1579245790008,
          "name": "2636941669676082.jpg",
          "path": "/images/2020-01-16-honeymoon/1764512297941-2636941669676082.jpg",
          "type": "image/jpeg"
        },
        {
          "id": 1579245790009,
          "name": "2636941736342742.jpg",
          "path": "/images/2020-01-16-honeymoon/1764512297942-2636941736342742.jpg",
          "type": "image/jpeg"
        },
        {
          "id": 1579369307000,
          "name": "2639728692730713.jpg",
          "path": "/images/2020-01-16-honeymoon/1764512297928-2639728692730713.jpg",
          "type": "image/jpeg"
        },
        {
          "id": 1579369307001,
          "name": "2639728742730708.jpg",
          "path": "/images/2020-01-16-honeymoon/1764512297929-2639728742730708.jpg",
          "type": "image/jpeg"
        },
        {
          "id": 1579369307002,
          "name": "2639728852730697.jpg",
          "path": "/images/2020-01-16-honeymoon/1764512297929-2639728852730697.jpg",
          "type": "image/jpeg"
        },
        {
          "id": 1579369307003,
          "name": "2639728922730690.jpg",
          "path": "/images/2020-01-16-honeymoon/1764512297930-2639728922730690.jpg",
          "type": "image/jpeg"
        },
        {
          "id": 1579369307004,
          "name": "2639729029397346.jpg",
          "path": "/images/2020-01-16-honeymoon/1764512297931-2639729029397346.jpg",
          "type": "image/jpeg"
        },
        {
          "id": 1579369307005,
          "name": "2639729092730673.jpg",
          "path": "/images/2020-01-16-honeymoon/1764512297932-2639729092730673.jpg",
          "type": "image/jpeg"
        },
        {
          "id": 1579369307006,
          "name": "2639729219397327.jpg",
          "path": "/images/2020-01-16-honeymoon/1764512297933-2639729219397327.jpg",
          "type": "image/jpeg"
        },
        {
          "id": 1579406427000,
          "name": "2640517172651865.jpg",
          "path": "/images/2020-01-16-honeymoon/1764512297926-2640517172651865.jpg",
          "type": "image/jpeg"
        },
        {
          "id": 1579406427001,
          "name": "2640517215985194.jpg",
          "path": "/images/2020-01-16-honeymoon/1764512297926-2640517215985194.jpg",
          "type": "image/jpeg"
        },
        {
          "id": 1579406427002,
          "name": "2640517275985188.jpg",
          "path": "/images/2020-01-16-honeymoon/1764512297927-2640517275985188.jpg",
          "type": "image/jpeg"
        }
      ]
    },
    {
      "id": 1590385376000,
      "date": "25/05/2020",
      "dateParsed": {
        "original": "25/05/2020",
        "date": "2020-05-25T04:00:00.000Z",
        "year": 2020,
        "month": 5,
        "day": 25,
        "format": "DD/MM/YYYY"
      },
      "endDate": "30/05/2020",
      "endDateParsed": {
        "original": "30/05/2020",
        "date": "2020-05-30T04:00:00.000Z",
        "year": 2020,
        "month": 5,
        "day": 30,
        "format": "DD/MM/YYYY"
      },
      "type": "family-event",
      "title": "Về quê thăm bà nội, 6 ngày",
      "description": "Tôi và cô ấy về quê thăm bà nội của tôi",
      "location": "Núi Thành, Quảng Nam",
      "witnesses": "Bà nội của tôi",
      "documents": "",
      "images": [
        {
          "id": 1590385376001,
          "name": "2921516174551962.jpg",
          "path": "/images/2020-05-25-family-event/1764512297912-2921516174551962.jpg",
          "type": "image/jpeg"
        },
        {
          "id": 1590385376004,
          "name": "2921521854551394.jpg",
          "path": "/images/2020-05-25-family-event/1764512297914-2921521854551394.jpg",
          "type": "image/jpeg"
        }
      ]
    },
    {
      "id": 1592105707000,
      "date": "13/06/2020",
      "dateParsed": {
        "original": "13/06/2020",
        "date": "2020-06-13T04:00:00.000Z",
        "year": 2020,
        "month": 6,
        "day": 13,
        "format": "DD/MM/YYYY"
      },
      "type": "pregnancy",
      "title": "Mang thai",
      "description": "Đây là hình ảnh cô ấy đang mang thai được 5 tháng",
      "location": "TP. Hồ Chí Minh",
      "witnesses": "",
      "documents": "Ảnh chụp chung",
      "images": [
        {
          "id": 1592105707000,
          "name": "2971766776193568.jpg",
          "path": "/images/2020-06-13-pregnancy/1764512297910-2971766776193568.jpg",
          "type": "image/jpeg"
        },
        {
          "id": 1764642708325.7534,
          "name": "116133916_3014518065441144_1756218716904028688_n.jpg",
          "path": "/images/2020-06-13-pregnancy/1764642708325-116133916_3014518065441144_1756218716904028688_n.jpg",
          "type": "image/jpeg",
          "size": 192679
        }
      ]
    },
    {
      "id": 1595996191000,
      "date": "29/07/2020",
      "dateParsed": {
        "original": "29/07/2020",
        "date": "2020-07-29T04:00:00.000Z",
        "year": 2020,
        "month": 7,
        "day": 29,
        "format": "DD/MM/YYYY"
      },
      "type": "anniversary",
      "title": "Cô ấy tặng quà nhân dịp kỷ niệm ngày đám cưới",
      "description": "Tôi rất thích món quà này",
      "location": "TP. Hồ Chí Minh",
      "witnesses": "",
      "documents": "Hình ảnh món quà",
      "images": [
        {
          "id": 1595996191000,
          "name": "3092883807415197.jpg",
          "path": "/images/2020-07-29-anniversary/1764512297907-3092883807415197.jpg",
          "type": "image/jpeg"
        },
        {
          "id": 1595996191001,
          "name": "3092883934081851.jpg",
          "path": "/images/2020-07-29-anniversary/1764512297907-3092883934081851.jpg",
          "type": "image/jpeg"
        },
        {
          "id": 1595996191002,
          "name": "3092883840748527.jpg",
          "path": "/images/2020-07-29-anniversary/1764512297908-3092883840748527.jpg",
          "type": "image/jpeg"
        }
      ]
    },
    {
      "id": 1596209973000,
      "date": "31/07/2020",
      "dateParsed": {
        "original": "31/07/2020",
        "date": "2020-07-31T04:00:00.000Z",
        "year": 2020,
        "month": 7,
        "day": 31,
        "format": "DD/MM/YYYY"
      },
      "type": "anniversary",
      "title": "Kỷ niệm ngày đám cưới",
      "description": "Tôi tổ chức lễ kỷ niểm niệm ngày đám cưới, cô ấy đang mang thai. Chúng tôi vô cùng hạnh phúc",
      "location": "TP. Hồ Chí Minh",
      "witnesses": "",
      "documents": "Ảnh chụp chung",
      "images": [
        {
          "id": 1596209973000,
          "name": "3100030336700544.jpg",
          "path": "/images/2020-07-31-anniversary/1764512297895-3100030336700544.jpg",
          "type": "image/jpeg"
        },
        {
          "id": 1596209973001,
          "name": "3100030490033862.jpg",
          "path": "/images/2020-07-31-anniversary/1764512297895-3100030490033862.jpg",
          "type": "image/jpeg"
        },
        {
          "id": 1596209973002,
          "name": "3100031070033804.jpg",
          "path": "/images/2020-07-31-anniversary/1764512297896-3100031070033804.jpg",
          "type": "image/jpeg"
        },
        {
          "id": 1596209973003,
          "name": "3100031656700412.jpg",
          "path": "/images/2020-07-31-anniversary/1764512297899-3100031656700412.jpg",
          "type": "image/jpeg"
        },
        {
          "id": 1596209973004,
          "name": "3100030383367206.jpg",
          "path": "/images/2020-07-31-anniversary/1764512297899-3100030383367206.jpg",
          "type": "image/jpeg"
        },
        {
          "id": 1596209973005,
          "name": "3100031613367083.jpg",
          "path": "/images/2020-07-31-anniversary/1764512297902-3100031613367083.jpg",
          "type": "image/jpeg"
        },
        {
          "id": 1596209973006,
          "name": "3100031396700438.jpg",
          "path": "/images/2020-07-31-anniversary/1764512297903-3100031396700438.jpg",
          "type": "image/jpeg"
        },
        {
          "id": 1596209973007,
          "name": "3100031116700466.jpg",
          "path": "/images/2020-07-31-anniversary/1764512297903-3100031116700466.jpg",
          "type": "image/jpeg"
        },
        {
          "id": 1596209973008,
          "name": "3100030933367151.jpg",
          "path": "/images/2020-07-31-anniversary/1764512297904-3100030933367151.jpg",
          "type": "image/jpeg"
        },
        {
          "id": 1596209973009,
          "name": "3100032840033627.jpg",
          "path": "/images/2020-07-31-anniversary/1764512297905-3100032840033627.jpg",
          "type": "image/jpeg"
        }
      ]
    },
    {
      "id": 1597674735000,
      "date": "17/08/2020",
      "dateParsed": {
        "original": "17/08/2020",
        "date": "2020-08-17T04:00:00.000Z",
        "year": 2020,
        "month": 8,
        "day": 17,
        "format": "DD/MM/YYYY"
      },
      "type": "anniversary",
      "title": "Sinh nhật cô ấy",
      "description": "Tôi tổ chức tiệt sinh nhật cho cô ấy, một bữa bữa tối thịnh soạn và lãng mạn ",
      "location": "TP. Hồ Chí Minh",
      "witnesses": "",
      "documents": "Ảnh chụp chung",
      "images": [
        {
          "id": 1597674735000,
          "name": "3148171145219796.jpg",
          "path": "/images/2020-08-17-anniversary/1764512297892-3148171145219796.jpg",
          "type": "image/jpeg"
        },
        {
          "id": 1597674735001,
          "name": "3148171311886446.jpg",
          "path": "/images/2020-08-17-anniversary/1764512297893-3148171311886446.jpg",
          "type": "image/jpeg"
        },
        {
          "id": 1597674735002,
          "name": "3148171191886458.jpg",
          "path": "/images/2020-08-17-anniversary/1764512297894-3148171191886458.jpg",
          "type": "image/jpeg"
        }
      ]
    },
    {
      "id": 1603946508000,
      "date": "28/10/2020",
      "dateParsed": {
        "original": "28/10/2020",
        "date": "2020-10-28T04:00:00.000Z",
        "year": 2020,
        "month": 10,
        "day": 28,
        "format": "DD/MM/YYYY"
      },
      "type": "birth",
      "title": "Con gái chào đời",
      "description": "Con gái của tôi và cô ấy ra đời lúc 11:50 28/10/2020 nặng 3.5kg. Tôi đặt tên con là Võ Ngọc Linh Đan, tên thường gọi là Sam. Cả nhà rất thương con. Tôi và cô ấy rất hạnh phúc",
      "location": "TP. Hồ Chí Minh",
      "witnesses": "",
      "documents": "",
      "images": [
        {
          "id": 1603946508000,
          "name": "3362670320436543.jpg",
          "path": "/images/2020-10-28-birth/1764512297888-3362670320436543.jpg",
          "type": "image/jpeg"
        },
        {
          "id": 1603946508001,
          "name": "3362670447103197.jpg",
          "path": "/images/2020-10-28-birth/1764512297889-3362670447103197.jpg",
          "type": "image/jpeg"
        }
      ]
    },
    {
      "id": 1606208085000,
      "date": "24/11/2020",
      "dateParsed": {
        "original": "24/11/2020",
        "date": "2020-11-24T05:00:00.000Z",
        "year": 2020,
        "month": 11,
        "day": 24,
        "format": "DD/MM/YYYY"
      },
      "type": "family-event",
      "title": "Đầy tháng con gái",
      "description": "Tôi và cô ấy tổ chức lễ đầy tháng cho con gái.",
      "location": "TP. Hồ Chí Minh",
      "witnesses": "Mẹ cô ấy",
      "documents": "Ảnh chụp chung",
      "images": [
        {
          "id": 1606208085000,
          "name": "3433610900009151.jpg",
          "path": "/images/2020-11-24-family-event/1764512297879-3433610900009151.jpg",
          "type": "image/jpeg"
        },
        {
          "id": 1606208085001,
          "name": "3433610993342475.jpg",
          "path": "/images/2020-11-24-family-event/1764512297880-3433610993342475.jpg",
          "type": "image/jpeg"
        },
        {
          "id": 1606208085002,
          "name": "3433611903342384.jpg",
          "path": "/images/2020-11-24-family-event/1764512297880-3433611903342384.jpg",
          "type": "image/jpeg"
        },
        {
          "id": 1606208085003,
          "name": "3433611850009056.jpg",
          "path": "/images/2020-11-24-family-event/1764512297881-3433611850009056.jpg",
          "type": "image/jpeg"
        },
        {
          "id": 1606208085004,
          "name": "3433611050009136.jpg",
          "path": "/images/2020-11-24-family-event/1764512297882-3433611050009136.jpg",
          "type": "image/jpeg"
        },
        {
          "id": 1606208085005,
          "name": "3433610933342481.jpg",
          "path": "/images/2020-11-24-family-event/1764512297883-3433610933342481.jpg",
          "type": "image/jpeg"
        },
        {
          "id": 1606208085006,
          "name": "3433611306675777.jpg",
          "path": "/images/2020-11-24-family-event/1764512297885-3433611306675777.jpg",
          "type": "image/jpeg"
        },
        {
          "id": 1606208085007,
          "name": "3433611090009132.jpg",
          "path": "/images/2020-11-24-family-event/1764512297885-3433611090009132.jpg",
          "type": "image/jpeg"
        },
        {
          "id": 1606208085008,
          "name": "3433611233342451.jpg",
          "path": "/images/2020-11-24-family-event/1764512297886-3433611233342451.jpg",
          "type": "image/jpeg"
        }
      ]
    },
    {
      "id": 1608824305000,
      "date": "24/12/2020",
      "dateParsed": {
        "original": "24/12/2020",
        "date": "2020-12-24T05:00:00.000Z",
        "year": 2020,
        "month": 12,
        "day": 24,
        "format": "DD/MM/YYYY"
      },
      "type": "family-event",
      "title": "Noel 2020",
      "description": "Mùa noel đầu tiên của gái rượu 🥰Chúc cả nhà giáng sinh an lành",
      "location": "TP. Hồ Chí Minh",
      "witnesses": "",
      "documents": "",
      "images": [
        {
          "id": 1608824305000,
          "name": "3512526568784250.jpg",
          "path": "/images/2020-12-24-family-event/1764512297877-3512526568784250.jpg",
          "type": "image/jpeg"
        },
        {
          "id": 1608824305001,
          "name": "3512526608784246.jpg",
          "path": "/images/2020-12-24-family-event/1764512297878-3512526608784246.jpg",
          "type": "image/jpeg"
        },
        {
          "id": 1608824305002,
          "name": "3512526668784240.jpg",
          "path": "/images/2020-12-24-family-event/1764512297878-3512526668784240.jpg",
          "type": "image/jpeg"
        }
      ]
    },
    {
      "id": 1609949494000,
      "date": "06/01/2021",
      "dateParsed": {
        "original": "06/01/2021",
        "date": "2021-01-06T05:00:00.000Z",
        "year": 2021,
        "month": 1,
        "day": 6,
        "format": "DD/MM/YYYY"
      },
      "type": "other",
      "title": "Con gái tôi",
      "description": "Ảnh thường nhật",
      "location": "TP. Hồ Chí Minh",
      "witnesses": "",
      "documents": "",
      "images": [
        {
          "id": 1609949494000,
          "name": "3544041112299462.jpg",
          "path": "/images/2021-01-06-other/1764593604605-3544041112299462.jpg",
          "type": "image/jpeg"
        },
        {
          "id": 1609949494001,
          "name": "3544041218966118.jpg",
          "path": "/images/2021-01-06-other/1764593604606-3544041218966118.jpg",
          "type": "image/jpeg"
        },
        {
          "id": 1609949494002,
          "name": "3544041135632793.jpg",
          "path": "/images/2021-01-06-other/1764593604607-3544041135632793.jpg",
          "type": "image/jpeg"
        }
      ]
    },
    {
      "id": 1613313945000,
      "date": "14/02/2021",
      "dateParsed": {
        "original": "14/02/2021",
        "date": "2021-02-14T05:00:00.000Z",
        "year": 2021,
        "month": 2,
        "day": 14,
        "format": "DD/MM/YYYY"
      },
      "type": "other",
      "title": "Tết của đại gia đình, xa nhưng ấm áp \n❤️❤️❤️",
      "description": "Video call với đại gia đình dịp tết âm lịch 2021",
      "location": "",
      "witnesses": "Gia đinh và họ hàng",
      "documents": "ảnh chụp màn hình",
      "images": [
        {
          "id": 1613313945000,
          "name": "3644130488957190.jpg",
          "path": "/images/2021-02-14-other/1764512297863-3644130488957190.jpg",
          "type": "image/jpeg"
        },
        {
          "id": 1613313945001,
          "name": "3644130618957177.jpg",
          "path": "/images/2021-02-14-other/1764512297864-3644130618957177.jpg",
          "type": "image/jpeg"
        },
        {
          "id": 1613313945002,
          "name": "3644130545623851.jpg",
          "path": "/images/2021-02-14-other/1764512297865-3644130545623851.jpg",
          "type": "image/jpeg"
        }
      ]
    },
    {
      "id": 1623206339000,
      "date": "08/06/2021",
      "dateParsed": {
        "original": "08/06/2021",
        "date": "2021-06-08T04:00:00.000Z",
        "year": 2021,
        "month": 6,
        "day": 8,
        "format": "DD/MM/YYYY"
      },
      "type": "anniversary",
      "title": "Món quà từ cô ấy",
      "description": "Cô ấy tặng cho tôi 1 cái tai nghe Sony ",
      "location": "TP. Hồ Chí Minh",
      "witnesses": "",
      "documents": "Hình ảnh món quà",
      "images": [
        {
          "id": 1623206339000,
          "name": "3971671692869733.jpg",
          "path": "/images/2021-06-08-anniversary/1764512297841-3971671692869733.jpg",
          "type": "image/jpeg"
        }
      ]
    },
    {
      "id": 1627037684000,
      "date": "23/07/2021",
      "dateParsed": {
        "original": "23/07/2021",
        "date": "2021-07-23T04:00:00.000Z",
        "year": 2021,
        "month": 7,
        "day": 23,
        "format": "DD/MM/YYYY"
      },
      "type": "anniversary",
      "title": "Cô ấy giúp tôi hớt tóc",
      "description": "Trong giai đoạn dịch covid19 chúng tôi không thể ra khỏi nhà để đến tiệm hớt tóc, vì vậy cô ấy giúp tôi hớt tóc",
      "location": "TP. Hồ Chí Minh",
      "witnesses": "",
      "documents": "Ảnh chụp chung",
      "images": [
        {
          "id": 1627037684000,
          "name": "4093224127381155.jpg",
          "path": "/images/2021-07-23-anniversary/1764512297840-4093224127381155.jpg",
          "type": "image/jpeg"
        },
        {
          "id": 1627037684001,
          "name": "4093224147381153.jpg",
          "path": "/images/2021-07-23-anniversary/1764512297841-4093224147381153.jpg",
          "type": "image/jpeg"
        }
      ]
    },
    {
      "id": 1629207085000,
      "date": "17/08/2021",
      "dateParsed": {
        "original": "17/08/2021",
        "date": "2021-08-17T04:00:00.000Z",
        "year": 2021,
        "month": 8,
        "day": 17,
        "format": "DD/MM/YYYY"
      },
      "type": "anniversary",
      "title": "Sinh nhật cô ấy",
      "description": "Võ Tuấn Nguyên đã thêm 3 ảnh mới. Chúc mừng sinh nhật vợ yêu, gia đình mình mãi hạnh phúc như thế này nhé ❤️❤️❤️\nChúc em luôn xinh đẹp, yêu con và yêu anh 😘😘😘",
      "location": "TP. Hồ Chí Minh",
      "witnesses": "Me cô ấy, chị em họ cô ấy",
      "documents": "Ảnh chụp chung",
      "images": [
        {
          "id": 1629207085000,
          "name": "4166424173394483.jpg",
          "path": "/images/2021-08-17-anniversary/1764512297824-4166424173394483.jpg",
          "type": "image/jpeg"
        },
        {
          "id": 1629207085001,
          "name": "4166424353394465.jpg",
          "path": "/images/2021-08-17-anniversary/1764512297824-4166424353394465.jpg",
          "type": "image/jpeg"
        },
        {
          "id": 1629207085002,
          "name": "4166424213394479.jpg",
          "path": "/images/2021-08-17-anniversary/1764512297825-4166424213394479.jpg",
          "type": "image/jpeg"
        }
      ]
    },
    {
      "id": 1637508043000,
      "date": "21/11/2021",
      "dateParsed": {
        "original": "21/11/2021",
        "date": "2021-11-21T05:00:00.000Z",
        "year": 2021,
        "month": 11,
        "day": 21,
        "format": "DD/MM/YYYY"
      },
      "type": "other",
      "title": "Đi ăn nhà hàng sau đợt dịch Covid-19",
      "description": "Chúng tôi đi ăn nhà hàng 5 sao",
      "location": "TP. Hồ Chí Minh",
      "witnesses": "Em gái tôi, mẹ cô ấy",
      "documents": "Ảnh chụp chung",
      "images": [
        {
          "id": 1637508043000,
          "name": "4464061326964098.jpg",
          "path": "/images/2021-11-21-other/1764512297802-4464061326964098.jpg",
          "type": "image/jpeg"
        },
        {
          "id": 1637508043001,
          "name": "4464061020297462.jpg",
          "path": "/images/2021-11-21-other/1764512297802-4464061020297462.jpg",
          "type": "image/jpeg"
        },
        {
          "id": 1637508043002,
          "name": "4464061973630700.jpg",
          "path": "/images/2021-11-21-other/1764512297803-4464061973630700.jpg",
          "type": "image/jpeg"
        },
        {
          "id": 1637508043003,
          "name": "4464061573630740.jpg",
          "path": "/images/2021-11-21-other/1764512297803-4464061573630740.jpg",
          "type": "image/jpeg"
        },
        {
          "id": 1637508043004,
          "name": "4464061156964115.jpg",
          "path": "/images/2021-11-21-other/1764512297804-4464061156964115.jpg",
          "type": "image/jpeg"
        },
        {
          "id": 1637508043005,
          "name": "4464061453630752.jpg",
          "path": "/images/2021-11-21-other/1764512297805-4464061453630752.jpg",
          "type": "image/jpeg"
        },
        {
          "id": 1637508043006,
          "name": "4464060886964142.jpg",
          "path": "/images/2021-11-21-other/1764512297805-4464060886964142.jpg",
          "type": "image/jpeg"
        }
      ]
    },
    {
      "id": 1646980342000,
      "date": "11/03/2022",
      "dateParsed": {
        "original": "11/03/2022",
        "date": "2022-03-11T05:00:00.000Z",
        "year": 2022,
        "month": 3,
        "day": 11,
        "format": "DD/MM/YYYY"
      },
      "type": "anniversary",
      "title": "Dự đám cưới đồng nghiệp",
      "description": "Tôi, cô ấy, con gái và mẹ cô ấy đi Bình Phước để dự đám cưới đồng nghiệp",
      "location": "Tỉnh Bình Phước",
      "witnesses": "Đồng nghiệp của tôi, mẹ cô ấy",
      "documents": "Ảnh chụp chung",
      "images": [
        {
          "id": 1646980342000,
          "name": "4839093682794192.jpg",
          "path": "/images/2022-03-11-anniversary/1764512297782-4839093682794192.jpg",
          "type": "image/jpeg"
        },
        {
          "id": 1646980342001,
          "name": "4839093709460856.jpg",
          "path": "/images/2022-03-11-anniversary/1764512297782-4839093709460856.jpg",
          "type": "image/jpeg"
        },
        {
          "id": 1646980342002,
          "name": "4839094256127468.jpg",
          "path": "/images/2022-03-11-anniversary/1764512297783-4839094256127468.jpg",
          "type": "image/jpeg"
        },
        {
          "id": 1646980342003,
          "name": "4839094329460794.jpg",
          "path": "/images/2022-03-11-anniversary/1764512297785-4839094329460794.jpg",
          "type": "image/jpeg"
        },
        {
          "id": 1646980342004,
          "name": "4839094429460784.jpg",
          "path": "/images/2022-03-11-anniversary/1764512297785-4839094429460784.jpg",
          "type": "image/jpeg"
        }
      ]
    },
    {
      "id": 1649655610000,
      "date": "11/04/2022",
      "dateParsed": {
        "original": "11/04/2022",
        "date": "2022-04-11T04:00:00.000Z",
        "year": 2022,
        "month": 4,
        "day": 11,
        "format": "DD/MM/YYYY"
      },
      "type": "other",
      "title": "Con gái tôi sắp đi học mẫu giáo",
      "description": "Ảnh thường nhật",
      "location": "",
      "witnesses": "",
      "documents": "",
      "images": [
        {
          "id": 1649655610000,
          "name": "4919899711380255.jpg",
          "path": "/images/2022-04-11-other/1764593604529-4919899711380255.jpg",
          "type": "image/jpeg"
        },
        {
          "id": 1649655610001,
          "name": "4919899828046910.jpg",
          "path": "/images/2022-04-11-other/1764593604529-4919899828046910.jpg",
          "type": "image/jpeg"
        },
        {
          "id": 1649655610002,
          "name": "4919899921380234.jpg",
          "path": "/images/2022-04-11-other/1764593604531-4919899921380234.jpg",
          "type": "image/jpeg"
        },
        {
          "id": 1649655610003,
          "name": "4919899808046912.jpg",
          "path": "/images/2022-04-11-other/1764593604532-4919899808046912.jpg",
          "type": "image/jpeg"
        },
        {
          "id": 1649655610004,
          "name": "4919900011380225.jpg",
          "path": "/images/2022-04-11-other/1764593604534-4919900011380225.jpg",
          "type": "image/jpeg"
        },
        {
          "id": 1649655610005,
          "name": "4919899731380253.jpg",
          "path": "/images/2022-04-11-other/1764593604535-4919899731380253.jpg",
          "type": "image/jpeg"
        },
        {
          "id": 1649655610006,
          "name": "4919900041380222.jpg",
          "path": "/images/2022-04-11-other/1764593604536-4919900041380222.jpg",
          "type": "image/jpeg"
        },
        {
          "id": 1649655610007,
          "name": "4919899904713569.jpg",
          "path": "/images/2022-04-11-other/1764593604536-4919899904713569.jpg",
          "type": "image/jpeg"
        }
      ]
    },
    {
      "id": 1649812894000,
      "date": "12/04/2022",
      "dateParsed": {
        "original": "12/04/2022",
        "date": "2022-04-12T04:00:00.000Z",
        "year": 2022,
        "month": 4,
        "day": 12,
        "format": "DD/MM/YYYY"
      },
      "type": "other",
      "title": "Con gái tôi đi học mẫu giáo",
      "description": "Ảnh thường nhật",
      "location": "",
      "witnesses": "",
      "documents": "",
      "images": [
        {
          "id": 1649812894000,
          "name": "4924442150926011.jpg",
          "path": "/images/2022-04-12-other/1764630508113-4924442150926011.jpg",
          "type": "image/jpeg"
        },
        {
          "id": 1649812894001,
          "name": "4924442234259336.jpg",
          "path": "/images/2022-04-12-other/1764630508116-4924442234259336.jpg",
          "type": "image/jpeg"
        },
        {
          "id": 1649812894002,
          "name": "4924442174259342.jpg",
          "path": "/images/2022-04-12-other/1764630508119-4924442174259342.jpg",
          "type": "image/jpeg"
        },
        {
          "id": 1649812894003,
          "name": "4924442274259332.jpg",
          "path": "/images/2022-04-12-other/1764630508121-4924442274259332.jpg",
          "type": "image/jpeg"
        },
        {
          "id": 1649812894004,
          "name": "4924442360925990.jpg",
          "path": "/images/2022-04-12-other/1764630508123-4924442360925990.jpg",
          "type": "image/jpeg"
        }
      ]
    },
    {
      "id": 1659280581000,
      "date": "31/07/2022",
      "dateParsed": {
        "original": "31/07/2022",
        "date": "2022-07-31T04:00:00.000Z",
        "year": 2022,
        "month": 7,
        "day": 31,
        "format": "DD/MM/YYYY"
      },
      "type": "anniversary",
      "title": "Kỷ niệm 4 năm ngày cưới ❤️",
      "description": "Tôi dẫn cô ấy và con gái đi ăn nhà hàng, kỹ niệm 4 năm ngày cưới",
      "location": "TP. Hồ Chí Minh",
      "witnesses": "",
      "documents": "Ảnh chụp chung",
      "images": [
        {
          "id": 1659280581000,
          "name": "5228088700561353.jpg",
          "path": "/images/2022-07-31-anniversary/1764512297731-5228088700561353.jpg",
          "type": "image/jpeg"
        },
        {
          "id": 1659280581001,
          "name": "5228089103894646.jpg",
          "path": "/images/2022-07-31-anniversary/1764512297731-5228089103894646.jpg",
          "type": "image/jpeg"
        },
        {
          "id": 1659280581002,
          "name": "5228089253894631.jpg",
          "path": "/images/2022-07-31-anniversary/1764512297732-5228089253894631.jpg",
          "type": "image/jpeg"
        },
        {
          "id": 1659280581003,
          "name": "5228088877228002.jpg",
          "path": "/images/2022-07-31-anniversary/1764512297733-5228088877228002.jpg",
          "type": "image/jpeg"
        },
        {
          "id": 1659280581004,
          "name": "5228089377227952.jpg",
          "path": "/images/2022-07-31-anniversary/1764512297734-5228089377227952.jpg",
          "type": "image/jpeg"
        },
        {
          "id": 1659280581005,
          "name": "5228089140561309.jpg",
          "path": "/images/2022-07-31-anniversary/1764512297735-5228089140561309.jpg",
          "type": "image/jpeg"
        },
        {
          "id": 1659280581006,
          "name": "5228089020561321.jpg",
          "path": "/images/2022-07-31-anniversary/1764512297736-5228089020561321.jpg",
          "type": "image/jpeg"
        },
        {
          "id": 1659280581007,
          "name": "5228089290561294.jpg",
          "path": "/images/2022-07-31-anniversary/1764512297737-5228089290561294.jpg",
          "type": "image/jpeg"
        },
        {
          "id": 1659280581008,
          "name": "5228088853894671.jpg",
          "path": "/images/2022-07-31-anniversary/1764512297737-5228088853894671.jpg",
          "type": "image/jpeg"
        },
        {
          "id": 1659280581009,
          "name": "5228088977227992.jpg",
          "path": "/images/2022-07-31-anniversary/1764512297738-5228088977227992.jpg",
          "type": "image/jpeg"
        }
      ]
    },
    {
      "id": 1660953824000,
      "date": "19/08/2022",
      "dateParsed": {
        "original": "19/08/2022",
        "date": "2022-08-19T04:00:00.000Z",
        "year": 2022,
        "month": 8,
        "day": 19,
        "format": "DD/MM/YYYY"
      },
      "type": "other",
      "title": "Đón bà ngoại tôi từ Mỹ về Việt Nam chơi",
      "description": "Tôi, cô ấy, và em gái tôi đón bà ngoại tôi từ Mỹ về Việt Nam",
      "location": "TP. Hồ Chí Minh",
      "witnesses": "Bà ngoại, em gái tôi",
      "documents": "Ảnh chụp chung",
      "images": [
        {
          "id": 1660953824000,
          "name": "5281927088510847.jpg",
          "path": "/images/2022-08-19-other/1764512297724-5281927088510847.jpg",
          "type": "image/jpeg"
        },
        {
          "id": 1660953824001,
          "name": "5281927188510837.jpg",
          "path": "/images/2022-08-19-other/1764512297725-5281927188510837.jpg",
          "type": "image/jpeg"
        },
        {
          "id": 1660953824002,
          "name": "5281927101844179.jpg",
          "path": "/images/2022-08-19-other/1764512297728-5281927101844179.jpg",
          "type": "image/jpeg"
        }
      ]
    },
    {
      "id": 1666921798000,
      "date": "27/10/2022",
      "dateParsed": {
        "original": "27/10/2022",
        "date": "2022-10-27T04:00:00.000Z",
        "year": 2022,
        "month": 10,
        "day": 27,
        "format": "DD/MM/YYYY"
      },
      "type": "birth",
      "title": "Sinh nhật con gái 2 tuổi",
      "description": "Tôi và cô ấy tổ chức sinh nhật cho con gái",
      "location": "TP. Hồ Chí Minh",
      "witnesses": "Mẹ cô ấy, em họ của tôi",
      "documents": "Ảnh chụp chung",
      "images": [
        {
          "id": 1666921798000,
          "name": "5480362582000629.jpg",
          "path": "/images/2022-10-27-birth/1764512297713-5480362582000629.jpg",
          "type": "image/jpeg"
        },
        {
          "id": 1666921798001,
          "name": "5480349102001977.jpg",
          "path": "/images/2022-10-27-birth/1764512297714-5480349102001977.jpg",
          "type": "image/jpeg"
        },
        {
          "id": 1666921798002,
          "name": "5480349012001986.jpg",
          "path": "/images/2022-10-27-birth/1764512297714-5480349012001986.jpg",
          "type": "image/jpeg"
        },
        {
          "id": 1666921798003,
          "name": "5480349038668650.jpg",
          "path": "/images/2022-10-27-birth/1764512297716-5480349038668650.jpg",
          "type": "image/jpeg"
        },
        {
          "id": 1666921798004,
          "name": "5480362602000627.jpg",
          "path": "/images/2022-10-27-birth/1764512297716-5480362602000627.jpg",
          "type": "image/jpeg"
        },
        {
          "id": 1666921798005,
          "name": "5480349268668627.jpg",
          "path": "/images/2022-10-27-birth/1764512297717-5480349268668627.jpg",
          "type": "image/jpeg"
        },
        {
          "id": 1666921798006,
          "name": "5480362795333941.jpg",
          "path": "/images/2022-10-27-birth/1764512297718-5480362795333941.jpg",
          "type": "image/jpeg"
        },
        {
          "id": 1666921798007,
          "name": "5480362745333946.jpg",
          "path": "/images/2022-10-27-birth/1764512297720-5480362745333946.jpg",
          "type": "image/jpeg"
        }
      ]
    },
    {
      "id": 1669252323000,
      "date": "23/11/2022",
      "dateParsed": {
        "original": "23/11/2022",
        "date": "2022-11-23T05:00:00.000Z",
        "year": 2022,
        "month": 11,
        "day": 23,
        "format": "DD/MM/YYYY"
      },
      "type": "other",
      "title": "Đón mẹ tôi từ Mỹ về Việt Nam chơi",
      "description": "Chúng tôi cùng nhau đón mẹ tôi từ Mỹ về Việt Nam ở sân bay Tân Sơn Nhất",
      "location": "TP. Hồ Chí Minh",
      "witnesses": "Gia đinh",
      "documents": "Ảnh chụp chung",
      "images": [
        {
          "id": 1669252323000,
          "name": "5555996904437196.jpg",
          "path": "/images/2022-11-23-other/1764512297712-5555996904437196.jpg",
          "type": "image/jpeg"
        }
      ]
    },
    {
      "id": 1671972069000,
      "date": "25/12/2022",
      "dateParsed": {
        "original": "25/12/2022",
        "date": "2022-12-25T05:00:00.000Z",
        "year": 2022,
        "month": 12,
        "day": 25,
        "format": "DD/MM/YYYY"
      },
      "type": "anniversary",
      "title": "Dự đám cưới 1 đồng nghiệp cũ",
      "description": "Tôi và cô ấy đi dự đám cưới 1 đồng nghiệp cũ",
      "location": "TP. Hồ Chí Minh",
      "witnesses": "",
      "documents": "Ảnh chụp chung",
      "images": [
        {
          "id": 1671972069000,
          "name": "5655970754439810.jpg",
          "path": "/images/2022-12-25-anniversary/1764593604492-5655970754439810.jpg",
          "type": "image/jpeg"
        }
      ]
    },
    {
      "id": 1672927943000,
      "date": "05/01/2023",
      "dateParsed": {
        "original": "05/01/2023",
        "date": "2023-01-05T05:00:00.000Z",
        "year": 2023,
        "month": 1,
        "day": 5,
        "format": "DD/MM/YYYY"
      },
      "type": "other",
      "title": "Cả nhà thương nhau 😘",
      "description": "Ảnh thường nhật",
      "location": "TP. Hồ Chí Minh",
      "witnesses": "",
      "documents": "Ảnh chụp chung",
      "images": [
        {
          "id": 1672927943000,
          "name": "5686326248070927.jpg",
          "path": "/images/2023-01-05-other/1764512297708-5686326248070927.jpg",
          "type": "image/jpeg"
        },
        {
          "id": 1672927943001,
          "name": "5686326274737591.jpg",
          "path": "/images/2023-01-05-other/1764512297708-5686326274737591.jpg",
          "type": "image/jpeg"
        },
        {
          "id": 1672927943002,
          "name": "5686326368070915.jpg",
          "path": "/images/2023-01-05-other/1764512297709-5686326368070915.jpg",
          "type": "image/jpeg"
        }
      ]
    },
    {
      "id": 1673154737000,
      "date": "08/01/2023",
      "dateParsed": {
        "original": "08/01/2023",
        "date": "2023-01-08T05:00:00.000Z",
        "year": 2023,
        "month": 1,
        "day": 8,
        "format": "DD/MM/YYYY"
      },
      "type": "other",
      "title": "Cuối tuần 😊",
      "description": "Ảnh thường nhật",
      "location": "TP. Hồ Chí Minh",
      "witnesses": "",
      "documents": "Ảnh chụp chung",
      "images": [
        {
          "id": 1673154737000,
          "name": "5693477934022425.jpg",
          "path": "/images/2023-01-08-other/1764512297705-5693477934022425.jpg",
          "type": "image/jpeg"
        },
        {
          "id": 1673154737001,
          "name": "5693478054022413.jpg",
          "path": "/images/2023-01-08-other/1764512297706-5693478054022413.jpg",
          "type": "image/jpeg"
        },
        {
          "id": 1673154737002,
          "name": "5693477977355754.jpg",
          "path": "/images/2023-01-08-other/1764512297707-5693477977355754.jpg",
          "type": "image/jpeg"
        },
        {
          "id": 1673154737003,
          "name": "5693478084022410.jpg",
          "path": "/images/2023-01-08-other/1764512297707-5693478084022410.jpg",
          "type": "image/jpeg"
        }
      ]
    },
    {
      "id": 1764643409883,
      "date": "01/02/2023",
      "dateParsed": {
        "original": "01/02/2023",
        "date": "2023-02-01T05:00:00.000Z",
        "year": 2023,
        "month": 2,
        "day": 1,
        "format": "DD/MM/YYYY"
      },
      "type": "travel",
      "title": "Đón tết 2023, đi du lịch Hội An, 1 ngày",
      "description": "Chúng tôi đi du lịch Hội An cùng mẹ cô ấy, em gái, em rễ và cháu gái của cô ấy",
      "location": "TP. Hội An, Quảng Nam",
      "witnesses": "mẹ cô ấy, em gái, em rễ và cháu gái của cô ấy",
      "documents": "Ảnh chụp chung",
      "images": [
        {
          "id": 1764643409837.588,
          "name": "485790210_4416144391945164_1125015710348303133_n.jpg",
          "path": "/images/2023-02-01-travel/1764643409837-485790210_4416144391945164_1125015710348303133_n.jpg",
          "type": "image/jpeg",
          "size": 347740
        },
        {
          "id": 1764643409839.549,
          "name": "485007069_4416144065278530_682314463015876172_n.jpg",
          "path": "/images/2023-02-01-travel/1764643409839-485007069_4416144065278530_682314463015876172_n.jpg",
          "type": "image/jpeg",
          "size": 605835
        },
        {
          "id": 1764643409844.3508,
          "name": "484813807_4416143938611876_646777280415242611_n.jpg",
          "path": "/images/2023-02-01-travel/1764643409844-484813807_4416143938611876_646777280415242611_n.jpg",
          "type": "image/jpeg",
          "size": 379863
        },
        {
          "id": 1764643409854.2263,
          "name": "484815035_4416144251945178_5703658969209731346_n.jpg",
          "path": "/images/2023-02-01-travel/1764643409854-484815035_4416144251945178_5703658969209731346_n.jpg",
          "type": "image/jpeg",
          "size": 665871
        }
      ]
    },
    {
      "id": 1686420117000,
      "date": "10/06/2023",
      "dateParsed": {
        "original": "10/06/2023",
        "date": "2023-06-10T04:00:00.000Z",
        "year": 2023,
        "month": 6,
        "day": 10,
        "format": "DD/MM/YYYY"
      },
      "type": "family-event",
      "title": "Tổ chức sinh nhật cho mẹ tôi",
      "description": "Chúng tôi cùng nhau tổ chức sinh nhật cho mẹ tôi",
      "location": "TP. Hồ Chí Minh",
      "witnesses": "mẹ tôi",
      "documents": "Ảnh chụp chung",
      "images": [
        {
          "id": 1686420117000,
          "name": "6181185178585029.jpg",
          "path": "/images/2023-06-10-family-event/1764512300124-6181185178585029.jpg",
          "type": "image/jpeg"
        },
        {
          "id": 1686420117001,
          "name": "6181185325251681.jpg",
          "path": "/images/2023-06-10-family-event/1764512300125-6181185325251681.jpg",
          "type": "image/jpeg"
        },
        {
          "id": 1686420117002,
          "name": "6181185208585026.jpg",
          "path": "/images/2023-06-10-family-event/1764512300125-6181185208585026.jpg",
          "type": "image/jpeg"
        },
        {
          "id": 1686420117003,
          "name": "6181185315251682.jpg",
          "path": "/images/2023-06-10-family-event/1764512300127-6181185315251682.jpg",
          "type": "image/jpeg"
        }
      ]
    },
    {
      "id": 1687701176000,
      "date": "25/06/2023",
      "dateParsed": {
        "original": "25/06/2023",
        "date": "2023-06-25T04:00:00.000Z",
        "year": 2023,
        "month": 6,
        "day": 25,
        "format": "DD/MM/YYYY"
      },
      "type": "anniversary",
      "title": "Đưa con gái đi xem phim",
      "description": "Tôi đưa 2 mẹ con cô ấy đi xem phim",
      "location": "TP. Hồ Chí Minh",
      "witnesses": "",
      "documents": "Ảnh chụp chung",
      "images": [
        {
          "id": 1687701176000,
          "name": "6233947086642171.jpg",
          "path": "/images/2023-06-25-anniversary/1764512297700-6233947086642171.jpg",
          "type": "image/jpeg"
        },
        {
          "id": 1687701176001,
          "name": "6233946943308852.jpg",
          "path": "/images/2023-06-25-anniversary/1764512297700-6233946943308852.jpg",
          "type": "image/jpeg"
        },
        {
          "id": 1687701176002,
          "name": "6233948006642079.jpg",
          "path": "/images/2023-06-25-anniversary/1764512297701-6233948006642079.jpg",
          "type": "image/jpeg"
        }
      ]
    },
    {
      "id": 1688893826000,
      "date": "09/07/2023",
      "dateParsed": {
        "original": "09/07/2023",
        "date": "2023-07-09T04:00:00.000Z",
        "year": 2023,
        "month": 7,
        "day": 9,
        "format": "DD/MM/YYYY"
      },
      "type": "other",
      "title": "Mang thai đứa con thứ 2",
      "description": "Thời điểm này là cô ấy đang mang thai đứa con thứ của chúng tôi được 5 tháng",
      "location": "TP. Hồ Chí Minh",
      "witnesses": "",
      "documents": "",
      "images": [
        {
          "id": 1764643657303.0347,
          "name": "487484005_4429537633939173_3299173274112496570_n.jpg",
          "path": "/images/2023-07-09-other/1764643657303-487484005_4429537633939173_3299173274112496570_n.jpg",
          "type": "image/jpeg",
          "size": 52370
        },
        {
          "id": 1764643693008.145,
          "name": "488485686_4429216793971257_5939779652762203751_n.jpg",
          "path": "/images/2023-07-09-other/1764643693008-488485686_4429216793971257_5939779652762203751_n.jpg",
          "type": "image/jpeg",
          "size": 314016
        }
      ]
    },
    {
      "id": 1690091827000,
      "date": "23/07/2023",
      "dateParsed": {
        "original": "23/07/2023",
        "date": "2023-07-23T01:57:07",
        "year": 2023,
        "month": 7,
        "day": 23,
        "format": "DD/MM/YYYY"
      },
      "type": "other",
      "title": "sáng CN đi ăn sáng",
      "description": "Võ Tuấn Nguyên đã thêm 4 ảnh mới. sáng CN đi ăn sáng",
      "location": "",
      "witnesses": "",
      "documents": "",
      "images": [
        {
          "id": 1690091827000,
          "name": "6326803177356561.jpg",
          "path": "/images/2023-07-23-other/1764512297695-6326803177356561.jpg",
          "type": "image/jpeg"
        },
        {
          "id": 1690091827001,
          "name": "6326803197356559.jpg",
          "path": "/images/2023-07-23-other/1764512297697-6326803197356559.jpg",
          "type": "image/jpeg"
        },
        {
          "id": 1690091827002,
          "name": "6326803264023219.jpg",
          "path": "/images/2023-07-23-other/1764512297697-6326803264023219.jpg",
          "type": "image/jpeg"
        },
        {
          "id": 1690091827003,
          "name": "6326803290689883.jpg",
          "path": "/images/2023-07-23-other/1764512297698-6326803290689883.jpg",
          "type": "image/jpeg"
        }
      ]
    },
    {
      "id": 1690820158000,
      "date": "31/07/2023",
      "dateParsed": {
        "original": "31/07/2023",
        "date": "2023-07-31T04:00:00.000Z",
        "year": 2023,
        "month": 7,
        "day": 31,
        "format": "DD/MM/YYYY"
      },
      "type": "anniversary",
      "title": "Kỷ niệm 5 năm ngày cưới ",
      "description": "Tôi dẫn con gái và cô ấy đi ăn nhà hàng để kỹ niệm 5 năm ngày cưới, nhiều niềm vui và hạnh phúc",
      "location": "",
      "witnesses": "",
      "documents": "",
      "images": [
        {
          "id": 1690820158000,
          "name": "6353991491304396.jpg",
          "path": "/images/2023-07-31-anniversary/1764512297686-6353991491304396.jpg",
          "type": "image/jpeg"
        },
        {
          "id": 1690820158001,
          "name": "6353992051304340.jpg",
          "path": "/images/2023-07-31-anniversary/1764512297687-6353992051304340.jpg",
          "type": "image/jpeg"
        },
        {
          "id": 1690820158002,
          "name": "6353992007971011.jpg",
          "path": "/images/2023-07-31-anniversary/1764512297687-6353992007971011.jpg",
          "type": "image/jpeg"
        },
        {
          "id": 1690820158003,
          "name": "6353991824637696.jpg",
          "path": "/images/2023-07-31-anniversary/1764512297689-6353991824637696.jpg",
          "type": "image/jpeg"
        },
        {
          "id": 1690820158004,
          "name": "6353991611304384.jpg",
          "path": "/images/2023-07-31-anniversary/1764512297690-6353991611304384.jpg",
          "type": "image/jpeg"
        },
        {
          "id": 1690820158005,
          "name": "6353991827971029.jpg",
          "path": "/images/2023-07-31-anniversary/1764512297691-6353991827971029.jpg",
          "type": "image/jpeg"
        },
        {
          "id": 1690820158006,
          "name": "6353991607971051.jpg",
          "path": "/images/2023-07-31-anniversary/1764512297691-6353991607971051.jpg",
          "type": "image/jpeg"
        },
        {
          "id": 1690820158007,
          "name": "6353991904637688.jpg",
          "path": "/images/2023-07-31-anniversary/1764512297692-6353991904637688.jpg",
          "type": "image/jpeg"
        },
        {
          "id": 1690820158008,
          "name": "6353992094637669.jpg",
          "path": "/images/2023-07-31-anniversary/1764512297694-6353992094637669.jpg",
          "type": "image/jpeg"
        },
        {
          "id": 1690820158009,
          "name": "6353991907971021.jpg",
          "path": "/images/2023-07-31-anniversary/1764512297694-6353991907971021.jpg",
          "type": "image/jpeg"
        }
      ]
    },
    {
      "id": 1691204821000,
      "date": "05/08/2023",
      "dateParsed": {
        "original": "05/08/2023",
        "date": "2023-08-05T04:00:00.000Z",
        "year": 2023,
        "month": 8,
        "day": 5,
        "format": "DD/MM/YYYY"
      },
      "endDate": "08/08/2023",
      "endDateParsed": {
        "original": "08/08/2023",
        "date": "2023-08-08T04:00:00.000Z",
        "year": 2023,
        "month": 8,
        "day": 8,
        "format": "DD/MM/YYYY"
      },
      "type": "family-event",
      "title": "Về quê chơi, 4 ngày",
      "description": "",
      "location": "",
      "witnesses": "",
      "documents": "Vé máy bay",
      "images": [
        {
          "id": 1691204821000,
          "name": "6368686893168189.jpg",
          "path": "/images/2023-08-05-family-event/1764512297680-6368686893168189.jpg",
          "type": "image/jpeg"
        },
        {
          "id": 1691204821001,
          "name": "6368687029834842.jpg",
          "path": "/images/2023-08-05-family-event/1764512297681-6368687029834842.jpg",
          "type": "image/jpeg"
        },
        {
          "id": 1691204821002,
          "name": "6368687103168168.jpg",
          "path": "/images/2023-08-05-family-event/1764512297682-6368687103168168.jpg",
          "type": "image/jpeg"
        },
        {
          "id": 1691204821003,
          "name": "6368686996501512.jpg",
          "path": "/images/2023-08-05-family-event/1764512297683-6368686996501512.jpg",
          "type": "image/jpeg"
        },
        {
          "id": 1691204821004,
          "name": "6368687133168165.jpg",
          "path": "/images/2023-08-05-family-event/1764512297684-6368687133168165.jpg",
          "type": "image/jpeg"
        },
        {
          "id": 1691204821005,
          "name": "6368686899834855.jpg",
          "path": "/images/2023-08-05-family-event/1764512297685-6368686899834855.jpg",
          "type": "image/jpeg"
        },
        {
          "id": 1764654203258.9253,
          "name": "screenshot_12_2_2025_12-40-52 AM.png",
          "path": "/images/2023-08-05-family-event/1764654203258-screenshot_12_2_2025_12-40-52_AM.png",
          "type": "image/png",
          "size": 670827
        }
      ]
    },
    {
      "id": 1692280142000,
      "date": "17/08/2023",
      "dateParsed": {
        "original": "17/08/2023",
        "date": "2023-08-17T04:00:00.000Z",
        "year": 2023,
        "month": 8,
        "day": 17,
        "format": "DD/MM/YYYY"
      },
      "type": "anniversary",
      "title": "Sinh nhật cô ấy",
      "description": "Tôi dẫn cô ấy và con gái đi ăn để chúc mừng sinh nhật",
      "location": "TP. Hồ Chí Minh",
      "witnesses": "",
      "documents": "Ảnh chụp chung",
      "images": [
        {
          "id": 1692280142000,
          "name": "6409326239104254.jpg",
          "path": "/images/2023-08-17-anniversary/1764512300129-6409326239104254.jpg",
          "type": "image/jpeg"
        },
        {
          "id": 1692280142001,
          "name": "6409326269104251.jpg",
          "path": "/images/2023-08-17-anniversary/1764512300130-6409326269104251.jpg",
          "type": "image/jpeg"
        },
        {
          "id": 1692280142002,
          "name": "6409326502437561.jpg",
          "path": "/images/2023-08-17-anniversary/1764512300131-6409326502437561.jpg",
          "type": "image/jpeg"
        },
        {
          "id": 1764643554134.8057,
          "name": "487921134_4429216967304573_417664466099014297_n.jpg",
          "path": "/images/2023-08-17-anniversary/1764643554134-487921134_4429216967304573_417664466099014297_n.jpg",
          "type": "image/jpeg",
          "size": 113813
        }
      ]
    },
    {
      "id": 1693798210000,
      "date": "03/09/2023",
      "dateParsed": {
        "original": "03/09/2023",
        "date": "2023-09-03T04:00:00.000Z",
        "year": 2023,
        "month": 9,
        "day": 3,
        "format": "DD/MM/YYYY"
      },
      "type": "anniversary",
      "title": "Đi xem phim",
      "description": "Cả 2 đi xem phim chung",
      "location": "TP. Hồ Chí Minh",
      "witnesses": "",
      "documents": "Ảnh chụp chung",
      "images": [
        {
          "id": 1693798210000,
          "name": "6467744929929051.jpg",
          "path": "/images/2023-09-03-anniversary/1764512297675-6467744929929051.jpg",
          "type": "image/jpeg"
        },
        {
          "id": 1693798210001,
          "name": "6467745019929042.jpg",
          "path": "/images/2023-09-03-anniversary/1764512297676-6467745019929042.jpg",
          "type": "image/jpeg"
        },
        {
          "id": 1693798210002,
          "name": "6467746489928895.jpg",
          "path": "/images/2023-09-03-anniversary/1764512297678-6467746489928895.jpg",
          "type": "image/jpeg"
        }
      ]
    },
    {
      "id": 1699668304000,
      "date": "11/11/2023",
      "dateParsed": {
        "original": "11/11/2023",
        "date": "2023-11-11T05:00:00.000Z",
        "year": 2023,
        "month": 11,
        "day": 11,
        "format": "DD/MM/YYYY"
      },
      "type": "birth",
      "title": "Con trai ra đời",
      "description": "Đứa con thứ 2 của tôi và cô ấy ra đời. Bé trai, tôi đặt tên là Võ Tuấn Sang, tên thường gọi là Bee. Hạnh phúc vô bờ",
      "location": "TP. Hồ Chí Minh",
      "witnesses": "",
      "documents": "Ảnh chụp ngay sau khi sinh mổ",
      "images": [
        {
          "id": 1699668304000,
          "name": "6721399351230273.jpg",
          "path": "/images/2023-11-11-birth/1764512297674-6721399351230273.jpg",
          "type": "image/jpeg"
        }
      ]
    },
    {
      "id": 1702001616000,
      "date": "07/12/2023",
      "dateParsed": {
        "original": "07/12/2023",
        "date": "2023-12-07T05:00:00.000Z",
        "year": 2023,
        "month": 12,
        "day": 7,
        "format": "DD/MM/YYYY"
      },
      "type": "family-event",
      "title": "Đầy tháng con trai (Bee)",
      "description": "Ảnh thường nhật",
      "location": "",
      "witnesses": "",
      "documents": "",
      "images": [
        {
          "id": 1702001616000,
          "name": "6818954838141390.jpg",
          "path": "/images/2023-12-07-other/1764512297673-6818954838141390.jpg",
          "type": "image/jpeg"
        }
      ]
    },
    {
      "id": 1709048284000,
      "date": "27/02/2024",
      "dateParsed": {
        "original": "27/02/2024",
        "date": "2024-02-27T05:00:00.000Z",
        "year": 2024,
        "month": 2,
        "day": 27,
        "format": "DD/MM/YYYY"
      },
      "type": "other",
      "title": "2 con của tôi chơi với nhau",
      "description": "Ảnh thường nhật",
      "location": "",
      "witnesses": "",
      "documents": "",
      "images": [
        {
          "id": 1709048284000,
          "name": "7127035210666683.jpg",
          "path": "/images/2024-02-27-other/1764512297662-7127035210666683.jpg",
          "type": "image/jpeg"
        },
        {
          "id": 1709048284001,
          "name": "7127035440666660.jpg",
          "path": "/images/2024-02-27-other/1764512297664-7127035440666660.jpg",
          "type": "image/jpeg"
        },
        {
          "id": 1709048284002,
          "name": "7127035244000013.jpg",
          "path": "/images/2024-02-27-other/1764512297665-7127035244000013.jpg",
          "type": "image/jpeg"
        },
        {
          "id": 1709048284003,
          "name": "7127035730666631.jpg",
          "path": "/images/2024-02-27-other/1764512297666-7127035730666631.jpg",
          "type": "image/jpeg"
        },
        {
          "id": 1709048284004,
          "name": "7127035367333334.jpg",
          "path": "/images/2024-02-27-other/1764512297667-7127035367333334.jpg",
          "type": "image/jpeg"
        },
        {
          "id": 1709048284005,
          "name": "7127035327333338.jpg",
          "path": "/images/2024-02-27-other/1764512297669-7127035327333338.jpg",
          "type": "image/jpeg"
        },
        {
          "id": 1709048284006,
          "name": "7127035483999989.jpg",
          "path": "/images/2024-02-27-other/1764512297669-7127035483999989.jpg",
          "type": "image/jpeg"
        },
        {
          "id": 1709048284007,
          "name": "7127035587333312.jpg",
          "path": "/images/2024-02-27-other/1764512297670-7127035587333312.jpg",
          "type": "image/jpeg"
        },
        {
          "id": 1709048284008,
          "name": "7127035627333308.jpg",
          "path": "/images/2024-02-27-other/1764512297671-7127035627333308.jpg",
          "type": "image/jpeg"
        }
      ]
    },
    {
      "id": 1714910173000,
      "date": "05/05/2024",
      "dateParsed": {
        "original": "05/05/2024",
        "date": "2024-05-05T04:00:00.000Z",
        "year": 2024,
        "month": 5,
        "day": 5,
        "format": "DD/MM/YYYY"
      },
      "type": "other",
      "title": "con gái dịu dàng 😘",
      "description": "Ảnh thường nhật",
      "location": "",
      "witnesses": "",
      "documents": "",
      "images": [
        {
          "id": 1714910173000,
          "name": "7405977036105831.jpg",
          "path": "/images/2024-05-05-other/1764593604473-7405977036105831.jpg",
          "type": "image/jpeg"
        },
        {
          "id": 1714910173001,
          "name": "7405977159439152.jpg",
          "path": "/images/2024-05-05-other/1764593604474-7405977159439152.jpg",
          "type": "image/jpeg"
        },
        {
          "id": 1714910173002,
          "name": "7405977296105805.jpg",
          "path": "/images/2024-05-05-other/1764593604474-7405977296105805.jpg",
          "type": "image/jpeg"
        },
        {
          "id": 1714910173003,
          "name": "7405977062772495.jpg",
          "path": "/images/2024-05-05-other/1764593604476-7405977062772495.jpg",
          "type": "image/jpeg"
        },
        {
          "id": 1714910173004,
          "name": "7405977216105813.jpg",
          "path": "/images/2024-05-05-other/1764593604478-7405977216105813.jpg",
          "type": "image/jpeg"
        },
        {
          "id": 1714910173005,
          "name": "7405977356105799.jpg",
          "path": "/images/2024-05-05-other/1764593604480-7405977356105799.jpg",
          "type": "image/jpeg"
        }
      ]
    },
    {
      "id": 1764643885882,
      "date": "09/06/2024",
      "dateParsed": {
        "original": "09/06/2024",
        "date": "2024-06-09T04:00:00.000Z",
        "year": 2024,
        "month": 6,
        "day": 9,
        "format": "DD/MM/YYYY"
      },
      "type": "anniversary",
      "title": "Tham dự đám cưới con gái của cậu tôi",
      "description": "",
      "location": "",
      "witnesses": "",
      "documents": "",
      "images": [
        {
          "id": 1764643885873.9097,
          "name": "489822309_4442649259294677_4476167188709180_n.jpg",
          "path": "/images/2024-06-09-anniversary/1764643885873-489822309_4442649259294677_4476167188709180_n.jpg",
          "type": "image/jpeg",
          "size": 283586
        },
        {
          "id": 1764643885879.1235,
          "name": "489822279_4442649269294676_5821649823970197649_n.jpg",
          "path": "/images/2024-06-09-anniversary/1764643885879-489822279_4442649269294676_5821649823970197649_n.jpg",
          "type": "image/jpeg",
          "size": 346585
        },
        {
          "id": 1764643885880.1257,
          "name": "490299109_4442649279294675_5790210561102326936_n.jpg",
          "path": "/images/2024-06-09-anniversary/1764643885880-490299109_4442649279294675_5790210561102326936_n.jpg",
          "type": "image/jpeg",
          "size": 345123
        }
      ]
    },
    {
      "id": 1723911616000,
      "date": "17/08/2024",
      "dateParsed": {
        "original": "17/08/2024",
        "date": "2024-08-17T04:00:00.000Z",
        "year": 2024,
        "month": 8,
        "day": 17,
        "format": "DD/MM/YYYY"
      },
      "type": "anniversary",
      "title": "Sinh nhật cô ấy",
      "description": "",
      "location": "",
      "witnesses": "Gia đình",
      "documents": "",
      "images": [
        {
          "id": 1723911616000,
          "name": "7952104574826405.jpg",
          "path": "/images/2024-08-17-anniversary/1764512297645-7952104574826405.jpg",
          "type": "image/jpeg"
        },
        {
          "id": 1723911616001,
          "name": "7952104754826387.jpg",
          "path": "/images/2024-08-17-anniversary/1764512297646-7952104754826387.jpg",
          "type": "image/jpeg"
        },
        {
          "id": 1723911616002,
          "name": "7952104634826399.jpg",
          "path": "/images/2024-08-17-anniversary/1764512297646-7952104634826399.jpg",
          "type": "image/jpeg"
        },
        {
          "id": 1723911616003,
          "name": "7952104704826392.jpg",
          "path": "/images/2024-08-17-anniversary/1764512297647-7952104704826392.jpg",
          "type": "image/jpeg"
        }
      ]
    },
    {
      "id": 1764644058541,
      "date": "09/09/2024",
      "dateParsed": {
        "original": "09/09/2024",
        "date": "2024-09-09T04:00:00.000Z",
        "year": 2024,
        "month": 9,
        "day": 9,
        "format": "DD/MM/YYYY"
      },
      "endDate": "11/09/2024",
      "endDateParsed": {
        "original": "11/09/2024",
        "date": "2024-09-11T04:00:00.000Z",
        "year": 2024,
        "month": 9,
        "day": 11,
        "format": "DD/MM/YYYY"
      },
      "type": "travel",
      "title": "Du lịch Phan Thiết, 3 ngày",
      "description": "Cả gia đình cùng đi du lịch Phan Thiết",
      "location": "Phan Thiết",
      "witnesses": "",
      "documents": "",
      "images": [
        {
          "id": 1764644058536.5112,
          "name": "493307428_4461752987384304_455554014037888105_n.jpg",
          "path": "/images/2024-09-09-travel/1764644058536-493307428_4461752987384304_455554014037888105_n.jpg",
          "type": "image/jpeg",
          "size": 185659
        },
        {
          "id": 1764644058537.676,
          "name": "494095269_4461753847384218_7976765890515544307_n.jpg",
          "path": "/images/2024-09-09-travel/1764644058537-494095269_4461753847384218_7976765890515544307_n.jpg",
          "type": "image/jpeg",
          "size": 228748
        },
        {
          "id": 1764644058538.4392,
          "name": "494133649_4461753187384284_7236122592564815884_n.jpg",
          "path": "/images/2024-09-09-travel/1764644058538-494133649_4461753187384284_7236122592564815884_n.jpg",
          "type": "image/jpeg",
          "size": 259568
        },
        {
          "id": 1764644058538.4644,
          "name": "493733678_4461753324050937_3210841936466246869_n.jpg",
          "path": "/images/2024-09-09-travel/1764644058538-493733678_4461753324050937_3210841936466246869_n.jpg",
          "type": "image/jpeg",
          "size": 327410
        },
        {
          "id": 1764644058539.9146,
          "name": "494070595_4461752894050980_3577326259525416084_n.jpg",
          "path": "/images/2024-09-09-travel/1764644058539-494070595_4461752894050980_3577326259525416084_n.jpg",
          "type": "image/jpeg",
          "size": 305680
        }
      ]
    },
    {
      "id": 1734929815000,
      "date": "22/12/2024",
      "dateParsed": {
        "original": "22/12/2024",
        "date": "2024-12-22T05:00:00.000Z",
        "year": 2024,
        "month": 12,
        "day": 22,
        "format": "DD/MM/YYYY"
      },
      "type": "other",
      "title": "Đi xem phim",
      "description": "Tôi đưa con gái, cô ấy và cháu của cô ấy đi xem phim",
      "location": "TP. Hồ Chí Minh",
      "witnesses": "",
      "documents": "Ảnh chụp chung trong rạp phim",
      "images": [
        {
          "id": 1734929815000,
          "name": "8787514397952081.jpg",
          "path": "/images/2024-12-22-other/1764512297624-8787514397952081.jpg",
          "type": "image/jpeg"
        },
        {
          "id": 1734929815001,
          "name": "8787517551285099.jpg",
          "path": "/images/2024-12-22-other/1764512297624-8787517551285099.jpg",
          "type": "image/jpeg"
        },
        {
          "id": 1734929815002,
          "name": "8787514411285413.jpg",
          "path": "/images/2024-12-22-other/1764512297626-8787514411285413.jpg",
          "type": "image/jpeg"
        },
        {
          "id": 1734929815003,
          "name": "8787514594618728.jpg",
          "path": "/images/2024-12-22-other/1764512297626-8787514594618728.jpg",
          "type": "image/jpeg"
        }
      ]
    },
    {
      "id": 1764644193049,
      "date": "03/02/2025",
      "dateParsed": {
        "original": "03/02/2025",
        "date": "2025-02-03T05:00:00.000Z",
        "year": 2025,
        "month": 2,
        "day": 3,
        "format": "DD/MM/YYYY"
      },
      "type": "anniversary",
      "title": "Đón tết 2025",
      "description": "Chụp ảnh tết cùng dại gia đình bên ngoại của tôi",
      "location": "Núi Thành, Quảng Nam",
      "witnesses": "Họ hàng bên ngoại của tôi",
      "documents": "Ảnh chụp chung",
      "images": [
        {
          "id": 1764644193045.755,
          "name": "508448269_4522360007990268_1311310752216098356_n.jpg",
          "path": "/images/2025-02-03-anniversary/1764644193045-508448269_4522360007990268_1311310752216098356_n.jpg",
          "type": "image/jpeg",
          "size": 296860
        },
        {
          "id": 1764644193046.828,
          "name": "508562498_4522359754656960_4186848177467537361_n.jpg",
          "path": "/images/2025-02-03-anniversary/1764644193046-508562498_4522359754656960_4186848177467537361_n.jpg",
          "type": "image/jpeg",
          "size": 214411
        }
      ]
    },
    {
      "id": 1740146571000,
      "date": "21/02/2025",
      "dateParsed": {
        "original": "21/02/2025",
        "date": "2025-02-21T05:00:00.000Z",
        "year": 2025,
        "month": 2,
        "day": 21,
        "format": "DD/MM/YYYY"
      },
      "type": "other",
      "title": "Con trai tôi ở lớp mẫu giáo",
      "description": "Ảnh thường nhật",
      "location": "TP. Hồ Chí Minh",
      "witnesses": "",
      "documents": "",
      "images": [
        {
          "id": 1740146571000,
          "name": "9118278068209044.jpg",
          "path": "/images/2025-02-21-other/1764512297618-9118278068209044.jpg",
          "type": "image/jpeg"
        }
      ]
    },
    {
      "id": 1764644354585,
      "date": "29/03/2025",
      "dateParsed": {
        "original": "29/03/2025",
        "date": "2025-03-29T04:00:00.000Z",
        "year": 2025,
        "month": 3,
        "day": 29,
        "format": "DD/MM/YYYY"
      },
      "endDate": "31/03/2025",
      "endDateParsed": {
        "original": "31/03/2025",
        "date": "2025-03-31T04:00:00.000Z",
        "year": 2025,
        "month": 3,
        "day": 31,
        "format": "DD/MM/YYYY"
      },
      "type": "anniversary",
      "title": "Đi chơi Vũng Tàu, 3 ngày",
      "description": "Đi chơi Vũng Tàu cùng mẹ cô ấy, em gái cô ấy và cháu gái cô ấy",
      "location": "",
      "witnesses": "Mẹ cô ấy, em gái cô ấy và cháu gái cô ấy",
      "documents": "",
      "images": [
        {
          "id": 1764644354581.8892,
          "name": "508830881_4522784724614463_7317523143659439625_n.jpg",
          "path": "/images/2025-03-29-anniversary/1764644354581-508830881_4522784724614463_7317523143659439625_n.jpg",
          "type": "image/jpeg",
          "size": 344341
        },
        {
          "id": 1764644354582.329,
          "name": "508383040_4522784624614473_1592439240968800899_n.jpg",
          "path": "/images/2025-03-29-anniversary/1764644354582-508383040_4522784624614473_1592439240968800899_n.jpg",
          "type": "image/jpeg",
          "size": 364181
        }
      ]
    },
    {
      "id": 1764644547537,
      "date": "24/05/2025",
      "dateParsed": {
        "original": "24/05/2025",
        "date": "2025-05-24T04:00:00.000Z",
        "year": 2025,
        "month": 5,
        "day": 24,
        "format": "DD/MM/YYYY"
      },
      "type": "travel",
      "title": "Du lịch núi Bà Đen, 1 ngày",
      "description": "",
      "location": "Núi Bà Đèn, Tây Ninh",
      "witnesses": "Mẹ cô ấy, em gái cô ấy và cháu gái cô ấy",
      "documents": "Ảnh chụp chung",
      "images": [
        {
          "id": 1764644547533.2886,
          "name": "511177512_4529154920644110_141569305802802265_n.jpg",
          "path": "/images/2025-05-24-travel/1764644547533-511177512_4529154920644110_141569305802802265_n.jpg",
          "type": "image/jpeg",
          "size": 397482
        },
        {
          "id": 1764644547535.8274,
          "name": "510296156_4529153230644279_4900207989512359225_n.jpg",
          "path": "/images/2025-05-24-travel/1764644547535-510296156_4529153230644279_4900207989512359225_n.jpg",
          "type": "image/jpeg",
          "size": 442899
        }
      ]
    },
    {
      "id": 1755380365000,
      "date": "16/08/2025",
      "dateParsed": {
        "original": "16/08/2025",
        "date": "2025-08-16T04:00:00.000Z",
        "year": 2025,
        "month": 8,
        "day": 16,
        "format": "DD/MM/YYYY"
      },
      "endDate": "17/08/2025",
      "endDateParsed": {
        "original": "17/08/2025",
        "date": "2025-08-17T04:00:00.000Z",
        "year": 2025,
        "month": 8,
        "day": 17,
        "format": "DD/MM/YYYY"
      },
      "type": "anniversary",
      "title": "Du lịch Vũng Tàu, 2 ngày",
      "description": "Tôi cùng cô ấy và 2 con đi du lịch Vũng Tàu",
      "location": "TP. Vũng Tàu",
      "witnesses": "",
      "documents": "Ảnh chụp chung",
      "images": [
        {
          "id": 1755380365000,
          "name": "24145551898388415.jpg",
          "path": "/images/2025-08-16-anniversary/1764593604431-24145551898388415.jpg",
          "type": "image/jpeg"
        },
        {
          "id": 1755380365001,
          "name": "24145551925055079.jpg",
          "path": "/images/2025-08-16-anniversary/1764593604432-24145551925055079.jpg",
          "type": "image/jpeg"
        },
        {
          "id": 1755380365002,
          "name": "24145551995055072.jpg",
          "path": "/images/2025-08-16-anniversary/1764593604434-24145551995055072.jpg",
          "type": "image/jpeg"
        }
      ]
    },
    {
      "id": 1764555946209,
      "date": "21/09/2025",
      "dateParsed": {
        "original": "21/09/2025",
        "date": "2025-09-21T04:00:00.000Z",
        "year": 2025,
        "month": 9,
        "day": 21,
        "format": "DD/MM/YYYY"
      },
      "endDate": "22/09/2025",
      "endDateParsed": {
        "original": "22/09/2025",
        "date": "2025-09-22T04:00:00.000Z",
        "year": 2025,
        "month": 9,
        "day": 22,
        "format": "DD/MM/YYYY"
      },
      "type": "family-event",
      "title": "Chuyến bay về Việt Nam thăm cô ấy và các con",
      "description": "Tôi về Việt Nam thăm cô ấy và các con sau 3 tháng định cư ở Mỹ, cô ấy và các con đón tôi ở sân bay. Thõa niềm mong nhớ",
      "location": "Boston, Sân bay quốc tế Tân Sơn Nhất",
      "witnesses": "",
      "documents": "Ảnh chụp chung",
      "images": [
        {
          "id": 1758474232000,
          "name": "24437334649210137.jpg",
          "path": "/images/2025-09-21-family-event/1764512297588-24437334649210137.jpg",
          "type": "image/jpeg"
        },
        {
          "id": 1758566405000,
          "name": "24445835825026686.jpg",
          "path": "/images/2025-09-22-family-event/1764512297584-24445835825026686.jpg",
          "type": "image/jpeg"
        },
        {
          "id": 1758566405001,
          "name": "24445835865026682.jpg",
          "path": "/images/2025-09-22-family-event/1764512297585-24445835865026682.jpg",
          "type": "image/jpeg"
        },
        {
          "id": 1758566405002,
          "name": "24445836125026656.jpg",
          "path": "/images/2025-09-22-family-event/1764512297586-24445836125026656.jpg",
          "type": "image/jpeg"
        },
        {
          "id": 1758566405003,
          "name": "24445836091693326.jpg",
          "path": "/images/2025-09-22-family-event/1764512297587-24445836091693326.jpg",
          "type": "image/jpeg"
        }
      ]
    },
    {
      "id": 1759033631000,
      "date": "28/09/2025",
      "dateParsed": {
        "original": "28/09/2025",
        "date": "2025-09-28T04:00:00.000Z",
        "year": 2025,
        "month": 9,
        "day": 28,
        "format": "DD/MM/YYYY"
      },
      "type": "family-event",
      "title": "Chuyến bay về quê thăm bà nội tôi",
      "description": "Tôi, cô ấy và 2 con về quê thăm bà nội tôi",
      "location": "Sân bay quốc tế Tân Sơn Nhất",
      "witnesses": "",
      "documents": "Ảnh chụp chung",
      "images": [
        {
          "id": 1759033631000,
          "name": "24492091580401110.jpg",
          "path": "/images/2025-09-28-family-event/1764512297574-24492091580401110.jpg",
          "type": "image/jpeg"
        },
        {
          "id": 1759033631001,
          "name": "24492091783734423.jpg",
          "path": "/images/2025-09-28-family-event/1764512297574-24492091783734423.jpg",
          "type": "image/jpeg"
        },
        {
          "id": 1759033631002,
          "name": "24492091613734440.jpg",
          "path": "/images/2025-09-28-family-event/1764512297577-24492091613734440.jpg",
          "type": "image/jpeg"
        },
        {
          "id": 1759033631003,
          "name": "24492091967067738.jpg",
          "path": "/images/2025-09-28-family-event/1764512297578-24492091967067738.jpg",
          "type": "image/jpeg"
        },
        {
          "id": 1759033631004,
          "name": "24492092033734398.jpg",
          "path": "/images/2025-09-28-family-event/1764512297581-24492092033734398.jpg",
          "type": "image/jpeg"
        },
        {
          "id": 1759033631005,
          "name": "24492091810401087.jpg",
          "path": "/images/2025-09-28-family-event/1764512297582-24492091810401087.jpg",
          "type": "image/jpeg"
        }
      ]
    },
    {
      "id": 1759197698000,
      "date": "29/09/2025",
      "dateParsed": {
        "original": "29/09/2025",
        "date": "2025-09-29T04:00:00.000Z",
        "year": 2025,
        "month": 9,
        "day": 29,
        "format": "DD/MM/YYYY"
      },
      "type": "family-event",
      "title": "Đi uống cafe cùng họ hàng của tôi",
      "description": "Tôi, cô ấy và các con đi uống cafe cùng vơi họ hàng của tôi ",
      "location": "TP. Hồ Chí Minh",
      "witnesses": "Gia đình, họ hàng",
      "documents": "Ảnh chụp chung",
      "images": [
        {
          "id": 1759197698000,
          "name": "24508529225424012.jpg",
          "path": "/images/2025-09-29-family-event/1764512297569-24508529225424012.jpg",
          "type": "image/jpeg"
        },
        {
          "id": 1759197698001,
          "name": "24508529312090670.jpg",
          "path": "/images/2025-09-29-family-event/1764512297570-24508529312090670.jpg",
          "type": "image/jpeg"
        },
        {
          "id": 1759197698002,
          "name": "24508529548757313.jpg",
          "path": "/images/2025-09-29-family-event/1764512297571-24508529548757313.jpg",
          "type": "image/jpeg"
        },
        {
          "id": 1759197698003,
          "name": "24508529628757305.jpg",
          "path": "/images/2025-09-29-family-event/1764512297573-24508529628757305.jpg",
          "type": "image/jpeg"
        },
        {
          "id": 1759197698004,
          "name": "24508530092090592.jpg",
          "path": "/images/2025-09-29-family-event/1764512297573-24508530092090592.jpg",
          "type": "image/jpeg"
        }
      ]
    },
    {
      "id": 1759494918000,
      "date": "03/10/2025",
      "dateParsed": {
        "original": "03/10/2025",
        "date": "2025-10-03T04:00:00.000Z",
        "year": 2025,
        "month": 10,
        "day": 3,
        "format": "DD/MM/YYYY"
      },
      "type": "other",
      "title": "Bữa tối ở nhà bà nội",
      "description": "Cùng nhau ăn tối ở nhà bà nội tôi",
      "location": "Núi Thành, Quảng Nam",
      "witnesses": "Bà nội tôi, cô của tôi",
      "documents": "Ảnh chụp chung",
      "images": [
        {
          "id": 1759494918002,
          "name": "24544294488514152.jpg",
          "path": "/images/2025-10-03-other/1764512297568-24544294488514152.jpg",
          "type": "image/jpeg"
        }
      ]
    },
    {
      "id": 1759739506000,
      "date": "06/10/2025",
      "dateParsed": {
        "original": "06/10/2025",
        "date": "2025-10-06T04:00:00.000Z",
        "year": 2025,
        "month": 10,
        "day": 6,
        "format": "DD/MM/YYYY"
      },
      "type": "other",
      "title": "Chuyến bay từ quê vào lại Sài Gòn",
      "description": "Tạm biệt bà cố, Sam và Bee vào lại SG đi học",
      "location": "Núi Thành, Quảng Nam",
      "witnesses": "",
      "documents": "Ảnh chụp chung",
      "images": [
        {
          "id": 1759739506000,
          "name": "24572486392361628.jpg",
          "path": "/images/2025-10-06-other/1764512297422-24572486392361628.jpg",
          "type": "image/jpeg"
        },
        {
          "id": 1759739506001,
          "name": "24572486659028268.jpg",
          "path": "/images/2025-10-06-other/1764512297423-24572486659028268.jpg",
          "type": "image/jpeg"
        },
        {
          "id": 1759739506002,
          "name": "24572486405694960.jpg",
          "path": "/images/2025-10-06-other/1764512297424-24572486405694960.jpg",
          "type": "image/jpeg"
        },
        {
          "id": 1759739506003,
          "name": "24572486845694916.jpg",
          "path": "/images/2025-10-06-other/1764512297425-24572486845694916.jpg",
          "type": "image/jpeg"
        },
        {
          "id": 1759739506004,
          "name": "24572486639028270.jpg",
          "path": "/images/2025-10-06-other/1764512297425-24572486639028270.jpg",
          "type": "image/jpeg"
        },
        {
          "id": 1759739506005,
          "name": "24572487055694895.jpg",
          "path": "/images/2025-10-06-other/1764512297426-24572487055694895.jpg",
          "type": "image/jpeg"
        },
        {
          "id": 1759739506006,
          "name": "24572486825694918.jpg",
          "path": "/images/2025-10-06-other/1764512297426-24572486825694918.jpg",
          "type": "image/jpeg"
        }
      ]
    },
    {
      "id": 1764644807150,
      "date": "28/10/2025",
      "dateParsed": {
        "original": "28/10/2025",
        "date": "2025-10-28T04:00:00.000Z",
        "year": 2025,
        "month": 10,
        "day": 28,
        "format": "DD/MM/YYYY"
      },
      "type": "family-event",
      "title": "Sinh nhật con gái 5 tuổi ",
      "description": "",
      "location": "TP. Hồ Chí Minh",
      "witnesses": "Gia đình cô ấy",
      "documents": "Ảnh chụp chung",
      "images": [
        {
          "id": 1764644807145.4739,
          "name": "571334541_4670305826529018_5219493973792259004_n.jpg",
          "path": "/images/2025-10-28-family-event/1764644807145-571334541_4670305826529018_5219493973792259004_n.jpg",
          "type": "image/jpeg",
          "size": 336886
        },
        {
          "id": 1764644807146.9834,
          "name": "571220322_4670305449862389_2070518513001046414_n.jpg",
          "path": "/images/2025-10-28-family-event/1764644807146-571220322_4670305449862389_2070518513001046414_n.jpg",
          "type": "image/jpeg",
          "size": 312737
        }
      ]
    },
    {
      "id": 1762837049000,
      "date": "10/11/2025",
      "dateParsed": {
        "original": "10/11/2025",
        "date": "2025-11-10T05:00:00.000Z",
        "year": 2025,
        "month": 11,
        "day": 10,
        "format": "DD/MM/YYYY"
      },
      "type": "other",
      "title": "Cô ấy tốt nghiệp khóa học spa chăm sóc da",
      "description": "Tôi tham dự lễ tối nghiệm của cô ấy",
      "location": "TP. Hồ Chí Minh",
      "witnesses": "",
      "documents": "Ảnh chụp chung",
      "images": [
        {
          "id": 1762837049000,
          "name": "24920931210850476.jpg",
          "path": "/images/2025-11-10-other/1764512297309-24920931210850476.jpg",
          "type": "image/jpeg"
        },
        {
          "id": 1762837049001,
          "name": "24920931360850461.jpg",
          "path": "/images/2025-11-10-other/1764512297311-24920931360850461.jpg",
          "type": "image/jpeg"
        },
        {
          "id": 1762837049002,
          "name": "24920931230850474.jpg",
          "path": "/images/2025-11-10-other/1764512297314-24920931230850474.jpg",
          "type": "image/jpeg"
        },
        {
          "id": 1762837049003,
          "name": "24920937614183169.jpg",
          "path": "/images/2025-11-10-other/1764512297315-24920937614183169.jpg",
          "type": "image/jpeg"
        }
      ]
    },
    {
      "id": 1764645192776,
      "date": "11/11/2025",
      "dateParsed": {
        "original": "11/11/2025",
        "date": "2025-11-11T05:00:00.000Z",
        "year": 2025,
        "month": 11,
        "day": 11,
        "format": "DD/MM/YYYY"
      },
      "type": "family-event",
      "title": "Sinh nhật con trai 2 tuổi",
      "description": "",
      "location": "TP. Hồ Chí Minh",
      "witnesses": "Mẹ cô ấy",
      "documents": "Ảnh chụp chung",
      "images": [
        {
          "id": 1764645192764.0518,
          "name": "IMG_7931.jpg",
          "path": "/images/2025-11-11-family-event/1764645192764-IMG_7931.jpg",
          "type": "image/jpeg",
          "size": 2749184
        },
        {
          "id": 1764645192771.3052,
          "name": "IMG_7918.jpg",
          "path": "/images/2025-11-11-family-event/1764645192771-IMG_7918.jpg",
          "type": "image/jpeg",
          "size": 2985242
        }
      ]
    },
    {
      "id": 1763652192000,
      "date": "20/11/2025",
      "dateParsed": {
        "original": "20/11/2025",
        "date": "2025-11-20T05:00:00.000Z",
        "year": 2025,
        "month": 11,
        "day": 20,
        "format": "DD/MM/YYYY"
      },
      "type": "dating",
      "title": "Chuyến bay về lại Mỹ",
      "description": "Tạm biệt vợ yêu Nương Nương, tạm biệt Sam, tạm biệt Bee.\nHẹn 6 tháng nữa ba lại về 😘😘😘 Chắc sẽ nhớ lắm đây",
      "location": "Sân bay quốc tế Tân Sơn Nhất",
      "witnesses": "",
      "documents": "",
      "images": [
        {
          "id": 1763652192000,
          "name": "25003701902573406.jpg",
          "path": "/images/2025-11-20-dating/1764512297292-25003701902573406.jpg",
          "type": "image/jpeg"
        }
      ]
    }
  ],
  "lastSaved": "2025-12-02T05:46:10.232Z",
  "version": "1.0"
}
